index,published,keyword,domain,language,valid,title,description,url,image,archive,content,quote,de,en,la,added
15a46ad5eb85984471be5268a1dcd0ad,2025-07-20T11:30:45Z,'typhoon',financialpost.com,en,0.7,Typhoon Wipha topples trees and causes major flight disruptions in Hong Kong and southern China,"HONG KONG (AP) — Typhoon Wipha toppled trees and caused major flight disruptions Sunday in Hong Kong and at some nearby airports in China as it moved west off the southern coast of the country. Airports in Hong Kong, Shenzhen, Zhuhai and the casino hub of Mac…",https://financialpost.com/pmn/typhoon-wipha-topples-trees-and-causes-major-flight-disruptions-in-hong-kong-and-southern-china,,,"HONG KONG (AP) Typhoon Wipha toppled trees and caused major flight disruptions Sunday in Hong Kong and at some nearby airports in China as it moved west off the southern coast of the country.
THIS C… [+4452 chars]",,"Der Taifun Wipha stürzt Bäume um und verursacht große Flugstörungen in Hongkong und Südchina. HONGKONG (AP) – Der Taifun Wipha stürzte am Sonntag Bäume um und verursachte schwere Flugstörungen in Hongkong und an einigen nahegelegenen Flughäfen in China, als er vor der Südküste des Landes nach Westen zog. Flughäfen in Hongkong, Shenzhen, Zhuhai und das Casino-Zentrum von Mac…","Typhoon Wipha topples trees and causes major flight disruptions in Hong Kong and southern China. HONG KONG (AP) — Typhoon Wipha toppled trees and caused major flight disruptions Sunday in Hong Kong and at some nearby airports in China as it moved west off the southern coast of the country. Airports in Hong Kong, Shenzhen, Zhuhai and the casino hub of Mac…","Typhoon Wipha ponit arbores et maiorem perturbationem fugae causat in Hong Kong et Sinis meridionalibus. HONG KONG (AP) — Typhoon Wipha arbores concidit et maiorem fugam perturbationum dominicae in Hong Kong effecit et in quibusdam prope aliquet nisl in Sinis occidentalem movit ad litus regionis meridionalis. Nisl in Hong Kong, Shenzhen, Zhuhai et hub varius Mac…",2025-12-17 21:07:00+00:00
0f5532ce065aeb122d1ca6c15854dc1c,2025-07-20T15:31:29Z,'typhoon',www.scmp.com,en,0.7,"Typhoon Wipha: Hong Kong emerges with dozens hurt, travellers frustrated","This story has been made freely available as a public service to our readers. Please consider supporting SCMP’s journalism by subscribing. New users who download our updated app get a seven-day free trial.
Hong Kong is getting back to normal after having larg…",https://www.scmp.com/news/hong-kong/health-environment/article/3318925/typhoon-wipha-hong-kong-emerges-dozens-hurt-travellers-frustrated,https://cdn.i-scmp.com/sites/default/files/styles/og_image_scmp_generic/public/d8/images/canvas/2025/07/20/ca57e9f2-7290-4ce6-b275-9f3fe398dc2f_2f034087.jpg?itok=CXlwWPrY&v=1753025487,http://web.archive.org/web/20250721014535/https://www.scmp.com/news/hong-kong/health-environment/article/3318925/typhoon-wipha-hong-kong-emerges-dozens-hurt-travellers-frustrated,This story has been made freely available as a public service to our readers. Please consider supporting SCMPs journalism bysubscribing. New users whodownload our updated appget a seven-day free tria… [+1330 chars],,"Taifun Wipha: Hongkong kommt mit Dutzenden Verletzten und frustrierten Reisenden. Diese Geschichte wurde unseren Lesern als öffentlicher Dienst frei zugänglich gemacht. Bitte denken Sie darüber nach, den Journalismus von SCMP durch ein Abonnement zu unterstützen. Neue Benutzer, die unsere aktualisierte App herunterladen, erhalten eine siebentägige kostenlose Testversion.
Hongkong kehrt nach großen… zur Normalität zurück","Typhoon Wipha: Hong Kong emerges with dozens hurt, travellers frustrated. This story has been made freely available as a public service to our readers. Please consider supporting SCMP’s journalism by subscribing. New users who download our updated app get a seven-day free trial.
Hong Kong is getting back to normal after having larg…","Typhoon Wipha: Hong Kong emergit cum justo laedere, viatores frustrati. Haec fabula gratuito praesto est ut officium publicum legentibus. Vide quaeso diurnarium SCMP suffragare scribendo. Novi usores qui nostram app renovationem deponunt ut per septem dies liberum iudicium capiant.
Hong Kong est recepto ad normalem postquam larg ...",2025-12-17 21:07:00+00:00
3ede403e71982e18b59ddabcf44c9583,2025-07-20T20:05:00Z,'typhoon',thehillstimes.in,en,0.7,Typhoon Wipha causes major disruptions in Hong Kong and southern China,"HONG KONG, July 20: Typhoon Wipha toppled trees and caused major flight disruptions Sunday in Hong Kong and at some nearby airports in China as it moved west off the southern coast of the country. Airports in Hong Kong, Shenzhen, Zhuhai and the casino hub of …",https://thehillstimes.in/international/typhoon-wipha-causes-major-disruptions-in-hong-kong-and-southern-china,https://thehillstimes.in/wp-content/uploads/2025/07/WhatsApp-Image-2025-07-21-at-12.20.28-AM.jpeg,http://web.archive.org/web/20250729190646/https://thehillstimes.in/international/typhoon-wipha-causes-major-disruptions-in-hong-kong-and-southern-china,"HONG KONG, July 20: Typhoon Wipha toppled trees and caused major flight disruptions Sunday in Hong Kong and at some nearby airports in China as it moved west off the southern coast of the country.
A… [+2231 chars]",,"Taifun Wipha sorgt für große Störungen in Hongkong und Südchina. HONGKONG, 20. Juli: Der Taifun Wipha stürzte am Sonntag Bäume um und verursachte schwere Flugstörungen in Hongkong und an einigen nahegelegenen Flughäfen in China, als er sich westlich der Südküste des Landes bewegte. Flughäfen in Hongkong, Shenzhen, Zhuhai und das Casino-Zentrum von …","Typhoon Wipha causes major disruptions in Hong Kong and southern China. HONG KONG, July 20: Typhoon Wipha toppled trees and caused major flight disruptions Sunday in Hong Kong and at some nearby airports in China as it moved west off the southern coast of the country. Airports in Hong Kong, Shenzhen, Zhuhai and the casino hub of …","Typhoon Wipha maiorem perturbationem in Hong Kong et Sinis meridionalibus creat. HONG KONG, die 20 mensis Iulii: Typhoon Wipha arbores construxit et maiorem fugam perturbationum dominicae in Hong Kong effecit et in quibusdam prope aliquet nisl in Sinis occidentalem plagam meridianam patriae movit. Nisl in Hong Kong, Shenzhen, Zhuhai et centrum varius ...",2025-12-17 21:07:00+00:00
99b6bd5aee476d9f8e7d8b77c4258cd9,2025-07-21T13:00:00Z,veryUnusualAndNeverUsedKeyword,www.nbcnews.com,en,0.7,Hurricane risk in Florida is escalating. Flood insurance is harder to get.,"Dayna and Matt Fancher lost their home in Fort Myers Beach, Florida, to Hurricane Ian in 2022",https://www.nbcnews.com/business/real-estate/hurricane-risk-florida-escalating-flood-insurance-harder-get-rcna216843,"https://media-cldnry.s-nbcnews.com/image/upload/t_nbcnews-fp-1200-630,f_auto,q_auto:best/rockcms/2024-10/241012-Milton-2-aa-1105a-24c138.jpg",http://web.archive.org/web/20250721210947/https://www.nbcnews.com/business/real-estate/hurricane-risk-florida-escalating-flood-insurance-harder-get-rcna216843,But hurricane risk in Florida is escalating as human-caused climate change warms the atmosphere and raises sea surface temperatures in the Gulf of Mexico. Hotter conditions are trapping moisture and … [+3553 chars],,"Die Hurrikangefahr in Florida eskaliert. Eine Überschwemmungsversicherung ist schwieriger zu bekommen. Dayna und Matt Fancher verloren 2022 ihr Haus in Fort Myers Beach, Florida, durch Hurrikan Ian","Hurricane risk in Florida is escalating. Flood insurance is harder to get.. Dayna and Matt Fancher lost their home in Fort Myers Beach, Florida, to Hurricane Ian in 2022","Procellae periculum in Florida escalat. Diluvium assecurationis difficilius est.. Dayna et Matt Fancher domum suam amiserunt in Litus Fort Myers, Florida, ad Ian anno 2022 Procellae",2025-12-17 21:07:00+00:00
5eb17906875122fb6d64c1a8eb7b8100,2025-07-24T13:46:13Z,veryUnusualAndNeverUsedKeyword,economictimes.indiatimes.com,en,0.7,Microsoft hack fallout worsens: These countries were hit the hardest in global cyber meltdown,"A widespread Microsoft SharePoint vulnerability has triggered cyberattacks impacting over 400 organizations globally, with the United States, Mauritius, Jordan, and South Africa being heavily affected. Chinese state-sponsored hackers, including Linen Typhoon …",https://economictimes.indiatimes.com/news/international/us/microsoft-hack-fallout-worsens-these-countries-were-hit-the-hardest-in-global-cyber-meltdown/articleshow/122884534.cms,"https://img.etimg.com/thumb/msid-122884721,width-1200,height-630,imgsize-23572,overlay-economictimes/articleshow.jpg",http://web.archive.org/web/20250724140740/https://economictimes.indiatimes.com/news/international/us/microsoft-hack-fallout-worsens-these-countries-were-hit-the-hardest-in-global-cyber-meltdown/articleshow/122884534.cms,"A serious Microsoft SharePoint vulnerability has led to breaches in hundreds of organizations around the world, making the global cybersecurity crisis even worse. This attack is huge and is spreading… [+5357 chars]",,"Die Auswirkungen des Microsoft-Hacks verschlimmern sich: Diese Länder wurden von der weltweiten Cyber-Krise am härtesten getroffen. Eine weit verbreitete Sicherheitslücke in Microsoft SharePoint hat Cyberangriffe ausgelöst, die über 400 Organisationen weltweit betreffen, wobei die USA, Mauritius, Jordanien und Südafrika am stärksten betroffen sind. Chinesische staatlich geförderte Hacker, darunter Linen Typhoon …","Microsoft hack fallout worsens: These countries were hit the hardest in global cyber meltdown. A widespread Microsoft SharePoint vulnerability has triggered cyberattacks impacting over 400 organizations globally, with the United States, Mauritius, Jordan, and South Africa being heavily affected. Chinese state-sponsored hackers, including Linen Typhoon …","Microsoft hack fallunt graviores: Hae nationes durissimae in global cyber meltdown sunt percussae. Pervulgata Microsoft SharePoint vulnerabilitas cyberatades impactae in globally CCCC Instituta impacta, cum Civitatibus Foederatis Americae, Mauritius, Iordanis, et Africa Australi graviter afficiuntur. Seres status-sponsores gratis, inter Linteum Typhoon ...",2025-12-17 21:07:00+00:00
559d07c3eb5969c62f3440c946affa3a,2025-07-25T12:07:44Z,'hurricane',www.tcpalm.com,en,0.7,"National Hurricane Center now tracking 4 waves in Atlantic, Caribbean, rain from Gulf system",The National Hurricane Center is now tracking four tropical waves with the development of a new one in the Caribbean.,https://www.tcpalm.com/story/weather/2025/07/25/national-hurricane-center-rain-storms-gulf/85363213007/,https://media.zenfs.com/en/palm_beach_post_natl_articles_437/af383545dbf310709bde04231d04c084,,The low-pressure system bringing rain and thunderstorms across Florida the last few days is expected to move out of the Gulf inland over southeastern Texas or western Louisiana going into the weekend… [+8891 chars],,"Das National Hurricane Center verfolgt jetzt vier Wellen im Atlantik, in der Karibik und im Regen aus dem Golfsystem. Das National Hurricane Center verfolgt derzeit vier tropische Wellen und die Entwicklung einer neuen in der Karibik.","National Hurricane Center now tracking 4 waves in Atlantic, Caribbean, rain from Gulf system. The National Hurricane Center is now tracking four tropical waves with the development of a new one in the Caribbean.","National Hurricane Centrum nunc 4 undas in Atlantic, Caribbean, pluvias e systemate sinus sequi. National Hurricane Centrum nunc quattuor undas tropicas sequi cum evolutione unius novi in ​​Caribbean.",2025-12-17 21:07:00+00:00
e84446acc06391d2d36ef26a258ef866,2025-07-27T12:00:00Z,'hurricane',www.space.com,en,0.7,Hurricane forecasters are losing 3 key satellites ahead of peak storm season − a meteorologist explains why it matters,"Satellite data allows meteorologists to keep track of the location, structure and intensity of severe weather, helping to keep people safe. Now they're losing access to these satellites.",https://www.space.com/astronomy/earth/hurricane-forecasters-are-losing-3-key-satellites-ahead-of-peak-storm-season-a-meteorologist-explains-why-it-matters,https://cdn.mos.cms.futurecdn.net/5EZDbHgpaq2NQVRQUzDG55.jpg,http://web.archive.org/web/20250729014621/https://www.space.com/astronomy/earth/hurricane-forecasters-are-losing-3-key-satellites-ahead-of-peak-storm-season-a-meteorologist-explains-why-it-matters,"This article was originally published at The Conversation. The publication contributed the article to Space.com's Expert Voices: Op-Ed &amp; Insights. 
About 600 miles off the west coast of Africa, … [+7178 chars]",,"Hurrikan-Prognostiker verlieren vor der Hauptsturmsaison drei wichtige Satelliten – ein Meteorologe erklärt, warum das wichtig ist. Mithilfe von Satellitendaten können Meteorologen den Ort, die Struktur und die Intensität von Unwettern verfolgen und so zur Sicherheit der Menschen beitragen. Jetzt verlieren sie den Zugang zu diesen Satelliten.","Hurricane forecasters are losing 3 key satellites ahead of peak storm season − a meteorologist explains why it matters. Satellite data allows meteorologists to keep track of the location, structure and intensity of severe weather, helping to keep people safe. Now they're losing access to these satellites.","Procellae forecasters vincunt satellites 3 key ante apicem tempestatis temporum − Cur astrologus refert. Data satellite permittit astrologi ut vestigia loci, structurae et vehementiae tempestatum servarent, adiuvantes ut homines incolumes servarent. Nunc aditus ad satellitum perdis.",2025-12-17 21:07:00+00:00
4a71b78a505c04735e3fa33fb230c3dc,2025-07-27T15:34:56Z,'hurricane',petapixel.com,en,0.7,Nat Geo’s ‘Hurricane Katrina’ Documentary Removes the Gap Between the Past and Present,"This year marks the 20th anniversary of the devastating Hurricane Katrina, which killed nearly 2,000 people, primarily in Louisiana and Mississippi. National Geographic's new documentary series, Hurricane Katrina: Race Against Time, transports viewers back to…",https://petapixel.com/2025/07/27/nat-geos-hurricane-katrina-documentary-removes-the-gap-between-the-past-and-present/,https://petapixel.com/assets/uploads/2025/07/hurricane-katrina-nat-geo-featured2.jpg,http://web.archive.org/web/20250729031445/https://petapixel.com/2025/07/27/nat-geos-hurricane-katrina-documentary-removes-the-gap-between-the-past-and-present/,"This year marks the 20th anniversary of the devastating Hurricane Katrina, which killed nearly 2,000 people, primarily in Louisiana and Mississippi. National Geographic‘s new documentary series, Hurr… [+12464 chars]",,"Nat Geos Dokumentarfilm „Hurricane Katrina“ schließt die Kluft zwischen Vergangenheit und Gegenwart. In diesem Jahr jährt sich der verheerende Hurrikan Katrina zum 20. Mal, bei dem vor allem in Louisiana und Mississippi fast 2.000 Menschen ums Leben kamen. Die neue Dokumentarserie von National Geographic, Hurricane Katrina: Race Against Time, entführt die Zuschauer zurück in die…","Nat Geo’s ‘Hurricane Katrina’ Documentary Removes the Gap Between the Past and Present. This year marks the 20th anniversary of the devastating Hurricane Katrina, which killed nearly 2,000 people, primarily in Louisiana and Mississippi. National Geographic's new documentary series, Hurricane Katrina: Race Against Time, transports viewers back to…","Nat Geo's 'Hurricane Katrina documentalium Gap Inter Praeteritum et Praesentem' removet. Hoc anno XX denotat anniversarium populationis Hurricanae Katrinae, quae fere ad duo milia hominum occidit, praesertim in Louisiana et Mississippi. Nova series documentalium nationalis Geographicae, Procellae Katrina: Race Contra tempus, onerarias visores ad…",2025-12-17 21:07:00+00:00
