index,published,keyword,domain,language,valid,title,description,url,image,archive,content,quote,de,en,la,added
2664efcd1284f4bdd76a6cdd4bf8800d,2024-07-16T02:06:24Z,veryUnusualAndNeverUsedKeyword,newatlas.com,en,0.9,Massive double-headed floating wind turbine can harness hurricanes,"Mingyang Smart Energy, maker of the world's largest wind turbines, has just unveiled its latest gigantic floating offshore wind turbine creation. The OceanX is A two-headed, deep water behemoth capable of generating during Cat 5 hurricanes.Continue ReadingCat…",https://newatlas.com/technology/mingyang-oceanx-floating-double-wind-turbine/,https://assets.newatlas.com/dims4/default/ec0c08f/2147483647/strip/true/crop/1920x1008+0+36/resize/1200x630!/quality/90/?url=http%3A%2F%2Fnewatlas-brightspot.s3.amazonaws.com%2F50%2F19%2F5b2a8c614067887760684fe5760d%2F1720804682710.jpg&na.image_optimisation=0,http://web.archive.org/web/20240717010236/https://newatlas.com/technology/mingyang-oceanx-floating-double-wind-turbine/,"Mingyang Smart Energy, maker of the world's largest wind turbines, has just unveiled its latest gigantic floating offshore wind turbine creation. The OceanX is a two-headed, deep-water behemoth capab… [+3249 chars]",,"Riesige schwimmende Doppelwindkraftanlage kann Hurrikane abwehren. Mingyang Smart Energy, Hersteller der größten Windkraftanlagen der Welt, hat gerade seine neueste gigantische schwimmende Offshore-Windkraftanlage vorgestellt. Der OceanX ist ein zweiköpfiger Tiefwasserriese, der bei Hurrikanen der Kategorie 5 Strom erzeugen kann.WeiterlesenCat…","Massive double-headed floating wind turbine can harness hurricanes. Mingyang Smart Energy, maker of the world's largest wind turbines, has just unveiled its latest gigantic floating offshore wind turbine creation. The OceanX is A two-headed, deep water behemoth capable of generating during Cat 5 hurricanes.Continue ReadingCat…","Ingens biceps fluitantia venti Turbine phaleras turbinibus esse potest. Mingyang Smart Energy, maximarum ventorum turbines effector, modo ingentes in litore venti Turbine creationis fluitans ultimam revelavit. OceanX est biceps, aqua profunda behemoth, quae in cat 5 procellas generare potest.Continue ReadingCat…",2025-12-17 13:40:36+00:00
f7f7b16a406b443240f95390427a9853,2024-07-16T10:21:20Z,'hurricane',financialpost.com,en,0.9,The Fund Managers Modeling Catastrophe Keep Winning Their Bets,"Last month, amid reports that Hurricane Beryl would become the earliest Category 5 hurricane in history, a group of money managers were busy trying to figure out whether their highly calibrated bets centered on natural catastrophes were about to take a major …",https://financialpost.com/pmn/business-pmn/the-fund-managers-modeling-catastrophe-keep-winning-their-bets,https://smartcdn.gprod.postmedia.digital/financialpost/wp-content/uploads/2024/07/776170040-2.jpg,,"Last month, amid reports that Hurricane Beryl would become the earliest Category 5 hurricane in history, a group of money managers were busy trying to figure out whether their highly calibrated bets … [+7516 chars]",,"Die Fondsmanager, die eine Katastrophe modellieren, gewinnen weiterhin ihre Wetten. Im vergangenen Monat war eine Gruppe von Vermögensverwaltern angesichts von Berichten, dass Hurrikan Beryl der früheste Hurrikan der Kategorie 5 in der Geschichte werden würde, damit beschäftigt, herauszufinden, ob ihre hochkalibrierten, auf Naturkatastrophen ausgerichteten Wetten bald einen großen Schaden nehmen würden …","The Fund Managers Modeling Catastrophe Keep Winning Their Bets. Last month, amid reports that Hurricane Beryl would become the earliest Category 5 hurricane in history, a group of money managers were busy trying to figure out whether their highly calibrated bets centered on natural catastrophes were about to take a major …","Fund Managers Modeling Catastrophe Serva conciliandos sponsionibus. Ultimus mensis, inter tradit Turbo Beryllus primogenitus categoriae 5 turbinis in historia fieret, coetus actoribus pecuniae occupatus erat ut instare quaereret utrum sponsiones calibratae in maximis calamitatibus naturalibus positae essent.",2025-12-17 13:40:36+00:00
b0385bfd8c7c01cb066f75cb218357a6,2024-07-16T15:33:00Z,veryUnusualAndNeverUsedKeyword,www.insurancejournal.com,en,0.9,Catastrophe Bondholders Sidestep Large Losses From Weather-Related Calamities,"Last month, amid reports that Hurricane Beryl would become the earliest Category 5 hurricane in history, a group of money managers were busy trying to figure out whether their highly calibrated bets centered on natural catastrophes were about to take …",https://www.insurancejournal.com/news/international/2024/07/16/784134.htm,https://www.insurancejournal.com/app/uploads/2024/07/hurricane-beryl-floods-homes-in-sargent-texas-bloomberg-scaled.jpg,http://web.archive.org/web/20240716173524/https://www.insurancejournal.com/news/international/2024/07/16/784134.htm,"Last month, amid reports that Hurricane Beryl would become the earliest Category 5 hurricane in history, a group of money managers were busy trying to figure out whether their highly calibrated bets … [+5078 chars]",,"Inhaber von Katastrophenanleihen umgehen große Verluste durch wetterbedingte Katastrophen. Letzten Monat war eine Gruppe von Vermögensverwaltern damit beschäftigt herauszufinden, ob ihre hochkalibrierten, auf Naturkatastrophen ausgerichteten Wetten angesichts von Berichten, dass Hurrikan Beryl zum frühesten Hurrikan der Kategorie 5 in der Geschichte werden würde, ins Wanken geraten würden …","Catastrophe Bondholders Sidestep Large Losses From Weather-Related Calamities. Last month, amid reports that Hurricane Beryl would become the earliest Category 5 hurricane in history, a group of money managers were busy trying to figure out whether their highly calibrated bets centered on natural catastrophes were about to take …","Catastrophe Bondholders Sidestep magnae damna ex tempestatibus actis calamitatibus. Ultimus mensis, inter tradit Turbo Beryllus primogenitus categoriae 5 turbinis in historia fieret, coetus actoribus pecuniae occupatus erat ut instare quaereret utrum sponsiones calibratae in naturalibus calamitatibus versatae essent ... sumpturi essent.",2025-12-17 13:40:36+00:00
3602d5c363aa178cd3d3a2b05df655ff,2024-07-16T16:03:27Z,'storm surge',www.insurancejournal.com,en,0.9,"Hurricane Beryl Caused $2.5-$4.5B in Estimated Insured Losses, Says Moody’s","U.S. insured losses from Hurricane Beryl will likely fall between $2.5 billion to $4.5 billion, according to estimates by Moody’s RMS Event Response. Insured losses associated with the storm include wind, storm surge, and precipitation-induced flooding. Moody…",https://www.insurancejournal.com/news/southcentral/2024/07/16/784137.htm,https://www.insurancejournal.com/app/uploads/2024/07/0714-Beryl-Blackout-OA-01.jpg.webp,,"U.S. insured losses from Hurricane Beryl will likely fall between $2.5 billion to $4.5 billion, according to estimates by Moody’s RMS Event Response. Insured losses associated with the storm include … [+3544 chars]",,"Hurrikan Beryl verursachte laut Moody’s geschätzte versicherte Schäden in Höhe von 2,5 bis 4,5 Milliarden US-Dollar. Schätzungen von Moody’s RMS Event Response zufolge werden die versicherten Schäden in den USA durch Hurrikan Beryl voraussichtlich zwischen 2,5 und 4,5 Milliarden US-Dollar sinken. Zu den versicherten Schäden im Zusammenhang mit dem Sturm zählen Wind, Sturmflut und niederschlagsbedingte Überschwemmungen. Launisch…","Hurricane Beryl Caused $2.5-$4.5B in Estimated Insured Losses, Says Moody’s. U.S. insured losses from Hurricane Beryl will likely fall between $2.5 billion to $4.5 billion, according to estimates by Moody’s RMS Event Response. Insured losses associated with the storm include wind, storm surge, and precipitation-induced flooding. Moody…","Hurricane Beryl Causa $2.5-$4.5B in Damna Insured Insured, says Moody's. U.S. damna ab Hurricane Beryl consecuta casura erunt inter $2.5 miliarda ad $4.5 miliarda, secundum aestimationes eventus Responsio Moody's RMS. Damna salubria cum tempestate coniunguntur includuntur venti, impetus tempestatis, et inundationes praecipitatio inducta. Tristis…",2025-12-17 13:40:36+00:00
533a3e8666c597029088d930c0964c10,2024-07-16T17:10:34Z,'hurricane',fortune.com,en,0.9,One group of investors is set to make a 14% return after the most severe hurricane season in decades,"According to Twelve Capital, a single hurricane would need to generate losses exceeding $50 billion for cat-bond investors to take a substantial hit.",https://fortune.com/2024/07/16/hurricane-beryle-investor-gains/,"https://fortune.com/img-assets/wp-content/uploads/2024/07/GettyImages-2162165155-e1721149728118.jpg?resize=1200,600",http://web.archive.org/web/20240717010202/https://fortune.com/2024/07/16/hurricane-beryle-investor-gains/,"Last month, amid reports that Hurricane Beryl would become the earliest Category 5 hurricane in history, a group of money managers were busy trying to figure out whether their highly calibrated bets … [+4799 chars]",,"Eine Gruppe von Anlegern dürfte nach der schwersten Hurrikansaison seit Jahrzehnten eine Rendite von 14 % erzielen. Laut Twelve Capital müsste ein einzelner Hurrikan Verluste von mehr als 50 Milliarden US-Dollar verursachen, damit Cat-Bond-Investoren einen erheblichen Schaden erleiden könnten.","One group of investors is set to make a 14% return after the most severe hurricane season in decades. According to Twelve Capital, a single hurricane would need to generate losses exceeding $50 billion for cat-bond investors to take a substantial hit.","Unius obsidum coetus ad quattuordecim annos reditus constituitur post gravissimum tempus tempestatis in decenniis. Secundum Duo Capital, unus turbo generare damna excedentes $50 miliardis pro cat-vinculo obsido ad substantialem ictum accipiendum esset.",2025-12-17 13:40:36+00:00
4e23b053598c1c9f6bd6d835a4dc04eb,2024-07-22T11:34:57Z,'hurricane',www.bbc.com,en,0.9,Brits want to keep spotlight on hurricane-hit Caribbean,Britons with links to the Caribbean say they want to keep the aftermath of the storm on people's minds.,https://www.bbc.com/news/articles/crgrxy5z07po,https://ichef.bbci.co.uk/news/1024/branded_news/8fae/live/354e9a90-481d-11ef-96a8-e710c6bfc866.jpg,http://web.archive.org/web/20240723082205/https://www.bbc.com/news/articles/crgrxy5z07po,"Hurricane Beryl destroyed and damaged homes and vital infrastructure in the Caribbean
People living in the Caribbean are still dealing with the aftermath of Hurricane Beryl three weeks ago.
The tro… [+4016 chars]",,Die Briten wollen weiterhin auf die vom Hurrikan heimgesuchte Karibik aufmerksam machen. Briten mit Verbindungen zur Karibik wollen die Nachwirkungen des Sturms im Gedächtnis behalten.,Brits want to keep spotlight on hurricane-hit Caribbean. Britons with links to the Caribbean say they want to keep the aftermath of the storm on people's minds.,Brits arcum in procellae-hit Caribbean retinere volunt. Britanni cum Nexus ad Caribbean dicunt se velle servare tempestatem reparata in animis hominum.,2025-12-17 13:40:36+00:00
6db436b1e3e100cc184262864226f3a9,2024-07-25T10:08:00Z,'hurricane',www.dw.com,en,0.9,"Why typhoons, hurricanes, cyclones are getting stronger","With ocean warming, we’re seeing stronger tropical storms. Typhoon Gaemi caused fatal destruction in the Philippines and Taiwan, then moved to China. Tropical storm seasons have only been getting worse.

When Typhoon Gaemi passed over Japan, the Philippines, …",https://www.dw.com/en/why-typhoons-hurricanes-cyclones-are-getting-stronger/a-67233959,https://static.dw.com/image/69762884_6.jpg,http://web.archive.org/web/20240726010150/https://www.dw.com/en/why-typhoons-hurricanes-cyclones-are-getting-stronger/a-67233959,"Tropical storm seasons have only been getting worse.
When Typhoon Gaemi passed over Japan, the Philippines, Taiwan and China in late July 2024, it was described as one of the strongest in almost a d… [+4993 chars]",,"Warum Taifune, Hurrikane und Zyklone stärker werden. Mit der Erwärmung der Ozeane erleben wir stärkere tropische Stürme. Taifun Gaemi verursachte verheerende Zerstörungen auf den Philippinen und in Taiwan und zog dann nach China. Die Tropensturmsaison wird immer schlimmer.

Als der Taifun Gaemi über Japan, die Philippinen, … zog.","Why typhoons, hurricanes, cyclones are getting stronger. With ocean warming, we’re seeing stronger tropical storms. Typhoon Gaemi caused fatal destruction in the Philippines and Taiwan, then moved to China. Tropical storm seasons have only been getting worse.

When Typhoon Gaemi passed over Japan, the Philippines, …","Quare typhonas, procellae, cyclones convalescunt. Tepente oceano, validiores tropicas tempestates videbamus. Typhon Gaemi perniciem in Philippinis et Taiwan effecit, deinde in Sinas commotus est. Tropical tem- pora pejus tantum fuerunt.

Cum Typhoon Gaemi Iaponiam, Philippinas, …",2025-12-17 13:40:36+00:00
a4cd00f16c55bf41213fefd995816c92,2024-07-29T17:18:32Z,veryUnusualAndNeverUsedKeyword,www.newsweek.com,en,0.9,Hurricane Center Tracking Potential Tropical Storm Moving Towards US,"""A tropical depression could form later this week while the system is in the vicinity of the Greater Antilles or the Bahamas,"" the NHC said.",https://www.newsweek.com/hurricane-center-tracking-potential-tropical-storm-us-mexico-1931617,https://d.newsweek.com/en/full/2438483/storm-map.jpg,http://web.archive.org/web/20240730020816/https://www.newsweek.com/hurricane-center-tracking-potential-tropical-storm-us-mexico-1931617,"Only a few weeks after Hurricane Beryl tore through the Caribbean, Mexico and Texas, another tropical storm may be heading in the same direction, and an expert told Newsweek how climate change has af… [+4981 chars]",,"Hurricane Center verfolgt potenziellen Tropensturm, der sich auf die USA zubewegt. „Später in dieser Woche könnte sich ein tropisches Tiefdruckgebiet bilden, während sich das System in der Nähe der Großen Antillen oder der Bahamas befindet“, sagte das NHC.","Hurricane Center Tracking Potential Tropical Storm Moving Towards US. ""A tropical depression could form later this week while the system is in the vicinity of the Greater Antilles or the Bahamas,"" the NHC said.","Procellae Centrum semita Potentia Tropical Moving Ad US. ""Depressione tropica hac septimana serius formare potuit dum systema in vicinia Maioris Antilles seu Bahamas"" dixit NHC.",2025-12-17 13:40:36+00:00
927a36c8cfc091652bdbdece7a00ebd4,2024-07-30T10:45:00Z,'hurricane',gizmodo.com,en,0.9,Will Florida’s Oranges Survive Another Hurricane Season?,"A perfect storm of hurricanes, diseases, and water scarcity threatens to wipe out the state's famed citrus industry.",https://gizmodo.com/will-floridas-oranges-survive-another-hurricane-season-2000480858,https://gizmodo.com/app/uploads/2024/07/shutterstock_99116396.jpg,,"This story was originally published by Grist. Sign up for Grist’s weekly newsletter here.
Oranges are synonymous with Florida. The zesty fruit can be spotted adorning everything from license plates … [+9903 chars]",,"Werden Floridas Oranges eine weitere Hurrikansaison überleben? Ein perfekter Sturm aus Hurrikanen, Krankheiten und Wasserknappheit droht die berühmte Zitrusindustrie des Staates auszulöschen.","Will Florida’s Oranges Survive Another Hurricane Season?. A perfect storm of hurricanes, diseases, and water scarcity threatens to wipe out the state's famed citrus industry.","Will Florida's Oranges Survive Another Hurricane Season?. Perfecta tempestas turbinum, morborum, et aquarum penuriam minatur ad delendam inclitam citri industriam.",2025-12-17 13:40:36+00:00
66272ce87dabf240f5c655738bccf53e,2024-07-31T09:00:00Z,'hurricane',www.npr.org,en,0.9,Do you rent? You may be more vulnerable to climate-driven disasters,"The financial cards are stacked against many renters who survive hurricanes, floods, wildfires and other major weather disasters. The long-term effects can be devastating.",https://www.npr.org/2024/07/31/nx-s1-4998376/renters-and-weather-disasters,https://npr.brightspotcdn.com/dims3/default/strip/false/crop/3000x1688+0+158/resize/1400/quality/100/format/jpeg/?url=http%3A%2F%2Fnpr-brightspot.s3.amazonaws.com%2Ff6%2F81%2F3d51eb9e4e8886f3395cab4d9d6d%2F0b6a2775-3.jpg,http://web.archive.org/web/20240801014712/https://www.npr.org/2024/07/31/nx-s1-4998376/renters-and-weather-disasters,"Venus James loved living in Matlacha, Florida. The tiny island just outside Fort Myers was quirky, with artsy shops, fishing boats and just a few hundred homes. You could walk from one end to the oth… [+12149 chars]",,"Mieten Sie? Sie sind möglicherweise anfälliger für klimabedingte Katastrophen. Viele Mieter, die Hurrikane, Überschwemmungen, Waldbrände und andere große Wetterkatastrophen überleben, sind finanziell schlecht aufgestellt. Die langfristigen Auswirkungen können verheerend sein.","Do you rent? You may be more vulnerable to climate-driven disasters. The financial cards are stacked against many renters who survive hurricanes, floods, wildfires and other major weather disasters. The long-term effects can be devastating.","Ecquid scissum est? Plures vulnerari potes calamitatibus climatis agitatae. In schedulis nummariis reclinatae sunt contra multos conductores qui turbines, inundationes, incendia incendia et alias calamitates tempestatum maioris momenti supersunt. Diu terminus effectus vastare potest.",2025-12-17 13:40:36+00:00
6a1876add6a1a09a0fb0c85a0f23bdc1,2024-07-31T15:01:43Z,'hurricane season',www.cnn.com,en,0.9,A potential Atlantic tropical system could reignite hurricane season,The eerie calm that settled over the Atlantic Ocean after historic Hurricane Beryl roared across it in early July is about to be shattered.,https://www.cnn.com/2024/07/31/weather/tropical-depression-atlantic-florida-hurricane-season/index.html,"https://media.cnn.com/api/v1/images/stellar/prod/cnn-digital-tracker-tropical-outlook-wednesday-073124-am.png?c=16x9&q=w_800,c_fill",http://web.archive.org/web/20240731235818/https://www.cnn.com/2024/07/31/weather/tropical-depression-atlantic-florida-hurricane-season/index.html,"The eerie calm over the Atlantic basin that settled in after historic Hurricane Beryl is about to be shattered.
Its been more than three weeks since deadly Beryl made its final landfall in Texas. Dr… [+3144 chars]",,"Ein potenzielles atlantisches Tropensystem könnte die Hurrikansaison neu entfachen. Die unheimliche Ruhe, die sich über dem Atlantik einstellte, nachdem der historische Hurrikan Beryl Anfang Juli darüber hinweggefegt war, steht kurz davor, zerstört zu werden.",A potential Atlantic tropical system could reignite hurricane season. The eerie calm that settled over the Atlantic Ocean after historic Hurricane Beryl roared across it in early July is about to be shattered.,Systema tropica Atlantici potentia potentialis temporis typhonii regnare potuit. Superstitio tranquillitas quae in Oceano Atlantico consedit postquam historica Hurricane Beryllus trans illum in primo Iulio fremuit conlisa est.,2025-12-17 13:40:36+00:00
