index,published,keyword,domain,language,valid,title,description,url,image,archive,content,quote,de,en,la,added
15c12f5401e11afa044476df70d0c964,2026-07-01T15:21:57Z,'tropical depression',www.nhc.noaa.gov,en,0.7,Tropical Depression Four-E Graphics,"Wind Speed Probabilities last updated Wed, 01 Jul 2026 15:21:57 GMT",https://www.nhc.noaa.gov/refresh/graphics_ep4+shtml/152157.shtml?cone,,,"* If the storm is forecast to dissipate within 3 days, the ""Full Forecast"" and ""3 day"" graphic will be identical
Click Here for a 5-day Cone Printer Friendly GraphicHow to use the cone graphic (vide… [+2695 chars]",,"Tropische Depression Four-E-Grafiken. Die Windgeschwindigkeitswahrscheinlichkeiten wurden zuletzt am Mittwoch, den 01. Juli 2026 um 15:21:57 Uhr GMT aktualisiert","Tropical Depression Four-E Graphics. Wind Speed Probabilities last updated Wed, 01 Jul 2026 15:21:57 GMT","Tropical Depressione Quattuor-E Graphics. Ventus Speed ​​Probabilitates renovatio Sat, 01 Jul 2026 15:21:57 GMT",2026-07-03 06:40:04+00:00
01cf8e5fd4c043f3727b57a13a1b7f45,2026-07-02T00:23:11Z,'tropical cyclone',www.scmp.com,en,0.9,Hong Kong issues No 1 typhoon signal on Thursday morning,"This story has been made freely available as a public service to our readers. Please consider supporting SCMP’s journalism by subscribing.
The Hong Kong Observatory issued the No 1 typhoon signal at 7.40am on Thursday as an approaching tropical cyclone moved …",https://www.scmp.com/news/hong-kong/article/3359089/hong-kong-issues-no-1-typhoon-signal-thursday-morning,https://cdn.i-scmp.com/sites/default/files/styles/og_image_scmp_generic/public/d8/images/canvas/2026/07/02/67675ccb-3a81-423d-9421-7ac921a43304_be60794f.jpg?itok=SkIclbgi&v=1782951783,,"This story has been made freely available as a public service to our readers. Please consider supporting SCMPs journalism bysubscribing.
The Hong Kong Observatory issued the No 1 typhoon signal at 7… [+932 chars]",,"Hongkong gibt am Donnerstagmorgen das Taifun-Signal Nr. 1 aus. Diese Geschichte wurde unseren Lesern als öffentlicher Dienst frei zugänglich gemacht. Bitte denken Sie darüber nach, den Journalismus von SCMP durch ein Abonnement zu unterstützen.
Das Hong Kong Observatory gab am Donnerstag um 7.40 Uhr das Taifun-Signal Nr. 1 aus, als sich ein herannahender tropischer Wirbelsturm bewegte …","Hong Kong issues No 1 typhoon signal on Thursday morning. This story has been made freely available as a public service to our readers. Please consider supporting SCMP’s journalism by subscribing.
The Hong Kong Observatory issued the No 1 typhoon signal at 7.40am on Thursday as an approaching tropical cyclone moved …","Hongcongum exit Non 1 typhon signum Iovis mane. Haec fabula gratuito praesto est ut officium publicum legentibus. Vide quaeso diurnarium SCMP suffragare scribendo.
Hong Kong Observatorium edixit No 1 typhonium signum ad 7.40am die Iovis ut appropinquans cyclo tropico movetur.",2026-07-04 06:27:41+00:00
1655f51a7b67274a0fa9da23f849bc4e,2026-07-02T05:39:18Z,'tropical cyclone',skepticalscience.com,en,0.9,Skeptical Science New Research for Week #27 2026,"Open access notables
Warming climate has lengthened global intense tropical cyclone seasons, Liu et al., Nature Communication

Intense tropical cyclones (TCs), which pose serious threats to human life and property, often occur within a short period of time ea…",https://skepticalscience.com/new_research_2026_27.html,https://skepticalscience.com/public/assets/images/og/button_sks_200.jpg,http://web.archive.org/web/20260702082417/https://skepticalscience.com/new_research_2026_27.html,"Posted on 2 July 2026 by Doug Bostrom, Marc Kodack
Open access notables
Warming climate has lengthened global intense tropical cyclone seasons, Liu et al., Nature Communication
Intense tropical cy… [+60313 chars]",,"Neue Forschungsergebnisse von Skeptical Science für Woche Nr. 27 2026. Open-Access-Prominente
Das sich erwärmende Klima hat weltweit die intensiven tropischen Wirbelsturmsaisonen verlängert, Liu et al., Nature Communication

Intensive tropische Wirbelstürme (TCs), die eine ernsthafte Bedrohung für Menschenleben und Eigentum darstellen, treten häufig innerhalb kurzer Zeit auf.","Skeptical Science New Research for Week #27 2026. Open access notables
Warming climate has lengthened global intense tropical cyclone seasons, Liu et al., Nature Communication

Intense tropical cyclones (TCs), which pose serious threats to human life and property, often occur within a short period of time ea…","Scientiae Scepticae Novae Investigationis pro Hebdomada #27 2026. Aperta aditus notabilium
Clima tepidior intensiorem cycli tropici tempora globalem produxit, Liu et al., Natura Communication

Vehemens tropicae cyclones (TCs), quae graves minas ponunt vitae et proprietatis humanae, saepe occurrunt intra breve tempus ea…",2026-07-04 06:27:41+00:00
c1b9339d5cef7f0f0b3b52416f7500bc,2026-07-01T08:36:21Z,'tropical depression',www.nhc.noaa.gov,en,0.7,Tropical Depression Four-E Graphics,,https://www.nhc.noaa.gov/refresh/graphics_ep4+shtml/083621.shtml?cone,,,"* If the storm is forecast to dissipate within 3 days, the ""Full Forecast"" and ""3 day"" graphic will be identical
Click Here for a 5-day Cone Printer Friendly GraphicHow to use the cone graphic (vide… [+2695 chars]",,Tropische Depression Four-E-Grafiken. Keiner,Tropical Depression Four-E Graphics. None,Tropical Depressione Quattuor-E Graphics. Nullus,2026-07-04 10:22:58+00:00
dabc2e314c1868ea262d1201067b008b,2026-07-05T09:03:53Z,'typhoon',www.bbc.co.uk,en,0.9,Evacuations in Guam as super typhoon Bavi approaches,The storm is forecast to bring winds in excess of 160mph and waves nearly 11m high when it makes landfall on Monday.,https://www.bbc.co.uk/news/articles/cr7xpgx50jxo,https://ichef.bbci.co.uk/ace/branded_news/1200/cpsprodpb/5ccc/live/14f8dd50-7840-11f1-a9d9-f754ec615ffe.jpg,http://web.archive.org/web/20260705101824/https://www.bbc.co.uk/news/articles/cr7xpgx50jxo,"Emergency evacuations are taking place in Guam and the Northern Mariana Islands as a super typhoon bears down on the US Pacific territories.
Bavi is forecast to make landfall early on Monday morning… [+1295 chars]",,"Evakuierungen in Guam, da sich der Supertaifun Bavi nähert. Es wird erwartet, dass der Sturm Windgeschwindigkeiten von über 160 Meilen pro Stunde und fast 11 Meter hohe Wellen mit sich bringt, wenn er am Montag auf Land trifft.",Evacuations in Guam as super typhoon Bavi approaches. The storm is forecast to bring winds in excess of 160mph and waves nearly 11m high when it makes landfall on Monday.,Vacationes in Guam sicut super typhonium Bavi accedit. Tempestas praenuntiat ut ventos in excessu 160mphorum et fluctuum 11m altam fere ferant cum lapsus die Lunae facit.,2026-07-07 11:18:35+00:00
41868abd3b23bc181f7447317871be3b,2026-07-02T05:14:40Z,'hurricane season',dailycaller.com,en,0.9,"Strengthening El Niño Suppressing Tropical Development, Officially Puts Atlantic Hurricane Season Behind Schedule","The first month of the 2026 Atlantic hurricane season has come to an end, and so far, there's only been the development of one tropical storm.",https://dailycaller.com/2026/07/02/el-nino-tropical-development-atlantic-hurricane-season/,"https://images.dailycaller.com/image/width=1280,height=549,fit=cover,format=webp,f=auto/https://cdn01.dailycaller.com/wp-content/uploads/2026/07/GettyImages-2281901037-scaled-e1782968878755.jpg",,"The first month of the 2026 Atlantic hurricane season has come to an end, and so far, there’s only been the development of one tropical storm. According to FOX Weather, this officially puts the seaso… [+1478 chars]",,"Durch die Verstärkung von El Niño wird die tropische Entwicklung unterdrückt, wodurch die Hurrikansaison im Atlantik offiziell hinter dem Zeitplan zurückbleibt. Der erste Monat der atlantischen Hurrikansaison 2026 ist zu Ende und bisher hat sich nur ein einziger Tropensturm entwickelt.","Strengthening El Niño Suppressing Tropical Development, Officially Puts Atlantic Hurricane Season Behind Schedule. The first month of the 2026 Atlantic hurricane season has come to an end, and so far, there's only been the development of one tropical storm.","Confortans El Niño Development Tropical omni- bus, Officialiter Ponit Atlanticum Procellae Season Post Schedulam. Primus mensis anni 2026 Atlantici tempestatis tempore finitur, et tantum tantum unius tempestatis tropicae fuit progressio.",2026-07-07 21:38:38+00:00
e74899a26bad84e552814f01d6438d38,2026-07-06T04:00:00Z,'typhoon climate change',www.americanthinker.com,en,0.3,Climate Change Blamed in Heat Waves: Science or Simulation?,"Photo Credit:heat wave illustration
 
 pixabayBy Mark KeenanAs Europe and much of North America endured record heat, headlines quickly appeared claiming that the heat wave was ""virtually impossible"" without human-caused climate change. Really?",https://www.americanthinker.com/articles/2026/07/climate-change-blamed-in-heat-waves-science-or-simulation/,https://images.americanthinker.com/ea/eamwnrxvvqnmbnfgpxli_1200.jpg,http://web.archive.org/web/20260706093809/https://www.americanthinker.com/articles/2026/07/climate-change-blamed-in-heat-waves-science-or-simulation/,"As Europe and much of North America endured record heat in recent days, headlines quickly appeared claiming that the heat wave was ""virtually impossible"" without human-caused climate change.
To many… [+10528 chars]",,"Hitzewellen für den Klimawandel verantwortlich machen: Wissenschaft oder Simulation? Bildnachweis: Hitzewellenillustration
 
 pixabayVon Mark KeenanAls Europa und ein Großteil Nordamerikas Rekordhitze erlebten, tauchten schnell Schlagzeilen auf, in denen behauptet wurde, dass die Hitzewelle ohne den vom Menschen verursachten Klimawandel „praktisch unmöglich“ sei. Wirklich?","Climate Change Blamed in Heat Waves: Science or Simulation?. Photo Credit:heat wave illustration
 
 pixabayBy Mark KeenanAs Europe and much of North America endured record heat, headlines quickly appeared claiming that the heat wave was ""virtually impossible"" without human-caused climate change. Really?","Climate Change Blamed in Heat Waves: Science or Simulation?. Photo Credit: illustrationem fluctus calor
 
 pixabayBy Mark KeenanAs Europa et multa Americae Septentrionalis recorda caloris pertulerunt, headlines cito apparuerunt dicentes aestus fluctum esse ""vire impossibile"" sine mutatione climatis humano. Itane?",2026-07-08 10:30:03+00:00
bc15a71b9edaaa9cdc2ba781be5a4bfa,2026-07-06T07:00:00Z,'typhoon climate change',www.insidehighered.com,en,0.3,"After the ‘Edupocalypse,’ What Next?","After the ‘Edupocalypse,’ What Next?

 


 
sara.custer@in…

Mon, 07/06/2026 - 03:00 AM

The policy changes in the One Big Beautiful Bill Act are just part of the poly-crises hitting higher ed, says legal scholar Peter Lake. He argues the sector could emerge …",https://www.insidehighered.com/news/government/student-aid-policy/2026/07/06/how-legal-scholar-thinks-obbba-will-change-higher-ed,https://www.insidehighered.com/sites/default/files/styles/large/public/2026-07/Reflection_of_college_binoculars.jpg?itok=vfV2W_M2,http://web.archive.org/web/20260706225842/https://www.insidehighered.com/news/government/student-aid-policy/2026/07/06/how-legal-scholar-thinks-obbba-will-change-higher-ed,The One Big Beautiful Bill Act ushered in a raft of policy reforms on July 1 that will change how students pay for college and how degrees are valued. Future graduate students will likely be more rel… [+14350 chars],,"Wie geht es nach der „Edupokalypse“ weiter? Wie geht es nach der „Edupokalypse“ weiter?

 


 
sara.custer@in…

Mo, 07.06.2026 – 03:00 Uhr

Die politischen Änderungen im One Big Beautiful Bill Act sind nur ein Teil der Polykrisen, die die Hochschulen heimsuchen, sagt der Rechtswissenschaftler Peter Lake. Er argumentiert, dass der Sektor entstehen könnte …","After the ‘Edupocalypse,’ What Next?. After the ‘Edupocalypse,’ What Next?

 


 
sara.custer@in…

Mon, 07/06/2026 - 03:00 AM

The policy changes in the One Big Beautiful Bill Act are just part of the poly-crises hitting higher ed, says legal scholar Peter Lake. He argues the sector could emerge …","Post 'Edupocalypse,' Quid deinde?. Post 'Edupocalypse,' Quid deinde?

 


 
sara.custer@in…

Mon, 07/06/2026 - 03:00 AM

Consiliorum mutationes in One Big Speciosa Bill Actus iusta pars poly-crises altiorem edendi percutit, dicit iuris scholaris Petrus Lake. Prouenire arguit sector...",2026-07-08 10:30:03+00:00
9b2a55563469253c65be8ab4b4004956,2026-07-05T16:54:26Z,'hurricane',www.aljazeera.com,en,0.7,Super Typhoon Bavi threatens Guam with catastrophic winds and flooding,The storm system is expected to reach landfall on Monday morning.,https://www.aljazeera.com/news/2026/7/5/super-typhoon-bavi-threatens-guam-with-catastrophic-winds-and-flooding,https://www.aljazeera.com/wp-content/uploads/2026/07/afp_6a4a7e60d2b0-1783266912.jpg?resize=1920%2C1440,http://web.archive.org/web/20260705204955/https://www.aljazeera.com/news/2026/7/5/super-typhoon-bavi-threatens-guam-with-catastrophic-winds-and-flooding,Residents of Guam and the Northern Mariana Islands are moving to emergency shelters and making last-minute preparations before the arrival of a super typhoon expected to batter the United States Paci… [+2903 chars],,Der Supertaifun Bavi bedroht Guam mit katastrophalen Winden und Überschwemmungen. Das Sturmsystem wird voraussichtlich am Montagmorgen das Festland erreichen.,Super Typhoon Bavi threatens Guam with catastrophic winds and flooding. The storm system is expected to reach landfall on Monday morning.,Super Typhoon Bavi Guam ventis calamitosis et inundationibus minatur. Tempestas ratio expectatur ut Lunae mane ad landfall perveniret.,2026-07-08 10:30:03+00:00
a7693c6baf176b4a7bc6077918bf1b82,2026-07-05T19:00:02Z,'hurricane',www.si.com,en,0.7,"Way-Too-Early 2026 Virginia Tech Football Preview and Prediction: Week 12, @ Miami",Virginia Tech's lost its last five games to the Hurricanes.,https://www.si.com/college/virginiatech/football/way-too-early-2026-virginia-tech-football-preview-and-prediction-week-12-miami-01kwnq00vmjp,https://s.yimg.com/os/en/virginia_tech_hokies_on_si_articles_561/dd773f6a3f4fc3cb6863bbfae0447598,http://web.archive.org/web/20260706073623/https://www.si.com/college/virginiatech/football/way-too-early-2026-virginia-tech-football-preview-and-prediction-week-12-miami-01kwnq00vmjp,"Virginia Tech football embarks on its penultimate road test of the season in late November when it travels to Miami Gardens, Fla., to take on perennial ACC power Miami.
While the Hurricanes haven't … [+5734 chars]",,"Viel zu frühe Vorschau und Vorhersage zum Virginia Tech Football 2026: Woche 12, @ Miami. Virginia Tech’s hat seine letzten fünf Spiele gegen die Hurricanes verloren.","Way-Too-Early 2026 Virginia Tech Football Preview and Prediction: Week 12, @ Miami. Virginia Tech's lost its last five games to the Hurricanes.","Way-Too-Early 2026 Virginia Tech Football Preview and Praedictio: Hebdomada 12, @ Miami. Virginia Tech ultimos quinque ludos turbinum amisit.",2026-07-08 10:30:03+00:00
5c47ea87708157b14c07d157ffe0d36e,2026-07-05T22:45:00Z,'hurricane',www.dw.com,en,0.7,Super Typhoon Bavi hits US Pacific islands,"Heavy rains and high winds are battering Guam and the Northern Marianas ahead of the arrival of a ""very dangerous"" storm that could cut power supplies for weeks or months.",https://www.dw.com/en/super-typhoon-bavi-hits-us-pacific-islands/a-77840713,https://static.dw.com/image/77840524_6.jpg,http://web.archive.org/web/20260705225245/https://www.dw.com/en/super-typhoon-bavi-hits-us-pacific-islands/a-77840713,"Super Typhoon Bavi arrived in the US Pacific Island territories of Guam and the Northern Marianas, bringing torrential rains and hurricane-force winds.
According to the National Weather Service, Bav… [+4035 chars]",,"Der Supertaifun Bavi trifft die Pazifikinseln der USA. Heftige Regenfälle und starke Winde verwüsten Guam und die Nördlichen Marianen, bevor ein „sehr gefährlicher“ Sturm eintritt, der die Stromversorgung wochen- oder monatelang unterbrechen könnte.","Super Typhoon Bavi hits US Pacific islands. Heavy rains and high winds are battering Guam and the Northern Marianas ahead of the arrival of a ""very dangerous"" storm that could cut power supplies for weeks or months.","Super Typhoon Bavi US Pacific insulas pervenit. Imbres et venti alti Guam arietant et Marianas Septentrionales antecedunt adventum tempestatis ""periculosissimi"", qui potestatem commeatus per septimanas vel menses incidere potuit.",2026-07-08 10:30:03+00:00
e0fb678f85867b71dbecdb7373a03a48,2026-07-06T07:59:55Z,'hurricane',www.aljazeera.com,en,0.7,Super Typhoon Bavi makes landfall on US Pacific islands,"Local authorities on Rota, part of the Northern Mariana Islands, say they have received reports of 'major damages'.",https://www.aljazeera.com/news/2026/7/6/super-typhoon-bavi-makes-landfall-on-us-pacific-islands,https://www.aljazeera.com/wp-content/uploads/2026/07/AFP__20260706__B9C7766__v1__HighRes__UsMarianaWeatherTyphoon-1783320371.jpg?resize=1920%2C1440,http://web.archive.org/web/20260706115110/https://www.aljazeera.com/news/2026/7/6/super-typhoon-bavi-makes-landfall-on-us-pacific-islands,"A super typhoon has made landfall on United States territorial islands in the western Pacific near Guam, with authorities saying they have received reports of significant damage as powerful winds and… [+1652 chars]",,"Der Supertaifun Bavi trifft auf Inseln im US-Pazifik auf Land. Die örtlichen Behörden auf Rota, einem Teil der Nördlichen Marianen, gaben an, Berichte über „große Schäden“ erhalten zu haben.","Super Typhoon Bavi makes landfall on US Pacific islands. Local authorities on Rota, part of the Northern Mariana Islands, say they have received reports of 'major damages'.","Eximius Typhoon Bavi in ​​US Pacifici insulas lapsus facit. Auctoritates locales de Rota, parte Insularum Marianarum septentrionalium, dicunt se accepisse relationes de damnis maioribus.",2026-07-08 10:30:03+00:00
9b0a83f2f2b6988b6147bc0489533570,2026-07-06T10:30:10Z,'hurricane',earmilk.com,en,0.7,"Hurricane accomplishes exactly that with ""CYCLES""","And that's exactly what Hurricane does with ""CYCLES,"" the first single off his upcoming EP of the same name. The track is a carefully curated blend of soul, R&B, and…",https://earmilk.com/2026/07/06/hurricane-accomplishes-exactly-that-with-cycles/,,,"And that's exactly what Hurricane does with ""CYCLES,"" the first single off his upcoming EP of the same name. The track is a carefully curated blend of soul, R&amp;B, and Afrobeats that speaks of pers… [+1225 chars]",,"Genau das gelingt Hurricane mit „CYCLES“. Und genau das macht Hurricane mit „CYCLES“, der ersten Single seiner kommenden gleichnamigen EP. Der Track ist eine sorgfältig kuratierte Mischung aus Soul, R&B und…","Hurricane accomplishes exactly that with ""CYCLES"". And that's exactly what Hurricane does with ""CYCLES,"" the first single off his upcoming EP of the same name. The track is a carefully curated blend of soul, R&B, and…","Procellae id prorsus efficit cum ""CYCLES"". Et hoc prorsus est quod Procellae cum ""CYCLES"" facit, primum unum eius EP adventus sui nominis. Vestigium est curata mixtio animae, R&B, et…",2026-07-08 10:30:03+00:00
4d72b4780b612d96afff8bda98dfa0ce,2026-07-05T09:40:33Z,'typhoon',www.vanguardngr.com,en,0.9,‘Very dangerous’ super typhoon nears US Pacific Islands,"There were few cars on the roads in Guam on Sunday as heavy rain and strong winds lashed the island.
The post ‘Very dangerous’ super typhoon nears US Pacific Islands appeared first on Vanguard News.",https://www.vanguardngr.com/2026/07/very-dangerous-super-typhoon-nears-us-pacific-islands/,https://cdn.vanguardngr.com/wp-content/uploads/2026/07/super-typhoon-mangkhut-approaching-the-philippines.jpg,http://web.archive.org/web/20260705100924/https://www.vanguardngr.com/2026/07/very-dangerous-super-typhoon-nears-us-pacific-islands/,"People in Guam and the Northern Marianas moved to emergency evacuation centers and made last-minute preparations on Sunday, hours before a “super typhoon” was projected to bulldoze through the US Pac… [+4163 chars]",,"„Sehr gefährlicher“ Supertaifun nähert sich den US-Pazifikinseln. Am Sonntag waren in Guam nur wenige Autos auf den Straßen unterwegs, da heftiger Regen und starke Winde über die Insel fegten.
Der Beitrag „Sehr gefährlicher“ Supertaifun nähert sich den Pazifikinseln der USA erschien zuerst auf Vanguard News.","‘Very dangerous’ super typhoon nears US Pacific Islands. There were few cars on the roads in Guam on Sunday as heavy rain and strong winds lashed the island.
The post ‘Very dangerous’ super typhoon nears US Pacific Islands appeared first on Vanguard News.","Item periculosum est super typhoon insulae Pacificae US appropinquat. Pauci currus in viis Guam die Dominico tam graves pluviae et venti validi insulam verberabant.
Posts 'periculosum' super typhonium prope US insulas Pacificas primum in Vanguard News apparuit.",2026-07-08 10:30:03+00:00
44372ab8b8128f85b441d4a70196dff2,2026-07-05T11:07:47Z,'typhoon',timesofmalta.com,en,0.9,'Very dangerous' super typhoon nears US Pacific islands,People moved to emergency evacuation centres ahead of forecast of winds up to 260 km/h,https://timesofmalta.com/article/very-dangerous-super-typhoon-nears-us-pacific-islands.1130948,https://cdn-attachments.timesofmalta.com/45cff85ca38a80bf21f02809721731951f986dca-1783243610-a007041a-1200x630.png,http://web.archive.org/web/20260706014134/https://timesofmalta.com/article/very-dangerous-super-typhoon-nears-us-pacific-islands.1130948,"People in Guam and the Northern Marianas moved to emergency evacuation centers and made last-minute preparations on Sunday, hours before a ""super typhoon"" was projected to bulldoze through the US Pac… [+4167 chars]",,"„Sehr gefährlicher“ Supertaifun nähert sich Pazifikinseln in den USA. Die Menschen zogen in Not-Evakuierungszentren, bevor Windgeschwindigkeiten von bis zu 260 km/h vorhergesagt wurden",'Very dangerous' super typhoon nears US Pacific islands. People moved to emergency evacuation centres ahead of forecast of winds up to 260 km/h,"""Periculosum"" super typhoon appropinquat insulis Pacificis US. Homines ad subitis evacuatione centra praenuntientur ventorum usque ad CCLX km / h *",2026-07-08 10:30:03+00:00
454f8aa8711ba46747054f44d59a72b2,2026-07-05T16:19:01Z,'hurricane',www.rte.ie,en,0.9,'Very dangerous' super typhoon nears US Pacific islands,"Howling winds and lashing rains battered Guam and the Northern Marianas today, hours before the projected arrival of a ""super typhoon"" with equivalent force to a category-5 hurricane over the US Pacific territories.",https://www.rte.ie/news/2026/0705/1581882-super-typhoon-bavi/,https://www.rte.ie/images/0024a4cc-1600.jpg,http://web.archive.org/web/20260705175219/https://www.rte.ie/news/2026/0705/1581882-super-typhoon-bavi/,"Howling winds and lashing rains battered Guam and the Northern Marianas today, hours before the projected arrival of a ""super typhoon"" with equivalent force to a category-5 hurricane over the US Paci… [+3499 chars]",,"„Sehr gefährlicher“ Supertaifun nähert sich Pazifikinseln in den USA. Heulende Winde und heftige Regenfälle haben Guam und die Nördlichen Marianen heute heimgesucht, Stunden bevor ein „Super-Taifun“ mit der Stärke eines Hurrikans der Kategorie 5 über den US-Pazifikgebieten eintreffen wird.","'Very dangerous' super typhoon nears US Pacific islands. Howling winds and lashing rains battered Guam and the Northern Marianas today, hours before the projected arrival of a ""super typhoon"" with equivalent force to a category-5 hurricane over the US Pacific territories.","""Periculosum"" super typhoon appropinquat insulis Pacificis US. Ventos ululantes et imbres verberantes Guam et Marianas septentrionales hodie, horis ante adventum projecti ""super typhonium"" cum aequivalente vi categoriae 5 turbo super US Pacifici fines.",2026-07-08 10:30:03+00:00
9a4164eb8ff09ad825da93a480fefa12,2026-07-05T23:19:25Z,'hurricane season',biztoc.com,en,0.9,Tracking The Caribbean Super Yacht Migration,"Tracking The Caribbean Super Yacht Migration 
 
The superyacht season across the Caribbean and the Gulf of America has shifted into the off-season, with hurricane season now roughly a month in. As tropical activity risks rise across the Atlantic basin, some o…",https://biztoc.com/x/06b788af51184357,https://biztoc.com/cdn/06b788af51184357_s.webp,,"Tracking The Caribbean Super Yacht Migration 
The superyacht season across the Caribbean and the Gulf of America has shifted into the off-season, with hurricane season now roughly a month in. As tro… [+147 chars]",,"Verfolgung der karibischen Superyacht-Migration. Verfolgung der karibischen Superyacht-Migration 
 
Die Superyacht-Saison in der Karibik und im Golf von Amerika ist in die Nebensaison übergegangen, und die Hurrikan-Saison ist nun etwa einen Monat her. Da die Gefahr tropischer Aktivitäten im gesamten Atlantikbecken zunimmt, sind einige …","Tracking The Caribbean Super Yacht Migration. Tracking The Caribbean Super Yacht Migration 
 
The superyacht season across the Caribbean and the Gulf of America has shifted into the off-season, with hurricane season now roughly a month in. As tropical activity risks rise across the Atlantic basin, some o…","Caribbean Super Yacht Donec adipiscing. Caribbean Super Yacht Donec adipiscing 
 
Superyacht tempus trans Caribbeum et Sinus Americam in extemporalitatem movit, tempestatum nunc fere per unum mensem. Actio tropica periculum subit per Oceanum Atlanticum, quidam o…",2026-07-08 10:30:03+00:00
