index,published,keyword,domain,language,valid,title,description,url,image,archive,content,quote,de,en,la,added
6fd38bd4bc97faec21e537dff9041c74,2024-11-06T15:18:53Z,'hurricane warning',biztoc.com,en,0.9,Carnival Cruise and Royal Caribbean share new hurricane warnings,"While most of the nation was distracted by the election, Tropical Storm Rafael grew into Hurricane Rafael. Carnival Cruise Line's consulting meteorologist, Amy Sweezy, shared her thoughts on the growing storm on the morning of Nov. 6.
""Hi everybody. Meteorolo…",https://biztoc.com/x/39df16376415529b,https://biztoc.com/cdn/39df16376415529b_s.webp,,"While most of the nation was distracted by the election, Tropical Storm Rafael grew into Hurricane Rafael. Carnival Cruise Line's consulting meteorologist, Amy Sweezy, shared her thoughts on the grow… [+147 chars]",,"Carnival Cruise und Royal Caribbean teilen neue Hurrikanwarnungen. Während der Großteil der Nation durch die Wahl abgelenkt war, entwickelte sich der Tropensturm Rafael zum Hurrikan Rafael. Die beratende Meteorologin von Carnival Cruise Line, Amy Sweezy, teilte ihre Gedanken über den zunehmenden Sturm am Morgen des 6. November mit.
„Hallo zusammen. Meteorolo…","Carnival Cruise and Royal Caribbean share new hurricane warnings. While most of the nation was distracted by the election, Tropical Storm Rafael grew into Hurricane Rafael. Carnival Cruise Line's consulting meteorologist, Amy Sweezy, shared her thoughts on the growing storm on the morning of Nov. 6.
""Hi everybody. Meteorolo…","Carnival Cruise and Royal Caribbean participes novae procellae monita. Dum pleraque natio per electionem distracta est, Tropical Rafael Tempestas in Procellae Rafael crevit. Carnival Cruise Line astrologus consulens Amy Sweezy, communicavit cogitationes suas in tempestate ingravescentem die 6 mensis Novembris.
""Hi omnes. Meteorolo...",2025-12-17 13:03:48+00:00
5e0769d555839ebb3dbf8d98abfa660b,2024-11-06T16:29:23Z,veryUnusualAndNeverUsedKeyword,www.newsweek.com,en,0.9,Hurricane Rafael Spaghetti Models as Florida Warned of Storm Conditions,Rafael is expected to maintain hurricane intensity Thursday through Friday as it moves northwestward across the southeastern Gulf.,https://www.newsweek.com/hurricane-rafael-spaghetti-models-florida-warned-storm-conditions-1981352,https://d.newsweek.com/en/full/2514260/spaghetti-model-em.png,http://web.archive.org/web/20241106163519/https://www.newsweek.com/hurricane-rafael-spaghetti-models-florida-warned-storm-conditions-1981352,"The National Hurricane Center (NHC) has issued an advisory warning residents across Florida to prepare for potential impacts as Hurricane Rafael approaches the state.
The storm, currently moving nor… [+3012 chars]",,"Hurrikan Rafael Spaghetti modelliert, als Florida vor Sturmbedingungen warnte. Es wird erwartet, dass Rafael von Donnerstag bis Freitag die Intensität des Hurrikans beibehält, während er sich nordwestlich über den südöstlichen Golf bewegt.",Hurricane Rafael Spaghetti Models as Florida Warned of Storm Conditions. Rafael is expected to maintain hurricane intensity Thursday through Friday as it moves northwestward across the southeastern Gulf.,Procellae Rafael Spaghetti exemplar est sicut Florida Tempestatum admonitus. Rafael expectat vehementiam Iovis per Veneris in aquilonem ponere per sinum meridianum ad aquilonem.,2025-12-17 13:03:48+00:00
91dcf106ce883459d45df0586832ae26,2024-11-15T16:03:12Z,'typhoon',www.pbs.org,en,0.9,"Typhoon Usagi pounds the Philippines, fifth major storm in a month, with a sixth due Sunday",Forecasters also say a new storm in the Pacific could strengthen into a powerful typhoon before hitting the Philippine archipelago on Sunday.,https://www.pbs.org/newshour/world/typhoon-usagi-pounds-the-philippines-fifth-major-storm-in-a-month-with-a-sixth-due-sunday,https://d3i6fh83elv35t.cloudfront.net/static/2024/11/2024-11-15T092557Z_1397867338_RC2L5BAMY4J1_RTRMADP_3_ASIA-WEATHER-PHILIPPINES-1024x768.jpg,http://web.archive.org/web/20241116024305/https://www.pbs.org/newshour/world/typhoon-usagi-pounds-the-philippines-fifth-major-storm-in-a-month-with-a-sixth-due-sunday,"MANILA, Philippines (AP) Typhoon Usagi swamped rural villages in floods, knocked down power and displaced thousands more people before blowing away on Friday from the northern Philippines, which has … [+3193 chars]",,"Taifun Usagi wütet auf den Philippinen, der fünfte große Sturm in einem Monat, der sechste soll am Sonntag drohen. Prognostiker gehen außerdem davon aus, dass sich ein neuer Sturm im Pazifik zu einem starken Taifun entwickeln könnte, bevor er am Sonntag den philippinischen Archipel erreicht.","Typhoon Usagi pounds the Philippines, fifth major storm in a month, with a sixth due Sunday. Forecasters also say a new storm in the Pacific could strengthen into a powerful typhoon before hitting the Philippine archipelago on Sunday.","Typhon Usagi libras Philippinarum, tempestate quinta maioris in mense, cum sexta debita dominica. Vates etiam dicunt novam tempestatem in Pacifico in validum typhonium corroborare antequam die Dominico archipelago Philippinarum feritur.",2025-12-17 13:03:48+00:00
f2ae0048ef5f51aac759bc75eb1ed127,2024-11-21T06:58:05Z,veryUnusualAndNeverUsedKeyword,skepticalscience.com,en,0.9,Skeptical Science New Research for Week #47 2024,"Open access notables
Projected increase in the frequency of extremely active Atlantic hurricane seasons, Lopez et al., Science Advances:

Future changes to the year-to-year swings between active and inactive North Atlantic tropical cyclone (TC) seasons have r…",https://skepticalscience.com/new_research_2024_47.html,https://skepticalscience.com/public/assets/images/og/button_sks_200.jpg,http://web.archive.org/web/20241124093939/https://skepticalscience.com/new_research_2024_47.html,"Posted on 21 November 2024 by Doug Bostrom, Marc Kodack
Open access notables
Projected increase in the frequency of extremely active Atlantic hurricane seasons, Lopez et al., Science Advances:
Fut… [+54767 chars]",,"Neue Forschungsergebnisse von Skeptical Science für Woche Nr. 47 2024. Open-Access-Prominente
Prognostizierter Anstieg der Häufigkeit extrem aktiver Hurrikansaisons im Atlantik, Lopez et al., Science Advances:

Zukünftige Änderungen der jährlichen Schwankungen zwischen aktiven und inaktiven tropischen Wirbelsturmsaisonen (TC) im Nordatlantik haben …","Skeptical Science New Research for Week #47 2024. Open access notables
Projected increase in the frequency of extremely active Atlantic hurricane seasons, Lopez et al., Science Advances:

Future changes to the year-to-year swings between active and inactive North Atlantic tropical cyclone (TC) seasons have r…","Scientiae Scepticae Novae Investigationis pro Hebdomada #47 2024. Aperta accessu notabilium
Augmentum proiectum frequentia tempestatum Atlanticorum maxime activorum, Lopez et al., Scientia Promovetur:

Mutationes futurae ad anni-ad-annum recursus inter cyclum tropicum Atlanticum activum et otiosum Septentrionalem (TC) tempora habent r...",2025-12-17 13:03:48+00:00
1a67c1a915db7cb6649892874ec292e2,2024-11-29T03:05:53Z,veryUnusualAndNeverUsedKeyword,www.thehindubusinessline.com,en,0.9,"Fengal or not, Tamil Nadu faces escalating risks from extreme weather, experts warn","Recent analysis indicates a twofold rise in tropical cyclones over the past decade, with 11 out of 32 districts in Tamil Nadu being at significant risk.",https://www.thehindubusinessline.com/economy/agri-business/fengal-or-not-tamil-nadu-faces-escalating-risks-from-extreme-weather-experts-warn/article68925773.ece,https://bl-i.thgim.com/public/incoming/i89l5n/article68925771.ece/alternates/LANDSCAPE_1200/20241128231L.jpg,http://web.archive.org/web/20241130022710/https://www.thehindubusinessline.com/economy/agri-business/fengal-or-not-tamil-nadu-faces-escalating-risks-from-extreme-weather-experts-warn/article68925773.ece,"The deep depression over the south-west Bay of Bengal off the Sri Lanka-south Tamil Nadu coast may be set to lose traction as projected cyclone Fengal, but this does not diminish the fact that states… [+1100 chars]",,"Fengal oder nicht, Tamil Nadu sieht sich mit zunehmenden Risiken durch extreme Wetterbedingungen konfrontiert, warnen Experten. Jüngste Analysen deuten darauf hin, dass tropische Wirbelstürme im letzten Jahrzehnt um das Doppelte zugenommen haben, wobei 11 von 32 Bezirken in Tamil Nadu einem erheblichen Risiko ausgesetzt sind.","Fengal or not, Tamil Nadu faces escalating risks from extreme weather, experts warn. Recent analysis indicates a twofold rise in tropical cyclones over the past decade, with 11 out of 32 districts in Tamil Nadu being at significant risk.","Fengal vel non, Tamil Nadu pericula ex extrema tempestate, periti monent. Recentis analysis indicat duplicem ortum in cyclis tropicis super praeteritum decennium, cum 11 e 32 regionibus Tamil Nadu in periculo significanti esse.",2025-12-17 13:03:48+00:00
97b711f3290cd5176f8588a18e74538b,2024-11-05T09:14:02Z,'hurricane death',www.newsweek.com,en,0.3,"Tropical Storm Rafael Path Update, Tracker as Warning Issued to Florida",The severe weather system is expected to intensify rapidly in the coming days as it approaches the mainland U.S.,https://www.newsweek.com/tropical-storm-rafael-path-update-tracker-warning-florida-1980211,https://d.newsweek.com/en/full/2512368/rafael-map.png,http://web.archive.org/web/20241112105444/https://www.newsweek.com/tropical-storm-rafael-path-update-tracker-warning-florida-1980211,"The 17th named storm of the 2024 Atlantic hurricane season, Tropical Storm Rafael, has formed in the Atlantic Ocean and is expected to intensify into a hurricane this week.
The storm is predicted to… [+3820 chars]",,"Tropensturm Rafael Path Update, Tracker als Warnung an Florida ausgegeben. Es wird erwartet, dass sich das Unwettersystem in den kommenden Tagen rasch verschärft, wenn es sich dem US-amerikanischen Festland nähert.","Tropical Storm Rafael Path Update, Tracker as Warning Issued to Florida. The severe weather system is expected to intensify rapidly in the coming days as it approaches the mainland U.S.","Tropical Rafael Path Update, Tracker ut Monitum ad Floridam. Ratio tempestatum gravis expectatur ut celeriter augeatur in dies venientes cum continenti appropinquat US.",2025-12-18 08:42:37+00:00
513c325c5f3a67f197c97289672af04b,2024-11-04T17:47:44Z,veryUnusualAndNeverUsedKeyword,www.insurancejournal.com,en,0.7,Will People Leave Florida After Hurricanes? History Suggests Not,"ORLANDO, Fla. (AP) — The news rippled through Treasure Island, Florida, almost like a third storm: The mayor planned to move off the barrier island a month after Hurricane Helene flooded tens of thousands of homes along the Gulf Coast …",https://www.insurancejournal.com/news/southeast/2024/11/04/799986.htm,https://www.insurancejournal.com/app/uploads/2024/11/treasure-island-sand.jpg,http://web.archive.org/web/20241106190420/https://www.insurancejournal.com/news/southeast/2024/11/04/799986.htm,"ORLANDO, Fla. (AP) The news rippled through Treasure Island, Florida, almost like a third storm: The mayor planned to move off the barrier island a month after Hurricane Helene flooded tens of thousa… [+6018 chars]",,"Werden die Menschen Florida nach Hurrikanen verlassen? Die Geschichte legt nahe, dass dies nicht der Fall ist. ORLANDO, Florida (AP) – Die Nachricht ging durch Treasure Island, Florida, fast wie ein dritter Sturm: Der Bürgermeister plante, die vorgelagerte Insel zu verlassen, einen Monat nachdem Hurrikan Helene Zehntausende Häuser entlang der Golfküste überschwemmt hatte …","Will People Leave Florida After Hurricanes? History Suggests Not. ORLANDO, Fla. (AP) — The news rippled through Treasure Island, Florida, almost like a third storm: The mayor planned to move off the barrier island a month after Hurricane Helene flooded tens of thousands of homes along the Gulf Coast …","Numquid relinquent Florida post turbinum? Insinuat Historia Not. ORLANDO, Fla (AP) — Nuntio per thesaurum Islandum, Floridam quasi tertiam tempestatem evulsus est: Maior obice insulam movere per mensem post Hurricane Helene inundavit decem milia domorum per Coast sinus ...",2025-12-18 08:42:37+00:00
895ec79804d6d574e086d915b9e0c5bd,2024-11-04T18:40:32Z,'hurricane',www.yahoo.com,en,0.7,"Here’s Where Hurricane Rafael Is Likely To Hit The US, Models Say","The storm is heading to these states. The post Here’s Where Hurricane Rafael Is Likely To Hit The US, Models Say appeared first on Mandatory.",https://www.yahoo.com/news/where-hurricane-rafael-likely-hit-184032310.html,https://media.zenfs.com/en/mandatory_995/8dbe0c6196116777f7b2b16a5463688b,http://web.archive.org/web/20241105160801/https://www.yahoo.com/news/where-hurricane-rafael-likely-hit-184032310.html,"The strength of Hurricane Rafael, which is projected to develop from Tropical Depression 18 in the Caribbean, has been steadily building over the weekend. Since Fridays predictions, various models an… [+1882 chars]",,"Hier wird Hurrikan Rafael wahrscheinlich die USA treffen, sagen Models. Der Sturm zieht auf diese Staaten zu. Der Beitrag Hier ist, wo Hurrikan Rafael die USA wahrscheinlich treffen wird, sagen Models, erschien zuerst auf Mandatory.","Here’s Where Hurricane Rafael Is Likely To Hit The US, Models Say. The storm is heading to these states. The post Here’s Where Hurricane Rafael Is Likely To Hit The US, Models Say appeared first on Mandatory.","Hic est ubi Procellae Rafael verisimile est Hit US, exemplum Say. In has civitates tendit tempestas. Postes Hic est ubi Hurricane Rafael verisimile est Hit US, Models Dic primum in Mandatorio apparuit.",2025-12-18 08:42:37+00:00
a020035820245d474795813b2eac2764,2024-11-04T21:00:44Z,veryUnusualAndNeverUsedKeyword,gizmodo.com,en,0.7,"After Hurricane Helene’s Destruction, Voters in Key Swing States Are Showing Up in Force",Record early voting in Georgia and North Carolina highlights the storm’s impact and the high stakes of the election.,https://gizmodo.com/after-hurricane-helenes-destruction-voters-in-key-swing-states-are-showing-up-in-force-2000520345,https://gizmodo.com/app/uploads/2024/11/voting-presidential-election.jpg,http://web.archive.org/web/20241104210232/https://gizmodo.com/after-hurricane-helenes-destruction-voters-in-key-swing-states-are-showing-up-in-force-2000520345,"Its been a little over a month since Hurricane Helene ripped through the southeastern United States, claiming hundreds of lives and causing an estimated $53 billion dollars in damages. In addition to… [+7328 chars]",,Nach der Zerstörung durch Hurrikan Helene sind die Wähler in wichtigen Swing States in großer Zahl an den Start gegangen. Der Rekord bei vorzeitigen Wahlen in Georgia und North Carolina verdeutlicht die Auswirkungen des Sturms und die hohen Risiken der Wahl.,"After Hurricane Helene’s Destruction, Voters in Key Swing States Are Showing Up in Force. Record early voting in Georgia and North Carolina highlights the storm’s impact and the high stakes of the election.","Post Destructionem Hurricane Helene, Voters in Key Swing States in Force monstrantur. Recordatio primae suffragationis in Georgia et North Carolina elucidat tempestatem impulsum et sudes altae electionis.",2025-12-18 08:42:37+00:00
fe13f8a7938ff53326539d84ce56de55,2024-11-05T01:45:00Z,veryUnusualAndNeverUsedKeyword,radaronline.com,en,0.7,Trump Victory Branded a 'Five-Alarm Fire' and 'Category 5 Hurricane' By One of America's Greatest Political Strategists: 'He's the Bully of all Bullies',Political strategist Robert Reich warned U.S. voters to not sit out the election as he called Donald Trump a 'bully' and threat to democracy.,https://radaronline.com/p/donald-trump-victory-branded-five-alarm-five-robert-reich/,https://media.radaronline.com/brand-img/KBA_nCipz/1200x628/donald-trump-ex-advisers-brand-him-fascist-1-1730764194037.png,http://web.archive.org/web/20241109104035/https://radaronline.com/p/donald-trump-victory-branded-five-alarm-five-robert-reich/,"In a new op-ed, Reich detailed how dangerous he viewed the ex-president, who has been branded a ""fascist"" by his former chief of staff, John Kelly, as well as his former chairman of the Joint Chiefs … [+342 chars]",,"Trump Victory wurde von einem der größten politischen Strategen Amerikas als „Fünf-Alarm-Feuer“ und „Hurrikan der Kategorie 5“ gebrandmarkt: „Er ist der Tyrann aller Tyrannen.“ Der Politikstratege Robert Reich warnte die US-Wähler davor, die Wahl auszusetzen, da er Donald Trump als „Bully“ und Bedrohung für die Demokratie bezeichnete.",Trump Victory Branded a 'Five-Alarm Fire' and 'Category 5 Hurricane' By One of America's Greatest Political Strategists: 'He's the Bully of all Bullies'. Political strategist Robert Reich warned U.S. voters to not sit out the election as he called Donald Trump a 'bully' and threat to democracy.,"Trump Victoria notavit 'Quinque Alarm Ignem' et 'Categoria 5 Procellae' By One of America's Great Political Strategists: 'Est PROBUS omnium Bulliarum'. Political strategist Robert Reich monuit US suffragatores ad electionem non sedere, sicut Donald Trump appellavit ""tamor"" et comminationem democratiae.",2025-12-18 08:42:37+00:00
149914ce90e311decb2ee4c6aa10f346,2024-11-05T02:22:00Z,veryUnusualAndNeverUsedKeyword,www.dailysignal.com,en,0.7,‘Stay Strong Hill Country’: One Volunteer’s Perspective on the Devastation in North Carolina After Hurricane Helene,"Beside a lonely road in Boone, North Carolina, Styrofoam stood, balanced on cardboard and weighed down by a rock. Scrawled on it in faded black,... Read More
The post ‘Stay Strong Hill Country’: One Volunteer’s Perspective on the Devastation in North Carolina…",https://www.dailysignal.com/2024/11/04/stay-strong-hill-country-one-volunteers-perspective-devastation-north-carolina-hurricane-helene/,https://www.dailysignal.com/wp-content/uploads/2024/11/Helene-victim.jpg,http://web.archive.org/web/20241105024857/https://www.dailysignal.com/2024/11/04/stay-strong-hill-country-one-volunteers-perspective-devastation-north-carolina-hurricane-helene/,"Beside a lonely road in Boone, North Carolina, Styrofoam stood, balanced on cardboard and weighed down by a rock. Scrawled on it in faded black, yellow, and orange markers read the message, I thank t… [+3957 chars]",,"„Stay Strong Hill Country“: Die Perspektive eines Freiwilligen auf die Verwüstung in North Carolina nach dem Hurrikan Helene. An einer einsamen Straße in Boone, North Carolina, stand Styropor, auf Pappe balanciert und von einem Stein beschwert. In verblasstem Schwarz darauf gekritzelt... Weiterlesen
Der Beitrag „Stay Strong Hill Country“: Die Perspektive eines Freiwilligen auf die Verwüstung in North Carolina…","‘Stay Strong Hill Country’: One Volunteer’s Perspective on the Devastation in North Carolina After Hurricane Helene. Beside a lonely road in Boone, North Carolina, Styrofoam stood, balanced on cardboard and weighed down by a rock. Scrawled on it in faded black,... Read More
The post ‘Stay Strong Hill Country’: One Volunteer’s Perspective on the Devastation in North Carolina…","'Mane Strong Hill Country': Perspective unus voluntarius in Devastatione in Carolina North post Hurricane Helene. Iuxta viam desertam in Boone, Carolina Septentrionali, Styrofoam stabat, in charta librata et saxo depressa. Colligavit in defloruere nigrum,... Read More
Post 'Mane Strong Hill Country': Perspectiva una voluntarii de Devastatione in Carolina Septentrionali…",2025-12-18 08:42:37+00:00
ebe4a6f26c33d13353b0eaeff8e01d69,2024-11-06T00:54:29Z,'hurricane season',www.npr.org,en,0.7,Hurricane Rafael forms in the Caribbean Sea and expected to enter the Gulf of Mexico,An active 2024 Atlantic Hurricane season continues as Rafael strengthens into a category 1 storm. It's expected to batter Cayman Islands and Cuba before swinging into the Gulf of Mexico.,https://www.npr.org/2024/11/05/g-s1-32656/hurricane-rafael-cayman-islands-cuba-gulf-of-mexico,https://npr.brightspotcdn.com/dims3/default/strip/false/crop/897x505+0+0/resize/1400/quality/100/format/png/?url=http%3A%2F%2Fnpr-brightspot.s3.amazonaws.com%2Fbd%2Ffa%2F3e3917374d5ab38bebff3163f0a4%2F235559-5day-cone-no-line-and-wind.png,http://web.archive.org/web/20241106200837/https://www.npr.org/2024/11/05/g-s1-32656/hurricane-rafael-cayman-islands-cuba-gulf-of-mexico,"Rafael has strengthened into a hurricane
 as it moves through the southern Caribbean Sea.
The category 1 storm has maximum sustained winds of 75 mph and is approaching the Cayman Islands. It will b… [+978 chars]",,"Hurrikan Rafael entsteht im Karibischen Meer und wird voraussichtlich in den Golf von Mexiko eindringen. Die aktive Atlantik-Hurrikan-Saison 2024 geht weiter, während Rafael sich zu einem Sturm der Kategorie 1 entwickelt. Es wird erwartet, dass es die Kaimaninseln und Kuba trifft, bevor es in den Golf von Mexiko schwenkt.",Hurricane Rafael forms in the Caribbean Sea and expected to enter the Gulf of Mexico. An active 2024 Atlantic Hurricane season continues as Rafael strengthens into a category 1 storm. It's expected to batter Cayman Islands and Cuba before swinging into the Gulf of Mexico.,Procellae Rafael in Mari Caribico format et in Sinum Mexicanum ingredi expectat. Tempus active 2024 Atlanticum Procellae pergit sicut Rafael in categoriam 1 procellam confirmat. Insulis Cayman et Cuba iactare expectatur antequam in Sinum Mexicanum flectatur.,2025-12-18 08:42:37+00:00
ba7eddf28574a8955d4af01a378032b4,2024-11-06T02:14:33Z,veryUnusualAndNeverUsedKeyword,www.newsweek.com,en,0.7,Tropical Storm Rafael Strengthens to Hurricane on Path to Cuba,"As of Tuesday morning, the storm was positioned 20 miles (35 kilometers) southeast of Little Cayman in the Cayman Islands.",https://www.newsweek.com/tropical-storm-rafael-strengthens-hurricane-path-cuba-1981026,https://d.newsweek.com/en/full/2513516/tropical-storm-rafael.jpg,http://web.archive.org/web/20241106040006/https://www.newsweek.com/tropical-storm-rafael-strengthens-hurricane-path-cuba-1981026,"Tropical Storm Rafael was upgraded to a Category 1 Hurricane this week on its current path towards Cuba.
This marked yet another setback for Cuba, already grappling with widespread blackouts and sti… [+3015 chars]",,Tropischer Sturm Rafael verstärkt sich zum Hurrikan auf dem Weg nach Kuba. Am Dienstagmorgen befand sich der Sturm 20 Meilen (35 Kilometer) südöstlich von Little Cayman auf den Cayman Islands.,"Tropical Storm Rafael Strengthens to Hurricane on Path to Cuba. As of Tuesday morning, the storm was positioned 20 miles (35 kilometers) southeast of Little Cayman in the Cayman Islands.","Tropical Rafael Confirmat Procellae in Path Cuba. Cum die Martis mane, tempestas viginti milia passuum (35 chiliometrorum) meridiem versus de Parva Cayman in insulis Cayman collocata est.",2025-12-18 08:42:37+00:00
dc45ba998b22b4efb290688203f998b8,2024-11-06T03:13:57Z,'hurricane',www.nhc.noaa.gov,en,0.7,Hurricane Rafael Graphics,"5-Day Uncertainty Track last updated Wed, 06 Nov 2024 03:13:57 GMT

 
Wind Speed Probabilities last updated Wed, 06 Nov 2024 03:23:00 GMT",https://www.nhc.noaa.gov/refresh/graphics_at3+shtml/031357.shtml?cone,,,"Coastal Watches/Warnings and Forecast Cone for Storm Center
* If the storm is forecast to dissipate within 3 days, the ""Full Forecast"" and ""3 day"" graphic will be identical
Click Here for a 5-day C… [+2926 chars]",,"Grafiken zum Hurrikan Rafael. 5-Tage-Unsicherheits-Track zuletzt aktualisiert am Mittwoch, 06. November 2024 um 03:13:57 Uhr GMT

 
Die Windgeschwindigkeitswahrscheinlichkeiten wurden zuletzt am Mittwoch, den 06. November 2024 um 03:23:00 Uhr GMT aktualisiert","Hurricane Rafael Graphics. 5-Day Uncertainty Track last updated Wed, 06 Nov 2024 03:13:57 GMT

 
Wind Speed Probabilities last updated Wed, 06 Nov 2024 03:23:00 GMT","Procellae Rafael Graphics. 5-Dies Incertus Track renovatio Sat, 06 Nov 2024 03:13:57 GMT

 
Ventus Speed Probabilitates renovatio Sat, 06 Nov 2024 03:23:00 GMT",2025-12-18 08:42:37+00:00
71217a5a0a5caa22c09d61cae07e03dc,2024-11-06T04:33:00Z,'hurricane',www.thestar.com.my,en,0.7,Hurricane Rafael barrels through Cayman Islands,"(Reuters) -Hurricane Rafael is passing through the Cayman Islands in the Caribbean and is forecast to rapidly intensify before making landfall in western Cuba, according to the U.S. National Hurricane Center. Read full story",https://www.thestar.com.my/news/world/2024/11/06/hurricane-rafael-barrels-through-cayman-islands,https://apicms.thestar.com.my/uploads/images/2024/11/06/3002897.jpg,http://web.archive.org/web/20241113105936/https://www.thestar.com.my/news/world/2024/11/06/hurricane-rafael-barrels-through-cayman-islands,"(Reuters) -Hurricane Rafael is passing through the Cayman Islands in the Caribbean and is forecast to rapidly intensify before making landfall in western Cuba, according to the U.S. National Hurrican… [+1833 chars]",,"Hurrikan Rafael wütet über die Cayman-Inseln. (Reuters) – Nach Angaben des US-amerikanischen National Hurricane Center zieht Hurrikan Rafael über die Kaimaninseln in der Karibik und wird sich voraussichtlich rasch verstärken, bevor er im Westen Kubas auf Land trifft. Lesen Sie die ganze Geschichte","Hurricane Rafael barrels through Cayman Islands. (Reuters) -Hurricane Rafael is passing through the Cayman Islands in the Caribbean and is forecast to rapidly intensify before making landfall in western Cuba, according to the U.S. National Hurricane Center. Read full story","Procellae Rafael dolia per insulas Cayman. (Reuters) -Hurricane Rafael per insulas Cayman in Caribbean transit et praevidet ut celeriter augeatur antequam ictum in Cuba occidentali facit, secundum US National Hurricane Centrum. Read full story",2025-12-18 08:42:37+00:00
