index,published,keyword,domain,language,valid,title,description,url,image,archive,content,quote,de,en,la,added
3fc42327ba54429db51c39706afab248,2026-01-01T07:07:08Z,'hurricane',clutchpoints.com,en,0.7,Miami football fans will love Carson Beck’s initial reaction to beating Ohio State,Miami Hurricanes fans are going to love star QB Carson Beck’s reaction after leading team upset win over Ohio State in the CFB quarterfinal.,https://clutchpoints.com/ncaa-football/miami-football-news-carson-beck-reaction-ohio-state-win,https://media.zenfs.com/en/clutchpoints_articles_939/8480e9685246a4b02226be8a0abb7c1e,,"Miami football fans will love Carson Becks initial reaction to beating Ohio State appeared first on ClutchPoints. Add ClutchPoints as a Preferred Source by clicking here.
The No. 10 Miami Hurricanes… [+1818 chars]",,Miami-Football-Fans werden Carson Becks erste Reaktion auf den Sieg über Ohio State lieben. Die Fans der Miami Hurricanes werden die Reaktion von Star-Quarterback Carson Beck nach dem überraschenden Sieg des führenden Teams über Ohio State im CFB-Viertelfinale lieben.,Miami football fans will love Carson Beck’s initial reaction to beating Ohio State. Miami Hurricanes fans are going to love star QB Carson Beck’s reaction after leading team upset win over Ohio State in the CFB quarterfinal.,Miami eu fans amabit Carson Beck reactionem initialem ad verberationem Ohio Civitatis. Miami Hurricanes fani amant stellam QB Carson Beck reactionem postquam turmas ducens perturbatus super Ohio rem publicam in CFB quartam partem conciliat.,2026-01-03 20:33:27+00:00
6518d478f1771bd51564b4b202b03ed7,2026-01-01T19:35:44Z,'hurricane',sports.yahoo.com,en,0.7,Texas two-step in CFP has Miami within a win of playing for a national title at home,"When Miami left Texas after an overtime loss to SMU at the start of November, the Hurricanes were at their lowest point of the season. “It means everything to this team,” quarterback Carson Beck said. Miami made its playoff debut with a first-round win at No.…",https://sports.yahoo.com/articles/texas-two-step-cfp-miami-193544632.html,https://s.yimg.com/ny/api/res/1.2/8lp_9984.0b9T1GZivtpFw--/YXBwaWQ9aGlnaGxhbmRlcjt3PTEyMDA7aD04MDA7Y2Y9d2VicA--/https://media.zenfs.com/en/ap.org/3da57217cde46fc2b66c268164250147,,"ARLINGTON, Texas (AP) When Miami left Texas after an overtime loss to SMU at the start of November, the Hurricanes were at their lowest point of the season. There was a very dim forecast for getting … [+4640 chars]",,"Durch den Two-Step von Texas in der CFP ist Miami nur noch einen Sieg davon entfernt, zu Hause um einen nationalen Titel zu spielen. Als Miami Anfang November Texas nach einer Overtime-Niederlage gegen SMU verließ, befanden sich die Hurricanes auf dem Tiefpunkt der Saison. „Es bedeutet diesem Team alles“, sagte Quarterback Carson Beck. Miami feierte sein Playoff-Debüt mit einem Sieg in der ersten Runde auf Platz …","Texas two-step in CFP has Miami within a win of playing for a national title at home. When Miami left Texas after an overtime loss to SMU at the start of November, the Hurricanes were at their lowest point of the season. “It means everything to this team,” quarterback Carson Beck said. Miami made its playoff debut with a first-round win at No.…","Texas duos gradus in CFP habet Miami intra ludendi pro titulo nationali domi. Cum Miami Texas post tempus subsicivum damnum SMU in ineunte Novembri reliquisset, turbinum in extremo temporis puncto erant. “Omnia ad hanc turmam significat”, QB Carson Beck dixit. Miami suum playoff debut fecit cum primo-circum win in No...",2026-01-03 20:33:27+00:00
550e21640b7d5e963d793e69c0aa56bd,2026-01-01T21:50:28Z,'hurricane',www.loudersound.com,en,0.7,Guitar God Nita Strauss announces 'miracle' pregnancy as she and husband look forward to welcoming their first child,"'Hurricane' Nita Strauss is pregnant with a son, she has confirmed in a statement alongside husband Josh Villalta",https://www.loudersound.com/bands-artists/guitar-god-nita-strauss-announces-miracle-pregnancy-as-she-and-husband-look-forward-to-welcoming-their-first-child,https://cdn.mos.cms.futurecdn.net/KDMRwFDYotkANkNWBAMBeT-1600-80.png,,"Alice Cooper guitarist Nita Strauss has announced she is pregnant with her and husband Josh Villalta's first child together.
Strauss, known as The Hurricane, confirmed the news in an Instagram post … [+1510 chars]",,"Gitarrengott Nita Strauss kündigt eine „Wunderschwangerschaft“ an, da sie und ihr Mann sich darauf freuen, ihr erstes Kind zu begrüßen. „Hurrikan“ Nita Strauss ist schwanger mit einem Sohn, wie sie zusammen mit Ehemann Josh Villalta in einer Erklärung bestätigte","Guitar God Nita Strauss announces 'miracle' pregnancy as she and husband look forward to welcoming their first child. 'Hurricane' Nita Strauss is pregnant with a son, she has confirmed in a statement alongside husband Josh Villalta","Guitar Deus Nita Strauss graviditatem miraculum nuntiat sicut ipsa et maritus exspectant suum primogenitum suscipiendum. 'procellae' Nita Strauss gravida est cum filio, eam confirmavit in propositione e regione viri Josh Villalta.",2026-01-03 20:33:27+00:00
f9da4f5f1947d58dd5ad98d8e85d8ad2,2026-01-01T23:49:01Z,'hurricane',nypost.com,en,0.7,Two Miami players entering transfer portal after team’s massive College Football Playoff upset,Two Miami players are set to enter the transfer portal amid the Hurricanes’ run through the College Football Playoff.,https://nypost.com/2026/01/01/sports/miamis-chance-robinson-brock-schott-to-hit-transfer-portal-after-cfp-win/,https://nypost.com/wp-content/uploads/sites/2/2026/01/newspress-collage-xarhvv9sm-1767310468487.jpg?quality=75&strip=all&1767292542&w=1200,,"Two Miami players are set to enter the transfer portal amid the Hurricanes run through the College Football Playoff. 
Wide receiver Chance Robinson, a former top prospect for Miami, and true freshma… [+2040 chars]",,"Zwei Spieler aus Miami betreten das Transferportal nach der großen Überraschung des Teams in den College Football Playoffs. Zwei Spieler aus Miami werden das Transferportal betreten, während die Hurricanes durch die College Football Playoffs laufen.",Two Miami players entering transfer portal after team’s massive College Football Playoff upset. Two Miami players are set to enter the transfer portal amid the Hurricanes’ run through the College Football Playoff.,Duo Miami lusores intrans translationem portae post quadrigis molem collegii Playoffs commoti sunt. Duo Miami histriones ponuntur ad translationem portae inter Hurricanes currunt per Collegium Football Playoff.,2026-01-03 20:33:27+00:00
b595d46b342e4e26964964e82200b59b,2026-01-02T13:04:34Z,'hurricane',post.rlsbb.to,en,0.7,Doug Varty – Keep The Dream Alive (2025),Tracklist:01 - Keep The Dream Alive02 - Solid Ground03 - Make It All Right04 - Everybody Needs A Lover05 - Sleepwalking06 - Girl's Already Gone07 - Just Say Hello08 - Leave My Heart Alone09 - The Right Mistakes10 - Hurricane Jane11 - Drive On12 - Sweet Tempta…,https://post.rlsbb.to/doug-varty-keep-the-dream-alive-2025/,,,Tracklist:01 - Keep The Dream Alive02 - Solid Ground03 - Make It All Right04 - Everybody Needs A Lover05 - Sleepwalking06 - Girl's Already Gone07 - Just Say Hello08 - Leave My Heart Alone09 - The Rig… [+267 chars],,Doug Varty – Keep The Dream Alive (2025). Tracklist:01 - Keep The Dream Alive02 - Solid Ground03 - Make It All Right04 - Everybody Needs A Lover05 - Sleepwalking06 - Girl's Almost Gone07 - Just Say Hello08 - Leave My Heart Alone09 - The Right Mistakes10 - Hurricane Jane11 - Drive On12 - Sweet Tempta…,Doug Varty – Keep The Dream Alive (2025). Tracklist:01 - Keep The Dream Alive02 - Solid Ground03 - Make It All Right04 - Everybody Needs A Lover05 - Sleepwalking06 - Girl's Already Gone07 - Just Say Hello08 - Leave My Heart Alone09 - The Right Mistakes10 - Hurricane Jane11 - Drive On12 - Sweet Tempta…,Doug Varty – Somnium tuum vivere (2025). Tracklist:01 - Serva Somnium Alive02 - Firmum Ground03 - Fac omnia Right04 - Omnes indiget Amator05 - Sleepwalking06 - Puellae Iam Gone07 - Just Dic Hello08 - Relinque Cor Meum Solus09 - Ius Erroris10 - Procellae Jane11 - Coegi On12 - Dulce Tempta…,2026-01-03 20:33:27+00:00
4a9257de76486b69cef41e9a6dbc546b,2026-01-05T09:43:04Z,'hurricane season',sports.yahoo.com,en,0.7,Tulsa plays Tulane on 3-game win streak,"Tulsa Golden Hurricane (9-4, 1-0 AAC) at Tulane Green Wave (6-8, 1-1 AAC) New Orleans; Tuesday, 7:30 p.m. EST BOTTOM LINE: Tulsa will try to prolong its...",https://sports.yahoo.com/articles/tulsa-plays-tulane-3-game-094304353.html,https://s.yimg.com/cv/apiv2/social/images/yahoo_default_logo-1200x1200.png,,"Tulsa Golden Hurricane (9-4, 1-0 AAC) at Tulane Green Wave (6-8, 1-1 AAC)
New Orleans; Tuesday, 7:30 p.m. EST
BOTTOM LINE: Tulsa will try to prolong its three-game win streak with a victory against… [+1634 chars]",,"Tulsa spielt gegen Tulane mit einer Siegesserie von 3 Spielen. Tulsa Golden Hurricane (9-4, 1-0 AAC) bei Tulane Green Wave (6-8, 1-1 AAC) New Orleans; Dienstag, 19:30 Uhr EST FAZIT: Tulsa wird versuchen, seine... zu verlängern.","Tulsa plays Tulane on 3-game win streak. Tulsa Golden Hurricane (9-4, 1-0 AAC) at Tulane Green Wave (6-8, 1-1 AAC) New Orleans; Tuesday, 7:30 p.m. EST BOTTOM LINE: Tulsa will try to prolong its...","Tulsa plays Tulane in 3-ludum series win. Tulsa Golden Hurricane (9-4, 1-0 AAC) apud Tulanum Undam Viridis (6-8, 1-1 AAC) Novi Aureliae; Die Martis, 7:30 a.m. EST BOTTOM LINE: Tulsa eius conabitur prorogare...",2026-01-06 14:36:25+00:00
67b358539062afe6ca22ead851c170cf,2026-01-05T04:49:31Z,'tropical cyclone',www.abc.net.au,en,0.8,Bureau forecasts moderate chance of cyclone hitting far north Queensland coast,"The chance of a tropical low off the far north Queensland coast developing into a cyclone is increasing from low to moderate by the weekend, according to the weather bureau.",https://www.abc.net.au/news/2026-01-05/far-north-queensland-cyclone-forecast/106199464,https://live-production.wcms.abc-cdn.net.au/8a9e40e21b56b6d426475faaeeb69d0f?impolicy=wcms_watermark_news&cropH=486&cropW=864&xPos=0&yPos=108&width=862&height=485&imformat=generic,,"There is a moderate chance of a cyclone forming off far north Queensland this weekend, according to the Bureau of Meteorology.
Senior meteorologist Miriam Bradbury said a low pressure trough current… [+3926 chars]",,"Das Büro prognostiziert eine mäßige Wahrscheinlichkeit, dass der Zyklon die nördliche Küste von Queensland trifft. Nach Angaben des Wetteramtes steigt die Wahrscheinlichkeit, dass sich ein tropisches Tief vor der nördlichen Küste von Queensland zu einem Zyklon entwickelt, bis zum Wochenende von niedrig auf mäßig.","Bureau forecasts moderate chance of cyclone hitting far north Queensland coast. The chance of a tropical low off the far north Queensland coast developing into a cyclone is increasing from low to moderate by the weekend, according to the weather bureau.",Hendrerit praenuntiat casum moderatum cyclonis ferendi oram Reginensis septentrionalis longe. Sors tropicae humilis longe septentrionalis oram Reginensis in cyclo evolutionis in cyclone ab humili ad moderatam secundum tempestatem hendrerit augetur.,2026-01-08 04:07:59+00:00
0eb235b3895b87177f0fcb0f19aca44e,2026-01-06T19:56:27Z,'tropical cyclone',www.abc.net.au,en,0.8,Gulf Country prepares for weeks of isolation as tropical low forms,"The Bureau of Meteorology said there is a ""moderate chance"" that a tropical low could reach cyclone strength in Far North Queensland in the next few days.",https://www.abc.net.au/news/2026-01-07/gulf-country-faces-intense-flooding-as-tropical-low-forms/106204784,https://live-production.wcms.abc-cdn.net.au/833978aef6364b7f4a0f16ad1fc85167?impolicy=wcms_watermark_news&cropH=1152&cropW=2048&xPos=0&yPos=344&width=862&height=485&imformat=generic,,"As floodwaters begin to recede in parts of north-western Queensland following days of intense rainfall, residents in the far north of the state are now bracing for potential heavy rain and flash floo… [+6418 chars]",,"Das Golfland bereitet sich auf wochenlange Isolation vor, während sich tropische Tiefststände bilden. Das Bureau of Meteorology sagte, es bestehe eine „moderate Wahrscheinlichkeit“, dass ein tropisches Tief in den nächsten Tagen im hohen Norden von Queensland die Stärke eines Zyklons erreichen könnte.","Gulf Country prepares for weeks of isolation as tropical low forms. The Bureau of Meteorology said there is a ""moderate chance"" that a tropical low could reach cyclone strength in Far North Queensland in the next few days.","Sinus Patria per septimanas solitudo praeparat formas tropicas sicut humiles. In hendrerit Meteorologico dixit ""fortunam modicam"" esse tropicam humilem cycloneam in Longe Queenslandia in paucis diebus proximis attingere posse.",2026-01-08 04:07:59+00:00
666f3f451074659b3ef318a3e8ea3c5a,2026-01-06T07:46:22Z,'tropical cyclone',www.abc.net.au,en,0.9,Cocos Keeling Islands endure second tropical cyclone in less than two weeks,"Residents of the islands clean up after heavy rain and winds brought by Tropical Cyclone Jenna, just weeks after another system battered the region on Christmas day.",https://www.abc.net.au/news/2026-01-06/cocos-tropical-cyclone-jenna-keeling-islands-indian-ocean/106203486,https://live-production.wcms.abc-cdn.net.au/f589e3d0726273fb6ff471b8b7238b4f?impolicy=wcms_watermark_news&cropH=654&cropW=1163&xPos=3&yPos=0&width=862&height=485&imformat=generic,,"It has been an unusually busy cyclone season for northern Western Australia, with the Cocos Keeling Islands lashed by a second system in two weeks.
On Monday afternoon, Tropical Cyclone Jenna was th… [+4072 chars]",,"Die Kokos-Keeling-Inseln erleiden den zweiten tropischen Wirbelsturm in weniger als zwei Wochen. Die Bewohner der Inseln räumen nach heftigen Regenfällen und Winden auf, die durch den tropischen Wirbelsturm Jenna verursacht wurden, nur wenige Wochen nachdem ein anderes System am Weihnachtstag die Region heimgesucht hatte.","Cocos Keeling Islands endure second tropical cyclone in less than two weeks. Residents of the islands clean up after heavy rain and winds brought by Tropical Cyclone Jenna, just weeks after another system battered the region on Christmas day.","Insulae Keelingae Cocos secundum cyclum tropicum sustinent minus quam duas hebdomades. Incolae insularum mundi post pluvias et ventos a Tropical Cyclone Jenna allatae sunt, mox septimanas post aliam systematis regionem in die Nativitatis quassaverunt.",2026-01-08 04:07:59+00:00
46c36c2eb72af2e6809c3776699d73b1,2026-01-07T14:00:00Z,'hurricane victims',www.rollingstone.com,en,0.3,L.A. Fires One Year Later: Music Community Reckons With Loss and Uncertainty,"One year after the LA. fires, members of Foo Fighters, Dawes, DIIV, and more reflect on a horrific past and tenuous, optimistic future.",http://www.rollingstone.com/music/music-features/los-angeles-fires-la-one-year-anniversary-stories-1235491739/,https://www.rollingstone.com/wp-content/uploads/2026/01/LA-FIRES-DAWES-VINYL.jpg?w=1600&h=900&crop=1,,"One year after wildfires fueled by hurricane-force winds roared through Los Angeles County, killing 31 people and destroying thousands of homes, survivors are still absorbing the impact. Many are mem… [+32606 chars]",,"L.A. feuert ein Jahr später: Musikgemeinschaft rechnet mit Verlust und Unsicherheit. Ein Jahr nach dem LA. Brände, Mitglieder von Foo Fighters, Dawes, DIIV und mehr denken über eine schreckliche Vergangenheit und eine dürftige, optimistische Zukunft nach.","L.A. Fires One Year Later: Music Community Reckons With Loss and Uncertainty. One year after the LA. fires, members of Foo Fighters, Dawes, DIIV, and more reflect on a horrific past and tenuous, optimistic future.","L.A. Fires One Year Later: Music Community Accounts With Loss and Uncertainty. Alter post annum la. ignes, membra Foo Pugnatores, Dawes, DIIV, magisque horrificam praeteritam et tenuem cogitantem, eu futurum.",2026-01-08 20:37:00+00:00
7d714d98f225b9c0722ff81706a5906b,2026-01-01T05:13:41Z,'hurricane victims',www.stateoftheu.com,en,0.2,"The Good, The Bad, and The Ugly: Goodyear Cotton Bowl, Ohio State Buckeyes College Football Playoff 2025 Edition",Miami defeated Ohio State in the Cotton Bowl Classic to secure another CFP win and advance to the Semifinals. ALL GOOD!!,https://www.stateoftheu.com/football-news/83722/the-good-the-bad-and-the-ugly-goodyear-cotton-bowl-ohio-state-buckeyes-college-football-playoff-2025-edition-mark-fletcher-carson-beck-jeremiah-smith-mario-cristobal,https://s.yimg.com/ny/api/res/1.2/iFnGTrK24L3ifl.4Of7F3g--/YXBwaWQ9aGlnaGxhbmRlcjt3PTEyMDA7aD04MDE7Y2Y9d2VicA--/https://media.zenfs.com/en/sb_nation_articles_115/c1f6b76b9c4a499387f4085c91a077ec,http://web.archive.org/web/20260102104521/https://www.stateoftheu.com/football-news/83722/the-good-the-bad-and-the-ugly-goodyear-cotton-bowl-ohio-state-buckeyes-college-football-playoff-2025-edition-mark-fletcher-carson-beck-jeremiah-smith-mario-cristobal,"THE MIAMI HURRICANES WENT INTO AT&amp;T STADIUM AND BEAT THE #2 OHIO STATE BUCKEYES 24-14 TO ADVANCE TO THE COLLEGE FOOTBALL PLAYOFF SEMIFINALS!!!!!!!!!
Craig T. Smith is back with your game recap, … [+12734 chars]",,"Das Gute, das Schlechte und das Hässliche: Goodyear Cotton Bowl, Ohio State Buckeyes College Football Playoff 2025 Edition. Miami besiegte Ohio State im Cotton Bowl Classic, sicherte sich einen weiteren CFP-Sieg und rückte ins Halbfinale vor. ALLES GUT!!","The Good, The Bad, and The Ugly: Goodyear Cotton Bowl, Ohio State Buckeyes College Football Playoff 2025 Edition. Miami defeated Ohio State in the Cotton Bowl Classic to secure another CFP win and advance to the Semifinals. ALL GOOD!!","Boni, Mali, et Turpis: Goodyear Cotton Bowl, Ohio State Buckeyes College Football Playoff 2025 Edition. Miami Ohio rem publicam vicit in Globus Cottonianum Classicum ad obtinendum alterum CFP vincendum et ad Semifinales progrediendum. OMNES GOOD!!",2026-01-09 08:45:46+00:00
41f54124d5add1e9f7be47d30f3e2b52,2026-01-01T03:50:00Z,'hurricane season',www.sun-sentinel.com,en,0.7,"Hurricanes upset Ohio State, punch ticket to College Football Playoff semis","ARLINGTON, Texas — Keionte Scott read the play perfectly. After Ohio State reached Miami’s red zone for the first time, Buckeyes quarterback Julian Sayin — the nation’s most accurate passer this season — tried to throw a short pass. Scott knew what was coming…",https://www.sun-sentinel.com/2025/12/31/um-osu-cotton-bowl/,https://s.yimg.com/cv/apiv2/social/images/yahoo_default_logo-1200x1200.png,http://web.archive.org/web/20260102103457/https://www.sun-sentinel.com/2025/12/31/um-osu-cotton-bowl/,"ARLINGTON, Texas Keionte Scott read the play perfectly.
After Ohio State reached Miami’s red zone for the first time, Buckeyes quarterback Julian Sayin the nation’s most accurate passer this season … [+4901 chars]",,"Hurrikane erschüttern den Bundesstaat Ohio und lösen das Ticket für das Halbfinale der College-Football-Playoffs. ARLINGTON, Texas – Keionte Scott hat das Stück perfekt gelesen. Nachdem Ohio State zum ersten Mal die rote Zone von Miami erreicht hatte, versuchte Buckeyes-Quarterback Julian Sayin – der treffsicherste Passgeber des Landes in dieser Saison – einen kurzen Pass zu werfen. Scott wusste, was kommen würde ...","Hurricanes upset Ohio State, punch ticket to College Football Playoff semis. ARLINGTON, Texas — Keionte Scott read the play perfectly. After Ohio State reached Miami’s red zone for the first time, Buckeyes quarterback Julian Sayin — the nation’s most accurate passer this season — tried to throw a short pass. Scott knew what was coming…","Turbinum perturbatio Ohio Civitatis, tessera ferrum ad Collegium Football Playoff semis. ARlington, Texas — Keionte Scott fabula perfecte legit. Postquam Ohio State zonam rubram Miami attigit primum, Buckeyes QB Iulianus Sayin - praeteriens hoc tempore nationis accuratissimus - brevem passum iacere conatus est. Scott sciebat quid veniret…",2026-01-09 08:45:46+00:00
4a68b10e86df59b9f44a9642f0bfd962,2026-01-01T04:50:00Z,'hurricane',www.sun-sentinel.com,en,0.7,Dave Hyde: Hurricanes show they’re not done in beating Ohio State,"This is as good as it gets, when you break through, when you change your world — when the night and the dream are coming to you at the same time on a big stage like Miami had Wednesday night in the Cotton Bowl. All Miami had to do was hold on to their lead by…",https://www.sun-sentinel.com/2025/12/31/dave-hyde-hurricanes-show-theyre-not-done-in-beating-ohio-state/,https://s.yimg.com/cv/apiv2/social/images/yahoo_default_logo-1200x1200.png,http://web.archive.org/web/20260101224013/https://www.sun-sentinel.com/2025/12/31/dave-hyde-hurricanes-show-theyre-not-done-in-beating-ohio-state/,"This is as good as it gets, when you break through, when you change your world when the night and the dream are coming to you at the same time on a big stage like Miami had Wednesday night in the Cot… [+3830 chars]",,"Dave Hyde: Hurrikane zeigen, dass sie mit dem Sieg über Ohio State noch nicht fertig sind. Das ist das Beste, was es nur gibt, wenn man durchbricht, wenn man seine Welt verändert – wenn die Nacht und der Traum gleichzeitig zu einem auf einer großen Bühne kommen, wie Miami am Mittwochabend im Cotton Bowl. Alles, was Miami tun musste, war, seinen Vorsprung zu behaupten, indem…","Dave Hyde: Hurricanes show they’re not done in beating Ohio State. This is as good as it gets, when you break through, when you change your world — when the night and the dream are coming to you at the same time on a big stage like Miami had Wednesday night in the Cotton Bowl. All Miami had to do was hold on to their lead by…","Dave Hyde: Procellae ostendunt se non esse factum in verberatione Ohio Civitatis. Hoc tam bonum est quam fit, cum perfringis, cum mundum mutaveris — cum nox et somnium ad te simul veniunt in magna scaena sicut Miami habuit mercurii noctem in Globus Cotton. Omnes Miami facere tenebatur suum ductum per…",2026-01-09 08:45:46+00:00
44621154099e0141d046fc0e0747013e,2026-01-07T04:06:02Z,'hurricane',thehockeynews.com,en,0.7,"'We Were Ready To Go Right From Puck Drop': K'Andre Miller, Logan Stankoven, Andrei Svechnikov, Rod Brind'Amour On Big Win Over Dallas","Offensive explosion fuels dominant Hurricanes win. Miller, Stankoven, Svechnikov and Brind'Amour break down the offensive surge and key factors.",https://thehockeynews.com/carolina-hurricanes/game-day/we-were-ready-to-go-right-from-puck-drop-k-andre-miller-logan-stankoven-andrei-svechnikov-rod-brind-amour-on-big-win-over-dallas,https://s.yimg.com/ny/api/res/1.2/GLpcN0OUNqZCV2fZuPzfaQ--/YXBwaWQ9aGlnaGxhbmRlcjt3PTEyMDA7aD04MDA7Y2Y9d2VicA--/https://media.zenfs.com/en/the_hockey_news_carolina_hurricanes_articles_659/eb5c1ac5c9a3c04f2087a9d916211df5,,"The Carolina Hurricanes speed bagged the Dallas Stars Tuesday night, smashing them 6-3 in an offensive explosion.
Andrei Svechnikov led the way with a four-point night while K'Andre Miller scored tw… [+10425 chars]",,"„Wir waren vom Puck-Drop an startklar“: K'Andre Miller, Logan Stankoven, Andrei Svechnikov und Rod Brind'Amour über den großen Sieg gegen Dallas. Offensive Explosion befeuert den Sieg der dominanten Hurricanes. Miller, Stankoven, Svechnikov und Brind'Amour schlüsseln den Offensivschub und die Schlüsselfaktoren auf.","'We Were Ready To Go Right From Puck Drop': K'Andre Miller, Logan Stankoven, Andrei Svechnikov, Rod Brind'Amour On Big Win Over Dallas. Offensive explosion fuels dominant Hurricanes win. Miller, Stankoven, Svechnikov and Brind'Amour break down the offensive surge and key factors.","'Parati sumus ut Ius ex Puck Iacta': K'Andre Miller, Logan Stankoven, Andrei Svechnikov, Rod Brind'Amour Die Big Win Over Dallas. Damnosa explosio fuels dominantium turbinum vincunt. Miller, Stankoven, Svechnikov et Brind'Amour offensum salum et factores clavium destruunt.",2026-01-10 04:02:48+00:00
