index,published,keyword,domain,language,valid,title,description,url,image,archive,content,quote,de,en,la,added
659c1f7a32a9e9f838a1b45fe724dfb9,2024-11-04T16:43:30Z,'hurricane',www.aljazeera.com,en,0.9,Late-season Caribbean hurricane expected to hit Cuba this week,"If it forms, Rafael would be the 11th hurricane of the 2024 season and could strike western Cuba as a Category 1 storm.",https://www.aljazeera.com/news/2024/11/4/late-season-caribbean-hurricane-expected-to-hit-cuba-this-week,https://www.aljazeera.com/wp-content/uploads/2024/11/AP24308803352697-1730735319.jpg?resize=1920%2C1440,http://web.archive.org/web/20241104180128/https://www.aljazeera.com/news/2024/11/4/late-season-caribbean-hurricane-expected-to-hit-cuba-this-week,"Miami, Florida, United States A hurricane is expected to form in the Caribbean and bring heavy rain and mudslides to Cuba before heading into the warm waters of the Gulf of Mexico, according to the U… [+2825 chars]",,"Der karibische Hurrikan in der Spätsaison wird voraussichtlich diese Woche Kuba treffen. Wenn er sich bildet, wäre Rafael der 11. Hurrikan der Saison 2024 und könnte als Sturm der Kategorie 1 den Westen Kubas treffen.","Late-season Caribbean hurricane expected to hit Cuba this week. If it forms, Rafael would be the 11th hurricane of the 2024 season and could strike western Cuba as a Category 1 storm.","Nuper tempus Caribbean procellae expectatur hac septimana Cubam ferire. Si formaret, Rafael esset 11th procella temporis 2024 et percutere Cubam occidentalem ut categoriam 1 tempestatis.",2025-12-17 13:03:48+00:00
0e7c78715e3c632afe73eb1bd2673080,2024-11-04T17:03:00Z,'hurricane',www.thestar.com.my,en,0.9,Cuba braces for second hurricane amid power crisis,HAVANA (Reuters) - Cuba began preparing on Monday for the predicted arrival of a strengthening tropical depression in the southern Caribbean Sea even as emergency workers are still responding to a nationwide blackout and hurricane just two weeks before. Read …,https://www.thestar.com.my/news/world/2024/11/05/cuba-braces-for-second-hurricane-amid-power-crisis,https://apicms.thestar.com.my/uploads/images/2024/11/05/3000849.jpg,http://web.archive.org/web/20241213131312/https://www.thestar.com.my/news/world/2024/11/05/cuba-braces-for-second-hurricane-amid-power-crisis,HAVANA (Reuters) - Cuba began preparing on Monday for the predicted arrival of a strengthening tropical depression in the southern Caribbean Sea even as emergency workers are still responding to a na… [+1919 chars],,"Kuba bereitet sich inmitten der Energiekrise auf den zweiten Hurrikan vor. HAVANNA (Reuters) – Kuba begann am Montag mit den Vorbereitungen für das vorhergesagte Eintreffen eines sich verstärkenden tropischen Tiefdruckgebiets in der südlichen Karibik, während Rettungskräfte noch immer auf einen landesweiten Stromausfall und einen Hurrikan nur zwei Wochen zuvor reagieren. Lesen …",Cuba braces for second hurricane amid power crisis. HAVANA (Reuters) - Cuba began preparing on Monday for the predicted arrival of a strengthening tropical depression in the southern Caribbean Sea even as emergency workers are still responding to a nationwide blackout and hurricane just two weeks before. Read …,"Cuba adstringit pro secundo turbine inter potentiam discriminis. HAVANA (Reuters) - Cuba die Lunae ad praedictum adventum depressionis tropicae firmandae in Mare Caribbean meridionali incepit, etiam cum subitis operariis adhuc nationi nigrae et turbinis ante duas septimanas respondet. Lege ...",2025-12-17 13:03:48+00:00
1ffb8c0fe5ae7003a4b0361ff651ddc0,2024-11-04T21:33:21Z,'hurricane',www.nbcnews.com,en,0.9,Tropical Storm Rafael forms in the Caribbean and is expected to become a hurricane,Tropical Storm Rafael formed in the Caribbean on Monday and is forecast to become a hurricane on Tuesday. It could approach the U.S. by mid to late week.,https://www.nbcnews.com/weather/hurricanes/tropical-storm-rafael-forms-expected-hurricane-rcna178632,"https://media-cldnry.s-nbcnews.com/image/upload/t_nbcnews-fp-1200-630,f_auto,q_auto:best/rockcms/2024-11/241104-tropical-storm-rafael-se-1106a-985635.jpg",http://web.archive.org/web/20241104215427/https://www.nbcnews.com/weather/hurricanes/tropical-storm-rafael-forms-expected-hurricane-rcna178632,"A disturbance in the Caribbean strengthened into Tropical Storm Rafael on Monday afternoon. The storm is forecast to become a hurricane on Tuesday. 
Rafael, previously known as Potential Tropical Cy… [+2132 chars]",,Der Tropensturm Rafael entsteht in der Karibik und wird voraussichtlich zu einem Hurrikan werden. Der Tropensturm Rafael hat sich am Montag in der Karibik gebildet und soll am Dienstag zu einem Hurrikan werden. Mitte bis Ende der Woche könnte es sich den USA nähern.,Tropical Storm Rafael forms in the Caribbean and is expected to become a hurricane. Tropical Storm Rafael formed in the Caribbean on Monday and is forecast to become a hurricane on Tuesday. It could approach the U.S. by mid to late week.,Tropical Rafael format in Caribbean et expectatur turbinem fieri. Tropical Rafael in Caribbean die Lunae formata est et praesagio procellarum die Martis fieri. Posset accedere US per medium ad multam hebdomadam.,2025-12-17 13:03:48+00:00
cf4f0bb0ead6d586c0d3730fd0a74fe5,2024-11-05T07:35:06Z,'hurricane',www.cnn.com,en,0.9,Tropical Storm Rafael to become a hurricane before Cuba landfall Wednesday | CNN,"While Tropical Storm Rafael winds remained consistent Monday night, the storm is forecast to strengthen Tuesday and become a hurricane Wednesday, bringing destructive winds and heavy rainfall to the western Caribbean and southern Florida by midweek.",https://www.cnn.com/2024/11/05/us/tropical-storm-rafael-forecast-hurricane-hnk/index.html,"https://media.cnn.com/api/v1/images/stellar/prod/2024-11-04t200207z-1812715103-rc2hyaa0mdu8-rtrmadp-3-storm-rafael-cuba.jpg?c=16x9&q=w_800,c_fill",http://web.archive.org/web/20241106041338/https://www.cnn.com/2024/11/05/us/tropical-storm-rafael-forecast-hurricane-hnk/index.html,"Tropical Storm Rafael has begun to strengthen in the Caribbean Sea, and it is expected to reach hurricane strength by Wednesday and bring destructive winds and heavy rainfall to the region.
Rafael w… [+3639 chars]",,"Tropensturm Rafael entwickelt sich zu einem Hurrikan, bevor er am Mittwoch auf Kuba trifft | CNN. Während der Tropensturm Rafael am Montagabend konstant wehte, wird der Sturm voraussichtlich am Dienstag stärker werden und sich am Mittwoch zu einem Hurrikan entwickeln, der bis zur Wochenmitte zerstörerische Winde und starke Regenfälle in die westliche Karibik und Südflorida bringt.","Tropical Storm Rafael to become a hurricane before Cuba landfall Wednesday | CNN. While Tropical Storm Rafael winds remained consistent Monday night, the storm is forecast to strengthen Tuesday and become a hurricane Wednesday, bringing destructive winds and heavy rainfall to the western Caribbean and southern Florida by midweek.","Tropical Rafael fiet turbo ante Cuba traham mercurii | Rhoncus. Dum Tropical Rafael venti consistunt, Lunae nocte consistens, tempestas Martis praesagio firmandae et procellae Mercurii factae sunt, ventos perniciosos et graves pluvias in Floridam occidentalem Caribbean et meridionalem a midhebdomada afferentes.",2025-12-17 13:03:48+00:00
fd7be0b1aeb88b0377cd6f11ec578f7c,2024-11-05T18:33:37Z,'hurricane season',insidethemagic.net,en,0.9,"Florida Hit with Threatening Tropical Storm Rafael Warning, Location of Impact Determined","As we continue through a particularly active hurricane season, all eyes are on the Atlantic, where a series of storms has developed over the past few months. Recently, we saw significant storms like Hurricane Milton and Hurricane Helene, and today, another sy…",https://insidethemagic.net/2024/11/florida-hit-tropical-storm-warning-location-impact-determined-ad1/,https://insidethemagic.net/wp-content/uploads/2023/12/mickey-minnie-disney-world.jpg,,"As we continue through a particularly active hurricane season, all eyes are on the Atlantic, where a series of storms has developed over the past few months. Recently, we saw significant storms like … [+3836 chars]",,"Florida wurde vom bedrohlichen Tropensturm Rafael heimgesucht, Ort des Aufpralls ermittelt. Während wir eine besonders aktive Hurrikansaison erleben, sind alle Augen auf den Atlantik gerichtet, wo sich in den letzten Monaten eine Reihe von Stürmen entwickelt hat. Kürzlich haben wir schwere Stürme wie Hurrikan Milton und Hurrikan Helene gesehen, und heute ein weiteres Sy…","Florida Hit with Threatening Tropical Storm Rafael Warning, Location of Impact Determined. As we continue through a particularly active hurricane season, all eyes are on the Atlantic, where a series of storms has developed over the past few months. Recently, we saw significant storms like Hurricane Milton and Hurricane Helene, and today, another sy…","Florida Hit cum minitare Tropical Rafael Monitum, Locus Impact Intentus. Cum per activum tempestatis tempus peculiariter continuamus, oculi omnes in Atlantico sunt, ubi series tempestatum per hos menses elaboravit. Nuper tempestates significantes vidimus sicut Milton Procellae et Procellae Helene, et hodie aliam sy…",2025-12-17 13:03:48+00:00
05e86585e1d135611489a7dd753b6807,2024-11-05T21:13:22Z,'hurricane season',slashdot.org,en,0.9,Tropical Storm Rafael gains intensity in Caribbean as it nears Cuba - The Guardian,"Tropical Storm Rafael gains intensity in Caribbean as it nears CubaThe Guardian Rafael means busy hurricane season is looking at a rare US landfall in NovemberUSA TODAY Rafael could become a hurricane soon, but the storm and its path could change drastically …",https://slashdot.org/firehose.pl?op=view&amp;id=175410585,,http://web.archive.org/web/20160119174443/http://slashdot.org/firehose.pl?op=view,The Fine Print: The following comments are owned by whoever posted them. We are not responsible for them in any way.,,"Der Tropensturm Rafael nimmt in der Karibik an Intensität zu, während er sich Kuba nähert – The Guardian. Der Tropensturm Rafael nimmt in der Karibik an Intensität zu, während er sich Kuba nähert. Der Guardian Rafael meint, dass in der geschäftigen Hurrikansaison im November ein seltener Landfall in den USA bevorsteht. USA HEUTE Rafael könnte sich bald zu einem Hurrikan entwickeln, aber der Sturm und seine Richtung könnten sich drastisch ändern …","Tropical Storm Rafael gains intensity in Caribbean as it nears Cuba - The Guardian. Tropical Storm Rafael gains intensity in Caribbean as it nears CubaThe Guardian Rafael means busy hurricane season is looking at a rare US landfall in NovemberUSA TODAY Rafael could become a hurricane soon, but the storm and its path could change drastically …","Tropical Rafael vehementiam in Caribbeana appropinquat Cuba - Custos. Tropical Rafael vehementiam in Caribbean consequitur sicut appropinquat CubaThe Guardian Rafael significat occupatum tempestatis tempus spectat ad raram US ruinam in NovembriUSA TODAY Rafael fieri potest cito turbo, sed tempestas et eius semita probiliter mutare potuit.",2025-12-17 13:03:48+00:00
f1337f358a4ddb9159d200f2cd184f70,2024-11-06T00:41:41Z,veryUnusualAndNeverUsedKeyword,www.nbcnews.com,en,0.9,Rafael strengthens to a Category 1 hurricane,"Tropical Storm Rafael strengthened into a Category 1 Hurricane Tuesday evening near the Cayman Islands, the National Hurricane Center said.",https://www.nbcnews.com/weather/hurricanes/rafael-strengthens-hurricane-rcna178791,"https://media-cldnry.s-nbcnews.com/image/upload/t_nbcnews-fp-1200-630,f_auto,q_auto:best/rockcms/2024-11/241105-tropical-storm-rafael-al-0953-9c5f0e.jpg",http://web.archive.org/web/20241107072519/https://www.nbcnews.com/weather/hurricanes/rafael-strengthens-hurricane-rcna178791,"Tropical Storm Rafael strengthened into a Category 1 Hurricane Tuesday evening near the Cayman Islands, the National Hurricane Center said.
Rafael was located 20 miles southeast of Little Cayman, wi… [+2396 chars]",,"Rafael verstärkt sich zu einem Hurrikan der Kategorie 1. Der Tropensturm Rafael hat sich am Dienstagabend in der Nähe der Cayman-Inseln zu einem Hurrikan der Kategorie 1 verstärkt, teilte das National Hurricane Center mit.","Rafael strengthens to a Category 1 hurricane. Tropical Storm Rafael strengthened into a Category 1 Hurricane Tuesday evening near the Cayman Islands, the National Hurricane Center said.","Rafael confirmat categoriam 1 turbinis. Tropical Rafael in Categoria 1 Procellae Martis vesperi prope Insulas Cayman, Centrum Nationale Hurricane dixit.",2025-12-17 13:03:48+00:00
44e05d0e5950c05024d8a75439333e8e,2024-11-06T01:09:27Z,'hurricane',biztoc.com,en,0.9,Tropical storm Rafael becomes hurricane,"Tropical storm Rafael intensified into a hurricane with maximum sustained winds of 75 miles per hour, the United States National Hurricane Center (NHC) said.The storm was upgraded as it approached the...",https://biztoc.com/x/c4be9f9990ba1ddc,https://biztoc.com/cdn/c4be9f9990ba1ddc_s.webp,,"Tropical storm Rafael intensified into a hurricane with maximum sustained winds of 75 miles per hour, the United States National Hurricane Center (NHC) said.The storm was upgraded as it approached th… [+69 chars]",,"Der Tropensturm Rafael wird zum Hurrikan. Der Tropensturm Rafael verstärkte sich zu einem Hurrikan mit maximalen Dauerwindgeschwindigkeiten von 75 Meilen pro Stunde, teilte das US-amerikanische National Hurricane Center (NHC) mit. Der Sturm verstärkte sich, als er sich dem ... näherte.","Tropical storm Rafael becomes hurricane. Tropical storm Rafael intensified into a hurricane with maximum sustained winds of 75 miles per hour, the United States National Hurricane Center (NHC) said.The storm was upgraded as it approached the...","Tropical Rafael tempestas fit turbo. Tempestas tropica Rafael in typhonematum intenditur cum maximis ventis sustinentibus 75 milia passuum per hora, Civitatibus Foederatis Americae National Hurricane Centrum (NHC) dixit. Tempestas in accessu ad ... upgraded est.",2025-12-17 13:03:48+00:00
d2f59374be4ff8ad9d10a0fcb21a530d,2024-11-06T01:53:19Z,'hurricane',slashdot.org,en,0.9,Rafael strengthens to a Category 1 hurricane - NBC News,"Rafael strengthens to a Category 1 hurricaneNBC News Rafael will become a hurricane soon, but the storm and its path toward the US could change drasticallyCNN Tropical Storm Rafael nearing hurricane strength. See what Florida can expectNews-Press Hurricane Ra…",https://slashdot.org/firehose.pl?op=view&amp;id=175411915,,,The Fine Print: The following comments are owned by whoever posted them. We are not responsible for them in any way.,,"Rafael verstärkt sich zu einem Hurrikan der Kategorie 1 – NBC News. Rafael verstärkt sich zu einem Hurrikan der Kategorie 1NBC News Rafael wird bald zu einem Hurrikan, aber der Sturm und seine Richtung in die USA könnten sich drastisch ändernCNN Tropischer Sturm Rafael nähert sich der Stärke eines Hurrikans. Sehen Sie, was Florida erwarten kannNews-Press Hurricane Ra…","Rafael strengthens to a Category 1 hurricane - NBC News. Rafael strengthens to a Category 1 hurricaneNBC News Rafael will become a hurricane soon, but the storm and its path toward the US could change drasticallyCNN Tropical Storm Rafael nearing hurricane strength. See what Florida can expectNews-Press Hurricane Ra…","Rafael confirmat Categoria 1 turbo - NBC News. Rafael confirmat categoriam 1 turbinisNBC Nuntii Rafael mox turbo fiet, sed tempestas eiusque iter in US drasticallyCNN Tropical Rafael appropinquante tempestatis viribus poterat mutare. Vide quid Florida possit expectNews-Press Procellae Ra…",2025-12-17 13:03:48+00:00
22471dccf9d5940cf52c46279d5d5dcc,2024-11-06T02:16:40Z,'hurricane',biztoc.com,en,0.9,Tropical Storm Rafael Strengthens to Hurricane on Path to Cuba,"Tropical Storm Rafael was upgraded to a Category 1 Hurricane this week on its current path towards Cuba.
This marked yet another setback for Cuba, already grappling with widespread blackouts and still recovering from a hurricane two weeks prior that left at l…",https://biztoc.com/x/4aabc356614f6005,https://biztoc.com/cdn/4aabc356614f6005_s.webp,,"Tropical Storm Rafael was upgraded to a Category 1 Hurricane this week on its current path towards Cuba.This marked yet another setback for Cuba, already grappling with widespread blackouts and still… [+144 chars]",,"Tropischer Sturm Rafael verstärkt sich zum Hurrikan auf dem Weg nach Kuba. Der Tropensturm Rafael wurde diese Woche auf seinem aktuellen Weg in Richtung Kuba zu einem Hurrikan der Kategorie 1 hochgestuft.
Dies war ein weiterer Rückschlag für Kuba, das bereits mit weit verbreiteten Stromausfällen zu kämpfen hatte und sich immer noch von einem Hurrikan erholte, der zwei Wochen zuvor auf Kuba aufgebrochen war.","Tropical Storm Rafael Strengthens to Hurricane on Path to Cuba. Tropical Storm Rafael was upgraded to a Category 1 Hurricane this week on its current path towards Cuba.
This marked yet another setback for Cuba, already grappling with widespread blackouts and still recovering from a hurricane two weeks prior that left at l…","Tropical Rafael Confirmat Procellae in Path Cuba. Tropical Rafael upgraded categorio 1 Procellae hac septimana in currenti suo itinere versus Cubam.
Hoc incommodum aliud adhuc notatum est pro Cuba, iam iniecta latibulis nigris et adhuc duabus ebdomadibus a turbine recuperatis ante quae supersunt ad l...",2025-12-17 13:03:48+00:00
c81a74632cc4326e2aa9ab4c8053eddb,2024-11-06T10:38:20Z,'hurricane',www.news-press.com,en,0.9,"Hurricane Rafael tracker: See projected path, spaghetti models, Florida impacts",Rafael is expected to be near major hurricane strength when it makes landfall in western Cuba later today.,https://www.news-press.com/story/weather/hurricane/2024/11/06/hurricane-rafael-tracker-path-spaghetti-models-florida-impacts/76068431007/,https://media.zenfs.com/en/the-news-press/4f425af5ff1f4e6afa850531e2106e3c,,"Hurricane Rafael is expected to strengthen before making landfall in western Cuba, according to the latest advisory from the National Hurricane Center.
Forecasters said Rafael could be near Category… [+1725 chars]",,"Hurrikan-Rafael-Tracker: Siehe projizierte Flugbahn, Spaghetti-Modelle, Auswirkungen auf Florida. Es wird erwartet, dass Rafael die Stärke eines großen Hurrikans erreicht, wenn er heute im Westen Kubas auf Land trifft.","Hurricane Rafael tracker: See projected path, spaghetti models, Florida impacts. Rafael is expected to be near major hurricane strength when it makes landfall in western Cuba later today.","Procellae Rafael venato: Vide viam projectam, exempla spaghetti, impacta Florida. Rafael exspectatur prope maiorem vim tempestatis esse cum postea hodie in Cuba occidentis ruinam facit.",2025-12-17 13:03:48+00:00
72da51ba8bbe3887c624c9951eebcd9a,2024-11-06T11:50:00Z,veryUnusualAndNeverUsedKeyword,oilprice.com,en,0.9,Hurricane Rafael Threatens U.S. Gulf of Mexico Oil Production,"Tropical storm Rafael has strengthened to hurricane intensity in recent hours and is still set to continue its path toward the U.S. Gulf of Mexico, where oil and gas producers have shut-in production at platforms and evacuated personnel to shore. The late-sea…",https://oilprice.com/Latest-Energy-News/World-News/Hurricane-Rafael-Threatens-US-Gulf-of-Mexico-Oil-Production.html,https://d32r1sh890xpii.cloudfront.net/news/718x300/2024-11-06_srbm2nnihw.jpg,http://web.archive.org/web/20241111080842/https://oilprice.com/Latest-Energy-News/World-News/Hurricane-Rafael-Threatens-US-Gulf-of-Mexico-Oil-Production.html,"This article discusses the importance…
It was a mixed earnings…
By Tsvetana Paraskova - Nov 06, 2024, 5:50 AM CSTTropical storm Rafael has strengthened to hurricane intensity in recent hours and is… [+1967 chars]",,"Hurrikan Rafael bedroht die Ölproduktion im Golf von Mexiko in den USA. Der Tropensturm Rafael hat in den letzten Stunden die Intensität eines Hurrikans erreicht und ist weiterhin bereit, seinen Weg in Richtung des US-Golfs von Mexiko fortzusetzen, wo Öl- und Gasproduzenten die Produktion an Plattformen eingestellt und Personal an Land evakuiert haben. Das Spätmeer…","Hurricane Rafael Threatens U.S. Gulf of Mexico Oil Production. Tropical storm Rafael has strengthened to hurricane intensity in recent hours and is still set to continue its path toward the U.S. Gulf of Mexico, where oil and gas producers have shut-in production at platforms and evacuated personnel to shore. The late-sea…","Procellae Rafael minatur US Sinus Mexicani Olei Productio. Tempestas tropica Rafael ad vehementiam typhonicam proximis horis confirmavit et adhuc iter suum pergere versus Sinum Mexicanum Americae constituit, ubi oleum et gasorum effectores in suggestis productionem concluserunt et curatores ad litus evacuaverunt. Nuper mare…",2025-12-17 13:03:48+00:00
fb08f8cd95ea410afbb12d24aefe8b7b,2024-11-06T13:38:09Z,'hurricane',nypost.com,en,0.9,"Rafael strengthens into Category 2 hurricane as Cuba braces for damaging winds, life-threatening storm surge",Hurricane Rafael continues to intensify and is expected to be near major hurricane strength when the late-season tropical system makes landfall in Cuba on Wednesday.,https://nypost.com/2024/11/06/world-news/rafael-strengthens-into-category-2-hurricane-as-cuba-braces-for-damaging-winds-life-threatening-storm-surge/,https://nypost.com/wp-content/uploads/sites/2/2024/11/newspress-collage-rbavuyv58-1730899990035.jpg?quality=75&strip=all&1730882045&w=1024,http://web.archive.org/web/20241106154228/https://nypost.com/2024/11/06/world-news/rafael-strengthens-into-category-2-hurricane-as-cuba-braces-for-damaging-winds-life-threatening-storm-surge/,"MIAMI Hurricane Rafael continues to intensify and is expected to be near major hurricane strength when the late-season tropical system makes landfall in Cuba on Wednesday.
Millions of people along t… [+3532 chars]",,"Rafael entwickelt sich zu einem Hurrikan der Kategorie 2, während Kuba sich auf schädliche Winde und eine lebensbedrohliche Sturmflut vorbereitet. Hurrikan Rafael verstärkt sich weiter und wird voraussichtlich die Stärke eines großen Hurrikans erreichen, wenn das tropische System der Spätsaison am Mittwoch auf Kuba trifft.","Rafael strengthens into Category 2 hurricane as Cuba braces for damaging winds, life-threatening storm surge. Hurricane Rafael continues to intensify and is expected to be near major hurricane strength when the late-season tropical system makes landfall in Cuba on Wednesday.","Rafael in Categoria 2 Procellae sicut Cuba adstringit ad deminutio ventos, impetus vitae minaces. Procellae Rafael augere pergit et expectatur prope maiorem vim tempestatis esse cum systema tropica nuper temporis in Cuba die Mercurii lapsus facit.",2025-12-17 13:03:48+00:00
4acd6ae465212a1a6dc79abfcb39e86e,2024-11-06T14:52:35Z,'hurricane',www.aljazeera.com,en,0.9,Hurricane Rafael becomes a Category 2 storm as it nears Cuba,Rafael continues to strengthen and forecast to be near major Category 3 hurricane status at landfall in western Cuba.,https://www.aljazeera.com/news/2024/11/6/hurricane-rafael-becomes-a-category-2-storm-as-it-nears-cuba,https://www.aljazeera.com/wp-content/uploads/2024/11/2024-11-05T194831Z_365714265_RC25ZAAZPINA_RTRMADP_3_STORM-RAFAEL-CUBA-1730901548.jpg?resize=1920%2C1440,http://web.archive.org/web/20241106230448/https://www.aljazeera.com/news/2024/11/6/hurricane-rafael-becomes-a-category-2-storm-as-it-nears-cuba,"Hurricane Rafael has intensified into a Category 2 hurricane just hours before it is forecast to make landfall in Cuba, according to the United States National Weather Service.
Hurricane Rafael is l… [+3014 chars]",,"Hurrikan Rafael entwickelt sich zu einem Sturm der Kategorie 2, als er sich Kuba nähert. Rafael verstärkt sich weiter und es wird prognostiziert, dass er bei Landung im Westen Kubas nahezu den Status eines schweren Hurrikans der Kategorie 3 erreichen wird.",Hurricane Rafael becomes a Category 2 storm as it nears Cuba. Rafael continues to strengthen and forecast to be near major Category 3 hurricane status at landfall in western Cuba.,Procellae Rafael factus est Categoria 2 tempestas cum iam Cubae appropinquat. Rafael pergit confirmare et praevidere prope magnum Categoriae 3 status procellae apud landfall in Cuba occidentali.,2025-12-17 13:03:48+00:00
