index,published,keyword,domain,language,valid,title,description,url,image,archive,content,quote,de,en,la,added
5516065cd9b4354f1a0299940ed7adb4,2025-08-11T07:57:00Z,'hurricane',newatlas.com,en,0.9,Stark warning for US as hurricane 'traffic jams' 10x more likely to form,"The North Atlantic has claimed a new title as the global hotspot for hurricane clusters, with the likelihood of these forming increasing tenfold in the past 46 years. A new study provides the first robust quantification of how the Earth's warming patterns are…",https://newatlas.com/environment/us-hurricane-clusters/,https://assets.newatlas.com/dims4/default/5ffb8c5/2147483647/strip/true/crop/1536x806+0+109/resize/1200x630!/quality/90/?url=https%3A%2F%2Fnewatlas-brightspot.s3.amazonaws.com%2Fb3%2F8f%2Fed85d96a4dc19c0d4f93c0be870f%2Fchatgpt-image-aug-11-2025-03-21-11-pm.png&na.image_optimisation=0,http://web.archive.org/web/20250813150018/https://newatlas.com/environment/us-hurricane-clusters/,"The North Atlantic has claimed a new title as the global hotspot for hurricane clusters, with the likelihood of these forming increasing tenfold in the past 46 years. A new study provides the first r… [+4971 chars]",,"Eindringliche Warnung für die USA, da Hurrikan-„Verkehrsstaus“ 10-mal wahrscheinlicher sind. Der Nordatlantik hat sich einen neuen Titel als globaler Hotspot für Hurrikancluster gesichert, wobei sich die Wahrscheinlichkeit ihrer Bildung in den letzten 46 Jahren verzehnfacht hat. Eine neue Studie liefert die erste belastbare Quantifizierung der Erwärmungsmuster der Erde …","Stark warning for US as hurricane 'traffic jams' 10x more likely to form. The North Atlantic has claimed a new title as the global hotspot for hurricane clusters, with the likelihood of these forming increasing tenfold in the past 46 years. A new study provides the first robust quantification of how the Earth's warming patterns are…","Stark monitum pro US ut procellae ""coniunctiones negotiationis"" 10x magis verisimile formare. Atlanticus Septentrionalis novum titulum assumpsit hotspot globalis pro typhonicis botris, cum probabilius harum formantium decuplo in praeteritum XLVI annos crescens. Novum studium praebet primam quantitatem robustam quomodo exemplaria calefactio Terrae sunt…",2025-12-17 12:46:33+00:00
66bd40c61554d9759bbbd156113d0114,2025-08-11T15:35:02Z,veryUnusualAndNeverUsedKeyword,www.naplesnews.com,en,0.9,"Tropical Storm Erin forms, expected to become major hurricane by weekend. See Florida impact",Tropical Storm Erin has formed in the eastern Atlantic and is predicted to become a Category 3 hurricane by Aug. 16.,https://www.naplesnews.com/story/weather/hurricanes/2025/08/11/tropical-storm-erin-major-hurricane-tracker-spaghetti-models-florida-us-impacts/85609114007/,https://media.zenfs.com/en/naples-daily-news/8d1bb8cfae6fcc136040b67ceec3d568,http://web.archive.org/web/20250811180929/https://www.naplesnews.com/story/weather/hurricanes/2025/08/11/tropical-storm-erin-major-hurricane-tracker-spaghetti-models-florida-us-impacts/85609114007/,"Tropical Storm Erin has formed in the eastern Atlantic.
Erin is expected to strengthen as it makes its way west across the Atlantic. Current forecasts predict it'll become a major hurricane, with su… [+4799 chars]",,"Es bildet sich der Tropensturm Erin, der sich voraussichtlich am Wochenende zu einem schweren Hurrikan entwickeln wird. Siehe Auswirkungen auf Florida. Der Tropensturm Erin hat sich im Ostatlantik gebildet und wird voraussichtlich bis zum 16. August zu einem Hurrikan der Kategorie 3 werden.","Tropical Storm Erin forms, expected to become major hurricane by weekend. See Florida impact. Tropical Storm Erin has formed in the eastern Atlantic and is predicted to become a Category 3 hurricane by Aug. 16.","Tropical Storm Erin forms, expectatur ut major procellae volutpat fiant. Vide Florida luctus. Tropical Tempestas Erin in Atlantico Orientali formavit et praedicitur categoria 3 turbinis ab 16 Aug.",2025-12-17 12:46:33+00:00
fb397eab6d738152b885765360aba757,2025-08-11T17:07:00Z,'hurricane',www.orlandosentinel.com,en,0.9,"Tropical Storm Erin forms, forecast to become major hurricane, NHC says","ORLANDO, Fla. — Tropical Storm Erin formed in the eastern tropical Atlantic on Monday morning and is forecast to grow into a major hurricane by the weekend, ...",https://www.orlandosentinel.com/2025/08/11/hurricane-center-tracks-2-atlantic-systems-that-could-develop/,https://s.yimg.com/ny/api/res/1.2/jLfmss65WdWwXCB5PdZrjg--/YXBwaWQ9aGlnaGxhbmRlcjt3PTEyMDA7aD03MDQ7Y2Y9d2VicA--/https://media.zenfs.com/en/orlando_sentinel_national_858/cc479183692eb0d261c009694c867f1e,http://web.archive.org/web/20250811192321/https://www.orlandosentinel.com/2025/08/11/hurricane-center-tracks-2-atlantic-systems-that-could-develop/,"ORLANDO, Fla. Tropical Storm Erin formed in the eastern tropical Atlantic on Monday morning and is forecast to grow into a major hurricane by the weekend, according to the National Hurricane Center.… [+2663 chars]",,"Laut NHC bildet sich der Tropensturm Erin, der voraussichtlich zu einem schweren Hurrikan werden wird. ORLANDO, Florida – Der Tropensturm Erin hat sich am Montagmorgen im östlichen tropischen Atlantik gebildet und soll sich bis zum Wochenende zu einem großen Hurrikan entwickeln, ...","Tropical Storm Erin forms, forecast to become major hurricane, NHC says. ORLANDO, Fla. — Tropical Storm Erin formed in the eastern tropical Atlantic on Monday morning and is forecast to grow into a major hurricane by the weekend, ...","Tropical Tempestas Erin formas praenuntiant fieri ventorum maiores, NHC dicit. ORLANDO, Fla. — Tempestas Tropical Erin in Atlantico tropico Orientali die Lunae mane formatur et praenuntiatur crescere in maiorem procellam ab auctoritatibus...",2025-12-17 12:46:33+00:00
8cb6735b23a3b85e7fcf5177dbf7805e,2025-08-11T19:09:16Z,'hurricane',www.heraldtribune.com,en,0.9,"Tropical Storm Erin to become hurricane. Where it's going, Sarasota, Bradenton impact","Tropical Storm Erin formed in the Atlantic Monday morning, Aug. 11. Erin could become a hurricane by Aug. 13.",https://www.heraldtribune.com/story/weather/hurricane/2025/08/11/noaa-tropical-storm-erin-path-track-spaghetti-models-sarasota-bradenton-impact/85614703007/,https://media.zenfs.com/en/herald-tribune/8d1bb8cfae6fcc136040b67ceec3d568,http://web.archive.org/web/20250813164523/https://www.heraldtribune.com/story/weather/hurricane/2025/08/11/noaa-tropical-storm-erin-path-track-spaghetti-models-sarasota-bradenton-impact/85614703007/,"Tropical Storm Erin formed in the Atlantic Monday morning, Aug. 11.
The National Hurricane Center issued its first advisory on the fifth-named storm of the Atlantic hurricane season at 11 a.m., warn… [+9602 chars]",,"Tropensturm Erin wird zum Hurrikan. Wohin es geht, Sarasota, Bradenton-Einschlag. Der Tropensturm Erin bildete sich am Montagmorgen, dem 11. August, im Atlantik. Erin könnte sich bis zum 13. August zu einem Hurrikan entwickeln.","Tropical Storm Erin to become hurricane. Where it's going, Sarasota, Bradenton impact. Tropical Storm Erin formed in the Atlantic Monday morning, Aug. 11. Erin could become a hurricane by Aug. 13.","Tropical storm erin to become hurricane. Ubi iturus est, Sarasota, Bradenton ictum est. Tropical Storm Erin in Atlantic Lunae mane formatus, 11. Aug. 11. Erin procella fieri potuit ab 13 Aug.",2025-12-17 12:46:33+00:00
0fd05c4cbd56b17d556576f432f76f97,2025-08-12T08:59:39Z,'hurricane',www.naplesnews.com,en,0.9,"Tropical Storm Erin expected to strengthen soon, become hurricane. See latest spaghetti models","Tropical Storm Erin continues to move quickly west, and is expected to become the first hurricane of the Atlantic season.",https://www.naplesnews.com/story/weather/hurricanes/2025/08/12/hurricane-erin-tropical-storm-strengthening-tracker-spaghetti-models-florida-impact/85613176007/,https://media.zenfs.com/en/naples-daily-news/97d06dd09e1d022d1fda7e6d3aa02431,http://web.archive.org/web/20250812212424/https://www.naplesnews.com/story/weather/hurricanes/2025/08/12/hurricane-erin-tropical-storm-strengthening-tracker-spaghetti-models-florida-impact/85613176007/,"Tropical Storm Erin continues to move quickly west, and is expected to become the first hurricane of the Atlantic season this week, according to the National Hurricane Center.
Strengthening is expec… [+4308 chars]",,Der Tropensturm Erin dürfte sich bald verstärken und zum Hurrikan werden. Sehen Sie sich die neuesten Spaghetti-Modelle an. Der Tropensturm Erin bewegt sich weiterhin schnell nach Westen und wird voraussichtlich der erste Hurrikan der Atlantiksaison werden.,"Tropical Storm Erin expected to strengthen soon, become hurricane. See latest spaghetti models. Tropical Storm Erin continues to move quickly west, and is expected to become the first hurricane of the Atlantic season.","Tropical Tempestas Erin mox confirmatura expectatur, fiet turbo. Vide ultima spaghetti exempla. Tropical Storm Erin cito occidens moveri pergit et expectatur primus procellae temporum Atlantici fieri.",2025-12-17 12:46:33+00:00
3df7cd802cdf78a76a8269e9cb6a6755,2025-08-12T14:12:53Z,'hurricane',www.palmbeachpost.com,en,0.9,"Tropical Storm Erin expected to strengthen, become hurricane. Latest spaghetti models","Tropical Storm Erin continues to move quickly west, is expected to become first hurricane of the 2025 Atlantic season. See models here.",https://www.palmbeachpost.com/story/weather/hurricane/2025/08/12/tropical-storm-erin-2025-spaghetti-models-florida-hurricane-tracker/85623655007/,https://media.zenfs.com/en/palm-beach-daily-news/64afea789fef28320423d1370982bd3e,http://web.archive.org/web/20250812152141/https://www.palmbeachpost.com/story/weather/hurricane/2025/08/12/tropical-storm-erin-2025-spaghetti-models-florida-hurricane-tracker/85623655007/,"Tropical Storm Erin continues to move quickly west, and is expected to become the first hurricane of the Atlantic season this week, according to the National Hurricane Center.
Strengthening is expec… [+4302 chars]",,"Es wird erwartet, dass sich der Tropensturm Erin verstärkt und zum Hurrikan wird. Neueste Spaghetti-Modelle. Der Tropensturm Erin bewegt sich weiterhin schnell nach Westen und wird voraussichtlich der erste Hurrikan der Atlantiksaison 2025 sein. Modelle finden Sie hier.","Tropical Storm Erin expected to strengthen, become hurricane. Latest spaghetti models. Tropical Storm Erin continues to move quickly west, is expected to become first hurricane of the 2025 Atlantic season. See models here.","Tropical Tempestas Erin firmare expectat, factus est impetus tempestatis. Tardus Tardus exempla. Tropical Storm Erin cito occidentem movere pergit, expectatur primum procellae temporis Atlantici 2025 fieri. Vide hic exempla.",2025-12-17 12:46:33+00:00
f1965bc0c8d22498c097322439854f06,2025-08-12T14:29:25Z,veryUnusualAndNeverUsedKeyword,www.capecodtimes.com,en,0.9,Tropical Storm Erin forecasted to become a hurricane. What's it track? Will it impact MA?,Tropical Storm Erin is expected to become a hurricane. See where it's tracking.,https://www.capecodtimes.com/story/weather/hurricane/2025/08/12/massachusetts-weather-tropical-storm-erin-hurricane-track-spaghetti-models/85622319007/,https://s.yimg.com/ny/api/res/1.2/R_BUDJmVr38aZk_u027y.Q--/YXBwaWQ9aGlnaGxhbmRlcjt3PTEyMDA7aD02NzU7Y2Y9d2VicA--/https://media.zenfs.com/en/cape-cod-times/4f35084fa13d588e61221bb15cbdbea0,http://web.archive.org/web/20250816055745/https://www.capecodtimes.com/story/weather/hurricane/2025/08/12/massachusetts-weather-tropical-storm-erin-hurricane-track-spaghetti-models/85622319007/,"Tropical Storm Erin is expected to intensify into the first major hurricane of the season, according to the National Hurricane Center.
The storm formed near the Cabo Verde Islands over the weekend a… [+4466 chars]",,"Der Tropensturm Erin soll sich zu einem Hurrikan entwickeln. Was ist das für ein Track? Wird es Auswirkungen auf MA haben? Es wird erwartet, dass sich der Tropensturm Erin zu einem Hurrikan entwickelt. Sehen Sie, wo es verfolgt wird.",Tropical Storm Erin forecasted to become a hurricane. What's it track? Will it impact MA?. Tropical Storm Erin is expected to become a hurricane. See where it's tracking.,Tropical Storm Erin forecasted to become turbo. Quid est semita? Ma numne labefactum ?. Tropical Storm Erin expectatur fieri procellae. Vide ubi suus vestigia.,2025-12-17 12:46:33+00:00
209011363237be9335d0ce879dac3be1,2025-08-12T15:00:03Z,'hurricane',www.accuweather.com,en,0.9,"Tropical Storm Erin forms, to become first Atlantic hurricane of year...","A tropical rainstorm in the eastern Atlantic Ocean has evolved into Tropical Storm Erin, and it may be on its way to a major hurricane this week, AccuWeather experts say. Meanwhile, there are additional areas also being monitored for potential tropical develo…",https://www.accuweather.com/en/hurricane/tropical-storm-erin-forms-to-become-first-atlantic-hurricane-of-2025/1804194,https://cms.accuweather.com/wp-content/uploads/2025/08/page_987a06.jpg?w=768,http://web.archive.org/web/20250812062259/https://www.accuweather.com/en/hurricane/tropical-storm-erin-forms-to-become-first-atlantic-hurricane-of-2025/1804194,Erin has formed in the eastern Atlantic and is forecast to be the first hurricane and first major hurricane of the 2025 Atlantic season. Erin will be a long-track storm and will eye the United States… [+7125 chars],,"Der Tropensturm Erin bildet sich und wird zum ersten atlantischen Hurrikan des Jahres ... Ein tropischer Regensturm im östlichen Atlantik hat sich zum Tropensturm Erin entwickelt und könnte diese Woche auf dem Weg zu einem großen Hurrikan sein, sagen AccuWeather-Experten. Mittlerweile gibt es weitere Gebiete, die ebenfalls auf potenzielle tropische Entwicklung überwacht werden …","Tropical Storm Erin forms, to become first Atlantic hurricane of year.... A tropical rainstorm in the eastern Atlantic Ocean has evolved into Tropical Storm Erin, and it may be on its way to a major hurricane this week, AccuWeather experts say. Meanwhile, there are additional areas also being monitored for potential tropical develo…","Tropical Tempestas Erin format, ut turbo Atlantici primi anni fiant.... Imbribus tropicus in Oceano Atlantico Orientali in Tropical Erin evolvit, et fortasse ad maiorem procellam hac septimana, periti AccuWeather dicunt. Interim adiectis locis etiam viverra potentiale tropicae evolvere.",2025-12-17 12:46:33+00:00
2da47d90c89a8f3575ac88f860ed4b08,2025-08-12T17:00:22Z,'hurricane',www.npr.org,en,0.9,Tropical Storm Erin could become the first Atlantic hurricane of the 2025 season,The National Hurricane Center expects the storm to strengthen over the next several days and says it could become a hurricane by late Thursday.,https://www.npr.org/2025/08/12/nx-s1-5500164/tropical-storm-erin-hurricane,https://npr.brightspotcdn.com/dims3/default/strip/false/crop/897x505+0+116/resize/1400/quality/100/format/png/?url=http%3A%2F%2Fnpr-brightspot.s3.amazonaws.com%2F1f%2Fe9%2F74618a24434a92b1b692db0fbe1c%2Ftropical-storm-erin.png,http://web.archive.org/web/20250812220904/https://www.npr.org/2025/08/12/nx-s1-5500164/tropical-storm-erin-hurricane,"A tropical storm churning in the Atlantic Ocean off the coast of Africa could become the first Atlantic hurricane of the 2025 season.
Federal forecasters expect Tropical Storm Erin
, currently loca… [+1662 chars]",,"Der Tropensturm Erin könnte der erste Atlantik-Hurrikan der Saison 2025 werden. Das National Hurricane Center geht davon aus, dass sich der Sturm in den nächsten Tagen verstärken wird, und geht davon aus, dass er bis zum späten Donnerstag zu einem Hurrikan werden könnte.",Tropical Storm Erin could become the first Atlantic hurricane of the 2025 season. The National Hurricane Center expects the storm to strengthen over the next several days and says it could become a hurricane by late Thursday.,Tropical Tempestas Erin prima procella Atlantici 2025 temporis fieri potuit. Procellae Nationalis Procellae Centrum exspectat ut per aliquot dies proximos confirmet et dicit posse fieri procellae proxime Iovis.,2025-12-17 12:46:33+00:00
26be0b382798716f8e1e453c7b2e137c,2025-08-12T19:50:35Z,'hurricane climate change',gizmodo.com,en,0.9,Hurricane Swarms Are a Thing We Have to Worry About Now,"Scientists have known climate change is increasing the severity of hurricanes for years now, but new research suggests it’s also leading to tropical cyclone clusters.",https://gizmodo.com/hurricane-swarms-are-a-thing-we-have-to-worry-about-now-2000642070,https://gizmodo.com/app/uploads/2025/08/hurricanes-Milton-Kirk-Leslie-1200x675.jpg,http://web.archive.org/web/20250813003717/https://gizmodo.com/hurricane-swarms-are-a-thing-we-have-to-worry-about-now-2000642070,"In early October 2024, hurricanes Milton, Kirk, and Leslie churned in the Atlantic Basinthe first time on record that three Atlantic hurricanes were simultaneously active after September, according t… [+3445 chars]",,"Hurrikanschwärme sind etwas, worüber wir uns jetzt Sorgen machen müssen. Wissenschaftler wissen seit Jahren, dass der Klimawandel die Schwere von Hurrikanen erhöht, aber neue Forschungsergebnisse deuten darauf hin, dass er auch zu tropischen Wirbelsturmclustern führt.","Hurricane Swarms Are a Thing We Have to Worry About Now. Scientists have known climate change is increasing the severity of hurricanes for years now, but new research suggests it’s also leading to tropical cyclone clusters.","Procellae examina res sunt solliciti nunc. Scientistae cognoverunt mutationem climatis iam iam annis severitatem increbrescere, sed nova investigatio eam suggerit etiam ad racemos cyclos tropicos ducens.",2025-12-17 12:46:33+00:00
e90fc2c5c9a825cc749fb14ddd40225f,2025-08-13T11:56:49Z,'hurricane',www.usatoday.com,en,0.9,Tropical Storm Erin to become major hurricane soon: See tracker,"Tropical Storm Erin is continuing to move west and is forecast to become a hurricane later this week, according to the National Hurricane Center.",https://www.usatoday.com/story/news/weather/2025/08/13/tropical-storm-erin-hurricane-path-tracker-spaghetti-models/85638228007/,https://s.yimg.com/ny/api/res/1.2/Camiz0Oi9diUA3yOdDndsg--/YXBwaWQ9aGlnaGxhbmRlcjt3PTEyMDA7aD0xMjAwO2NmPXdlYnA-/https://media.zenfs.com/en/usa_today_news_641/ff0a6b1f7d6f42b7489e1ef891d83f64,http://web.archive.org/web/20250813200853/https://www.usatoday.com/story/news/weather/2025/08/13/tropical-storm-erin-hurricane-path-tracker-spaghetti-models/85638228007/,"Tropical Storm Erin continues to travel west and is on pace to strengthen into the season's first major hurricane by the end of this week, the National Hurricane Center said.
According to a 5 a.m. E… [+6243 chars]",,Tropensturm Erin wird bald zu einem schweren Hurrikan: Siehe Tracker. Nach Angaben des National Hurricane Center zieht der Tropensturm Erin weiter nach Westen und wird voraussichtlich noch in dieser Woche zu einem Hurrikan.,"Tropical Storm Erin to become major hurricane soon: See tracker. Tropical Storm Erin is continuing to move west and is forecast to become a hurricane later this week, according to the National Hurricane Center.","Tropical Storm Erin to become major turbo mox: Vide venato. Tropical Tempestas Erin occidentem movere pergit et praesagio procellarum postea hac septimana fiet, secundum Centrum Procellae Nationalis.",2025-12-17 12:46:33+00:00
d35fe4055b99d1219199c8af6b883a4b,2025-08-13T13:48:30Z,'hurricane season',www.space.com,en,0.9,Satellites watch Tropical Storm Erin take shape over the Atlantic Ocean (video),Forecasters warn Erin may intensify into the season's first major hurricane within days.,https://www.space.com/astronomy/earth/satellites-watch-tropical-storm-erin-take-shape-over-the-atlantic-ocean-video,https://cdn.mos.cms.futurecdn.net/TM6ubcyex22xoALQZoaooJ.jpg,http://web.archive.org/web/20250813233541/https://www.space.com/astronomy/earth/satellites-watch-tropical-storm-erin-take-shape-over-the-atlantic-ocean-video,"Satellites are tracking Tropical Storm Erin from space as it steadily gathers strength over the Atlantic Ocean. Currently, Tropical Storm Erin is expected to intensify and could become the first hurr… [+2895 chars]",,"Satelliten beobachten, wie der Tropensturm Erin über dem Atlantik Gestalt annimmt (Video). Meteorologen warnen davor, dass sich Erin innerhalb weniger Tage zum ersten großen Hurrikan der Saison entwickeln könnte.",Satellites watch Tropical Storm Erin take shape over the Atlantic Ocean (video). Forecasters warn Erin may intensify into the season's first major hurricane within days.,Satellitae Tropical Tempestas Erin speculantur super Oceanum Atlanticum (video). Vates monent Erin in maiorem tempestatis procellam intra dies augere possunt.,2025-12-17 12:46:33+00:00
71954e72e4f13702c43e5b3d7a961983,2025-08-13T15:18:50Z,veryUnusualAndNeverUsedKeyword,consent.yahoo.com,en,0.9,"Tropical Storm Erin to become Cat. 3 hurricane. Is Erin coming to Pensacola, Florida?",,https://consent.yahoo.com/v2/collectConsent?sessionId=1_cc-session_fd8d723b-b27b-48f4-97fe-602775c681d0,,,"If you click 'Accept all', we and our partners, including 236 who are part of the IAB Transparency &amp; Consent Framework, will also store and/or access information on a device (in other words, use … [+714 chars]",,"Tropischer Sturm Erin wird zur Katze. 3 Hurrikan. Kommt Erin nach Pensacola, Florida? Nan","Tropical Storm Erin to become Cat. 3 hurricane. Is Erin coming to Pensacola, Florida?. nan","Tropical Storm Erin to become Cat. procellae III. Estne Erin ad Pensacola, Floridam? nan",2025-12-17 12:46:33+00:00
7b6f27b7a2af8fac309831562bbcf7c1,2025-08-13T15:29:24Z,'hurricane',www.floridatoday.com,en,0.9,Is Erin coming to Brevard? Storm expected to strengthen to hurricane as it shifts west,Tropical Storm Erin took a westward shift as it gains strength. Will it come to Brevard as a hurricane?,https://www.floridatoday.com/story/news/local/2025/08/13/latest-tropical-storm-erin-shift-brevard-hurricane-weather-west-forecast/85639915007/,https://media.zenfs.com/en/florida-today/f97c6f9103c2539c057129a046d35639,http://web.archive.org/web/20250819102120/https://www.floridatoday.com/story/news/local/2025/08/13/latest-tropical-storm-erin-shift-brevard-hurricane-weather-west-forecast/85639915007/,"Tropical Storm Erin took a westward shift as it is expected to gain strength and become a hurricane by Aug. 14 or Aug. 15.
The National Hurricane Service is predicting it could become a Category 3 h… [+3999 chars]",,"Kommt Erin nach Brevard? Es wird erwartet, dass sich der Sturm zu einem Hurrikan verstärkt, während er sich nach Westen verlagert. Der Tropensturm Erin verlagerte sich mit zunehmender Stärke nach Westen. Wird es als Hurrikan nach Brevard kommen?",Is Erin coming to Brevard? Storm expected to strengthen to hurricane as it shifts west. Tropical Storm Erin took a westward shift as it gains strength. Will it come to Brevard as a hurricane?,Estne Erin ad Brevardum? Tempestas expectatur ad confirmandum procellae sicut ad occidentem transfert. Tropical Storm Erin ad occidentem trabeam sumpsit ut vires obtinet. Venietne ad Brevardum quasi turbo?,2025-12-17 12:46:33+00:00
de15998cfcf656d59cd09caa29ac89df,2025-08-13T23:08:00Z,'hurricane season',www.orlandosentinel.com,en,0.9,"Tropical Storm Erin path shifts, but strengthens and still forecast to grow into major hurricane, NHC says","Tropical Storm Erin on Wednesday continued to push west through the Atlantic with a forecast to become the season’s first hurricane, growing to major...",https://www.orlandosentinel.com/2025/08/13/tropical-storm-erin-forecast-to-become-major-hurricane/,https://s.yimg.com/ny/api/res/1.2/C1mfXybsrfIFfZSJT93a9w--/YXBwaWQ9aGlnaGxhbmRlcjt3PTEyMDA7aD03MzU7Y2Y9d2VicA--/https://media.zenfs.com/en/orlando_sentinel_national_858/ebd1a7468fa25688b798fcba9e5a1604,http://web.archive.org/web/20250813173144/https://www.orlandosentinel.com/2025/08/13/tropical-storm-erin-forecast-to-become-major-hurricane/,"Tropical Storm Erin on Wednesday continued to push west through the Atlantic with a forecast to become the seasons first hurricane, growing to major hurricane strength by Friday, according to the Nat… [+3639 chars]",,"Der Verlauf des Tropensturms Erin verschiebt sich, verstärkt sich jedoch und wird laut NHC voraussichtlich immer noch zu einem großen Hurrikan werden. Der Tropensturm Erin drängte am Mittwoch weiter nach Westen durch den Atlantik und es wird prognostiziert, dass er zum ersten Hurrikan der Saison werden und sich zu einem schweren Hurrikan entwickeln wird.","Tropical Storm Erin path shifts, but strengthens and still forecast to grow into major hurricane, NHC says. Tropical Storm Erin on Wednesday continued to push west through the Atlantic with a forecast to become the season’s first hurricane, growing to major...","Tropical Tempestas Erin iter variat, sed confirmat et adhuc praenuntiet crescere in maiorem procellam, NHC dicit. Tropical Tempestas Erin die mercurii per Oceanum per Atlanticum pellere pergebat ut temporis primi procellae cresceret ad maiorem fieri...",2025-12-17 12:46:33+00:00
