index,published,keyword,domain,language,valid,title,description,url,image,archive,content,quote,de,en,la,added
37c28774bd5da4e0c290900058931177,2025-01-11T12:59:00Z,veryUnusualAndNeverUsedKeyword,www.thestar.com.my,en,0.8,Cyclone-battered Mayotte to be put on red alert,"PARIS (Reuters) - Authorities will put the French overseas territory of Mayotte on red alert late on Saturday, Overseas Minister Manuel Valls said, as a tropical storm nears the Indian Ocean archipelago that was devastated by a cyclone last month. Read full s…",https://www.thestar.com.my/news/world/2025/01/11/cyclone-battered-mayotte-to-be-put-on-red-alert,https://apicms.thestar.com.my/uploads/images/2025/01/11/3112846.jpg,http://web.archive.org/web/20250111135242/https://www.thestar.com.my/news/world/2025/01/11/cyclone-battered-mayotte-to-be-put-on-red-alert,"PARIS (Reuters) - Authorities will put the French overseas territory of Mayotte on red alert late on Saturday, Overseas Minister Manuel Valls said, as a tropical storm nears the Indian Ocean archipel… [+1030 chars]",,"Das vom Zyklon heimgesuchte Mayotte wird in Alarmbereitschaft versetzt. PARIS (Reuters) – Die Behörden werden das französische Überseegebiet Mayotte am späten Samstag in Alarmbereitschaft versetzen, sagte Außenminister Manuel Valls, während sich ein tropischer Sturm dem Archipel im Indischen Ozean nähert, das letzten Monat von einem Zyklon verwüstet wurde. Lesen Sie die ganze s…","Cyclone-battered Mayotte to be put on red alert. PARIS (Reuters) - Authorities will put the French overseas territory of Mayotte on red alert late on Saturday, Overseas Minister Manuel Valls said, as a tropical storm nears the Indian Ocean archipelago that was devastated by a cyclone last month. Read full s…","Mayotte cyclone-quassata ut vigiles rubras induerent. PARIS (Reuters) - Auctoritates Gallicum transmarinum territorium Mayotte in rubris intentum sero die Sabbati ponent, Minister Transmarinus Manuel Valls dixit velut tempestas tropica prope Oceanum Indicum archipelago quae cyclone ultimo mense devastata est. Read full s…",2025-12-17 12:56:36+00:00
6f4b5278e2f1022b9c85d6efd7e7ad95,2025-01-12T14:00:27Z,'tropical cyclone',abcnews.go.com,en,0.8,France's Mayotte islands hit by tropical storm just weeks after devastating cyclone,The French territory of Mayotte is on red alert again with another cyclone heading toward the islands off Africa that were devastated by their worst storm in nearly a century last month,https://abcnews.go.com/International/wireStory/frances-battered-mayotte-islands-hit-new-tropical-storm-117596652,https://i.abcnewsfe.com/a/7e2f9ba0-790f-4d51-a1ec-c820013cb817/wirestory_9778e92b63ddb38424312cd5e45184da_16x9.jpg?w=1600,http://web.archive.org/web/20250112195531/https://abcnews.go.com/International/wireStory/frances-battered-mayotte-islands-hit-new-tropical-storm-117596652,"CAPE TOWN, South Africa -- The French territory of Mayotte was battered by a new tropical storm Sunday, just weeks after the worst cyclone to hit the islands in nearly a century laid waste to entire … [+4144 chars]",,"Die französischen Mayotte-Inseln wurden nur wenige Wochen nach dem verheerenden Wirbelsturm von einem Tropensturm heimgesucht. Das französische Territorium Mayotte ist erneut in Alarmbereitschaft, da ein weiterer Zyklon auf die Inseln vor Afrika zusteuert, die letzten Monat von ihrem schlimmsten Sturm seit fast einem Jahrhundert verwüstet wurden",France's Mayotte islands hit by tropical storm just weeks after devastating cyclone. The French territory of Mayotte is on red alert again with another cyclone heading toward the islands off Africa that were devastated by their worst storm in nearly a century last month,Franciae Mayottae insulae tropicae tempestate percussae proximae septimanae post cyclum vastatae sunt. Territorium Gallicum Mayotte in rubris rursus vigilat cum alio cyclone versus Africam versus insulas quae ultimo mense fere per saeculum tempestate pessima devastatae sunt.,2025-12-17 12:56:36+00:00
52d3e4b28200b57ae7be8e0d66493177,2025-01-12T17:43:00Z,'tropical cyclone',news.sky.com,en,0.8,Mayotte hit by new storm just weeks after devastating cyclone,A fresh tropical storm has struck Mayotte in the Indian Ocean just weeks after a deadly cyclone which killed at least 39 people and left more than 200 still missing.,https://news.sky.com/story/mayotte-hit-by-new-storm-just-weeks-after-devastating-cyclone-13287801,https://e3.365dm.com/24/12/1600x900/skynews-mayotte-storm-damage_6778006.jpg?20241216164621,http://web.archive.org/web/20250112195707/https://news.sky.com/story/mayotte-hit-by-new-storm-just-weeks-after-devastating-cyclone-13287801,"A fresh tropical storm has struck Mayotte in the Indian Ocean just weeks after a deadly cyclone which killed at least 39 people and left more than 200 still missing.
The archipelago, off the east co… [+3065 chars]",,"Nur wenige Wochen nach dem verheerenden Wirbelsturm wurde Mayotte von einem neuen Sturm heimgesucht. Ein neuer Tropensturm hat Mayotte im Indischen Ozean heimgesucht, nur wenige Wochen nach einem tödlichen Wirbelsturm, bei dem mindestens 39 Menschen ums Leben kamen und mehr als 200 noch vermisst wurden.",Mayotte hit by new storm just weeks after devastating cyclone. A fresh tropical storm has struck Mayotte in the Indian Ocean just weeks after a deadly cyclone which killed at least 39 people and left more than 200 still missing.,"Mayotte nova tempestate percussa mox septimanas post cyclonem devastantem. Nova tempestas tropica Mayotte in Oceano Indico percussit sicut hebdomades post cyclonem funestum, qui saltem 39 homines occidit et plus quam 200 adhuc defuit.",2025-12-17 12:56:36+00:00
364690f6cc9bedf9e5264c913ff23310,2025-01-29T19:00:08Z,'tropical cyclone',www.abc.net.au,en,0.8,BOM forecasting shows four potential cyclones could form off Australia,"The Bureau of Meteorology is forecasting multiple cyclones could form across northern Australia by the end of the week, as tropical lows linger off the coast of north Queensland, in the Gulf of Carperntaria, and off the Kimberley in Western Australia.",https://www.abc.net.au/news/2025-01-30/bom-forecasts-four-potential-cyclones-in-coming-days/104872330,https://live-production.wcms.abc-cdn.net.au/962b6ca677a89ea4211de50e284e7402?impolicy=wcms_watermark_news&cropH=990&cropW=1760&xPos=239&yPos=0&width=862&height=485&imformat=generic,http://web.archive.org/web/20250130023341/https://www.abc.net.au/news/2025-01-30/bom-forecasts-four-potential-cyclones-in-coming-days/104872330,"Multiple cyclones could potentially form across northern Australia by the end of this week and into next, in a late but mighty show of the monsoon, the Bureau of Meteorology has warned. 
It includes… [+5881 chars]",,"BOM-Prognosen zeigen, dass sich vor Australien vier potenzielle Wirbelstürme bilden könnten. Das Bureau of Meteorology prognostiziert, dass sich bis zum Ende der Woche mehrere Wirbelstürme in ganz Nordaustralien bilden könnten, da tropische Tiefststände vor der Küste von Nord-Queensland, im Golf von Carperntaria und vor Kimberley in Westaustralien anhalten.","BOM forecasting shows four potential cyclones could form off Australia. The Bureau of Meteorology is forecasting multiple cyclones could form across northern Australia by the end of the week, as tropical lows linger off the coast of north Queensland, in the Gulf of Carperntaria, and off the Kimberley in Western Australia.","BOM praevidens ostendit quattuor cyclones potentiales Australiam formare posse. Meteorologiae hendrerit multiplex cyclones praevidens per Australiam septentrionalem finem hebdomadis formare potuit, sicut mugitus tropicus moratur oram Reginae septentrionalis, in sinu Carperntariae, et Kimberley in Australia occidentali.",2025-12-17 12:56:36+00:00
1694bc2415e8d1ba35a2780f47dbb043,2025-01-08T21:02:46Z,'hurricane climate change',www.caring.com,en,0.9,Extreme weather events put older adults at risk. Here's how they can prepare.,"Over the past two decades, extreme weather events and record-breaking temperatures fueled by climate change have put more lives at risk. In the United States and around the world, hurricanes, tornadoes, floods, and heat waves have become more frequent, intens…",https://www.caring.com/resources/older-adults-risk-preparation-for-extreme-weather-events/,https://analytics.stacker.com/tracking/1f3f472e-5a19-44c5-94c9-cc1b324ba040/pixel.gif?source=feed,http://web.archive.org/web/20250110151526/https://www.caring.com/resources/older-adults-risk-preparation-for-extreme-weather-events/,"Over the past two decades, extreme weather events and record-breaking temperatures fueled by climate change have put more lives at risk. In the United States and around the world, hurricanes, tornado… [+7685 chars]",,"Extreme Wetterereignisse gefährden ältere Erwachsene. So können sie sich vorbereiten. In den letzten zwei Jahrzehnten haben extreme Wetterereignisse und rekordverdächtige Temperaturen, die durch den Klimawandel verursacht wurden, mehr Leben gefährdet. In den Vereinigten Staaten und auf der ganzen Welt sind Hurrikane, Tornados, Überschwemmungen und Hitzewellen häufiger und intensiver geworden.","Extreme weather events put older adults at risk. Here's how they can prepare.. Over the past two decades, extreme weather events and record-breaking temperatures fueled by climate change have put more lives at risk. In the United States and around the world, hurricanes, tornadoes, floods, and heat waves have become more frequent, intens…","Eventus tempestatis extremae maiores adultos in periculo posuit. Ecce quomodo praeparare possunt.. Praeteritis duobus decenniis, extremae tempestatis eventus et recordatio temperaturarum dissolutionum quae per mutationem climatis peractae sunt, plus vitae in periculo posuit. In Civitatibus Foederatis et circa orbem terrarum, procellae, turbines, inundationes et aestus fluctus frequentiores fiunt, intens…",2025-12-17 12:56:36+00:00
ef2f68daaefd1cdab29325aac361c97a,2025-01-10T14:00:00Z,'tropical cyclone',wattsupwiththat.com,en,0.9,Carbon Brief and The Guardian Falsely Claim Climate Change is Making Cyclones Worse,"Multiple lines of evidence indicate that tropical cyclones are not getting worse due to the modest warming of the past hundred plus years, regardless of the reason for the warming. Carbon Brief and The Guardian misinform and do their readers a disservice when…",https://wattsupwiththat.com/2025/01/10/carbon-brief-and-the-guardian-falsely-claim-climate-change-is-making-cyclones-worse/,https://i0.wp.com/wattsupwiththat.com/wp-content/uploads/2025/01/Typhoons_Line_Up_in_the_Western_Pacific.webp?fit=1024%2C512&ssl=1,http://web.archive.org/web/20250111040428/https://wattsupwiththat.com/2025/01/10/carbon-brief-and-the-guardian-falsely-claim-climate-change-is-making-cyclones-worse/,"From ClimateREALISM
By Linnea Lueken
Media outlets such as Carbon Brief and The Guardian recently ran articles claiming that climate change is making tropical cyclones worse shortly after cyclone C… [+4234 chars]",,"Carbon Brief und The Guardian behaupten fälschlicherweise, dass der Klimawandel Wirbelstürme verschlimmert. Mehrere Belege deuten darauf hin, dass sich tropische Wirbelstürme aufgrund der moderaten Erwärmung der letzten mehr als hundert Jahre nicht verschlimmern, unabhängig von der Ursache der Erwärmung. Carbon Brief und The Guardian informieren falsch und erweisen ihren Lesern keinen Gefallen, wenn …","Carbon Brief and The Guardian Falsely Claim Climate Change is Making Cyclones Worse. Multiple lines of evidence indicate that tropical cyclones are not getting worse due to the modest warming of the past hundred plus years, regardless of the reason for the warming. Carbon Brief and The Guardian misinform and do their readers a disservice when…","Carbon Brief et Custos Falsus Claim Clima Mutationem Cyclones deteriores facit. Plures testimoniorum lineae indicant cyclones tropicos non pejus esse propter modicam calefactionem ante centum plus annorum, quamcumque rationem calefactionis. Carbonis breve et  Custos detorquere et legentibus dissuationem facere, cum…",2025-12-17 12:56:36+00:00
b14abc70dec2b0433b511ba5569c2a84,2025-01-13T06:00:00Z,veryUnusualAndNeverUsedKeyword,www.naturalnews.com,en,0.9,Climate science reality check: Data shows hurricanes are NOT increasing in frequency or power,"A study published in Nature by Chinese meteorologists analyzed tropical cyclone activity over 30 years using the Power Dissipation Index (PDI), which measures storm intensity, duration, and frequency. The findings reveal no increase in cyclone destructiveness…",https://www.naturalnews.com/2025-01-13-data-shows-hurricanes-not-increasing-in-frequency-power.html,https://www.naturalnews.com/wp-content/uploads/sites/91/2025/01/hurricane-harvey.jpg,http://web.archive.org/web/20250113232724/https://naturalnews.com/2025-01-13-data-shows-hurricanes-not-increasing-in-frequency-power.html,"<ul><li>A study published in Nature by Chinese meteorologists analyzed tropical cyclone activity over 30 years using the Power Dissipation Index (PDI), which measures storm intensity, duration, and f… [+5746 chars]",,"Klimawissenschaftlicher Realitätscheck: Daten zeigen, dass Hurrikane NICHT an Häufigkeit oder Stärke zunehmen. Eine von chinesischen Meteorologen in „Nature“ veröffentlichte Studie analysierte die Aktivität tropischer Wirbelstürme über einen Zeitraum von 30 Jahren mithilfe des Power Dissipation Index (PDI), der Sturmintensität, -dauer und -häufigkeit misst. Die Ergebnisse zeigen keine Zunahme der Zerstörungskraft des Zyklons …","Climate science reality check: Data shows hurricanes are NOT increasing in frequency or power. A study published in Nature by Chinese meteorologists analyzed tropical cyclone activity over 30 years using the Power Dissipation Index (PDI), which measures storm intensity, duration, and frequency. The findings reveal no increase in cyclone destructiveness…","Scientiae climatis re vera perscriptio: Data spectaculorum turbinum frequentia vel potentia non augentur. Studium in Natura editum a meteorologis Sinensium actio cyclonis tropicae enucleata per 30 annos utens potentiae Dissipationis Index (PDI), quae intensionem, durationem et frequentiam tempestatis metitur. Inventiones nullum incrementum in cyclone destruc- tionis revelant...",2025-12-17 12:56:36+00:00
dcbca8c2d39400cd5d6a0b1eb44acd33,2025-01-26T21:15:23Z,'tropical cyclone',www.abc.net.au,en,0.9,Queensland heatwave eases ahead of possible tropical cyclones off coast,"Queensland could get its first cyclones of this summer as several tropical lows develop in the state's north, while heatwave conditions have begun to ease in parts of the state.",https://www.abc.net.au/news/2025-01-27/queensland-weather-forecast-heatwave-possible-tropical-cyclones/104861336,https://live-production.wcms.abc-cdn.net.au/267c7066bdc370bdb50e04674ceee324?impolicy=wcms_watermark_news&cropH=581&cropW=1033&xPos=261&yPos=36&width=862&height=485&imformat=generic,http://web.archive.org/web/20250126223918/https://www.abc.net.au/news/2025-01-27/queensland-weather-forecast-heatwave-possible-tropical-cyclones/104861336,"Queensland could be in for wild weather this week, with the chance several low pressure systems in the state's north could form into tropical cyclones.
Forecasters say heatwave conditions are beginn… [+3014 chars]",,"Die Hitzewelle in Queensland lässt vor möglichen tropischen Wirbelstürmen vor der Küste nach. In Queensland könnte es in diesem Sommer zu den ersten Wirbelstürmen kommen, da sich im Norden des Bundesstaates mehrere tropische Tiefstwerte entwickeln, während die Hitzewellenbedingungen in Teilen des Bundesstaates allmählich nachlassen.","Queensland heatwave eases ahead of possible tropical cyclones off coast. Queensland could get its first cyclones of this summer as several tropical lows develop in the state's north, while heatwave conditions have begun to ease in parts of the state.","Queensland heatwave eases before of cyclones tropical possibiles off coast. Reginae primas cyclones huius aestatis obtinere potuit ut plures in septentrione status tropici enucleantur, cum condiciones caloris in partibus civitatis lenire inceperunt.",2025-12-17 12:56:36+00:00
00d946145d28fc8a183f19a62d87a905,2025-01-27T17:48:01Z,veryUnusualAndNeverUsedKeyword,www.businessinsider.com,en,0.9,I went on 50 cruises by the time I turned 30. I still think about 5 mistakes I made that future cruisers can easily avoid.,"After 50 cruises, I still tell future travelers to avoid these mistakes, like sailing during hurricane season or flying in on the day the ship leaves.",https://www.businessinsider.com/mistakes-avoid-cruises-after-many-sailings-seasoned-traveler,https://i.insider.com/678ffb3110c98eace91346b6?width=1200&format=jpeg,http://web.archive.org/web/20250127234345/https://www.businessinsider.com/mistakes-avoid-cruises-after-many-sailings-seasoned-traveler,"I hope future cruisers can try to avoid some of the travel mistakes I've made on my many cruises over the years. Allie Hubers
<ul><li>I've taken 50 cruises around the world by age 30, but my experie… [+5300 chars]",,"Als ich 30 wurde, habe ich 50 Kreuzfahrten gemacht. Ich denke immer noch an 5 Fehler, die ich gemacht habe und die zukünftige Kreuzfahrtschiffe leicht vermeiden können. Nach 50 Kreuzfahrten rate ich zukünftigen Reisenden immer noch, diese Fehler zu vermeiden, wie zum Beispiel das Segeln während der Hurrikansaison oder das Einfliegen am Tag der Abfahrt des Schiffes.","I went on 50 cruises by the time I turned 30. I still think about 5 mistakes I made that future cruisers can easily avoid.. After 50 cruises, I still tell future travelers to avoid these mistakes, like sailing during hurricane season or flying in on the day the ship leaves.",Ibam in 50 cruise per tempus conversus 30. Adhuc cogitare de 5 erroribus feci ut lembos futuros facile devitare possint.,2025-12-17 12:56:36+00:00
