index,published,keyword,domain,language,valid,title,description,url,image,archive,content,quote,de,en,la,added
e75de5ee0e829b6f3eaf70251aa52102,2025-08-17T07:57:51Z,'hurricane season',www.aljazeera.com,en,0.9,"Erin downgraded to Category 3 hurricane, NHC says","Erin is the fifth named storm of the Atlantic hurricane season, which runs from June 1 to November 30.",https://www.aljazeera.com/news/2025/8/17/erin-downgraded-to-category-3-hurricane-nhc-says,https://www.aljazeera.com/wp-content/uploads/2025/08/AFP__20250816__69Q29EF__v1__HighRes__UsPuertoRicoWeatherHurricaneErin-1755411483.jpg?resize=1920%2C1440,http://web.archive.org/web/20250818072157/https://www.aljazeera.com/news/2025/8/17/erin-downgraded-to-category-3-hurricane-nhc-says,"Hurricane Erin, the first hurricane of this years Atlantic season, is a Category 3, the United States National Hurricane Center (NHC) said, downgrading the storm from Category 4 as the wind speed eas… [+2756 chars]",,"Laut NHC wurde Erin auf Hurrikan der Kategorie 3 herabgestuft. Erin ist der fünfte benannte Sturm der atlantischen Hurrikansaison, die vom 1. Juni bis 30. November dauert.","Erin downgraded to Category 3 hurricane, NHC says. Erin is the fifth named storm of the Atlantic hurricane season, which runs from June 1 to November 30.","Erin inclinata ad categoriam 3 turbinis, NHC dicit. Erin quinta tempestas tempestatis Atlantici nominatur, quae a die 1 Iunii ad 30 Novembrem decurrit.",2025-12-17 12:46:33+00:00
42224208c12df21811adc1f773d4c4b6,2025-08-17T15:22:38Z,'hurricane',www.yahoo.com,en,0.9,Hurricane Erin to fluctuate in strength as dangers increase along US coast,"Mighty Hurricane Erin will cruise waters just east of the United States this week. Even if the center of the hurricane remains offshore, far-reaching and...",https://www.yahoo.com/news/articles/hurricane-erin-fluctuate-strength-dangers-152238193.html,https://media.zenfs.com/en/accuweather_articles_339/b1283fea61558b4bdd93f3c3a260232d,http://web.archive.org/web/20250817221755/https://www.yahoo.com/news/articles/hurricane-erin-fluctuate-strength-dangers-152238193.html,"Hurricane Erin is forecast by AccuWeather meteorologists to experience fluctuations in wind intensity while taking a curved path between the United States and Bermuda in the week ahead.
As of Sunday… [+7544 chars]",,"Die Stärke des Hurrikans Erin schwankt, da die Gefahren entlang der US-Küste zunehmen. Der mächtige Hurrikan Erin wird diese Woche über die Gewässer östlich der Vereinigten Staaten ziehen. Auch wenn das Zentrum des Hurrikans vor der Küste liegt, sind weitreichende und...","Hurricane Erin to fluctuate in strength as dangers increase along US coast. Mighty Hurricane Erin will cruise waters just east of the United States this week. Even if the center of the hurricane remains offshore, far-reaching and...","Procellae Erin fluctuare in viribus ut pericula per litora US augent. Procellae Fortis Erin aquas in oriente in Civitatibus Foederatis Americae hac septimana transibit. Etiamsi centrum procellae maris remanet, penitus et...",2025-12-17 12:46:33+00:00
ed4ca1c1d40c6f440715d33a3969a374,2025-08-17T16:06:48Z,veryUnusualAndNeverUsedKeyword,weather.com,en,0.9,"Major Hurricane Erin Growing In Size, Impacting Caribbean","Hurricane Erin remains a major hurricane as it passes just to the north of Puerto Rico and Hispaniola. The storm is expected to maintain its intensity, and...",https://weather.com/storms/hurricane/video/major-hurricane-erin-growing-in-size-impacting-caribbean,https://s.yimg.com/ny/api/res/1.2/RXTmxvm0y2m525iGj9hcwg--/YXBwaWQ9aGlnaGxhbmRlcjt3PTEyMDA7aD02NzU7Y2Y9d2VicA--/https://media.zenfs.com/en/the_weather_channel_videos_110/6d283a7e64a5075fdb99739d51cd2cd6,http://web.archive.org/web/20250820190624/https://weather.com/storms/hurricane/video/major-hurricane-erin-growing-in-size-impacting-caribbean,"Hurricane Erin remains a major hurricane as it passes just to the north of Puerto Rico and Hispaniola. The storm is expected to maintain its intensity, and possibly strengthen during the next day or … [+259 chars]",,"Der schwere Hurrikan Erin wird immer größer und trifft auf die Karibik. Hurrikan Erin bleibt ein schwerer Hurrikan, da er nördlich von Puerto Rico und Hispaniola vorbeizieht. Es wird erwartet, dass der Sturm seine Intensität beibehält und...","Major Hurricane Erin Growing In Size, Impacting Caribbean. Hurricane Erin remains a major hurricane as it passes just to the north of Puerto Rico and Hispaniola. The storm is expected to maintain its intensity, and...","Maior Procellae Erin Crescens in magnitudine, Impacting Caribbean. Procellae Erin maior procellae manet dum transit ad septentrionem Puerto Rico et Hispaniola. Tempestas expectat suam intensionem ponere, et...",2025-12-17 12:46:33+00:00
a05f813751c21b685ca8d40eb19b4873,2025-08-18T11:23:12Z,'hurricane season',petapixel.com,en,0.9,Breathtaking Shots From Inside the Colossal Hurricane Erin,"Hurricane Erin, the first hurricane of the 2025 Atlantic hurricane season, strengthened at a historic rate over the weekend, and new photos from inside the hurricane show its immense size and power.
[Read More]",https://petapixel.com/2025/08/18/breathtaking-shots-from-inside-the-colossal-hurricane-erin/,https://petapixel.com/assets/uploads/2025/08/inside-hurricane-erin.jpg,,"Hurricane Erin, the first hurricane of the 2025 Atlantic hurricane season, strengthened at a historic rate over the weekend, and new photos from inside the hurricane show its immense size and power. … [+2619 chars]",,"Atemberaubende Aufnahmen aus dem Inneren des kolossalen Hurrikans Erin. Hurrikan Erin, der erste Hurrikan der atlantischen Hurrikansaison 2025, hat sich am Wochenende mit historischer Geschwindigkeit verstärkt, und neue Fotos aus dem Inneren des Hurrikans zeigen seine immense Größe und Kraft.
[Mehr lesen]","Breathtaking Shots From Inside the Colossal Hurricane Erin. Hurricane Erin, the first hurricane of the 2025 Atlantic hurricane season, strengthened at a historic rate over the weekend, and new photos from inside the hurricane show its immense size and power.
[Read More]","Breathtaking offa ab intus Colossae Procellae Erin. Procellae Erin, prima procella tempestatis Atlantici MMXXV, historica rate in auctor volutpat roborata, et novae imagines ab intra procellae magnitudinem suam et potentiam immensam ostendunt.
[Read More]",2025-12-17 12:46:33+00:00
dd85b2b50308e4d74f22a5fc42e2be65,2025-08-18T15:13:00Z,'hurricane',weather.com,en,0.9,"Hurricane Erin Continues To Strengthen And Will Be A Major East Coast Rip Current, Wave Generator This Week","Erin is not only an intense hurricane, but it has also become a large storm in the Atlantic. While it won't landfall in the U.S., its large size will be a...",https://weather.com/storms/hurricane/news/2025-08-18-major-hurricane-erin-atlantic-bahamas-east-coast-waves,https://s.yimg.com/ny/api/res/1.2/kIenO0NxrBp2Ob2yiAMOUg--/YXBwaWQ9aGlnaGxhbmRlcjt3PTEyMDA7aD02NzU7Y2Y9d2VicA--/https://media.zenfs.com/en/the_weather_channel_articles_180/1bda0743577d71b3b1101179a6dcdd8f,http://web.archive.org/web/20250819043940/https://weather.com/storms/hurricane/news/2025-08-18-major-hurricane-erin-atlantic-bahamas-east-coast-waves,"Hurricane Erin is once again intensifying as it brushes the Bahamas, but has also grown significantly in size, and while it won't landfall in the U.S., it will generate dangerous high surf and rip cu… [+4703 chars]",,"Hurrikan Erin verstärkt sich weiter und wird diese Woche ein großer Wellengenerator an der Ostküste sein. Erin ist nicht nur ein heftiger Hurrikan, sondern hat sich auch zu einem großen Sturm im Atlantik entwickelt. Obwohl es nicht in den USA landen wird, wird seine Größe ein ... sein.","Hurricane Erin Continues To Strengthen And Will Be A Major East Coast Rip Current, Wave Generator This Week. Erin is not only an intense hurricane, but it has also become a large storm in the Atlantic. While it won't landfall in the U.S., its large size will be a...","Procellae Erin Pergit confirma et erit maior Orientis Coast Rip Current, Undo generator hoc Week. Erin non solum procellae intensa est, sed etiam magna tempestas in Atlantico facta est. Dum non traham in US, magna magnitudo eius erit ...",2025-12-17 12:46:33+00:00
1dbc42c8cd3b08e3164643c0197544ae,2025-08-18T22:03:33Z,'hurricane',travelhost.com,en,0.9,"Carnival, Royal Caribbean divert cruises to avoid Hurricane Erin","Monster Hurricane Erin is causing cruise disruptions, and bringing a lesser-known hurricane hazard to Bahamas beaches.",https://travelhost.com/cruises/carnival-royal-caribbean-divert-cruises-to-avoid-hurricane-erin,https://media.zenfs.com/en/come_cruise_with_me_articles_739/09fe86a73cef89d6400b187878a0b0e4,,"Carnival, Royal Caribbean divert cruises to avoid Hurricane Erin originally appeared on TravelHost.
All the signs were there last week as the tropical system that would become Hurricane Erin rapidly… [+4507 chars]",,"Carnival und Royal Caribbean stellen Kreuzfahrten um, um Hurrikan Erin zu vermeiden. Der Monster-Hurrikan Erin verursacht Unterbrechungen bei Kreuzfahrten und bringt eine weniger bekannte Hurrikangefahr an die Strände der Bahamas.","Carnival, Royal Caribbean divert cruises to avoid Hurricane Erin. Monster Hurricane Erin is causing cruise disruptions, and bringing a lesser-known hurricane hazard to Bahamas beaches.","Carnival, Royal Caribbean cruisas avertere ad evitandum Hurricane Erin. Monstrum Procellae Erin lecythus turbationes causat, et minus notum turbinis aleam ad litora Bahamas afferens.",2025-12-17 12:46:33+00:00
d9bc62fee416b88d2db4ced1ee85288c,2025-08-19T14:45:06Z,veryUnusualAndNeverUsedKeyword,gizmodo.com,en,0.9,Forecasters Warn of 100-Foot Waves as Hurricane Erin Brushes the East Coast,The first hurricane of the 2025 Atlantic season is poised to bring life-threatening impacts to much of the East Coast even though it’s unlikely to make landfall.,https://gizmodo.com/forecasters-warn-of-100-foot-waves-as-hurricane-erin-brushes-the-east-coast-2000644947,https://gizmodo.com/app/uploads/2025/08/Hurricane-Erin-August-19-1200x675.jpg,http://web.archive.org/web/20250819155313/https://gizmodo.com/forecasters-warn-of-100-foot-waves-as-hurricane-erin-brushes-the-east-coast-2000644947,"The National Hurricane Center expects Hurricane Erin to grow in size as it creeps up the Eastern Seaboard this week, hammering coastal communities with potentially deadly storm surge and rip currents… [+3574 chars]",,"Meteorologen warnen vor 100 Fuß hohen Wellen, wenn Hurrikan Erin über die Ostküste fegt. Der erste Hurrikan der Atlantiksaison 2025 wird voraussichtlich lebensbedrohliche Auswirkungen auf weite Teile der Ostküste haben, auch wenn es unwahrscheinlich ist, dass er auf Land trifft.",Forecasters Warn of 100-Foot Waves as Hurricane Erin Brushes the East Coast. The first hurricane of the 2025 Atlantic season is poised to bring life-threatening impacts to much of the East Coast even though it’s unlikely to make landfall.,"Vates Mone de 100-Foot Waves ut Procellae Erin perstringit Orientem Coast. Prima procella temporis Atlantici 2025 libratur ad vitam minas impulsus ad multum Orientis Coast adducendae, quamvis probabile est terram ruinam facere.",2025-12-17 12:46:33+00:00
486f39aef411806d32e541efcb5c1216,2025-08-20T05:02:11Z,'hurricane',abcnews.go.com,en,0.9,"It's the time of year for Cape Verde hurricanes, the longest and most powerful storms",It's the time of year for Cape Verde hurricanes,https://abcnews.go.com/US/wireStory/time-year-cape-verde-hurricanes-longest-powerful-storms-124799447,https://i.abcnewsfe.com/a/824ab696-90d4-4a73-9cce-1201c3a99c5e/wirestory_59e16c43ffb7909a5b4b3ce79f9e36ed_16x9.jpg?w=1600,,"They are the hurricanes of legend, the bowling balls that cross the entire Atlantic Ocean, menaced ships of yore and make the long, curved lines on the hurricane charts.
Cape Verde storms, named for… [+3786 chars]",,"Es ist die Zeit des Jahres für Hurrikane auf den Kapverden, die längsten und stärksten Stürme. Es ist die Zeit des Jahres für Hurrikane auf den Kapverden","It's the time of year for Cape Verde hurricanes, the longest and most powerful storms. It's the time of year for Cape Verde hurricanes","Est tempus anni ad Promontorium Verde turbinum, tempestates longissimas et potentissimas. Est tempus anni pro Cape Verde turbinum",2025-12-17 12:46:33+00:00
a5a3eceac8aced1382afba2ef6deb058,2025-08-20T09:27:47Z,'typhoon',www.aljazeera.com,en,0.9,Hurricanes explained: How they form and differ from cyclones and typhoons,"With this year’s hurricane season under way, Al Jazeera visualises the differences between various storm systems.",https://www.aljazeera.com/news/2025/8/20/hurricanes-explained-how-they-form-and-differ-from-cyclones-and-typhoons,https://www.aljazeera.com/wp-content/uploads/2025/08/INTERACTIVE_CYCLONES_TYPHOONS_HURRICANES2_August20_2025_INTERACTIVE-Hurricane-typhoon-tropical-storm-1755671648.png?resize=1200%2C630,http://web.archive.org/web/20250821021955/https://www.aljazeera.com/news/2025/8/20/hurricanes-explained-how-they-form-and-differ-from-cyclones-and-typhoons,Hurricane Erin became the Atlantic Oceans first hurricane of the season which runs from June 1 to November 30 rapidly intensifying to Category 5 on Saturday before weakening to Category 2 on Tuesday.… [+3183 chars],,"Hurrikane erklärt: Wie sie entstehen und sich von Zyklonen und Taifunen unterscheiden. Während die diesjährige Hurrikansaison im Gange ist, visualisiert Al Jazeera die Unterschiede zwischen verschiedenen Sturmsystemen.","Hurricanes explained: How they form and differ from cyclones and typhoons. With this year’s hurricane season under way, Al Jazeera visualises the differences between various storm systems.","Procellae explicantur: Quomodo formant et differant a cyclonibus et typhonibus. Cum hoc anno tempestatis sub modo, Al Jazeera visivae differentias inter varias systemata tempestatum.",2025-12-17 12:46:33+00:00
b869d4f5b881fae78a180a8c5f02178e,2025-08-20T09:39:00Z,'storm surge',cdn.jwplayer.com,en,0.9,Wild video shows tidal surge swallowing homes as Hurricane Erin slams Outer Banks,Dramatic aerial footage shows storm surge flooding homes and a motel in North Carolina’s Outer Banks on Aug. 19 as Hurricane Erin battered the coast...,https://cdn.jwplayer.com/videos/5PIDgFfi-fJbDEVqk.mp4,https://media.zenfs.com/en/ny_post_videos_491/07073a91b57b219062c99448552bb4bc,,"Dramatic aerial footage shows storm surge flooding homes and a motel in North Carolinas Outer Banks on Aug. 19 as Hurricane Erin battered the coast. Officials ordered evacuations in Dare County, warn… [+47 chars]",,"Wildes Video zeigt, wie die Flutwelle Häuser verschluckt, während Hurrikan Erin Outer Banks verwüstet. Dramatische Luftaufnahmen zeigen, wie eine Sturmflut am 19. August Häuser und ein Motel in den Outer Banks von North Carolina überschwemmte, als Hurrikan Erin die Küste verwüstete ...",Wild video shows tidal surge swallowing homes as Hurricane Erin slams Outer Banks. Dramatic aerial footage shows storm surge flooding homes and a motel in North Carolina’s Outer Banks on Aug. 19 as Hurricane Erin battered the coast...,Ferus video ostendit aestus aestus domos deglutiens sicut Procellae Erin slams externas ripas. Dramatica aeria footage tempestatem fluctuationem inundantem domos et motel in Carolina Septentrionali Banks in Novo Aug. ostendit sicut Oram... Hurricane Erin quassavit.,2025-12-17 12:46:33+00:00
8a9d225195942b8c7dfbbcc87b1ae4aa,2025-08-20T11:39:06Z,veryUnusualAndNeverUsedKeyword,www.bostonherald.com,en,0.9,"As hurricane season collides with immigration agenda, fears increase for those without legal status",Immigrants face increased risks this hurricane season due to aggressive immigration enforcement.,https://www.bostonherald.com/2025/08/20/us-philanthropies-immigrants-disasters/,https://www.bostonherald.com/wp-content/uploads/2025/08/Philanthropy_Immigrants_Disasters_89674-1.jpg?w=1024&h=682,http://web.archive.org/web/20250820195221/https://www.bostonherald.com/2025/08/20/us-philanthropies-immigrants-disasters/,"By GABRIELA AOUN ANGUEIRA, Associated Press
If a major hurricane approaches Central Florida this season, Maria knows its dangerous to stay inside her wooden, trailer-like home. In past storms, she e… [+7912 chars]",,"Da die Hurrikansaison mit der Einwanderungsagenda kollidiert, nehmen die Ängste derjenigen ohne Aufenthaltsstatus zu. Aufgrund der strengen Durchsetzung der Einwanderungsbestimmungen sind Einwanderer in dieser Hurrikansaison einem erhöhten Risiko ausgesetzt.","As hurricane season collides with immigration agenda, fears increase for those without legal status. Immigrants face increased risks this hurricane season due to aggressive immigration enforcement.","Ut tempus turbo cum immigratione agendi impacta est, metus auget pro iis qui sine legali statu sunt. Immigrantes facies periculum auctum hoc tempore tempestatis ob immigrationem ultro cogendi.",2025-12-17 12:46:33+00:00
2d2a1e452e87cc404497ba2803e59fcc,2025-08-20T14:30:00Z,'hurricane',apnews.com,en,0.9,What to know about powerful Hurricane Erin as it heads past the East Coast,Erin lost some strength Tuesday and dropped to a Category 2 hurricane as it moves northward roughly parallel to the East Coast.,https://apnews.com/article/hurricane-erin-north-carolina-outer-banks-c248ff527e0603f6e6d0c85c2a8db400,https://bloximages.newyork1.vip.townnews.com/richmond.com/content/tncms/assets/v3/editorial/c/16/c16a73ea-cb20-56c9-b6ae-973f47cdbb09/68a5dbc427cac.preview.jpg?crop=1761%2C925%2C0%2C125&resize=1200%2C630&order=crop%2Cresize,http://web.archive.org/web/20250820190410/https://apnews.com/article/hurricane-erin-north-carolina-outer-banks-c248ff527e0603f6e6d0c85c2a8db400,"Hurricane Erin is creating potentially deadly water conditions all along the U.S. East Coast days before the largest waves are expected, with high winds and waves anticipated in North Carolina by Wed… [+6113 chars]",,"Was Sie über den starken Hurrikan Erin wissen sollten, der an der Ostküste vorbeizieht. Erin verlor am Dienstag etwas an Kraft und fiel in einen Hurrikan der Kategorie 2, der sich ungefähr parallel zur Ostküste nach Norden bewegte.",What to know about powerful Hurricane Erin as it heads past the East Coast. Erin lost some strength Tuesday and dropped to a Category 2 hurricane as it moves northward roughly parallel to the East Coast.,"Quid de potentissimo Procellae Erin scire, quod praeter Orientem Coast Principem capit. Erin Martis aliquas vires amisit et ad Categoriam 2 procellae decidit ut septentrionem versus fere parallelam Orientem Coast moveat.",2025-12-17 12:46:33+00:00
d19ace7ba53d150e42cd689c00a25364,2025-08-20T15:00:38Z,'storm surge',biztoc.com,en,0.9,Hurricane Erin threatens North Carolina's Outer Banks with storm surge,,https://biztoc.com/x/7412ae9709b5c142,https://biztoc.com/cdn/950/og.png,http://web.archive.org/web/20250820160511/https://biztoc.com/x/7412ae9709b5c142,"{ window.open(this.href, '_blank'); }, 200); return false;""&gt;Why is Target replacing its CEO amid a sales slump? { window.open(this.href, '_blank'); }, 200); return false;""&gt;How will US stake in … [+807 chars]",,Hurrikan Erin bedroht die Outer Banks von North Carolina mit einer Sturmflut. Nan,Hurricane Erin threatens North Carolina's Outer Banks with storm surge. nan,Procellae Erin aestu maris externae ripas Carolinae Septentrionalis imminet. nan,2025-12-17 12:46:33+00:00
059dbeb027be9c885b75750382fcf6fa,2025-08-20T15:55:01Z,'hurricane',www.pbs.org,en,0.9,"As hurricane season collides with immigration agenda, fears increase for those without legal status",Efforts by President Donald Trump's Republican administration to expand immigration enforcement capacity mean many disaster response agencies are entangled in immigration enforcement in hurricane-prone Florida and Texas. Nonprofits and community organizations…,https://www.pbs.org/newshour/nation/as-hurricane-season-collides-with-immigration-agenda-fears-increase-for-those-without-legal-status,https://d3i6fh83elv35t.cloudfront.net/static/2025/08/2025-08-20T140247Z_1218623484_RC22BGAZ7YZO_RTRMADP_3_STORM-ERIN-1024x683.jpg,,"If a major hurricane approaches Central Florida this season, Maria knows it’s dangerous to stay inside her wooden, trailer-like home. In past storms, she evacuated to her sister’s sturdier house. If … [+7408 chars]",,"Da die Hurrikansaison mit der Einwanderungsagenda kollidiert, nehmen die Ängste derjenigen ohne Aufenthaltsstatus zu. Die Bemühungen der republikanischen Regierung von Präsident Donald Trump, die Kapazitäten für die Durchsetzung der Einwanderungsbestimmungen zu erweitern, führen dazu, dass viele Katastrophenschutzbehörden in die Durchsetzung der Einwanderungsbestimmungen im hurrikangefährdeten Florida und Texas verwickelt sind. Gemeinnützige und gemeinschaftliche Organisationen…","As hurricane season collides with immigration agenda, fears increase for those without legal status. Efforts by President Donald Trump's Republican administration to expand immigration enforcement capacity mean many disaster response agencies are entangled in immigration enforcement in hurricane-prone Florida and Texas. Nonprofits and community organizations…","Ut tempus turbo cum immigratione agendi impacta est, metus auget pro iis qui sine legali statu sunt. Conatus Praeses Donald Trump in administratione Republicana ad immigrationem cogendi facultatem dilatandam significans multae calamitates institutionum responsionis implicatae sunt in immigratione cogendi in Floridae et Texas procellae. Nonprofits et coetus communitatis…",2025-12-17 12:46:33+00:00
4dcd133bf06dbb1543da72414413fec1,2025-08-20T16:03:59Z,'hurricane',gcaptain.com,en,0.9,"Hurricane Erin Strengthens Near U.S. East Coast, Poses Significant Maritime Threat","Hurricane Erin has intensified to near-major hurricane strength with maximum sustained winds of 110 mph while moving northward through the western Atlantic, the National Hurricane Center reported Wednesday morning. The...",https://gcaptain.com/hurricane-erin-strengthens-near-u-s-east-coast-poses-significant-maritime-threat/,https://gcaptain.com/wp-content/uploads/2025/08/Hurricane-Erin-Aug-20.jpg,http://web.archive.org/web/20250820162326/https://gcaptain.com/hurricane-erin-strengthens-near-u-s-east-coast-poses-significant-maritime-threat/,"Hurricane Erin has intensified to near-major hurricane strength with maximum sustained winds of 110 mph while moving northward through the western Atlantic, the National Hurricane Center reported Wed… [+2505 chars]",,"Hurrikan Erin verstärkt sich nahe der Ostküste der USA und stellt eine erhebliche Bedrohung für das Meer dar. Wie das National Hurricane Center am Mittwochmorgen berichtete, hat sich Hurrikan Erin mit maximalen Dauerwindgeschwindigkeiten von 110 Meilen pro Stunde auf nahezu die Stärke eines großen Hurrikans verstärkt, während er sich nordwärts durch den Westatlantik bewegte. Der...","Hurricane Erin Strengthens Near U.S. East Coast, Poses Significant Maritime Threat. Hurricane Erin has intensified to near-major hurricane strength with maximum sustained winds of 110 mph while moving northward through the western Atlantic, the National Hurricane Center reported Wednesday morning. The...","Procellae Erin Confirmat circa US Orientem oram, ponit Insignes comminatio maritima. Procellae Erin ad maiorem vim tempestatis prope maiorem vim ventorum 110 mph sustinentium intendit, dum septentrionem versus per Atlanticum occidentalem movit, National Hurricane Centrum mane mercurii nuntiavit. The...",2025-12-17 12:46:33+00:00
4694f679b46ad2e5e219bd93dfc54db9,2025-08-20T16:15:27Z,'hurricane',slashdot.org,en,0.9,North Carolina Beach Towns Brace for Dangerous Seas From Hurricane Erin - The New York Times,"North Carolina Beach Towns Brace for Dangerous Seas From Hurricane ErinThe New York Times Erin could become major hurricane again as massive waves, rip currents close beaches from Florida to New YorkFOX Weather Dare County NewsDare County, NC (.gov) Hurricane…",https://slashdot.org/firehose.pl?op=view&amp;id=178783892,,http://web.archive.org/web/20160119174443/http://slashdot.org/firehose.pl?op=view,The Fine Print: The following comments are owned by whoever posted them. We are not responsible for them in any way.,,"North Carolina Beach Towns bereiten sich auf gefährliche Meere durch Hurrikan Erin vor – The New York Times. Strandstädte in North Carolina bereiten sich auf gefährliche Meere durch Hurrikan Erin vor Die New York Times Erin könnte erneut zu einem großen Hurrikan werden, da massive Wellen und reißende Strömungen Strände von Florida bis New York schließenFOX Weather Dare County NewsDare County, NC (.gov) Hurrikan…","North Carolina Beach Towns Brace for Dangerous Seas From Hurricane Erin - The New York Times. North Carolina Beach Towns Brace for Dangerous Seas From Hurricane ErinThe New York Times Erin could become major hurricane again as massive waves, rip currents close beaches from Florida to New YorkFOX Weather Dare County NewsDare County, NC (.gov) Hurricane…","North Carolina Oppida Brace pro Periculo Maria Ab Hurricane Erin - The New York Times. Oppida Brace Carolina Septentrionalis ad Maris Periculo A Turbo ErinThe New York Times Erin major fieri potuit turbinis iterum sicut ingentes fluctus, rip flumina prope litora e Florida ad Novum YorkFOX Tempestas Dare Comitatus NewsDare Comitatus, NC (.gov) Procellae…",2025-12-17 12:46:33+00:00
