index,published,keyword,domain,language,valid,title,description,url,image,archive,content,quote,de,en,la,added
3796ed69ea90bf3d07c1e287b5e04519,2026-05-07T06:00:00Z,'hurricane',www.naturalnews.com,en,0.7,“Beyond The Diagnosis” on BrightU: How indoor air is becoming more toxic than outdoor smog,"On Day 10 of “Beyond The Diagnosis,” Mike Dillon explains that modern energy-efficient building codes, updated after Hurricane Andrew, have sealed homes so tightly that indoor air is often more toxic than outdoor air. Mike Adams confirms that indoor air can b…",https://www.naturalnews.com/2026-05-07-indoor-air-more-toxic-than-outdoor-smog.html,https://www.naturalnews.com/wp-content/uploads/sites/91/2026/05/Pollution-Sickness-Teddy-Bear-Mask.jpg,,"<ul><li>On Day 10 of ""Beyond The Diagnosis,"" Mike Dillon explains that modern energy-efficient building codes, updated after Hurricane Andrew, have sealed homes so tightly that indoor air is often mo… [+6921 chars]",,"„Beyond The Diagnosis“ auf BrightU: Wie Innenluft giftiger wird als Smog im Freien. Am zehnten Tag von „Beyond The Diagnosis“ erklärt Mike Dillon, dass moderne energieeffiziente Bauvorschriften, die nach dem Hurrikan Andrew aktualisiert wurden, Häuser so dicht abgedichtet haben, dass die Luft in Innenräumen oft giftiger ist als die Außenluft. Mike Adams bestätigt, dass Raumluft …","“Beyond The Diagnosis” on BrightU: How indoor air is becoming more toxic than outdoor smog. On Day 10 of “Beyond The Diagnosis,” Mike Dillon explains that modern energy-efficient building codes, updated after Hurricane Andrew, have sealed homes so tightly that indoor air is often more toxic than outdoor air. Mike Adams confirms that indoor air can b…","""Extra Diagnosis"" in BrightU: Quomodo aeris umbratica plus toxicus fit quam smog velit. Pridie Kalendas Decembres ""Extra Diagnosis"" Mike Dillon explicat recentes industriae efficaces codices aedificandi, post Hurricane Andrew renovatos, domos tam arcte obsignatas esse ut aer umbraticus saepius toxicus quam aer velit. Mike Adams confirmat amet aerem potest b ...",2026-05-09 15:06:45+00:00
05befbd0f45486436afe98df3112c14d,2026-05-07T06:03:08Z,'hurricane',alltoc.com,en,0.7,Kanye West Hurricane copyright trial updates #entertainment,Kanye West’s “Hurricane” trial: what’s happening Kanye West—now performing as Ye—testified in a Los Angeles courtroom as a copyright case over his 2010 track “Hurricane” moved forward. The dispute centers on claims by musicians who say their work was used wit…,https://alltoc.com/entertainment/kanye-west-hurricane-copyright-trial-updates,https://alltoc.com/cdn/1046/og.png,,"Kanye Wests Hurricane trial: whats happening
Kanye Westnow performing as Yetestified in a Los Angeles courtroom as a copyright case over his 2010 track Hurricane moved forward. The dispute centers o… [+1315 chars]",,"Kanye West Hurricane Urheberrechtsprozess aktualisiert #Entertainment. Kanye Wests „Hurricane“-Prozess: Was passiert? Kanye West – jetzt als Ye auftretend – sagte in einem Gerichtssaal in Los Angeles aus, als ein Urheberrechtsstreit um seinen Titel „Hurricane“ aus dem Jahr 2010 vorangetrieben wurde. Im Mittelpunkt des Streits stehen Behauptungen von Musikern, die behaupten, ihre Werke seien mit … verwendet worden.",Kanye West Hurricane copyright trial updates #entertainment. Kanye West’s “Hurricane” trial: what’s happening Kanye West—now performing as Ye—testified in a Los Angeles courtroom as a copyright case over his 2010 track “Hurricane” moved forward. The dispute centers on claims by musicians who say their work was used wit…,"Kanye West Hurricane copyright trial updates #entertainment. Kanye West's ""Hurricane"" iudicium: quod evenit Kanye West-nunc faciendo sicut Vos-testatus est in aula Los Angeles ut causa librariae super suum 2010 semita ""Hurricane"" progrediebatur. Controversia centra vindicat a musicis qui suum opus dicunt esse ingenium...",2026-05-09 15:06:45+00:00
1b9f34d0f140511814394a40cec97bfe,2026-05-07T11:44:04Z,'hurricane season',financialpost.com,en,0.7,A Quieter Hurricane Season This Year Could Still Pummel the US Power Grid,The number of storms isn’t the best predictor of damage to infrastructure or how long it takes to repair.,https://financialpost.com/pmn/business-pmn/a-quieter-hurricane-season-this-year-could-still-pummel-the-us-power-grid,https://smartcdn.gprod.postmedia.digital/financialpost/wp-content/uploads/2026/05/ratio-of-storm-damage-to-recovery-time-varies-infrastructur.jpg,,"(Bloomberg) Meteorologists are forecasting about 13 named Atlantic storms this season, or a little less activity than average. That sounds like good news for the US power grid and everyone who relies… [+4843 chars]",,Eine ruhigere Hurrikansaison in diesem Jahr könnte das US-Stromnetz dennoch beeinträchtigen. Die Anzahl der Stürme ist nicht der beste Indikator für Schäden an der Infrastruktur oder wie lange die Reparatur dauert.,A Quieter Hurricane Season This Year Could Still Pummel the US Power Grid. The number of storms isn’t the best predictor of damage to infrastructure or how long it takes to repair.,A quietior Procellae Season hoc anno adhuc Pomum US Power Grid. Numerus tempestatum non est optimus predictor damni infrastructure vel quousque sarcire capit.,2026-05-09 15:06:45+00:00
1ea2a9f7877cc1be00feea0d3e3069c6,2026-05-07T12:34:42Z,'hurricane climate change',crooksandliars.com,en,0.7,Increased Odds Of Super El Nino Could Mean Very Bad Hurricane Year,"Not that this is anywhere near as important as Trump's Versailles ballroom, but it seems like we will pay this year for decades of thumbing our nose at climate change. Because while climate change doesn't cause El Ninos, it can make them much worse.
One of th…",https://crooksandliars.com/2026/05/increased-odds-super-el-nino-could-mean,https://crooksandliars.com/files/embeds/2026/05/70215.jpg,,"Not that this is anywhere near as important as Trump's Versailles ballroom, but it seems like we will pay this year for decades of thumbing our nose at climate change. Because while climate change do… [+1535 chars]",,"Erhöhte Wahrscheinlichkeit eines Super El Niño könnte ein sehr schlimmes Hurrikanjahr bedeuten. Das ist zwar nicht annähernd so wichtig wie Trumps Ballsaal in Versailles, aber es sieht so aus, als würden wir dieses Jahr dafür büßen, dass wir jahrzehntelang den Klimawandel ignoriert haben. Denn der Klimawandel verursacht El Niños zwar nicht, kann ihn aber deutlich verschlimmern.
Einer der…","Increased Odds Of Super El Nino Could Mean Very Bad Hurricane Year. Not that this is anywhere near as important as Trump's Versailles ballroom, but it seems like we will pay this year for decades of thumbing our nose at climate change. Because while climate change doesn't cause El Ninos, it can make them much worse.
One of th…","Auxit Odds De Super El Nino significare potuit Ipsum malum Procellae Year. Non hoc est usquam prope tam magni momenti quam ballroom Versaliis Trump, sed videtur simile reddemus hoc anno pro decenniis pollicendi nasum nostrum ad mutationem climatis. Quia dum mutatio climatis El Ninos non causat, eos multo deteriores facere potest.
Una th…",2026-05-09 15:06:45+00:00
d369ca330023add92df90406f6e5a329,2026-05-07T16:12:46Z,'hurricane',www.dailymail.com,en,0.7,Kanye West makes the rare move of wearing a suit as he heads to LA court for latest lawsuit,"West, 48, is entangled in ongoing litigation over his Grammy-winning single Hurricane from the 2021 album Donda.",https://www.dailymail.com/tvshowbiz/article-15797057/kanye-west-suit-la-court-lawsuit.html,https://i.dailymail.com/1s/2026/05/07/05/108429509-0-image-m-1_1778129987228.jpg,,"Kanye West testified that he feels 'like a lot of people try to take advantage of' him as he took the stand in a copyright case in Los Angeles federal court on Wednesday.
West, 48, is entangled in o… [+3288 chars]",,"Kanye West macht den seltenen Schritt, einen Anzug zu tragen, als er wegen seiner neuesten Klage zum Gericht in LA geht. Der 48-jährige West ist in einen laufenden Rechtsstreit um seine mit einem Grammy ausgezeichnete Single „Hurricane“ aus dem 2021 erschienenen Album „Donda“ verwickelt.","Kanye West makes the rare move of wearing a suit as he heads to LA court for latest lawsuit. West, 48, is entangled in ongoing litigation over his Grammy-winning single Hurricane from the 2021 album Donda.","Kanye Occidens rarum motum litem gerendi facit cum LA aulam petit pro novissima lite. West, 48, implicatus est in lite permanente de suo Grammy-conciliando unum Procellae ab anno 2021 album Donda.",2026-05-09 15:06:45+00:00
43854cc0349b2bd227dd86c59e821f2d,2026-05-07T18:00:00Z,'hurricane',electrek.co,en,0.7,"Bluetti Hurricane Prep Sale offers exclusive power station lows from $449, Segway e-bikes at lows from $1,800, ECOVACS, more","Headlining today’s Green Deals is Bluetti’s Hurricane Prep Sale with tons of exclusive power station lows, like the 2,764Wh Apex 300 Portable Power Station down at $1,425 and others. We’ve shone a spotlight on Segway’s e-bike deals to their all-time lowest pr…",http://electrek.co/2026/05/07/bluetti-hurricane-prep-sale-exclusive-power-station-from-449-segway-e-bikes-ecovacs-more/,https://i0.wp.com/electrek.co/wp-content/uploads/sites/3/2026/05/Bluetti-Segway-Hiboy-ECOVACS-GDs-FI.jpg?resize=1200%2C628&quality=82&strip=all&ssl=1,,"Headlining today’s Green Deals is Bluetti’s Hurricane Prep Sale with tons of exclusive power station lows, like the 2,764Wh Apex 300 Portable Power Station down at $1,425 and others. We’ve shone a sp… [+18376 chars]",,"Bluetti Hurricane Prep Sale bietet exklusive Kraftwerke zu günstigen Preisen ab 449 $, Segway-E-Bikes zu günstigen Preisen ab 1.800 $, ECOVACS und mehr. Der Höhepunkt der heutigen Green Deals ist der Hurricane Prep Sale von Bluetti mit zahlreichen exklusiven Kraftwerks-Sonderangeboten, wie dem tragbaren Kraftwerk Apex 300 mit 2.764 Wh für 1.425 US-Dollar und anderen. Wir haben die E-Bike-Angebote von Segway zu den niedrigsten Preisen aller Zeiten ins Rampenlicht gerückt …","Bluetti Hurricane Prep Sale offers exclusive power station lows from $449, Segway e-bikes at lows from $1,800, ECOVACS, more. Headlining today’s Green Deals is Bluetti’s Hurricane Prep Sale with tons of exclusive power station lows, like the 2,764Wh Apex 300 Portable Power Station down at $1,425 and others. We’ve shone a spotlight on Segway’s e-bike deals to their all-time lowest pr…","Bluetti Procellae Prep Sale offert stationem potentiae exclusivam ab $449, Segway e-bikes ad quam sequitur ab $1,800, ECOVACS, plus. Headlining hodie Deals Green est Bluetti in Hurricane Prep Sale cum tons stationis exclusivae potestatis lows, sicut 2,764Wh Apex 300 Power Station descensus at $1,425 et alii. Vestibulum arcus in Segway e-bike agit de eorum omnibus infimis pr…",2026-05-09 15:06:45+00:00
8f619859dd7d7695be3e56aa1b557361,2026-05-07T12:28:15Z,'hurricane',economictimes.indiatimes.com,en,0.9,Refund rush: Millions to get cash back in June after $90.5 million energy billing error - who gets paid and when,"The Duke Energy $90.5 million refund is set to impact millions of US households starting June billing cycles, after regulators confirmed a major energy bills overcharge linked to 2024 hurricane recovery costs. Nearly $1 billion was collected, but actual storm…",https://economictimes.indiatimes.com/news/international/us/refund-rush-millions-to-get-cash-back-in-june-after-90-5-million-energy-billing-error-who-gets-paid-and-when/articleshow/130893793.cms,"https://img.etimg.com/thumb/msid-130894133,width-1200,height-630,imgsize-48222,overlay-economictimes/articleshow.jpg",,The Duke Energy $90.5 million refund is now set to bring automatic relief to millions of American households starting June billing cycles. This Duke Energy $90.5 million refund comes after regulators… [+6221 chars],,"Erstattungsansturm: Millionen erhalten im Juni Bargeld zurück, nachdem ein Energieabrechnungsfehler in Höhe von 90,5 Millionen US-Dollar aufgetreten ist – wer wird wann bezahlt? Die Erstattung in Höhe von 90,5 Millionen US-Dollar durch Duke Energy dürfte sich ab den Abrechnungszyklen im Juni auf Millionen von US-Haushalten auswirken, nachdem die Aufsichtsbehörden bestätigt haben, dass die Energierechnungen im Zusammenhang mit den Kosten für die Bergung nach dem Hurrikan im Jahr 2024 erheblich überhöht sind. Fast 1 Milliarde US-Dollar wurden gesammelt, aber der tatsächliche Sturm ...","Refund rush: Millions to get cash back in June after $90.5 million energy billing error - who gets paid and when. The Duke Energy $90.5 million refund is set to impact millions of US households starting June billing cycles, after regulators confirmed a major energy bills overcharge linked to 2024 hurricane recovery costs. Nearly $1 billion was collected, but actual storm…","Refugium ruunt: Ingentium nummi recipiunt in mense Iunio post $90.5 decies centena industria errorum exosculatio - qui mercedem accipit et quando. Dux Energy $90.5 decies centena milia refugium constituitur ad impulsum decies centena milia familiarum US exosculatio cyclos incipiens, postquam regulatores confirmaverunt maiorem energiam onerariam oneris coniunctam cum 2024 ventorum recuperatione gratuita. Fere $1 miliardis collecta est, sed tempestas actualis…",2026-05-09 15:06:45+00:00
1ab2c59a39446f85a28df7c21457b667,2026-05-07T17:51:13Z,'hurricane',www.businessinsider.com,en,0.9,I loved living in Florida. The natural disasters and constant flooding drove me out.,"After enduring back-to-back hurricanes in 2024, Lorraine English knew she had to leave Florida. She moved to Asheville, North Carolina, and is happier.",https://www.businessinsider.com/left-florida-hurricanes-flooding-moved-to-north-carolina-2026-5,https://i.insider.com/69f8d7ea9a23d20d291b6190?width=1200&format=jpeg,,"Homes in Bradenton, Florida.zimmytws/Getty Images
<ul><li>Lorraine English, 72, loved living in Florida, but hurricanes made life there difficult.</li><li>In 2025, she moved from Bradenton — a city … [+5681 chars]",,"Ich habe es geliebt, in Florida zu leben. Die Naturkatastrophen und die ständigen Überschwemmungen haben mich vertrieben. Nachdem Lorraine English im Jahr 2024 mehrere Hurrikane erlebt hatte, wusste sie, dass sie Florida verlassen musste. Sie ist nach Asheville, North Carolina, gezogen und ist glücklicher.","I loved living in Florida. The natural disasters and constant flooding drove me out.. After enduring back-to-back hurricanes in 2024, Lorraine English knew she had to leave Florida. She moved to Asheville, North Carolina, and is happier.","Vivens in Florida amavi. Clades naturales et assidua inundatio me expulit.. Post diuturnos turbines anno 2024, Lotharingia Anglica scivit se Floridam relinquere. Ashevillam, Carolinam Septentrionalem movit, et beatior est.",2026-05-09 15:06:45+00:00
784a488f2f2ade0159a13a126d8c0ea2,2026-05-07T13:00:00Z,'tropical cyclone',wattsupwiththat.com,en,0.9,"New Study: Declining Trends In 1980-2023 Tropical Cyclone Frequency, Accumulated Energy","Another anthropogenic global warming (AGW) modeling failure emerges in observed tropical cyclone data. 
The post New Study: Declining Trends In 1980-2023 Tropical Cyclone Frequency, Accumulated Energy appeared first on Watts Up With That?.",https://wattsupwiththat.com/2026/05/07/new-study-declining-trends-in-1980-2023-tropical-cyclone-frequency-accumulated-energy/,https://wattsupwiththat.com/wp-content/uploads/2025/03/Untitled-1.webp,,"From the NoTricksZone
By Kenneth Richard on 6. May 2026
According to climate modeling (Knutson et al., 2015 and 2020), everyday human activities such as driving cars and using cell phones (AGW) sho… [+1013 chars]",,"Neue Studie: Rückläufige Trends bei der Häufigkeit tropischer Wirbelstürme 1980–2023, akkumulierte Energie. Ein weiterer Fehler bei der Modellierung der anthropogenen globalen Erwärmung (AGW) zeigt sich in den beobachteten Daten zu tropischen Wirbelstürmen. 
Der Beitrag „Neue Studie: Rückläufige Trends bei der Häufigkeit tropischer Wirbelstürme 1980–2023, akkumulierte Energie“ erschien zuerst auf Watts Up With That?.","New Study: Declining Trends In 1980-2023 Tropical Cyclone Frequency, Accumulated Energy. Another anthropogenic global warming (AGW) modeling failure emerges in observed tropical cyclone data. 
The post New Study: Declining Trends In 1980-2023 Tropical Cyclone Frequency, Accumulated Energy appeared first on Watts Up With That?.","New Study: Declinatio Trends In 1980-2023 Tropical Cyclone Frequency, Accumulated Energy. Alius anthropogenicus calefactio globalis (AGW) exemplar defectus emergit in notitia cyclo tropicali observato. 
Post Novae Study: Declinatio Trends In 1980-2023 Tropical Cyclone Frequentia, Energia Accumulata primum apparuit in Watts Cum Eo?.",2026-05-09 20:58:46+00:00
d7e09be8d224acbac3176a6659a13f1d,2026-05-04T15:30:22Z,'hurricane',dukewire.usatoday.com,en,0.7,"Kara Lawson ""sounds the siren"" at Carolina Hurricanes playoff game","Duke women's basketball coach Kara Lawson served as the Carolina Hurricanes ""Siren Sounder"" for Game 1 of their second round series versus the Flyers",https://dukewire.usatoday.com/story/sports/college/duke/womens-basketball/2026/05/04/kara-lawson-sounds-siren-at-carolina-hurricanes-playoff-game/89921042007/,https://s.yimg.com/ny/api/res/1.2/nL1541bcHrK3H.EDJkgrWQ--/YXBwaWQ9aGlnaGxhbmRlcjt3PTEyMDA7aD03OTk7Y2Y9d2VicA--/https://media.zenfs.com/en/duke_wire_articles_169/f5fe851d1a57cecf6adc62f2dc346c4d,,"Add Siren Sounder to the resume of Duke womens basketball coach Kara Lawson.
Fresh off back-to-back ACC tournament titles, the former WNBA All-star was in attendance at Game 1 of the Carolina Hurric… [+1241 chars]",,"Kara Lawson lässt beim Playoff-Spiel der Carolina Hurricanes „die Sirene ertönen“. Die Basketballtrainerin der Duke-Frauen, Kara Lawson, diente den Carolina Hurricanes als „Siren Sounder“ für Spiel 1 ihrer zweiten Runde gegen die Flyers","Kara Lawson ""sounds the siren"" at Carolina Hurricanes playoff game. Duke women's basketball coach Kara Lawson served as the Carolina Hurricanes ""Siren Sounder"" for Game 1 of their second round series versus the Flyers","Kara Lawson ""siren sonat"" in Carolina Hurricanes lusum playoffs. Dux feminarum ultrices raeda Kara Lawson servivit Carolina turbinum ""Siren Sounder"" pro Ludus 1 secundae seriei rotundae versus volaces",2026-05-10 06:18:56+00:00
1b78aeec738513801a913678af661a5d,2026-05-08T20:59:19Z,'hurricane',www.foxsports.com,en,0.7,"NFL Offseason Check-In: After Warren Sapp Tribute, Rueben Bain Seeks to Forge Own Path","The Hurricanes star fell unexpectedly to the Bucs, who are thrilled to have him as a new catalyst for their defensive front.",https://www.foxsports.com/stories/nfl/nfl-offseason-check-in-after-warren-sapp-tribute-rueben-bain-seeks-forge-own-path,https://a57.foxsports.com/statics.foxsports.com/www.foxsports.com/content/uploads/2026/05/1408/814/rueben-bain.jpg?ve=1&tl=1,,"TAMPA, Fla. The parallel was already easy to make for Rueben Bain Jr.
A consensus All-America who wreaked havoc at the front of a University of Miami defense but fell unexpectedly and landed in the … [+4966 chars]",,"NFL-Offseason-Check-In: Nach der Hommage an Warren Sapp versucht Rueben Bain, seinen eigenen Weg zu gehen. Der Star der Hurricanes fiel unerwartet an die Bucs, die begeistert sind, ihn als neuen Katalysator für ihre Verteidigungsfront zu haben.","NFL Offseason Check-In: After Warren Sapp Tribute, Rueben Bain Seeks to Forge Own Path. The Hurricanes star fell unexpectedly to the Bucs, who are thrilled to have him as a new catalyst for their defensive front.","NFL Offseason Moderare-In: Post Warren Sapp Tributum, Rueben Bain quaerit viam suam excudere. Turbinum sidus improviso in Bucs cecidit, qui eum quasi novum catalystum ad defensionem suam horruerunt.",2026-05-10 21:02:00+00:00
