index,published,keyword,domain,language,valid,title,description,url,image,archive,content,quote,de,en,la,added
efba3c5ef9c7c19a58e0ebdfcc44480e,2026-05-12T15:00:39Z,'hurricane season',www.disneyfoodblog.com,en,0.9,New Rules for Hurricane Season in Disney World for 2026,Traveling to Orlando during hurricane season? Do NOT head that way without knowing these two things!,https://www.disneyfoodblog.com/2026/05/12/new-rules-for-hurricane-season-in-disney-world-for-2026/,https://www.disneyfoodblog.com/wp-content/uploads/2026/04/2026-wdw-mk-liberty-square-rain-1-700x525.jpg,,"We’re just about halfway through the year, and that means that hurricane season is almost here, and it’s time to prepare.
Rainy Day in Magic Kingdom
Hurricane season happens every year in Florida, … [+3674 chars]",,"Neue Regeln für die Hurrikansaison in Disney World für 2026. Reisen Sie während der Hurrikansaison nach Orlando? Gehen Sie NICHT dorthin, ohne diese beiden Dinge zu wissen!",New Rules for Hurricane Season in Disney World for 2026. Traveling to Orlando during hurricane season? Do NOT head that way without knowing these two things!,"Novae Regulae pro tempore tempestatis in Disney pro 2026. Iter ad Orlandum in tempore tempestatis? Noli hoc modo caput, quin haec duo sciant!",2026-05-15 16:11:12+00:00
dc66f66bb187ce3a26bd9a44272ab79a,2026-05-12T16:00:19Z,'hurricane',allears.net,en,0.9,What I Wish I’d Known Before Visiting Disney World During Hurricane Season,Here's what you need to know about traveling to Disney World during hurricane season.,https://allears.net/2026/05/12/what-i-wish-id-known-before-visiting-disney-world-during-hurricane-season/,https://allears.net/wp-content/uploads/2024/10/2024-wdw-hurricane-milton-guests-walking-rain-storm-buses-transportation-1-700x525.jpg,,"The summer is almost here, and with that comes the arrival of hurricane season in Florida. Now, hurricane season runs from June through November, so if you’re planning a trip to Disney World during t… [+7591 chars]",,"Was ich gerne gewusst hätte, bevor ich Disney World während der Hurrikansaison besuchte. Hier erfahren Sie, was Sie über Reisen nach Disney World während der Hurrikansaison wissen müssen.",What I Wish I’d Known Before Visiting Disney World During Hurricane Season. Here's what you need to know about traveling to Disney World during hurricane season.,What I Wish I'd Known Before Visiting Disney World During Hurricane Season. Hic est quod debes scire de itinere ad Disney World in tempore tempestatis.,2026-05-15 16:11:12+00:00
90a59ac09bee8d4964c411433be2a23f,2026-05-05T08:19:25Z,'typhoon',pypi.org,en,0.7,TyphoonTest 1.35.4,Typhoon Testing Utilities,https://pypi.org/project/typhoontest/1.35.4/,,,"A required part of this site couldnt load. This may be due to a browser
 extension, network issues, or browser settings. Please check your
 connection, disable any ad blockers, or try using a diffe… [+12 chars]",,TyphoonTest 1.35.4. Dienstprogramme für Typhoon-Tests,TyphoonTest 1.35.4. Typhoon Testing Utilities,TyphoonTest 1.35.4. Typhoon Test Utilitas,2026-05-16 06:06:36+00:00
b016c67299c59782b8017b18fc2696c2,2026-05-06T21:53:17Z,'tropical depression',newsonjapan.com,en,0.9,Typhoon No. 5 Set to Fade Without Affecting Japan,"Typhoon No. 5 is expected to move westward into next week without significant development and is forecast to weaken into a tropical depression, with no impact anticipated for Japan. (News On Japan)",https://newsonjapan.com/article/149137.php,https://i2.ytimg.com/vi/-4b8_z3Qmcw/mqdefault.jpg,http://web.archive.org/web/20260506230307/https://newsonjapan.com/article/149137.php,"TOKYO, May 07 (News On Japan) -
 Typhoon No. 5 is expected to move westward into next week without significant development and is forecast to weaken into a tropical depression, with no impact antici… [+793 chars]",,"Taifun Nr. 5 wird verschwinden, ohne Japan zu beeinträchtigen. Es wird erwartet, dass Taifun Nr. 5 in der nächsten Woche ohne nennenswerte Entwicklung nach Westen zieht und sich voraussichtlich zu einem tropischen Tiefdruckgebiet abschwächt, ohne dass Auswirkungen auf Japan zu erwarten sind. (Neuigkeiten über Japan)","Typhoon No. 5 Set to Fade Without Affecting Japan. Typhoon No. 5 is expected to move westward into next week without significant development and is forecast to weaken into a tropical depression, with no impact anticipated for Japan. (News On Japan)","Typhoon No. 5 Pone ad Pade Sine Iaponia afficiens. Typhoon N. 5. expectatur ad occidentem in proximam septimanam movere sine progressu notabili et praevidetur debilitare in depressionem tropicam, nullo impulsu pro Iaponia anticipato. (News On Japan)",2026-05-16 06:06:36+00:00
848f2192c7444295b44ec84c78b62b4e,2026-05-05T02:11:27Z,'hurricane',www.rollingstone.com,en,0.7,Kanye West ‘Hurricane’ Copyright Infringement Trial: ‘Snubbed’ Musicians Ask for Half a Million Dollars,"The copyright infringement trial against Kanye West over 'Hurricane' began on Monday, with 'snubbed' musicians asking for half a million dollars.",http://www.rollingstone.com/music/music-news/kanye-west-hurricane-copyright-infringement-trial-begins-1235557458/,https://www.rollingstone.com/wp-content/uploads/2026/05/kanye-west-copyright-trial-starts.jpg?w=1600&h=900&crop=1,http://web.archive.org/web/20260506025732/https://www.rollingstone.com/music/music-news/kanye-west-hurricane-copyright-infringement-trial-begins-1235557458/,"Kanye West has been hit with more than a dozen copyright infringement lawsuits over his controversial career. Now one has reached a jury, with the artist now known as Ye expected to testify later thi… [+3703 chars]",,"Prozess wegen Urheberrechtsverletzung gegen Kanye West „Hurricane“: „Brüsselte“ Musiker fordern eine halbe Million Dollar. Der Urheberrechtsverletzungsprozess gegen Kanye West wegen „Hurricane“ begann am Montag, wobei „brüskierte“ Musiker eine halbe Million Dollar forderten.","Kanye West ‘Hurricane’ Copyright Infringement Trial: ‘Snubbed’ Musicians Ask for Half a Million Dollars. The copyright infringement trial against Kanye West over 'Hurricane' began on Monday, with 'snubbed' musicians asking for half a million dollars.","Kanye West 'Hurricane' Copyright Infringement Trial: 'Snubbed' musici roga pro dimidia decies centena millia. Praeiudicio librariae iudicii contra Kanye Occidentem super 'procellae' die Lunae incepit, cum 'supbed' musici dimidium miliones dollariorum postulare.",2026-05-16 09:50:17+00:00
c4e89780499b6ec2cb6cda177831a6c1,2026-05-08T10:00:40Z,'hurricane',gizmodo.com,en,0.7,Pentagon Think Tank Tests Ingenious Plan to Protect Coasts From Hurricanes—and It’s Working,"After Hurricane Michael laid waste to Tyndall Air Force Base, DARPA turned to a common bivalve for assistance.",https://gizmodo.com/pentagon-think-tank-just-came-up-with-an-ingenious-plan-to-protect-coasts-from-hurricanes-2000755913,https://gizmodo.com/app/uploads/2026/05/DARPA-Bushek-Oyster-Reef-Tech-1200x675.jpg,http://web.archive.org/web/20260509065954/https://gizmodo.com/pentagon-think-tank-just-came-up-with-an-ingenious-plan-to-protect-coasts-from-hurricanes-2000755913,"The Pentagon got serious about mitigating climate disasters after the 155-mile-per-hour winds of Hurricane Michael left Tyndall Air Force Base virtually leveled, as one military spokesperson describe… [+4108 chars]",,"Pentagon Think Tank testet genialen Plan zum Schutz der Küsten vor Hurrikanen – und er funktioniert. Nachdem Hurrikan Michael den Luftwaffenstützpunkt Tyndall verwüstet hatte, wandte sich die DARPA hilfesuchend an eine Muschel.","Pentagon Think Tank Tests Ingenious Plan to Protect Coasts From Hurricanes—and It’s Working. After Hurricane Michael laid waste to Tyndall Air Force Base, DARPA turned to a common bivalve for assistance.","Pentagonum Puta Tank Tests Ingenious Plan ut Coasts ab Hurricanes tueretur—et laborat. Postquam Michael Hurricane ad Tyndall Air Force Base vastavit, DARPA ad communem bivalvam auxilium convertit.",2026-05-16 09:50:17+00:00
ee56c3642984db33ee26112bca0701dc,2026-05-12T22:35:11Z,'hurricane',www.rollingstone.com,en,0.7,Kanye West Loses at Trial Over Uncleared Sample on ‘Hurricane’,"The artist, now known as Ye, testified that he knowingly removed a sample from the Grammy-winning song after a sold-out listening event because he lacked clearance",http://www.rollingstone.com/music/music-news/kanye-found-liable-hurricane-copyright-infringement-trial-1235561041/,https://www.rollingstone.com/wp-content/uploads/2026/05/kanye-west-trial-verdict.jpg?crop=63px%2C28px%2C1737px%2C976px&resize=1600%2C900,http://web.archive.org/web/20260513004124/https://www.rollingstone.com/music/music-news/kanye-found-liable-hurricane-copyright-infringement-trial-1235561041/,"Kanye West and his companies must pay $438,558 in damages after a jury found he infringed on the copyright of an unreleased demo track by sampling it in an early version of his Grammy-winning song “H… [+7358 chars]",,"Kanye West verliert vor Gericht wegen ungeklärter Probe zu „Hurricane“. Der Künstler, der jetzt als Ye bekannt ist, sagte aus, dass er nach einer ausverkauften Hörveranstaltung wissentlich ein Sample aus dem mit einem Grammy ausgezeichneten Song entfernt habe, weil ihm die Freigabe fehlte","Kanye West Loses at Trial Over Uncleared Sample on ‘Hurricane’. The artist, now known as Ye, testified that he knowingly removed a sample from the Grammy-winning song after a sold-out listening event because he lacked clearance","Kanye West Loses apud Trial Over Uncleared Sample de 'Hurricane'. Artifex, nunc notus ut Vos, testatus est se scienter removisse exemplum e carmine Grammy-victricis post eventum venditionis audientis quod alvi deerat.",2026-05-16 09:50:17+00:00
851c5e73862295ac637330a4b6ac295d,2026-05-13T04:03:00Z,'hurricane',consent.yahoo.com,en,0.7,World’s First Catastrophe Bond ETF Braces for Hurricane Season,,https://consent.yahoo.com/v2/collectConsent?sessionId=1_cc-session_af5b41ab-dbda-4618-b7f3-bb49c1e54b3b,,,"If you click 'Accept all', we and our partners, including 247 who are part of the IAB Transparency &amp; Consent Framework, will also store and / or access information on a device (in other words, us… [+1046 chars]",,Der weltweit erste Katastrophenanleihen-ETF bereitet sich auf die Hurrikan-Saison vor. Keiner,World’s First Catastrophe Bond ETF Braces for Hurricane Season. None,Primum Catastrophe Bond ETF Braces pro tempore Hurricane Mundi. Nullus,2026-05-16 09:50:17+00:00
10756948ec51607b01941684750ca27e,2026-05-04T10:54:41Z,'hurricane',www.bbc.com,en,0.9,How a hurricane created a 'precious saltmarsh',This year marks 30 years since a storm breached sea defenses in Porlock.,https://www.bbc.com/news/articles/c5y74l61j29o,https://ichef.bbci.co.uk/news/1024/branded_news/55f7/live/9482b710-47a0-11f1-970b-c9a1b7950074.jpg,http://web.archive.org/web/20260505022915/https://www.bbc.com/news/articles/c5y74l61j29o,"In 1996, Hurricane Lili caused a storm to move from the Atlantic to Porlock Bay, where it battered the shore, changing the appearance and nature of the coast itself.",,"Wie ein Hurrikan eine „kostbare Salzwiese“ schuf. Dieses Jahr ist es 30 Jahre her, dass ein Sturm die Seeverteidigung in Porlock durchbrach.",How a hurricane created a 'precious saltmarsh'. This year marks 30 years since a storm breached sea defenses in Porlock.,"Qualiter gurges condidit salmarium pretiosum. Hoc anno XXX marcas, cum tempestas maris munimenta in Porlock dissipata est.",2026-05-16 09:50:17+00:00
70edf9193702daffdadb1fdc1246c9d6,2026-05-12T05:24:39Z,'hurricane season',post.rlsbb.to,en,0.7,Shed And Buried Classic Cars S04E08 1080p WEB-DL H264-Pr1M371M3,"Season 4, Episode 08 – In a dusty warehouse, Henry Cole and Fuzz Townshend uncover a rare Armstrong Siddeley Hurricane convertible. Can they revive this British classic?Links: HOMEPAGE – TVMZShed.And.Buried.Classic.Cars.S04E08.720p.WEB.H264-JFFMKV | AC3 / dol…",https://post.rlsbb.to/shed-and-buried-classic-cars-s04e08-1080p-web-dl-h264-pr1m371m3/,,,"Season 4, Episode 08 In a dusty warehouse, Henry Cole and Fuzz Townshend uncover a rare Armstrong Siddeley Hurricane convertible. Can they revive this British classic?
Links:HOMEPAGE  TVMZ
Shed.And… [+522 chars]",,"Verschüttete und vergrabene Oldtimer S04E08 1080p WEB-DL H264-Pr1M371M3. Staffel 4, Folge 08 – In einer staubigen Lagerhalle entdecken Henry Cole und Fuzz Townshend ein seltenes Armstrong Siddeley Hurricane Cabriolet. Können sie diesen britischen Klassiker wiederbeleben?Links: HOMEPAGE – TVMZShed.And.Buried.Classic.Cars.S04E08.720p.WEB.H264-JFFMKV | AC3 / dol…","Shed And Buried Classic Cars S04E08 1080p WEB-DL H264-Pr1M371M3. Season 4, Episode 08 – In a dusty warehouse, Henry Cole and Fuzz Townshend uncover a rare Armstrong Siddeley Hurricane convertible. Can they revive this British classic?Links: HOMEPAGE – TVMZShed.And.Buried.Classic.Cars.S04E08.720p.WEB.H264-JFFMKV | AC3 / dol…","Effunde et sepelite Cars Ordo S04E08 1080p WEB-DL H264-Pr1M371M3. Season 4, Episode 08 – In pulverulento horreis, Henricus Cole et Fuzz Townshend detege rarum Armstrong Siddeley Procellae convertibile. Potestne haec classica Britannica renovare? Links: HOMEPAGE – TVMZShed.And.Buried.Classic.Cars.S04E08.720p.WEB.H264-JFFMKV | AC3 / dol…",2026-05-16 15:11:25+00:00
6f229f82bd72fc0908c7e2b6e75704e0,2026-05-12T21:35:43Z,'hurricane',post.rlsbb.to,en,0.9,Escape To Florida S01E07 1080p WEB-DL H264-7VFr33104D,"Season 1, Episode 07 – David and Gina rebuild their hurricane-wrecked properties. And Laura and Lindsay invite their Florida friends to their baby shower before Lindsay heads for the delivery room.Links: HOMEPAGE – TVMEscape.To.Florida.S01E07.720p.WEB.H264-JF…",https://post.rlsbb.to/escape-to-florida-s01e07-1080p-web-dl-h264-7vfr33104d/,,,"Season 1, Episode 07 David and Gina rebuild their hurricane-wrecked properties. And Laura and Lindsay invite their Florida friends to their baby shower before Lindsay heads for the delivery room.
Li… [+475 chars]",,"Flucht nach Florida S01E07 1080p WEB-DL H264-7VFr33104D. Staffel 1, Folge 07 – David und Gina bauen ihre vom Hurrikan zerstörten Grundstücke wieder auf. Und Laura und Lindsay laden ihre Freunde aus Florida zu ihrer Babyparty ein, bevor Lindsay in den Kreißsaal geht.Links: HOMEPAGE – TVMEscape.To.Florida.S01E07.720p.WEB.H264-JF…","Escape To Florida S01E07 1080p WEB-DL H264-7VFr33104D. Season 1, Episode 07 – David and Gina rebuild their hurricane-wrecked properties. And Laura and Lindsay invite their Florida friends to their baby shower before Lindsay heads for the delivery room.Links: HOMEPAGE – TVMEscape.To.Florida.S01E07.720p.WEB.H264-JF…","Effugere ad Floridam S01E07 1080p WEB-DL H264-7VFr33104D. Season 1, Episode 07 – David et Gina suas ventorum naufragas possessiones aedificant. Et Laura et Lindesay amicos suos Floridas ad infantem imbrem invitant ante Lindsay capita ad cubiculum partus.Links: HOMEPAGE – TVMEscape.To.Florida.S01E07.720p.WEB.H264-JF…",2026-05-16 15:11:25+00:00
adc048cf6ef15e85475c5e47bdd4dc07,2026-05-13T05:01:53Z,'hurricane',www.insurancejournal.com,en,0.9,Viewpoint: Why a Quieter Hurricane Season Doesn’t Mean Lower Risk,"The 2026 Atlantic hurricane season is projected to be quieter than many of the hyperactive years that preceded it. Six of the past seven seasons produced above-average Atlantic activity, including the record-setting 2020 season, which had 30 named storms. But…",https://www.insurancejournal.com/news/southeast/2026/05/13/869548.htm,https://www.insurancejournal.com/app/uploads/2025/10/Hurricane-Helene-scaled.jpg,http://web.archive.org/web/20260514090927/https://www.insurancejournal.com/news/southeast/2026/05/13/869548.htm,"The 2026 Atlantic hurricane season is projected to be quieter than many of the hyperactive years that preceded it. Six of the past seven seasons produced above-average Atlantic activity, including th… [+4842 chars]",,"Standpunkt: Warum eine ruhigere Hurrikansaison nicht gleichbedeutend mit einem geringeren Risiko ist. Die Hurrikansaison 2026 im Atlantik dürfte ruhiger verlaufen als viele der hyperaktiven Jahre davor. Sechs der letzten sieben Saisons brachten eine überdurchschnittliche atlantische Aktivität, darunter die Rekordsaison 2020 mit 30 benannten Stürmen. Aber…","Viewpoint: Why a Quieter Hurricane Season Doesn’t Mean Lower Risk. The 2026 Atlantic hurricane season is projected to be quieter than many of the hyperactive years that preceded it. Six of the past seven seasons produced above-average Atlantic activity, including the record-setting 2020 season, which had 30 named storms. But…","Viewpoint: Why a Quieter Hurricane Season doesn't mean Lower Risk. Tempus Atlanticum 2026 proiectum est ut quietius esset quam multi anni hyperactivi qui eum antecesserunt. Sex praeteriti temporis septem proxime activitatem Atlanticam supra mediocris producta sunt, incluso temporis recordo occasu 2020, quod tempestates 30 nominaverat. Sed…",2026-05-16 15:11:25+00:00
ce069a066208e0f03670f0406c38a291,2026-05-14T17:55:00Z,'hurricane season',www.prnewswire.com,en,0.7,"As Hurricane Season Nears, Communities Are Reassessing How They Prepare for Floods","From emergency officials to utility providers and retailers, organizations are increasingly seeking real-time visibility into predicted flood impacts as storms become faster, more disruptive, and harder to predict. DENVER, May 14, 2026 /PRNewswire/ -- As hurr…",https://www.prnewswire.com/news-releases/as-hurricane-season-nears-communities-are-reassessing-how-they-prepare-for-floods-302772741.html,https://mma.prnewswire.com/media/2980529/FloodMapp_Hurricane_Season.jpg?p=facebook,http://web.archive.org/web/20260514183916/https://www.prnewswire.com/news-releases/as-hurricane-season-nears-communities-are-reassessing-how-they-prepare-for-floods-302772741.html,"From emergency officials to utility providers and retailers, organizations are increasingly seeking real-time visibility into predicted flood impacts as storms become faster, more disruptive, and har… [+5003 chars]",,"Während die Hurrikansaison näher rückt, überdenken Gemeinden ihre Vorbereitung auf Überschwemmungen. Von Rettungskräften bis hin zu Versorgungsunternehmen und Einzelhändlern streben Organisationen zunehmend nach Echtzeit-Einblick in die vorhergesagten Auswirkungen von Überschwemmungen, da Stürme schneller, störender und schwerer vorhersehbar werden. DENVER, 14. Mai 2026 /PRNewswire/ – Als Hurr…","As Hurricane Season Nears, Communities Are Reassessing How They Prepare for Floods. From emergency officials to utility providers and retailers, organizations are increasingly seeking real-time visibility into predicted flood impacts as storms become faster, more disruptive, and harder to predict. DENVER, May 14, 2026 /PRNewswire/ -- As hurr…","Procellae tempore Nears, Communitates perpendentes quomodo parant flumina. Ex subitis ministris ad utilitatem provisoribus et venditoribus, consociationes magis magisque quaerunt visionem realem temporis in impactibus diluvii praedictis, ut tempestates citius, turbulentiores fiunt, et difficilius praedicunt. DENVER, die 14 mensis Maii anno 2026 / PRNewswire/ -- Cum hurr...",2026-05-16 21:01:54+00:00
034e0df9c0ca393d9977672ff13dd7e8,2026-05-14T13:28:27Z,'hurricane victims',theconversation.com,en,0.3,"A ‘super El Niño?’ Why it’s too early to forecast one with certainty, but not too soon to prepare",Twin cyclones helped trigger massive ocean warming in the Pacific. But whether that leads to a strong El Niño is still uncertain. Here’s what you need to know.,https://theconversation.com/a-super-el-nino-why-its-too-early-to-forecast-one-with-certainty-but-not-too-soon-to-prepare-282574,https://images.theconversation.com/files/735167/original/file-20260511-57-ieczoo.jpg?ixlib=rb-4.1.0&rect=67%2C540%2C2932%2C1466&q=45&auto=format&w=1356&h=668&fit=crop,,"El Niño can mean a rainy U.S. Southwest, warmer winters in the North and less Atlantic hurricane activity – but not always. Bill Tompkins/Getty Images
Talk of a “super El Niño” developing in 2026 is… [+7888 chars]",,"Ein „Super-El Niño“? Warum es zu früh ist, um einen mit Sicherheit vorherzusagen, aber nicht zu früh, um sich darauf vorzubereiten. Zwillingswirbelstürme trugen dazu bei, eine massive Erwärmung der Ozeane im Pazifik auszulösen. Doch ob das zu einem starken El Niño führt, ist noch ungewiss. Folgendes müssen Sie wissen:","A ‘super El Niño?’ Why it’s too early to forecast one with certainty, but not too soon to prepare. Twin cyclones helped trigger massive ocean warming in the Pacific. But whether that leads to a strong El Niño is still uncertain. Here’s what you need to know.","A 'super El Niño?' Cur immaturum est pro certo praevidere, sed non cito praeparare. Cyclones gemini felis ingentes oceani in Pacifico calefactione adiuverunt. Sed an forte El Niño ducatum sit, adhuc incertum est. Hic est quod scire debes.",2026-05-17 15:11:44+00:00
c647fc61af2a5ec3f0061ca3052a7084,2026-05-16T09:21:37Z,'hurricane climate change',theconversation.com,en,0.9,The Mediterranean sea is capable of generating hurricanes and climate change will make them worse,"Freak tropical-like storms are highly sensitive to climate change and as a result, could be coming soon to the Mediterranean.",https://theconversation.com/the-mediterranean-sea-is-capable-of-generating-hurricanes-and-climate-change-will-make-them-worse-281182,https://images.theconversation.com/files/733948/original/file-20260505-57-907y3l.jpg?ixlib=rb-4.1.0&rect=0%2C1022%2C3263%2C1631&q=45&auto=format&w=1356&h=668&fit=crop,,"Tropical-like cyclone Ianos crosses the Ionian Sea and approaches Greece on September 17th, 2020. contains modified Copernicus Sentinel data (2020), processed by ESA, CC BY-SA
In March 2026, a tropi… [+6392 chars]",,Das Mittelmeer kann Hurrikane erzeugen und der Klimawandel wird sie verschlimmern. Ungewöhnliche tropenähnliche Stürme reagieren sehr empfindlich auf den Klimawandel und könnten daher bald das Mittelmeer erreichen.,"The Mediterranean sea is capable of generating hurricanes and climate change will make them worse. Freak tropical-like storms are highly sensitive to climate change and as a result, could be coming soon to the Mediterranean.",Mare Mediterraneum capax est turbinum generare et mutationem climatis deteriores facere. Tempestates monstrificae tropicae sicut tempestates valde sensitivae sunt ad mutationem climatis et per consequens mox ad Mare Mediterraneum venire possunt.,2026-05-17 15:11:44+00:00
08b23975a8f3f176e36e28d5d3d11dc1,2026-05-16T12:01:06Z,'hurricane',gothamist.com,en,0.7,MTA raised alarms about Amtrak tunnel plan before this week's Penn Station meltdown,"Sections of an East River tunnel owned by Amtrak showed signs of serious water damage from Hurricane Sandy before repairs began last year.
 

LIRR President Rob Free all but said “I told you so” to Amtrak officials during a news conference on Friday. [ more ›…",https://gothamist.com/news/mta-raised-alarms-about-amtrak-tunnel-plan-before-this-weeks-penn-station-meltdown,https://api-prod.gothamist.com/images/351302/fill-1200x650|format-webp|webpquality-85/,,"MTA officials spent months last year warning that an Amtrak construction plan would spark service meltdowns at Penn Station.
That prediction proved true Thursday after a fire in an East River train … [+2267 chars]",,"MTA warnte vor der Kernschmelze der Penn Station in dieser Woche vor dem Amtrak-Tunnelplan. Abschnitte eines East River-Tunnels im Besitz von Amtrak zeigten vor Beginn der Reparaturen im vergangenen Jahr Anzeichen schwerer Wasserschäden durch Hurrikan Sandy.
 

LIRR-Präsident Rob Free sagte den Amtrak-Beamten während einer Pressekonferenz am Freitag beinahe: „Ich habe es Ihnen gesagt.“ [ mehr >…","MTA raised alarms about Amtrak tunnel plan before this week's Penn Station meltdown. Sections of an East River tunnel owned by Amtrak showed signs of serious water damage from Hurricane Sandy before repairs began last year.
 

LIRR President Rob Free all but said “I told you so” to Amtrak officials during a news conference on Friday. [ more ›…","MTA terrores circa Amtrak cuniculum consilium excitavit ante hoc septimana scriptor Penn Station Meltdown. Sectiones cuniculi Fluminis Orientalis ab Amtrak possesso signa gravissimae aquae damni ab Hurricane Sandy ante annum reparationis inceperunt.
 

LIRR Praeses Rob Free omnia dixit ""Dixi tibi ita"" ad magistratus Amtrak in colloquio nuntiorum Veneris. [ magis …",2026-05-17 21:06:15+00:00
