index,published,keyword,domain,language,valid,title,description,url,image,archive,content,quote,de,en,la,added
68b8d1e351f15c37757e833f69fb9f78,2026-01-07T23:21:20Z,'storm surge',msmagazine.com,en,0.7,"Ms. Global: Iraq’s Child Marriage Surge, Hurricane Devastation in Jamaica, Historic EU Abortion Vote and More","The U.S. ranks as the 19th most dangerous country for women, 11th in maternal mortality, 30th in closing the gender pay gap, 75th in women’s political representation, and painfully lacks paid family leave and equal access to health care. But Ms. has always un…",https://msmagazine.com/2026/01/07/ms-global-iraq-child-marriage-jamaica-eu-abortion/,https://msmagazine.com/wp-content/uploads/2026/01/Ms.-Global-Iraqs-Child-Marriage-Surge-Hurricane-Devastation-in-Jamaica-Historic-EU-Abortion-Vote-and-More.png,,"The U.S. ranks as the 19th most dangerous country for women, 11th in maternal mortality, 30th in closing the gender pay gap, 75th in womens political representation, and painfully lacks paid family l… [+12470 chars]",,"Frau Global: Der Anstieg der Kinderehen im Irak, die verheerenden Auswirkungen des Hurrikans auf Jamaika, das historische EU-Abtreibungsvotum und mehr. Die USA rangieren auf Platz 19 der gefährlichsten Länder für Frauen, auf Platz 11 bei der Müttersterblichkeit, auf Platz 30 bei der Beseitigung des geschlechtsspezifischen Lohngefälles, auf Platz 75 bei der politischen Vertretung von Frauen und es mangelt schmerzlich an bezahltem Familienurlaub und gleichem Zugang zur Gesundheitsversorgung. Aber Frau hat immer un…","Ms. Global: Iraq’s Child Marriage Surge, Hurricane Devastation in Jamaica, Historic EU Abortion Vote and More. The U.S. ranks as the 19th most dangerous country for women, 11th in maternal mortality, 30th in closing the gender pay gap, 75th in women’s political representation, and painfully lacks paid family leave and equal access to health care. But Ms. has always un…","Ms Global: Iraq Infantis Matrimonii Surge, Devastatio Procellae in Jamaica, Historica EU Abortus Suffragium et More. Americae ordines sicut XIX terra periculosissima pro mulieribus, XI in mortalitate materna, XXX in occlusione sexum solvendi spacium, LXXV in mulierum repraesentatione politica, et dolore caret familia soluta licentia et par accessus ad sanitatis. Sed semper un... Ms.",2026-01-10 08:38:44+00:00
323a4785c7c12142e03b5f6d1ad730da,2026-01-08T07:00:01Z,'hurricane',www.sportingnews.com,en,0.0,Why is Michael Irvin on the Miami sideline? Explaining college connection to Mario Cristobal,"When watching the Hurricanes, it's hard to miss Michael Irvin going ballistic on the sidelines. What are Irvin's ties to Miami, and why is he on the field?",https://www.sportingnews.com/us/ncaa-football/miami/news/michael-irvin-miami-sideline-college-connection-mario-cristobal/f9f106f87c5d0237361a3c0e,https://media.zenfs.com/en/the_sporting_news_articles_584/f57c9e0db0e30b69f72c42c80fb39c5e,,"Why is Michael Irvin on the Miami sideline? Explaining college connection to Mario Cristobal originally appeared on The Sporting News. Add The Sporting News as a Preferred Source by clicking here.
T… [+3358 chars]",,"Warum steht Michael Irvin an der Seitenlinie von Miami? Erklärt die College-Verbindung zu Mario Cristobal. Wenn man sich die Hurricanes anschaut, ist es kaum zu übersehen, dass Michael Irvin am Spielfeldrand wild wird. Welche Verbindungen hat Irvin zu Miami und warum ist er auf dem Spielfeld?","Why is Michael Irvin on the Miami sideline? Explaining college connection to Mario Cristobal. When watching the Hurricanes, it's hard to miss Michael Irvin going ballistic on the sidelines. What are Irvin's ties to Miami, and why is he on the field?","Cur Michael Irvin in Miami sideline? Collegium nexus explicans ad Mario Cristobal. Cum Procellae spectans, difficile est Michael Irvin deesset ballisticum in sidelines ire. Quid Irvin cum Miami iungit, et cur in campo est?",2026-01-10 14:31:10+00:00
ed9ab51a4eaadf1464e48e9e5079a086,2026-01-08T11:05:31Z,'hurricane',www.usatoday.com,en,0.0,Why is Michael Irvin on Miami sideline? Legendary alum is Hurricanes' biggest fan,Miami legend Michael Irvin has been the Hurricanes' unofficial mascot all season. Here's why he brings so much energy to his alma mater:,https://www.usatoday.com/story/sports/ncaaf/2026/01/08/why-is-michael-irvin-on-miami-sideline-hurricanes/88055704007/,https://s.yimg.com/ny/api/res/1.2/2JG3L_aVA9tyRklDFbwWzA--/YXBwaWQ9aGlnaGxhbmRlcjt3PTEyMDA7aD04MDA7Y2Y9d2VicA--/https://media.zenfs.com/en/usa_today_sports_articles_558/86439dcdb011a5597bb5bfcaf35ded1f,,"Michael Irvin, one of the greatest receivers of all time, has been Miami football's greatest fan all season. The former Hurricanes standout hasn't looked or acted 59 years old, either, with his amusi… [+3458 chars]",,Warum steht Michael Irvin an der Seitenlinie von Miami? Der legendäre Alaun ist der größte Fan der Hurricanes. Die Miami-Legende Michael Irvin war die ganze Saison über das inoffizielle Maskottchen der Hurricanes. Deshalb bringt er so viel Energie in seine Alma Mater:,Why is Michael Irvin on Miami sideline? Legendary alum is Hurricanes' biggest fan. Miami legend Michael Irvin has been the Hurricanes' unofficial mascot all season. Here's why he brings so much energy to his alma mater:,Cur Michael Irvin in Miami sideline? Alumen fabulosum est turbinum maximus ventilabrum. Miami legenda Michael Irvin has been the Hurricanes' priyatus terque omni tempore. Hic cur tantam industriam ad almam matrem suam deferat;,2026-01-10 14:31:10+00:00
6fc82dfe8592852b435f7d4748024879,2026-01-08T00:41:35Z,'hurricane victims',pagesix.com,en,0.3,Gayle King’s future with CBS revealed after low-key lunch meeting with network news honcho Bari Weiss,"King's lawyers and CBS are meeting about her future, which may mean more of a Diane Sawyer like role.",https://pagesix.com/2026/01/07/entertainment/gayle-kings-future-with-cbs-revealed-after-low-key-lunch-meeting-with-network-news-honcho-bari-weiss/,https://pagesix.com/wp-content/uploads/sites/3/2026/01/118459050.jpg?quality=75&strip=all&w=1200,,"Amid a hurricane of speculation about Gayle King’s future at CBS, Page Six has learned that the “CBS This Morning” co-host had a “low key lunch” with the network’s swashbuckling new news chief Bari W… [+3014 chars]",,"Gayle Kings Zukunft bei CBS wurde nach einem unauffälligen Mittagessen mit dem Nachrichtenchef des Senders, Bari Weiss, enthüllt. Kings Anwälte und CBS treffen sich über ihre Zukunft, was möglicherweise eher eine Rolle wie Diane Sawyer bedeutet.","Gayle King’s future with CBS revealed after low-key lunch meeting with network news honcho Bari Weiss. King's lawyers and CBS are meeting about her future, which may mean more of a Diane Sawyer like role.","Gayle regis futurum cum CBS revelatum est post prandium clavem prandii cum nuntio retis honcho Bari Weiss. Regis advocati et CBS conveniunt de ea futura, quae plus de Diane Sawyer quasi munus significare potest.",2026-01-10 14:31:10+00:00
2bea5bbef090f9d7718ed9ff8cb062ee,2026-01-07T22:51:28Z,'hurricane',loudwire.com,en,0.7,What Inspired Jack Osbourne's Prepper Lifestyle After Hurricane Katrina?,"From rock climbing to stocking up on supplies, Jack Osbourne reveals how one moment changed his approach to disaster readiness. Continue reading…",https://loudwire.com/jack-osbourne-doomsday-prepper/,https://townsquare.media/site/366/files/2026/01/attachment-featured-images-2026-01-07t164341-050.jpg?w=1200&q=75&format=natural,,"You should consider yourself lucky if you're friends with Jack Osbourne in the event of a doomsday scenario.
During a recent podcast appearance, Jack revealed that he had gotten heavily into prepper… [+3124 chars]",,"Was hat Jack Osbournes Prepper-Lebensstil nach dem Hurrikan Katrina inspiriert? Vom Klettern am Fels bis zum Auffüllen von Vorräten verrät Jack Osbourne, wie sich in einem Moment seine Herangehensweise an die Katastrophenvorsorge verändert hat. Weiterlesen…","What Inspired Jack Osbourne's Prepper Lifestyle After Hurricane Katrina?. From rock climbing to stocking up on supplies, Jack Osbourne reveals how one moment changed his approach to disaster readiness. Continue reading…","What Inspired Jack Osbourne's Prepper Lifestyle After Hurricane Katrina?. Ex rupe ascendendo ad commeatus instruendas, Jack Osbourne ostendit quomodo unum momentum accessus ad calamitatem promptitudinem mutaverit. Continue reading…",2026-01-10 14:31:10+00:00
6ae38e0e8d3f56c8e0fbdb11d8c261f2,2026-01-08T17:00:00Z,'hurricane',shows.acast.com,en,0.7,Rational Security: The “Caracas Like a Hurricane” Special Venezuela Edition,"This week, Scott sat down with his Lawfare colleagues Benjamin Wittes, Natalie Orpett, and Molly Roberts for a special deep-dive into the intervention in Venezuela, including:<ul><li>“A Hop, Skip, and Jump Across the Rubicon.” This past weekend, the Trump adm…",https://shows.acast.com/lawfare/episodes/rational-security-the-caracas-like-a-hurricane-special-venez,https://open-images.acast.com/shows/60518a52f69aa815d2dba41c/1767889508161-ed827262-9076-4fd7-be39-8c63cedf00bd.jpeg?height=315,,"This week, Scott sat down with his Lawfare colleagues Benjamin Wittes, Natalie Orpett, and Molly Roberts for a special deep-dive into the intervention in Venezuela, including:
<ul><li>A Hop, Skip, a… [+2304 chars]",,"Rationale Sicherheit: Die Venezuela-Sonderausgabe „Caracas wie ein Hurrikan“. Diese Woche setzte sich Scott mit seinen Lawfare-Kollegen Benjamin Wittes, Natalie Orpett und Molly Roberts zusammen, um einen besonderen Einblick in die Intervention in Venezuela zu erhalten, darunter: „Ein Hüpfer, ein Sprung und ein Sprung über den Rubikon.“ Am vergangenen Wochenende hat der Trump-Administrator …","Rational Security: The “Caracas Like a Hurricane” Special Venezuela Edition. This week, Scott sat down with his Lawfare colleagues Benjamin Wittes, Natalie Orpett, and Molly Roberts for a special deep-dive into the intervention in Venezuela, including:<ul><li>“A Hop, Skip, and Jump Across the Rubicon.” This past weekend, the Trump adm…","Securitas rationalis: ""Caracas Velut Procellae"" Praecipua Venezuela Edition. Hac septimana Scott sederunt cum collegis suis Lawfare Beniamin Wittes, Natalie Orpett, et Molly Roberts ob singularem in Venetiola interventum profundo, incluso: <ul><li> ""Hop, Skip, et trans Rubiconis Salire."" Praeterita volutpat vestibulum, tuba adm…",2026-01-10 14:31:10+00:00
f1c537f7b493bf2d97159e82ac0a2d33,2026-01-08T01:49:04Z,'hurricane',post.rlsbb.to,en,0.9,Nigel Latta Blows Stuff Up S01 1080p CUR WEB-DL H264-BLOOM,Have you ever wondered what it's like to be struck by lightning or be propelled by hurricane-speed winds? What is it really like inside a burning house? In this fun (and funny!) science series Nigel Latta subjects himself to a variety of 'don't try this at ho…,https://post.rlsbb.to/nigel-latta-blows-stuff-up-s01-1080p-cur-web-dl-h264-bloom/,,,Have you ever wondered what it's like to be struck by lightning or be propelled by hurricane-speed winds? What is it really like inside a burning house? In this fun (and funny!) science series Nigel … [+331 chars],,"Nigel Latta bläst Sachen in die Luft S01 1080p CUR WEB-DL H264-BLOOM. Haben Sie sich jemals gefragt, wie es ist, vom Blitz getroffen zu werden oder von Winden mit Hurrikangeschwindigkeit angetrieben zu werden? Wie ist es wirklich in einem brennenden Haus? In dieser unterhaltsamen (und witzigen!) Wissenschaftsreihe unterwirft sich Nigel Latta einer Reihe von „Versuchen Sie das nicht zu Hause …“",Nigel Latta Blows Stuff Up S01 1080p CUR WEB-DL H264-BLOOM. Have you ever wondered what it's like to be struck by lightning or be propelled by hurricane-speed winds? What is it really like inside a burning house? In this fun (and funny!) science series Nigel Latta subjects himself to a variety of 'don't try this at ho…,"Nigel Latta Blow Stuff Up S01 1080p CUR WEB-DL H264-FLOR. Mirarisne unquam quid fulmini simile sit, vel ventorum cursu propelli? Quid est vere sicut intra domum ardentem? In hoc ioco (et ridiculo!) scientiarum series Nigel Latta se variis de rebus 'noli hoc in ho ... tempta.",2026-01-10 14:31:10+00:00
7f80782bac6a295d1d4552c0e59bc635,2026-01-08T13:10:28Z,'hurricane',financialpost.com,en,0.9,Storm Goretti to Batter Europe With Heavy Snow and Violent Winds,"A winter storm is set to lash northern Europe with hurricane-force winds, along with heavy rain and snow as it moves through the region late on Thursday and Friday.",https://financialpost.com/pmn/business-pmn/storm-goretti-to-batter-europe-with-heavy-snow-and-violent-winds,,,"(Bloomberg) A winter storm is set to lash northern Europe with hurricane-force winds, along with heavy rain and snow as it moves through the region late on Thursday and Friday.
THIS CONTENT IS RESER… [+4230 chars]",,Sturm Goretti überschwemmt Europa mit starkem Schneefall und heftigen Winden. Ein Wintersturm wird Nordeuropa am späten Donnerstag und Freitag mit orkanartigen Winden sowie starkem Regen und Schnee über die Region fegen.,"Storm Goretti to Batter Europe With Heavy Snow and Violent Winds. A winter storm is set to lash northern Europe with hurricane-force winds, along with heavy rain and snow as it moves through the region late on Thursday and Friday.","Tempestas Goretti ad Europam Batter Cum Gravis Nives et Vehemens Ventis. Tempestas hiemalis posita est in Europam septentrionalem cum impetu ventorum verberare, cum gravibus pluviis et nivibus per regionem sero die Iovis et Veneris movens.",2026-01-10 14:31:10+00:00
2abcb0800a9fc250c335691b8b53d17d,2026-01-08T16:23:26Z,'hurricane',www.insurancejournal.com,en,0.9,"Storm Goretti to Hit Europe With Heavy Snow, Violent Winds","A winter storm is set to lash northern Europe with hurricane-force winds, along with heavy rain and snow as it moves through the region late on Thursday and Friday. Storm Goretti is expected to gather energy as low pressure deepens …",https://www.insurancejournal.com/news/international/2026/01/08/853605.htm,https://www.insurancejournal.com/img/social/opengraph/ij-social-default-1200x630.png,,"A winter storm is set to lash northern Europe with hurricane-force winds, along with heavy rain and snow as it moves through the region late on Thursday and Friday.Storm Goretti is expected to gather… [+2006 chars]",,"Sturm Goretti wird Europa mit starkem Schneefall und heftigen Winden treffen. Ein Wintersturm wird Nordeuropa am späten Donnerstag und Freitag mit orkanartigen Winden sowie starkem Regen und Schnee über die Region fegen. Es wird erwartet, dass Sturm Goretti an Kraft gewinnt, wenn sich der Tiefdruck verschärft …","Storm Goretti to Hit Europe With Heavy Snow, Violent Winds. A winter storm is set to lash northern Europe with hurricane-force winds, along with heavy rain and snow as it moves through the region late on Thursday and Friday. Storm Goretti is expected to gather energy as low pressure deepens …","Tempestas Goretti ad Europam percute Gravibus Nubila, ventis violentis. Tempestas hiemalis posita est in Europam septentrionalem cum impetu ventorum verberare, cum gravibus pluviis et nivibus per regionem sero die Iovis et Veneris movens. Tempestas Goretti expectat industriam colligere quam humilis pressura profundior ...",2026-01-10 14:31:10+00:00
3280525bbe9e2bda5b35351db87e0000,2026-01-07T19:52:05Z,'tropical cyclone',www.abc.net.au,en,0.9,Far North Queensland braces for a deluge of rain and possible cyclone,A tropical low has been declared over the Coral Sea and it is expected to move towards the Far North Queensland coast over the next few days. The bureau said there is a moderate chance it could develop into a tropical cyclone.,https://www.abc.net.au/news/2026-01-08/far-north-east-qld-braces-for-deluge-of-rain-possible-cyclone/106207878,https://live-production.wcms.abc-cdn.net.au/2736c73fb3b68477c3c122a09f62d159?impolicy=wcms_watermark_news&cropH=2268&cropW=4032&xPos=0&yPos=0&width=862&height=485&imformat=generic,,"Residents in Queensland's far north-east and down the coast to Proserpine are preparing for severe weather and flooding, as the Bureau of Meteorology (BOM) monitors a new declared tropical low over t… [+4469 chars]",,"Der hohe Norden von Queensland bereitet sich auf eine Regenflut und einen möglichen Wirbelsturm vor. Über dem Korallenmeer wurde ein tropisches Tief ausgerufen und es wird erwartet, dass es sich in den nächsten Tagen in Richtung der Küste des hohen Nordens von Queensland bewegt. Das Büro sagte, es bestehe eine mäßige Wahrscheinlichkeit, dass es sich zu einem tropischen Wirbelsturm entwickeln könnte.",Far North Queensland braces for a deluge of rain and possible cyclone. A tropical low has been declared over the Coral Sea and it is expected to move towards the Far North Queensland coast over the next few days. The bureau said there is a moderate chance it could develop into a tropical cyclone.,Longe Reginae Septentrionalis adstringit ad diluvium pluviae et cyclonem possibilem. Tropica humilis indicata est per Mare Corallium et expectatur se movere ad oram longinquam Reginalis Septentrionalis per paucos dies proximos. The hendrerit dixit occasionem modicus esse potuisse in cyclo tropico evolvere.,2026-01-10 20:33:35+00:00
96adaa0fc81dbd0263c372876a6824a7,2026-01-08T19:54:49Z,'tropical cyclone',www.abc.net.au,en,0.9,Moderate chance of tropical cyclone developing over north east coast,"A tropical low off the Coral Coast could have the potential to become a tropical cyclone over the weekend, as residents across the far North Coast prepare for heavy rainfall.",https://www.abc.net.au/news/2026-01-09/tropical-low-to-hit-far-north-queensland-late-friday/106211562,https://live-production.wcms.abc-cdn.net.au/b3533b08494417162034059531657b42?impolicy=wcms_watermark_news&cropH=1080&cropW=1920&xPos=0&yPos=0&width=862&height=485&imformat=generic,http://web.archive.org/web/20260109022930/https://www.abc.net.au/news/2026-01-09/tropical-low-to-hit-far-north-queensland-late-friday/106211562,"The Bureau of Meteorology has issued a severe weather warning for broad parts of north and Far North Queensland, stretching all the way from Cooktown down to Hamilton Island, including Townsville, Bo… [+4822 chars]",,"Mäßige Wahrscheinlichkeit, dass sich über der Nordostküste ein tropischer Wirbelsturm entwickelt. Ein tropisches Tief vor der Korallenküste könnte sich am Wochenende zu einem tropischen Wirbelsturm entwickeln, da sich die Bewohner an der äußersten Nordküste auf starke Regenfälle einstellen.","Moderate chance of tropical cyclone developing over north east coast. A tropical low off the Coral Coast could have the potential to become a tropical cyclone over the weekend, as residents across the far North Coast prepare for heavy rainfall.","Casus modicus cycli tropici super oram orientalem septentrionalem evolutionis. Tropicus humilis off Coral Coast potentiam habere potuit ut cyclo tropicus fiat super volutpat, sicut habitant per longam Coast Septentrionalem pluvias graves praeparant.",2026-01-10 20:33:35+00:00
55a0e07d87a8d4ef01ab368618866a08,2026-01-09T14:55:01Z,'hurricane',www.carriermanagement.com,en,0.9,Surge of Supercharged Hurricanes Prompt Call for Cat 6 Classification,"Scientists warn that warming sea surface temperatures are fueling a surge of extreme, off-the-charts storms, prompting a new hurricane category. Warm, deep ocean hot spots are leading to stronger and more dangerous hurricanes and typhoons, according to new re…",https://www.carriermanagement.com/news/2026/01/08/283252.htm,https://www.insurancejournal.com/app/uploads/2026/01/satellite-view-of-hurricane-1543208143-AdobeStock-scaled.jpeg,,"Scientists warn that warming sea surface temperatures are fueling a surge of extreme, off-the-charts storms, prompting a new hurricane category.
Warm, deep ocean hot spots are leading to stronger an… [+5545 chars]",,"Die Welle hochaufgeladener Hurrikane fordert eine Einstufung in Kategorie 6. Wissenschaftler warnen, dass die Erwärmung der Meeresoberflächentemperaturen zu einer Welle extremer, ungewöhnlicher Stürme führt und eine neue Hurrikankategorie auslöst. Laut neuen Erkenntnissen führen warme Hotspots in der Tiefsee zu stärkeren und gefährlicheren Hurrikanen und Taifunen.","Surge of Supercharged Hurricanes Prompt Call for Cat 6 Classification. Scientists warn that warming sea surface temperatures are fueling a surge of extreme, off-the-charts storms, prompting a new hurricane category. Warm, deep ocean hot spots are leading to stronger and more dangerous hurricanes and typhoons, according to new re…","Surge supercharged turbinum Promptus Call pro Cat VI Classification. Docti monent temperaturas superficiei maris calefacere aestum extremae, extemporalitatis procellas, novum categoriae procellae monentes. Calidum, altum oceanum calidum maculis validioribus et periculosioribus turbinibus et typhonibus ducunt, secundum novam re…",2026-01-10 20:33:35+00:00
9a8eb8d9aa40aebc8ace94dc9d680ea3,2026-01-09T20:19:05Z,'tropical cyclone',www.abc.net.au,en,0.9,North Queensland braces for tropical cyclone likely to form today,North Queensland residents are readying themselves as a tropical low is likely to become a category one cyclone later today.,https://www.abc.net.au/news/2026-01-10/queensland-tropical-low-expected-to-intensify-into-cyclone-koji/106213662,https://live-production.wcms.abc-cdn.net.au/daa0b102962474cf4d1c1682588fe043?impolicy=wcms_watermark_news&cropH=3238&cropW=5757&xPos=0&yPos=300&width=862&height=485&imformat=generic,,"Residents in North Queensland are bracing for damaging winds, heavy rain and flooding between Cairns and Townsville, as a tropical low likely to intensify into a cyclone lingers off the coast.
The B… [+6501 chars]",,"North Queensland bereitet sich auf einen tropischen Wirbelsturm vor, der sich heute wahrscheinlich bilden wird. Die Bewohner von Nord-Queensland bereiten sich darauf vor, dass sich ein tropisches Tief später heute wahrscheinlich zu einem Zyklon der Kategorie 1 entwickeln wird.",North Queensland braces for tropical cyclone likely to form today. North Queensland residents are readying themselves as a tropical low is likely to become a category one cyclone later today.,Queensland septentrionalis adstringit ad cyclum tropicum verisimile hodie formare. Reginae septentrionalis incolas se parant ut humilem tropicam esse verisimile fiet categoriam unius cyclonis postea hodie.,2026-01-10 20:33:35+00:00
3f2756c5b39116d58bcc263b277cea0b,2026-01-07T09:00:00Z,'hurricane evacuation',www.cbc.ca,en,0.2,Turbulence is getting worse. Would it be better if planes looked more like birds?,"Pilots can’t see it coming, and it’s hard to avoid. But severe clear-air turbulence can shake a plane ‘like King Kong.’ It’s on the rise, and forecast to get worse due to climate change. The rise has researchers investigating how to better predict clear-air t…",https://www.cbc.ca/radio/whatonearth/clear-air-turbulence-prediction-planes-birds-9.7017065,"https://i.cbc.ca/ais/f52cfb59-0770-4fb2-8fc4-d9adc17c48c3,1766090971522/full/max/0/default.jpg?im=Crop%2Crect%3D%280%2C9%2C1148%2C645%29%3BResize%3D620",,"When Luke Wheeldon stepped onto Air Canada Flight AC33 in July of 2019, he was exhausted. 

He was heading home to Australia after his band, Hurricane Fall, played a music festival in P.E.I. Keen for… [+8400 chars]",,"Die Turbulenzen werden schlimmer. Wäre es besser, wenn Flugzeuge eher wie Vögel aussehen würden? Piloten können es nicht kommen sehen und es ist schwer zu vermeiden. Aber schwere Turbulenzen bei klarer Luft können ein Flugzeug „wie King Kong“ erschüttern. Sie nehmen zu und werden sich voraussichtlich aufgrund des Klimawandels verschlimmern. Der Anstieg veranlasst Forscher dazu, zu untersuchen, wie sich die Zeit bei klarer Luft besser vorhersagen lässt …","Turbulence is getting worse. Would it be better if planes looked more like birds?. Pilots can’t see it coming, and it’s hard to avoid. But severe clear-air turbulence can shake a plane ‘like King Kong.’ It’s on the rise, and forecast to get worse due to climate change. The rise has researchers investigating how to better predict clear-air t…","Turbo est pejus. Meliusne esset, si planis avibus similiores viderentur? Gubernatores eum venientem videre non possunt, et difficile est vitare. Sed gravis serenitas aeris potest movere planum 'sicut Rex Kong.' Est in ortu et praecognoscere graviora fieri propter mutationem climatis. Ortum habet inquisitores indagantes quomodo melius praedicere t-aerem lucidum…",2026-01-11 20:33:58+00:00
