index,published,keyword,domain,language,valid,title,description,url,image,archive,content,quote,de,en,la,added
73feff36d000d7018a4d594663b02b97,2023-09-09T09:00:00Z,'hurricane',www.cbc.ca,en,0.7,All eyes are on Hurricane Lee in Atlantic Canada,CBC Meteorologist Ryan Snoddon has a closer look at Hurricane Lee and the main factors for the eventual path of the storm,https://www.cbc.ca/news/canada/nova-scotia/weather-ryan-snoddon-hurricane-lee-1.6960749,https://i.cbc.ca/1.6960840.1694226248!/fileImage/httpImage/image.jpg_gen/derivatives/16x9_620/hurricane-lee.jpg,http://web.archive.org/web/20230909223324/https://www.cbc.ca/news/canada/nova-scotia/weather-ryan-snoddon-hurricane-lee-1.6960749,"Hurricane Lee is a powerful hurricane slowly tracking through the Caribbean.
There is good forecast model agreement that Lee will continue to track west northwest over the next few days, tracking ma… [+3279 chars]",,Alle Augen sind auf den Hurrikan Lee im atlantischen Kanada gerichtet. CBC-Meteorologe Ryan Snoddon wirft einen genaueren Blick auf Hurrikan Lee und die Hauptfaktoren für den letztendlichen Verlauf des Sturms,All eyes are on Hurricane Lee in Atlantic Canada. CBC Meteorologist Ryan Snoddon has a closer look at Hurricane Lee and the main factors for the eventual path of the storm,Omnes oculi in Turbo Lee in Canada Atlantica sunt. CBC Meteorologist Ryan Snoddon propius aspectum habet in Procellae Lee et factores principales ad viam tempestatis eventualem.,2025-12-18 14:59:04+00:00
0a1a6a4121b924bc325dd3be65b7ad4a,2023-09-09T10:00:00Z,veryUnusualAndNeverUsedKeyword,www.space.com,en,0.7,Hurricane Lee looks absolutely terrifying in this footage from inside its eye (video),"Storm chasers with the Air Force Reserve's Hurricane Hunters caught terrifying footage from inside the eye of Hurricane Lee on Sept. 8, showing the storm brimming with lightning.",https://www.space.com/hurricane-lee-lightning-eye-video,https://cdn.mos.cms.futurecdn.net/AD7wN83jtnAhHoNyCjj7PZ-1200-80.jpg,http://web.archive.org/web/20230909222746/https://www.space.com/hurricane-lee-lightning-eye-video,"Storm chasers caught terrifying footage from inside the eye of Hurricane Lee on Friday (Sept. 8).
The footage of the hurricane shows lightning crackling throughout the storm as its jet-black eye loo… [+2208 chars]",,"Hurrikan Lee sieht in diesem Filmmaterial aus seinem Inneren absolut erschreckend aus (Video). Sturmjäger der Hurricane Hunters der Air Force Reserve machten am 8. September erschreckende Aufnahmen aus dem Auge des Hurrikans Lee, die den Sturm voller Blitze zeigen.","Hurricane Lee looks absolutely terrifying in this footage from inside its eye (video). Storm chasers with the Air Force Reserve's Hurricane Hunters caught terrifying footage from inside the eye of Hurricane Lee on Sept. 8, showing the storm brimming with lightning.","Procellae Lee spectat absolute terribilem in hoc footage ab intra suum oculum (video). Tempestas caesores cum Subsidium Air Force Venatores Procellae terribiles capiunt pedites ab intra oculum Hurricane Lee die 8 Sept., tempestatem repletam fulmine ostendentes.",2025-12-18 14:59:04+00:00
ea237794d1952f89e395579423312a2e,2023-09-09T11:18:21Z,'hurricane',abcnews.go.com,en,0.7,Heavy swells pound northeast Caribbean as Hurricane Lee charges through open waters,Large swells are battering the northeast Caribbean as Hurricane Lee churns nearby through open waters as a Category 3 storm,https://abcnews.go.com/International/wireStory/heavy-swells-pound-northeast-caribbean-hurricane-lee-charges-103050803,https://i.abcnewsfe.com/a/e4193e39-035b-4d09-9cb3-cfdf2b46d4e8/wirestory_cfd1840ab0e92d9d6af71878aec0b187_12x5.jpg?w=992,http://web.archive.org/web/20230910020855/https://abcnews.go.com/International/wireStory/heavy-swells-pound-northeast-caribbean-hurricane-lee-charges-103050803,"SAN JUAN, Puerto Rico -- Large swells battered the northeast Caribbean on Saturday as Hurricane Lee churned nearby through open waters as a Category 3 storm.
The storm, which is not forecast to make… [+3234 chars]",,"Schwere Wellen erschüttern die Nordostkaribik, während Hurrikan Lee durch offene Gewässer stürmt. Große Wellen erschüttern die Nordostkaribik, während Hurrikan Lee als Sturm der Kategorie 3 in der Nähe durch offene Gewässer fegt",Heavy swells pound northeast Caribbean as Hurricane Lee charges through open waters. Large swells are battering the northeast Caribbean as Hurricane Lee churns nearby through open waters as a Category 3 storm,Gravis minas tumet ad septentriones Caribbean ut Procellae Lee per apertas criminationes aquas. Ingentes tumores inter septentriones et orientem solem sicut Procellae Lee conturbant prope per apertas aquas sicut a Categoria 3 procella,2025-12-18 14:59:04+00:00
516df1989cb947727e2cd73a4bd6f896,2023-09-09T11:32:06Z,veryUnusualAndNeverUsedKeyword,www.bostonglobe.com,en,0.7,Heavy swells pound northeast Caribbean as Hurricane Lee charges through open waters,Large swells battered the northeast Caribbean on Saturday as Hurricane Lee churned nearby through open waters as a Category 3 storm.,https://www.bostonglobe.com/2023/09/09/world/heavy-swells-pound-northeast-caribbean-hurricane-lee-charges-through-open-waters/,https://bostonglobe-prod.cdn.arcpublishing.com/resizer/nZD05SKgK7-GqYxlTWL-S286vV4=/506x0/cloudfront-us-east-1.images.arcpublishing.com/bostonglobe/O54OD3L7URP7PUQ2NCLV7JEJIY.jpg,http://web.archive.org/web/20230912185538/https://www.bostonglobe.com/2023/09/09/world/heavy-swells-pound-northeast-caribbean-hurricane-lee-charges-through-open-waters/,"This was one of the fastest rates of strengthening in the Atlantic Basin on record, AccuWeather said in a statement.
Saturday, Sept 9th 5 AM AST Key Messages for Hurricane #Lee: It is too soon to kn… [+3079 chars]",,"Schwere Wellen erschüttern die Nordostkaribik, während Hurrikan Lee durch offene Gewässer stürmt. Große Wellen erschütterten am Samstag die nordöstliche Karibik, als Hurrikan Lee als Sturm der Kategorie 3 in der Nähe durch offene Gewässer fegte.",Heavy swells pound northeast Caribbean as Hurricane Lee charges through open waters. Large swells battered the northeast Caribbean on Saturday as Hurricane Lee churned nearby through open waters as a Category 3 storm.,Gravis minas tumet ad septentriones Caribbean ut Procellae Lee per apertas criminationes aquas. Ingens tumet Caribbean inter septentriones et orientem die Sabbati sicut Procellae Lee prope per apertas aquas sicut Categoria 3 procella turbetur.,2025-12-18 14:59:04+00:00
e7b08411f58e069fd5891e521ec105b6,2023-09-09T12:00:50Z,'hurricane',finance.yahoo.com,en,0.7,Gas Prices Could Spike to $6 a Gallon Due To ‘Active Hurricane Season’,Many factors influence fuel prices at the pump here in the U.S. Holiday weekends typically bring a spike in gas prices. Oil output among suppliers in the...,https://finance.yahoo.com/news/gas-prices-could-spike-6-120050721.html,https://s.yimg.com/ny/api/res/1.2/gr5OECFj2yosiN7UNUIi9A--/YXBwaWQ9aGlnaGxhbmRlcjt3PTEyMDA7aD02NzU-/https://media.zenfs.com/en/gobankingrates_644/61ef03fd5654057d6cae70a20b245241,http://web.archive.org/web/20230910021248/https://finance.yahoo.com/news/gas-prices-could-spike-6-120050721.html,"Guillem de Balanzo / Getty Images/iStockphoto
Many factors influence fuel prices at the pump here in the U.S. Holiday weekends typically bring a spike in gas prices. Oil output among suppliers in th… [+1697 chars]",,Die Benzinpreise könnten aufgrund der „aktiven Hurrikansaison“ auf 6 US-Dollar pro Gallone steigen. Viele Faktoren beeinflussen die Kraftstoffpreise an der Zapfsäule hier in den USA. Feiertagswochenenden bringen normalerweise einen Anstieg der Benzinpreise mit sich. Ölförderung der Lieferanten in der...,Gas Prices Could Spike to $6 a Gallon Due To ‘Active Hurricane Season’. Many factors influence fuel prices at the pump here in the U.S. Holiday weekends typically bring a spike in gas prices. Oil output among suppliers in the...,Gas Prices Potuerunt despicere ad $6 a Gallon Due Ad 'Tempus activum Hurricane'. Plures factores valent pretia cibus apud sentinam hic in US weekends nullas fere spicam in pretia gasi afferunt. Oleum output in amet in...,2025-12-18 14:59:04+00:00
720149264bbdac656bf4557cc7226c2b,2023-09-09T17:38:24Z,veryUnusualAndNeverUsedKeyword,www.thedailybeast.com,en,0.7,Hurricane Lee Downgraded to Category 3 But May Strengthen Again,"NOAA
Hurricane Lee has been downgraded to a Category 3 storm, the U.S. National Hurricane Center (NHC) said Saturday, but warned it may gain strengthen again in the next few days.Lee is positioned hundreds of miles east of the Caribbean as of Saturday mornin…",https://www.thedailybeast.com/hurricane-lee-downgraded-to-category-3-but-may-strengthen-again-national-hurricane-center-says,"https://img.thedailybeast.com/image/upload/c_crop,d_placeholder_euli9k,h_642,w_1142,x_501,y_61/dpr_2.0/c_limit,w_740/fl_lossy,q_auto/v1694279716/2023-09-09T154004Z_1105962901_RC2253AF0YKI_RTRMADP_3_HURRICANE-LEE_bf9kyr",http://web.archive.org/web/20230910025128/https://www.thedailybeast.com/hurricane-lee-downgraded-to-category-3-but-may-strengthen-again-national-hurricane-center-says,"Hurricane Lee has been downgraded to a Category 3 storm, the U.S. National Hurricane Center (NHC) said Saturday, but warned it may gain strengthen again in the next few days.
Lee is positioned hundr… [+1206 chars]",,"Hurrikan Lee wurde auf Kategorie 3 herabgestuft, könnte sich aber wieder verstärken. NOAA
Hurrikan Lee wurde auf einen Sturm der Kategorie 3 herabgestuft, teilte das US-amerikanische National Hurricane Center (NHC) am Samstag mit, warnte jedoch davor, dass er in den nächsten Tagen wieder stärker werden könnte. Seit Samstagmorgen befindet sich Lee Hunderte Meilen östlich der Karibik.","Hurricane Lee Downgraded to Category 3 But May Strengthen Again. NOAA
Hurricane Lee has been downgraded to a Category 3 storm, the U.S. National Hurricane Center (NHC) said Saturday, but warned it may gain strengthen again in the next few days.Lee is positioned hundreds of miles east of the Caribbean as of Saturday mornin…","Procellae Lee Downgraded ad Categoria III Sed confirma Iterum. NOAA
Procellae Lee ad Categoriam 3 procellam deiecta est, US National Hurricane Centre (NHC) Saturni dixit, sed monuit ut in proximis paucis diebus iterum confirmaret. Lee centum milia passuum ab oriente Caribici sicut Saturni mornin ... collocatur.",2025-12-18 14:59:04+00:00
469fc855f9db45233084f00190afc249,2023-09-09T17:51:31Z,veryUnusualAndNeverUsedKeyword,nypost.com,en,0.7,Video goes inside powerful Hurricane Lee — monster set to regain strength,Video from the eye of Hurricane Lee shows the powerful storm as it generated flashes of lighting and whipped up winds of 165 MPH earlier this week.,https://nypost.com/2023/09/09/video-goes-inside-powerful-hurricane-lee/,https://nypost.com/wp-content/uploads/sites/2/2023/09/NYPICHPDPICT000032801631.jpg?quality=75&strip=all&w=1024,http://web.archive.org/web/20230910023600/https://nypost.com/2023/09/09/video-goes-inside-powerful-hurricane-lee/,"Stormchaser video taken inside the eye of the monstrous Hurricane Lee shows the powerful storm as it generated flashes of lighting and whipped up winds of 165 mph earlier this week.
The Air Force Re… [+2258 chars]",,"Das Video zeigt das Innere des mächtigen Hurrikans Lee – ein Monster, das wieder zu Kräften kommen wird. Ein Video aus dem Auge des Hurrikans Lee zeigt den starken Sturm, wie er Anfang dieser Woche Blitze erzeugte und Windgeschwindigkeiten von 165 MPH aufwirbelte.",Video goes inside powerful Hurricane Lee — monster set to regain strength. Video from the eye of Hurricane Lee shows the powerful storm as it generated flashes of lighting and whipped up winds of 165 MPH earlier this week.,Video potentem Procellae Lee intus vadit - monstrum ad vires recuperandas. Video ab oculo Turbo Lee tempestatem potentem ostendit cum generata fulgura accendendi et flagellanda ventos 165 MPH hac septimana ante.,2025-12-18 14:59:04+00:00
574d410fd1f450edabac052b886403ab,2023-09-09T17:52:06Z,'typhoon',biztoc.com,en,0.7,South China small businesses start to count cost of record rains,"Shop owners in a town in China's southern manufacturing heartland tried to clean up the mess and started to count the cost of Typhoon Haikui on Saturday, as the lingering storm lumbered west after wreaking havoc. Two days after making landfall, Haikui brought…",https://biztoc.com/x/30d109940705d5a7,https://c.biztoc.com/p/30d109940705d5a7/s.webp,,"Shop owners in a town in China's southern manufacturing heartland tried to clean up the mess and started to count the cost of Typhoon Haikui on Saturday, as the lingering storm lumbered west after wr… [+292 chars]",,"Kleine Unternehmen in Südchina beginnen, die Kosten der Rekordregenfälle zu berechnen. Ladenbesitzer in einer Stadt im südlichen Produktionszentrum Chinas versuchten, das Chaos zu beseitigen, und begannen am Samstag, die Kosten für den Taifun Haikui zu berechnen, als der anhaltende Sturm nach verheerenden Verwüstungen nach Westen zog. Zwei Tage nach der Landung brachte Haikui…","South China small businesses start to count cost of record rains. Shop owners in a town in China's southern manufacturing heartland tried to clean up the mess and started to count the cost of Typhoon Haikui on Saturday, as the lingering storm lumbered west after wreaking havoc. Two days after making landfall, Haikui brought…","Sinae meridionales parvas negotiationes incipiunt ad sumptus recordum pluvias numerare. Tabernae possessores in oppido meditullio fabricando Sinarum meridionali pulmentum mundare conati sunt et sumptus Typhonis Haikui die Sabbati computare coeperunt, sicut tempestas diuturna in occidente post saevientem grassabatur. Biduo post traham, Haikui duxit…",2025-12-18 14:59:04+00:00
6af0fc25edae23ae69688073c3d690d3,2023-09-09T18:26:33Z,'hurricane',economictimes.indiatimes.com,en,0.7,Hurricane Jova unleashes surf swell at San Diego Coast; Here’s what happened,The World Surf League (WSL) is abuzz with excitement as the wind swell from Hurricane Jova approaches.,https://economictimes.indiatimes.com/news/international/us/hurricane-jova-unleashes-surf-swell-at-san-diego-coast-heres-what-happened/articleshow/103540907.cms,"https://economictimes.indiatimes.com/thumb/msid-103540927,width-1070,height-580,imgsize-192960,overlay-economictimes/photo.jpg",http://web.archive.org/web/20230914110338/https://economictimes.indiatimes.com/news/international/us/hurricane-jova-unleashes-surf-swell-at-san-diego-coast-heres-what-happened/articleshow/103540907.cms,"Hurricane Jova, a powerful force in the eastern Pacific, has unleashed a wind-driven swell that is making its way to the picturesque shores of San Diego. While the hurricane is gradually weakening, i… [+3184 chars]",,"Hurrikan Jova löst Brandungswellen an der Küste von San Diego aus; Hier ist, was passiert ist. Die World Surf League (WSL) ist voller Aufregung, als sich die Windwelle des Hurrikans Jova nähert.",Hurricane Jova unleashes surf swell at San Diego Coast; Here’s what happened. The World Surf League (WSL) is abuzz with excitement as the wind swell from Hurricane Jova approaches.,Hurricane Jova unleashes surf swell at San Diego Coast; Hic id factum est. Mundus Surf League (WSL) abuzz tumultus est ut ventus intumescens ab Hurricane Jova appropinquat.,2025-12-18 14:59:04+00:00
f2929f2a103eac6644a5f94aa6a20695,2023-09-10T04:34:24Z,'hurricane',www.voanews.com,en,0.7,Heavy Swells Pound Caribbean as Hurricane Lee Charges Through Open Waters,"Large swells battered the northeast Caribbean on Saturday night as Hurricane Lee churned nearby through open waters as a Category 2 storm.


The storm, which is not forecast to make landfall, was centered about 455 kilometers northeast of the northern Leeward…",https://www.voanews.com/a/heavy-swells-pound-caribbean-as-hurricane-lee-charges-through-open-waters-/7261781.html,https://gdb.voanews.com/01000000-0aff-0242-10d5-08dbb009608e_w1200_r1.jpg,http://web.archive.org/web/20230911013803/https://www.voanews.com/a/heavy-swells-pound-caribbean-as-hurricane-lee-charges-through-open-waters-/7261781.html,"SAN JUAN, Puerto Rico  Large swells battered the northeast Caribbean on Saturday night as Hurricane Lee churned nearby through open waters as a Category 2 storm.
The storm, which is not forecast to … [+3392 chars]",,"Schwere Wellen erschüttern die Karibik, während Hurrikan Lee durch offene Gewässer stürmt. Große Wellen erschütterten am Samstagabend die nordöstliche Karibik, als Hurrikan Lee als Sturm der Kategorie 2 in der Nähe durch offene Gewässer fegte.


Der Sturm, der voraussichtlich nicht auf Land treffen wird, konzentrierte sich etwa 455 Kilometer nordöstlich der nördlichen Leeward-Insel.","Heavy Swells Pound Caribbean as Hurricane Lee Charges Through Open Waters. Large swells battered the northeast Caribbean on Saturday night as Hurricane Lee churned nearby through open waters as a Category 2 storm.


The storm, which is not forecast to make landfall, was centered about 455 kilometers northeast of the northern Leeward…","Gravis Pound Caribbean sicut Procellae Lee felis ac per Open aquas. Ingens tumet Caribbean septentriones in nocte Sabbati quassavit sicut Hurricane Lee prope per apertas aquas sicut Categoria 2 procella turbetur.


Tempestas, quae terram ruinae facere non praevidet, circiter 455 chiliometrorum septentrionalium Leeward septentrionalis media est.",2025-12-18 14:59:04+00:00
f43f3b89ebc63b8e61e47a6f263cfee6,2023-09-10T11:24:06Z,'hurricane',www.bostonglobe.com,en,0.7,Hurricane Lee unleashes heavy swell on northern Caribbean as it charges through open waters,"Hurricane Lee barreled Sunday through open waters just northeast of the Caribbean, unleashing heavy swell on several islands.",https://www.bostonglobe.com/2023/09/10/world/hurricane-lee-unleashes-heavy-swell-northern-caribbean-it-charges-through-open-waters/,https://bostonglobe-prod.cdn.arcpublishing.com/resizer/nZD05SKgK7-GqYxlTWL-S286vV4=/506x0/cloudfront-us-east-1.images.arcpublishing.com/bostonglobe/O54OD3L7URP7PUQ2NCLV7JEJIY.jpg,http://web.archive.org/web/20230913101347/https://www.bostonglobe.com/2023/09/10/world/hurricane-lee-unleashes-heavy-swell-northern-caribbean-it-charges-through-open-waters/,"SAN JUAN, Puerto Rico Hurricane Lee barreled Sunday through open waters just northeast of the Caribbean, unleashing heavy swell on several islands.
The Category 2 storm is not forecast to make landf… [+2670 chars]",,"Hurrikan Lee löst in der nördlichen Karibik starken Wellengang aus, während er durch offene Gewässer stürmt. Hurrikan Lee fegte am Sonntag durch offene Gewässer nordöstlich der Karibik und löste auf mehreren Inseln starken Wellengang aus.","Hurricane Lee unleashes heavy swell on northern Caribbean as it charges through open waters. Hurricane Lee barreled Sunday through open waters just northeast of the Caribbean, unleashing heavy swell on several islands.","Turbo Lee gravem tumorem ingreditur Caribbean septentrionalem per apertas aquas incurrens. Procellae Lee Solis per apertas aquas sicut septentriones Caribici dolavit, graves invehitur in plures insulas intumescens.",2025-12-18 14:59:04+00:00
843308dc92be4d5e16599c1b32330453,2023-09-10T18:29:28Z,veryUnusualAndNeverUsedKeyword,www.usatoday.com,en,0.7,"Hurricane Lee updates: No direct hit expected, but rip currents headed to East Coast","Hurricane Lee was rolling north in the Atlantic Ocean on Sunday, gaining strength but not expected to unleash its full fury across U.S. shores.",https://www.usatoday.com/story/news/nation/2023/09/10/hurricane-lee-updates/70817120007/,https://s.yimg.com/ny/api/res/1.2/AGEDkftzYr6oSW4w7eHo5Q--/YXBwaWQ9aGlnaGxhbmRlcjt3PTEyMDA7aD05MTM-/https://media.zenfs.com/en/usa_today_news_641/18398aac4ec4528f83dee258a513d3da,http://web.archive.org/web/20230911035105/https://www.usatoday.com/story/news/nation/2023/09/10/hurricane-lee-updates/70817120007/,"One of the most powerful hurricanes in recent years was rolling north in the Atlantic Ocean on Sunday, gaining strength but not expected to unleash its full fury across U.S. shores.
The reprieve was… [+2306 chars]",,"Hurrikan Lee-Updates: Kein direkter Treffer erwartet, aber Strömungen ziehen auf die Ostküste zu. Hurrikan Lee rollte am Sonntag im Atlantischen Ozean nach Norden und gewann an Stärke, aber es ist nicht zu erwarten, dass er seine volle Wucht über die US-Küsten entfesselt.","Hurricane Lee updates: No direct hit expected, but rip currents headed to East Coast. Hurricane Lee was rolling north in the Atlantic Ocean on Sunday, gaining strength but not expected to unleash its full fury across U.S. shores.","Procellae Lee updates: Nulla directa hit expectata, sed rivos rip ad Orientem tendens. Procellae Lee septentrionem in Oceano Atlantico die Dominico volvebat, viribus aucta sed plenam furorem per litora Americae evellere non expectabat.",2025-12-18 14:59:04+00:00
1b8429a1bd866e8ddb3e152ecd1066bb,2023-09-10T19:24:09Z,veryUnusualAndNeverUsedKeyword,www.cbsnews.com,en,0.7,Jova causes dangerous surf and rip currents along California and Mexico,"As of Sunday morning, Jova was moving northwest at nearly 5 mph, with maximum sustained winds near 40 mph, the National Hurricane Center said​.",https://www.cbsnews.com/news/tropical-storm-jova-california-mexico-coasts-eastern-pacific-rip-currents/,https://assets1.cbsnewsstatic.com/hub/i/r/2023/09/10/4f8a841f-7274-49cb-8026-be519597198a/thumbnail/1200x630/3c10fa1edfc6a17ea00d37b2c799a1b0/screenshot-2023-09-10-at-2-34-47-pm.png?v=181d27d1e918a6408b48ea2e220df310,http://web.archive.org/web/20230911025533/https://www.cbsnews.com/news/tropical-storm-jova-california-mexico-coasts-eastern-pacific-rip-currents/,"Swells generated by Tropical Storm Jova will cause ""life-threatening"" beach conditions along portions of California's coast and the western coast of Mexico through Monday, according to the National W… [+979 chars]",,"Jova verursacht gefährliche Brandungs- und Strömungen entlang Kalifornien und Mexiko. Am Sonntagmorgen bewegte sich Jova mit einer Geschwindigkeit von fast 5 Meilen pro Stunde nach Nordwesten, mit maximalen Dauerwinden von etwa 40 Meilen pro Stunde, teilte das National Hurricane Center mit.","Jova causes dangerous surf and rip currents along California and Mexico. As of Sunday morning, Jova was moving northwest at nearly 5 mph, with maximum sustained winds near 40 mph, the National Hurricane Center said​.","Jova salo periculosos facit et flumina rip per California et Mexico. Cum mane Solis, Iova chorum fere 5 mph movebat, cum ventis maximis sustinentibus prope 40 mph, Centrum National Hurricane dixit.",2025-12-18 14:59:04+00:00
c1f626d31e15eb96a9de4003b82388c7,2023-09-10T19:55:28Z,'hurricane',slashdot.org,en,0.7,Blame Jova in Pacific Ocean for Southern California weather - Los Angeles Times,Blame Jova in Pacific Ocean for Southern California weatherLos Angeles Times Tropical Storm Jova causes dangerous surf and rip currents along coasts of California and MexicoCBS News Hurricane Jova off of Baja brings dangerous conditions on the coast and a fir…,https://slashdot.org/firehose.pl?op=view&amp;id=171797266,,http://web.archive.org/web/20160119174443/http://slashdot.org/firehose.pl?op=view,Sign up for the Slashdot newsletter! OR check out the new Slashdot job board to browse remote jobs or jobs in your areaDo you develop on GitHub? You can keep using GitHub but automatically sync your … [+268 chars],,Machen Sie Jova im Pazifischen Ozean für das Wetter in Südkalifornien verantwortlich – Los Angeles Times. Machen Sie Jova im Pazifischen Ozean für das Wetter in Südkalifornien verantwortlichLos Angeles Times Tropischer Sturm Jova verursacht gefährliche Brandungs- und Strömungen entlang der Küsten Kaliforniens und MexikosCBS News Hurrikan Jova vor Baja bringt gefährliche Bedingungen an der Küste und einen Brand…,Blame Jova in Pacific Ocean for Southern California weather - Los Angeles Times. Blame Jova in Pacific Ocean for Southern California weatherLos Angeles Times Tropical Storm Jova causes dangerous surf and rip currents along coasts of California and MexicoCBS News Hurricane Jova off of Baja brings dangerous conditions on the coast and a fir…,Culpa Jova in Oceano Pacifico pro tempestas Australi California - Los Angeles Times. Culpa Jova in Oceano Pacifico pro Southern California weatherLos Angeles Times Tropical Storm Jova periculosas salo facit et flumina rip per litora Californiae et MexicoCBS News Procellae Jova longinquitatem Baja periculosas condiciones in oram et abietem affert…,2025-12-18 14:59:04+00:00
4f0f01aa3451d86ad37cb36f1cf3011a,2023-09-10T20:38:12Z,'tropical cyclone',www.nhc.noaa.gov,en,0.7,Post-Tropical Cyclone Jova Graphics,"5-Day Uncertainty Track last updated Sun, 10 Sep 2023 20:38:12 GMT

 
Wind Speed Probabilities last updated Sun, 10 Sep 2023 20:38:12 GMT",https://www.nhc.noaa.gov/refresh/graphics_ep1+shtml/203812.shtml?cone,,,"Coastal Watches/Warnings and Forecast Cone for Storm Center
* If the storm is forecast to dissipate within 3 days, the ""Full Forecast"" and ""3 day"" graphic will be identical
Click Here for a 5-day C… [+2926 chars]",,"Posttropische Zyklon-Jova-Grafiken. 5-Tage-Unsicherheitsverlauf, zuletzt aktualisiert am Sonntag, 10. September 2023 um 20:38:12 Uhr GMT

 
Die Windgeschwindigkeitswahrscheinlichkeiten wurden zuletzt am Sonntag, 10. September 2023 um 20:38:12 Uhr GMT aktualisiert","Post-Tropical Cyclone Jova Graphics. 5-Day Uncertainty Track last updated Sun, 10 Sep 2023 20:38:12 GMT

 
Wind Speed Probabilities last updated Sun, 10 Sep 2023 20:38:12 GMT","Post-Tropical Cyclone Jova Graphica. 5-Dies Incertae semita renovationis sol, 10 Sep 2023 20:38:12 GMT

 
Ventus Speed Probabilia renovatio sol, 10 Sep 2023 20:38:12 GMT",2025-12-18 14:59:04+00:00
