index,published,keyword,domain,language,valid,title,description,url,image,archive,content,quote,de,en,la,added
358ac3372b607d3d880a95a1f050205b,2024-06-30T09:33:07Z,'hurricane',slashdot.org,en,0.9,Hurricane Beryl: Season's first hurricane to hit Caribbean - BBC.com,Hurricane Beryl: Season's first hurricane to hit CaribbeanBBC.com Beryl Forecast To Become Major Hurricane In Atlantic - Videos from The Weather ChannelThe Weather Channel Record hot oceans driving Hurricane BerylUSA TODAY Beryl strengthens into a Category 1 …,https://slashdot.org/firehose.pl?op=view&amp;id=174348117,,http://web.archive.org/web/20160119174443/http://slashdot.org/firehose.pl?op=view,"""The pathology is to want control, not that you ever get it, because of
course you never do.""
-- Gregory Bateson",,"Hurrikan Beryl: Der erste Hurrikan der Saison, der die Karibik heimgesucht hat – BBC.com. Hurrikan Beryl: Der erste Hurrikan der Saison trifft auf CaribbeanBBC.com. Beryl prognostiziert, dass er sich zu einem großen Hurrikan im Atlantik entwickeln wird – Videos von The Weather ChannelThe Weather Channel Rekordheiße Ozeane treiben Hurrikan BerylUSA HEUTE an. Beryl verstärkt sich zu einem Hurrikan der Kategorie 1 …",Hurricane Beryl: Season's first hurricane to hit Caribbean - BBC.com. Hurricane Beryl: Season's first hurricane to hit CaribbeanBBC.com Beryl Forecast To Become Major Hurricane In Atlantic - Videos from The Weather ChannelThe Weather Channel Record hot oceans driving Hurricane BerylUSA TODAY Beryl strengthens into a Category 1 …,Procellae Berylae: Primae tempestatis Temporum ut Caribbean feriat - BBC.com. Procellae Berylae: Primae tempestatis Temporum ferire CaribbeanBBC.com Beryllus Praedictio Maior fieri Procellae In Atlantic - Videos ab Tempestas ChannelThe Tempestas Channel Record Oceani calidi pulsis Procellae BerylUSA TODAY Beryllus in categoria 1 ... roborat.,2025-12-17 13:40:36+00:00
ed1f1a889d27beb6c22e2f240ee149a3,2024-06-30T12:36:49Z,'hurricane',www.cbsnews.com,en,0.9,Hurricane Beryl becomes powerful Category 3 storm as it nears Caribbean,"Hurricane Beryl is expected to hit the Windward Islands as an ""extremely dangerous"" Category 4 hurricane, the U.S.-based Nationall Hurricane Center said.",https://www.cbsnews.com/news/hurricane-beryl-forecast-powerful-storm-caribbean-islands/,https://assets2.cbsnewsstatic.com/hub/i/r/2024/06/29/6dcad20f-0101-460b-bf1f-75604b0c342a/thumbnail/1200x630/fa1105c23865c3e20c01e4b646b42c53/hurricane.jpg?v=a23cb4bdf4fa7f3cb72e5118085577f9,http://web.archive.org/web/20240701010623/https://www.cbsnews.com/news/hurricane-beryl-forecast-powerful-storm-caribbean-islands/,"Hurricane Beryl became the first Category 3 storm as it churned toward the southeast Caribbean, forecasters warned Sunday morning.
As of 7 a.m. ET, Beryl was located about 420 miles east-southeast o… [+4958 chars]",,"Hurrikan Beryl entwickelt sich zu einem starken Sturm der Kategorie 3, als er sich der Karibik nähert. Hurrikan Beryl wird die Windward Islands voraussichtlich als „extrem gefährlicher“ Hurrikan der Kategorie 4 treffen, teilte das in den USA ansässige National Hurricane Center mit.","Hurricane Beryl becomes powerful Category 3 storm as it nears Caribbean. Hurricane Beryl is expected to hit the Windward Islands as an ""extremely dangerous"" Category 4 hurricane, the U.S.-based Nationall Hurricane Center said.","Turbo Beryllus potens Categoria 3 procella fit ut Caribbean appropinquat. Procellae Berylae expectatur ut insulas Windwardas ferire sicut ""maxime periculosus"" Categoria 4 procellarum, quae US-Nationall Hurricane Centrum fundatur.",2025-12-17 13:40:36+00:00
df9d31285e2e87230f23d10c659b5cb7,2024-06-30T13:17:10Z,veryUnusualAndNeverUsedKeyword,www.cbc.ca,en,0.9,Hurricane Beryl described as 'very dangerous' Category 3 storm threatening southeast Caribbean,Beryl has been upgraded to a Category 3 hurricane by the U.S. National Hurricane Center as it travels westward in the southeast Caribbean.,https://www.cbc.ca/news/world/hurricane-beryl-caribbean-barbados-1.7251058,https://i.cbc.ca/1.7251060.1719752208!/fileImage/httpImage/image.jpg_gen/derivatives/16x9_620/tropical-weather.jpg,http://web.archive.org/web/20240630233200/https://www.cbc.ca/news/world/hurricane-beryl-caribbean-barbados-1.7251058,"Hurricane Beryl has been upgraded to a ""very dangerous"" Category 3 as it approaches the southeast Caribbean, the U.S. the National Hurricane Center said Sunday.
The hurricane is located about 675 ki… [+3484 chars]",,"Hurrikan Beryl wurde als „sehr gefährlicher“ Sturm der Kategorie 3 beschrieben, der die Südostkaribik bedroht. Beryl wurde vom U.S. National Hurricane Center auf seinem Weg nach Westen in der südöstlichen Karibik zu einem Hurrikan der Kategorie 3 eingestuft.",Hurricane Beryl described as 'very dangerous' Category 3 storm threatening southeast Caribbean. Beryl has been upgraded to a Category 3 hurricane by the U.S. National Hurricane Center as it travels westward in the southeast Caribbean.,"Procellae Berylae descripta esse 'periculosissima' Categoria 3 Tempestas minitans Caribbean meridiem versus. Beryl upgraded ad Categoriam 3 procellae ab US National Procellae Centri, quod ad occidentem versus pergit ad meridiem Caribbean.",2025-12-17 13:40:36+00:00
04f5e901c39eb5f432d68399f155574d,2024-06-30T13:21:17Z,'hurricane',www.ibtimes.com,en,0.9,Caribbean Braces As Hurricane Beryl Strengthens To 'Very Dangerous' Storm,"Beryl, the first hurricane of the 2024 Atlantic season, strengthened into a ""very dangerous"" Category 3 storm Sunday morning as it threatened the southeast Caribbean with potential life-threatening winds and storm surge, US forecasters said.",https://www.ibtimes.com/caribbean-braces-hurricane-beryl-strengthens-very-dangerous-storm-3735512,https://d.ibtimes.com/en/full/4532948/cars-line-gas-station-hurricane-beryl-heads-towards-bridgetown-barbados-june-29-2024.jpg,http://web.archive.org/web/20240701014020/https://www.ibtimes.com/caribbean-braces-hurricane-beryl-strengthens-very-dangerous-storm-3735512,"Beryl, the first hurricane of the 2024 Atlantic season, strengthened into a ""very dangerous"" Category 3 storm Sunday morning as it threatened the southeast Caribbean with potential life-threatening w… [+3122 chars]",,"Die Karibik bereitet sich darauf vor, dass sich Hurrikan Beryl zu einem „sehr gefährlichen“ Sturm entwickelt. Beryl, der erste Hurrikan der Atlantiksaison 2024, verstärkte sich am Sonntagmorgen zu einem „sehr gefährlichen“ Sturm der Kategorie 3, da er die südöstliche Karibik mit potenziell lebensbedrohlichen Winden und Sturmfluten bedrohte, sagten US-Prognostiker.","Caribbean Braces As Hurricane Beryl Strengthens To 'Very Dangerous' Storm. Beryl, the first hurricane of the 2024 Atlantic season, strengthened into a ""very dangerous"" Category 3 storm Sunday morning as it threatened the southeast Caribbean with potential life-threatening winds and storm surge, US forecasters said.","Caribbean Braces sicut Procellae Beryllus Confirmat 'Periculosum' Tempestatem. Beryl, prima procella temporis Atlantici anni 2024, confirmata in ""periculosum"" Categoria III tempestatem Dominicae mane, cum Caribbean meridiem imminebat cum potential vita-minantibus ventis et fluctu tempestatis, US forecasters dixit.",2025-12-17 13:40:36+00:00
48445f8019ae0a346c33d5a1b9b188aa,2024-06-30T13:21:33Z,'hurricane',www.forbes.com,en,0.9,Hurricane Beryl Explosively Intensified - What’s Next?,Hurricane Beryl has intensified to a dangerous major hurricane and is breaking records along the way. What's next for the Caribbean and U.S.?,https://www.forbes.com/sites/marshallshepherd/2024/06/30/hurricane-beryl-explosively-intensifiedwhats-next/,https://imageio.forbes.com/specials-images/imageserve/66815b3784f8bb56ec4d05b4/0x0.jpg?format=jpg&height=900&width=1600&fit=bounds,http://web.archive.org/web/20240701011952/https://www.forbes.com/sites/marshallshepherd/2024/06/30/hurricane-beryl-explosively-intensifiedwhats-next/,"Hurricane Beryl is now a major hurricane as of Sunday June 30th, 2024.
NOAA and Tropical Tidbits website
Just wow. Those two words are used sparingly by me because it is important to be credible no… [+3899 chars]",,Hurrikan Beryl hat sich explosionsartig verstärkt – wie geht es weiter? Hurrikan Beryl hat sich zu einem gefährlichen Großhurrikan entwickelt und bricht dabei Rekorde. Was kommt als nächstes für die Karibik und die USA?,Hurricane Beryl Explosively Intensified - What’s Next?. Hurricane Beryl has intensified to a dangerous major hurricane and is breaking records along the way. What's next for the Caribbean and U.S.?,Procellae Beryl Explosive auctae - What's Next?. Procellae Beryllus ad maiorem periculosam procellam intendit et tabulas per viam frangit. Quid deinde ad Caribbean et US?,2025-12-17 13:40:36+00:00
