index,published,keyword,domain,language,valid,title,description,url,image,archive,content,quote
52c4efaf5edf24bc01686f623d806c1b,2025-10-01T09:19:59Z,'typhoon',www.bbc.com,en,0.0,'State of calamity' as earthquake kills 69 in Philippines province,The earthquake comes barely more than a week after the country was hit by back-to-back typhoons.,https://www.bbc.com/news/articles/ced5pyjzej3o,https://ichef.bbci.co.uk/news/1024/branded_news/5ac2/live/0f27a350-9e9f-11f0-9f70-63cdd409bfce.jpg,,"Jonathan HeadSouth East Asia correspondent and
At least 69 people have been killed and dozens injured after a powerful 6.9 magnitude earthquake struck the central Philippines late on Tuesday.
The p… [+3600 chars]",
cbc09d825dfb4598835af4406874beb8,2025-10-01T10:00:18Z,'hurricane climate change',www.cbsnews.com,en,0.0,These hospitals face major flood risk. Experts say Trump is making it worse.,"Hospitals across the U.S. are at risk of significant flooding, and climate experts warn that the Trump administration's cuts leave the nation less prepared.",https://www.cbsnews.com/news/hospitals-flood-risk-trump-climate/,https://assets3.cbsnewsstatic.com/hub/i/r/2025/09/25/d000be6a-c607-42f0-a471-0f6251ea250f/thumbnail/1200x630/43c3f260f187712944bd2c10c05683fe/hospital-flood-risk10.jpg,,"LOUISVILLE, Tenn. — When a big storm hits, Peninsula Hospital could be underwater.
At this decades-old psychiatric hospital on the edge of the Tennessee River, an intense storm could submerge the bu… [+23631 chars]",
4893fb9dca8ed34ca68975c818af77a6,2025-10-01T10:36:00Z,'hurricane alert',www.independent.ie,en,0.0,Storm Amy: Met Éireann issues Status Yellow wind alert for Ireland and rain warning for 14 counties,Met Éireann has named the first storm of the season and issued a Status Yellow wind warning along with a Status Yellow rain warning for 14 counties as the country also braces for the “wet and very windy” arrival of Hurricane Humberto.,https://www.independent.ie/weather/storm-amy-met-eireann-issues-status-yellow-wind-alert-for-ireland-and-rain-warning-for-14-counties/a1172978844.html,https://focus.independent.ie/thumbor/KYkCXoJHGfPZCAo_cOI9dTLbWoQ=/0x0:1279x853/629x0/prod-mh-ireland/093bf13b-7a05-4dff-b1d1-65cc4d842fdd/56ef6c43-0e55-4a7d-a1c3-777d50826040/093bf13b-7a05-4dff-b1d1-65cc4d842fdd.jpg,,Met Éireann has named the first storm of the season and issued a Status Yellow wind warning along with a Status Yellow rain warning for 14 counties as the country also braces for the wet and very win… [+2103 chars],
3229377d9ea47ca7069a6ce82a669be9,2025-10-01T10:37:48Z,'hurricane warning',www.cbsnews.com,en,0.0,"Hurricanes Imelda, Humberto likely to bring dangerous conditions to East Coast","Hurricane Imelda is eyeing Bermuda and Hurricane Humberto has already passed it but, says the Miami-based National Hurricane Center, both are likely to bring dangerous conditions to much of the U.S. East Coast.",https://www.cbsnews.com/news/hurricane-imelda-humberto-maps-forecast-path-dangerous-surf-rip-currents-east-coast/,https://assets2.cbsnewsstatic.com/hub/i/r/2025/10/01/9a24b5d5-8f2a-41db-b460-f3cb903f2b80/thumbnail/1200x630/d079b737c3e622b98fc152c0ce82ff5d/imedla-cones-5a-100125.png,,"Hurricane Imelda is eyeing Bermuda and Hurricane Humberto has already passed it but, the National Hurricane Center said early Wednesday, both are likely to bring dangerous conditions behind them to a… [+1816 chars]",
efdfb9f068b9b1975b14001e1aa837a3,2025-10-02T10:45:28Z,'tropical cyclone',www.palmbeachpost.com,en,0.0,"National Hurricane Center tracking 2 new disturbances, including one that could impact Florida","An area of low pressure may form near the northwestern Bahamas and southern Florida by Saturday, Oct. 4.",https://www.palmbeachpost.com/story/weather/hurricane/2025/10/02/national-hurricane-center-tracking-storm-disturbances-florida-hurricane-imelda/86460148007/,https://media.zenfs.com/en/palm_beach_post_natl_articles_437/a89cde49494f7fb493783c5edf29b6a1,,"As Hurricane Imelda speeds away from Bermuda, the National Hurricane Center is now tracking two new disturbances, including one that could impact Florida.
Imelda moved over Bermuda Wednesday night, … [+8413 chars]",
a8b5fef97efae2acb148a3a28fd34550,2025-10-02T15:23:07Z,'hurricane season',www.foxweather.com,en,0.0,"Tropical disturbance fuels Florida wet weekend, flooding threat","After being spared from back-to-back hurricanes, Florida will continue to see the potential for flooding rain through the weekend as the National Hurricane...",https://www.foxweather.com/weather-news/tropical-disturbance-florida-rain-flooding,https://s.yimg.com/ny/api/res/1.2/bKmsvmXgcKobfEd_HjIiKg--/YXBwaWQ9aGlnaGxhbmRlcjt3PTEyMDA7aD02NzU7Y2Y9d2VicA--/https://media.zenfs.com/en/fox_weather_articles_483/1c0c44b6785bb085ef12913122c69020,,"MIAMI After being spared from back-to-back hurricanes, Florida will continue to see the potential for flooding rain through the weekend as the National Hurricane Center is tracking a new area off the… [+2630 chars]",
05748aab6a192efda161f8795aa3ce68,2025-10-02T23:05:49Z,'hurricane alert',www.thejournal.ie,en,0.0,Storm Amy: Everything you need to know as the first named storm of the season sweeps in,"While flooding was the main concern yesterday, strong winds threaten to damage power lines today.",https://www.thejournal.ie/heres-what-you-need-to-know-as-storm-amy-sweeps-in-6833283-Oct2025/,https://img2.thejournal.ie/article/6833283/river/?height=400&version=6833285,,"THE FIRST NAMED storm of the season, Storm Amy, makes landfall today with Met Éireann warning of fallen trees, power cuts and dangerous travelling conditions.
Ahead of its arrival, Ireland was subje… [+5209 chars]",
78f259a6d869c196225d47dd48940e07,2025-10-03T10:31:07Z,'typhoon',www.insurancejournal.com,en,0.0,"Typhoon Matmo Strengthens as It Hits Philippines, on Track to China","Typhoon Matmo intensified as it made landfall in northern Philippines on Friday where it’s forecast to dump heavy rain, with the nation still reeling from the impact of two deadly typhoons in the past two weeks. Matmo, locally named Paolo, …",https://www.insurancejournal.com/news/international/2025/10/03/842365.htm,https://www.insurancejournal.com/app/uploads/2025/10/typhoon-matmo-heads-toward-philippines-bloomberg.jpg,,"Typhoon Matmo intensified as it made landfall in northern Philippines on Friday where it’s forecast to dump heavy rain, with the nation still reeling from the impact of two deadly typhoons in the pas… [+2159 chars]",
e969c8b210bc5c154412ecc7e6083b7a,2025-10-03T16:26:41Z,'hurricane evacuation',www.bostonherald.com,en,0.0,"20 years after Katrina, Louisiana still struggles with evacuation plans that minimize health risks",Laura eventually became one of the strongest hurricanes to make landfall in the U.S.,https://www.bostonherald.com/2025/10/03/louisiana-evacuation-plans-struggle/,https://www.bostonherald.com/wp-content/uploads/2025/10/202510020400MCT_____PHOTO____US-NEWS-LOUISIANA-EVACUATION-PLANS-6-MCT-1.jpg?w=1024&h=683,,"By Halle Parker, Verite News, KFF Health News
In late August 2020, Ashlee Guidry and her staff kept a wary eye on guidance from local officials as Hurricane Laura passed over Cuba en route to southw… [+13267 chars]",
fe12877a5582b020ab11899cfd9d43d1,2025-10-05T07:23:52Z,'typhoon',biztoc.com,en,0.0,Typhoon Matmo hits southern China during peak holiday season,,https://biztoc.com/x/030c5548d2cc9e90,https://biztoc.com/cdn/950/og.png,,"{ window.open(this.href, '_blank'); }, 200); return false;""&gt;Why did Rite Aid close all stores? { window.open(this.href, '_blank'); }, 200); return false;""&gt;How will Japans new leader affect econ… [+745 chars]",
06dad7fb7ac333f8bc13051be9bef9f8,2025-10-05T16:37:51Z,'hurricane',www.yahoo.com,en,0.0,"Likely tropical storm in the Atlantic, eastern Pacific hurricanes highlight a new week in the tropics","After a brief respite, the Atlantic is about to heat back up, with a new tropical storm expected to form soon. Meanwhile, the Eastern Pacific is still active...",https://www.yahoo.com/news/articles/likely-tropical-storm-atlantic-eastern-163751771.html,https://media.zenfs.com/en/accuweather_articles_339/91c49a94048fb2e91ed244e58b68bcec,,"The leaves may be turning and the temperature may be falling in parts of the U.S., but the tropics are far from done for the season. AccuWeather hurricane experts are warning that a tropical storm ma… [+5193 chars]",
d0b9dbc0c287671967287afee60c6c97,2025-10-05T18:34:03Z,'tropical cyclone',www.usatoday.com,en,0.0,Hurricane watchers eye tropical wave in Atlantic Ocean. See where it's heading,"The National Hurricane Center says tropical wave AL95 has a ""high"" chance of becoming a tropical depression this week.",https://www.usatoday.com/story/news/nation/2025/10/05/al95-nhc-outlook-tropical-depression-tracker/86537178007/,https://media.zenfs.com/en/usa_today_news_641/301eb7819bf7f313cf292350f4fdec38,,"Forecasters are tracking a broad area of low pressure associated with a tropical wave in the Atlantic that has a medium to high chance of developing into a tropical cyclone, the National Hurricane Ce… [+4734 chars]",
b7d6a16752ad575d4d5718479c6b308e,2025-10-07T02:29:05Z,'typhoon',www.yahoo.com,en,0.0,Hanoi flooded again as storm season brings more rain to Vietnam's north,"HANOI (Reuters) -Torrential rains triggered by Typhoon Matmo flooded parts of Hanoi on Tuesday, the latest in a series of deluges that have inundated the...",https://www.yahoo.com/news/articles/hanoi-flooded-again-storm-season-022905461.html,https://media.zenfs.com/en/reuters.com/09c115ef3d760373ac29875bd335388d,,"HANOI (Reuters) -Torrential rains triggered by Typhoon Matmo flooded parts of Hanoi on Tuesday, the latest in a series of deluges that have inundated the Vietnamese capital over the past month as a r… [+1214 chars]",
93d0fd0085021998d8142d8d6d8f6594,2025-10-07T12:18:48Z,'hurricane evacuation',www.usatoday.com,en,0.0,Tropical Storm Jerry forms in the Atlantic. See its potential path.,The National Hurricane Center said Tropical Storm Jerry has formed in the Atlantic Ocean on Oct. 7. Here's where it's headed.,https://www.usatoday.com/story/news/weather/2025/10/07/tropical-storm-jerry-path-tracker-atlantic/86561650007/,https://media.zenfs.com/en/usa_today_news_641/af935f1a64a8fd46385469991c1594e8,,"Tropical Storm Jerry has formed in the Atlantic Ocean.
The National Hurricane Center said in an advisory on Tuesday, Oct. 7 the Atlantic hurricane season's 10th named storm was located about 1,315 m… [+5249 chars]",
d74cb06ee124c5f9126ca0307fa66ac2,2025-10-07T17:40:52Z,'hurricane season',www.espn.com,en,0.0,"New Rays owners want park fixed, then new one","The new owners of the Tampa Bay Rays are promising to get hurricane-damaged Tropicana Field repaired in time for next season and beginning a search for a new, permanent ballpark to open in 2029.",https://www.espn.com/mlb/story/_/id/46521150/new-rays-owners-promise-tropicana-field-repairs-search-new-park-region,https://a1.espncdn.com/combiner/i?img=%2Fphoto%2F2024%2F1010%2Fr1398816_1296x729_16%2D9.jpg,,"TAMPA, Fla. -- The new owners of the Tampa Bay Rays are promising to get hurricane-damaged Tropicana Field repaired in time for next season and beginning a search for a new ballpark to open in 2029.… [+3001 chars]",
3f5bd71117dee1e93358664c18f3f32c,2025-10-07T18:54:04Z,'tropical cyclone',dailycaller.com,en,0.0,"Tropical Storm Jerry Forms In Atlantic, Expected To Become Hurricane Within Days","Tropical Storm Jerry developed Tuesday in the Atlantic Ocean, putting extra pressure in the tropical Atlantic Basin that has been seeing heightened activity.",https://dailycaller.com/2025/10/07/tropical-storm-jerry-atlantic-ocean-hurricane-weather/,"https://images.dailycaller.com/image/width=1280,height=549,fit=cover,format=webp,f=auto/https://cdn01.dailycaller.com/wp-content/uploads/2025/10/GettyImages-2173441155-scaled-e1759862780688.jpg",,"Tropical Storm Jerry developed Tuesday in the Atlantic Ocean, putting extra pressure in the tropical Atlantic Basin that has been seeing heightened activity as we near the conclusion of the 2025 Atla… [+1497 chars]",
0bf3ade389ff2911c8804026a5c28a2a,2025-10-08T11:00:50Z,'tropical cyclone',gizmodo.com,en,0.0,Zombie Fires and Historic Hurricanes: The 8 Wildest Weather Events of Summer 2025,A surge in zombie fires. Back-to-back black rainstorms. This summer’s weather was something else.,https://gizmodo.com/zombie-fires-and-historic-hurricanes-the-8-wildest-weather-events-of-summer-2025-2000667518,https://gizmodo.com/app/uploads/2025/10/canada-wildfire-1200x675.jpg,,"This year has produced some really wild weather. And when I say wild, I mean truly unexpected, record-breaking, extreme events that defied our understanding of Earths climate system.
To be fair to t… [+8065 chars]",
656148bdbcd99191cd93a9f70d2d78f6,2025-10-08T23:12:58Z,'typhoon',www.sfchronicle.com,en,0.0,Powerful typhoon is set to trigger an unusually strong California storm,San Francisco's rainiest day since last winter is possible next week as energy from a recurving West Pacific typhoon dislodges cold air from Canada and whips...,https://www.sfchronicle.com/weather-forecast/article/typhoon-halong-recurve-california-storm-rain-snow-21090941.php,https://s.yimg.com/ny/api/res/1.2/.GRvnFOf8OAHGdXVcuaDVA--/YXBwaWQ9aGlnaGxhbmRlcjt3PTEyMDA7aD04MDI7Y2Y9d2VicA--/https://media.zenfs.com/en/san_francisco_chronicle_hearst_178/bffd9d0704f473be01d2548f48d9fcc2,,"A powerful typhoon that made a close approach to Japan is poised to energize the storm track across the Pacific Ocean and potentially bring heavy rain and snow to California next week.
Typhoon Halon… [+3994 chars]",
5dbedcf14a32becb05bd5a7d27c9493e,2025-10-09T07:34:52Z,'typhoon',japantoday.com,en,0.0,Typhoon batters Izu islands,Heavy rain from a typhoon on Thursday battered a chain of Japanese islands south of Tokyo and the government urged residents to watch for landslides and flooding. Kyodo news agency reported there has been record rainfall of about  207 millimeters in parts of …,https://japantoday.com/category/national/Typhoon-hits-Izu-islands-with-heavy-rain,,,"Heavy rain from a typhoon on Thursday battered a chain of Japanese islands south of Tokyo and the government urged residents to watch for landslides and flooding.
Kyodo news agency reported there ha… [+426 chars]",
fd40e88a7da877d46ef35e2ac8d3268e,2025-10-09T13:01:32Z,'hurricane',www.usatoday.com,en,0.0,"La Niña has arrived, forecasters say. What does this mean for our weather?","This La Niña could impact the tail end of the 2025 hurricane season, and also have an effect on fall and winter weather in the U.S.",https://www.usatoday.com/story/news/weather/2025/10/09/what-la-nina-means-for-weather-forecast/86587224007/,https://s.yimg.com/ny/api/res/1.2/oRVX6.n_qIOONqswnd1GDA--/YXBwaWQ9aGlnaGxhbmRlcjt3PTEyMDA7aD04MDA7Y2Y9d2VicA--/https://media.zenfs.com/en/usa_today_news_641/801f142d7240f0db165cc4814828adae,,"La Niña has officially arrived, federal forecasters from the Climate Prediction Center announced Thursday Oct. 9.
""La Niña conditions emerged in September 2025, as indicated by the expansion of belo… [+3472 chars]",
13437a3ddd1f0d4f6a7ad9042a0a31a2,2025-10-09T13:57:04Z,'tropical cyclone',phys.org,en,0.0,Driving behaviors during extreme weather events explored,"When a storm or tropical cyclone impacts mainland Australia, would you get behind the wheel of a vehicle?",https://phys.org/news/2025-10-behaviors-extreme-weather-events-explored.html,https://scx2.b-cdn.net/gfx/news/hires/2025/cyclone-1.jpg,,"When a storm or tropical cyclone impacts mainland Australia, would you get behind the wheel of a vehicle?
New Griffith University research has explored this question by analyzing driver behavior dur… [+3312 chars]",
163d45eef7888fbad7947e93afe82b3b,2025-10-09T16:55:14Z,'flooding',www.bostonherald.com,en,0.0,At least 170 US hospitals face major flood risk. Experts say Trump is making it worse,"Nearly 30,000 patient beds face the risk of significant or dangerous flooding.",https://www.bostonherald.com/2025/10/09/at-least-170-us-hospitals-face-major-flood-risk-experts-say-trump-is-making-it-worse/,https://www.bostonherald.com/wp-content/uploads/2025/10/202510080400MCT_____PHOTO____US-NEWS-HEALTH-HOSPITALS-FLOOD-RISK-1-KHN.jpg?w=1024&h=682,,"By Holly K. Hacker, Brett Kelman, Daniel Chang, Hannah Norman Lydia Zuraw, KFF Health News
LOUISVILLE, Tenn. When a big storm hits, Peninsula Hospital could be underwater.
At this decades-old psych… [+18236 chars]",
b281f82352fb8e9bb8528368de3920e9,2025-10-09T22:26:43Z,'typhoon',dailycaller.com,en,0.0,Shockwaves From Typhoon Halong To Cause Unusually Strong Storm For US West Coast,A super typhoon that recently sliced off the coast of Japan is forecasted to send shockwaves throughout the Pacific Ocean.,https://dailycaller.com/2025/10/09/typhoon-halong-remnants-storm-united-states-west-coast-california/,"https://images.dailycaller.com/image/width=1280,height=549,fit=cover,format=webp,f=auto/https://cdn01.dailycaller.com/wp-content/uploads/2025/10/GettyImages-1348746012-scaled-e1760048372443.jpg",,"A super typhoon that recently sliced off the coast of Japan is forecasted to send shockwaves throughout the Pacific Ocean, which could possibly cause a week of wild weather for the Western United Sta… [+2158 chars]",
9d87bb5db0c80dfe24de5d7260e2b378,2025-10-09T22:55:48Z,'flooding',abcnews.go.com,en,0.0,"Tropical Storm Priscilla to drench Southwest US, raising deadly flash flood risk",Flash flooding is a growing risk in the southwestern U.S. through this weekend,https://abcnews.go.com/US/wireStory/tropical-storm-priscilla-drench-southwest-us-raising-deadly-126382117,https://i.abcnewsfe.com/a/6ebda5cd-3762-49a5-a45e-65ff7a3533c8/wirestory_941fb0e978a28e41703122925bced707_16x9.jpg?w=1600,,"FORT COLLINS, Colo. -- FORT COLLINS, Colo. (AP) A region more accustomed to baking heat than soggy weather is about to get soaked, raising the risk of flash floods that can surprise and kill in minut… [+5264 chars]",
07821db7ff718507ff25ffa8f25a2090,2025-10-10T12:07:50Z,'typhoon',www.forbes.com,en,0.0,Lee Jun-ho And Kim Min-Ha Join Forces In K-Drama ‘Typhoon Family’,"Set during the IMF Crisis, 'Typhoon Family' is the story of a rich kid from Gangnam who must save his father's business from failure.",https://www.forbes.com/sites/joanmacdonald/2025/10/10/lee-jun-ho-and-kim-min-ha-join-forces-in-k-drama-typhoon-family/,"https://imageio.forbes.com/specials-images/imageserve/68de9828ce37345d95274ff5/0x0.jpg?format=jpg&crop=2544,1430,x0,y10,safe&height=900&width=1600&fit=bounds",,"Kim Min-ha and Lee Jun-ho star in 'Typhoon Family.'
Studio Dragon
The upcoming k-drama Typhoon Family is set in Korea during the widespread East Asian financial crisis of 1997, referred to as the I… [+3603 chars]",
caf53fe602e281170f694c4a98e29c89,2025-10-10T16:10:05Z,'hurricane',wattsupwiththat.com,en,0.0,LIVE at 1PM EDT: Where Are All the Hurricanes? (Guest: Joe Bastardi) — The Climate Realism Show #177,"In September 2025, no hurricanes made landfall in the United States — the first time that’s happened in a decade. What’s going on with this year’s hurricane season?",https://wattsupwiththat.com/2025/10/10/live-at-1pm-edt-where-are-all-the-hurricanes-guest-joe-bastardi-the-climate-realism-show-177/,https://i0.wp.com/wattsupwiththat.com/wp-content/uploads/2025/10/TCRS177.webp?fit=1200%2C675&quality=75&ssl=1,,"In September 2025, no hurricanes made landfall in the United States the first time thats happened in a decade. Whats going on with this years hurricane season? 
We ask WeatherBELL Analytics Joe Bast… [+721 chars]",
94c7dd8e83258ed5bc407873481eab3d,2025-10-10T16:10:50Z,'tropical depression',www.forbes.com,en,0.1,Why Meteorologists Are Stunned By Subtropical Storm Karen,Subtropical Storm Karen formed in an unusual place. Here's why.,https://www.forbes.com/sites/marshallshepherd/2025/10/10/why-meteorologists-are-stunned-by-subtropical-storm-karen/,https://imageio.forbes.com/specials-images/imageserve/68e924cebe579bb347bfffe1/0x0.jpg?format=jpg&height=900&width=1600&fit=bounds,http://web.archive.org/web/20251010222930/https://www.forbes.com/sites/marshallshepherd/2025/10/10/why-meteorologists-are-stunned-by-subtropical-storm-karen/,"Subtropical Storm Karen on October 10, 2025. The storm formed north of 45 degrees latitude.
NOAA and Tropical Tidbits Website
We are in the midst of hurricane season, so the formation of tropical s… [+2525 chars]",
a223206c913b165dbc3b59e11e92366c,2025-10-10T20:34:36Z,'tropical depression',www.nhc.noaa.gov,en,0.1,Post-Tropical Cyclone Karen Graphics,"5-Day Uncertainty Track last updated Fri, 10 Oct 2025 20:34:10 GMT


 
Wind Speed Probabilities last updated Fri, 10 Oct 2025 20:34:10 GMT",https://www.nhc.noaa.gov/refresh/graphics_at1+shtml/203436.shtml?cone,,,"Coastal Watches/Warnings and Forecast Cone for Storm Center
* If the storm is forecast to dissipate within 3 days, the ""Full Forecast"" and ""3 day"" graphic will be identical
Click Here for a 5-day C… [+2926 chars]",
74cd7d7d20143c36506e7f9eb723b9f3,2025-10-11T06:38:46Z,'hurricane season',www.aljazeera.com,en,0.0,At least 28 killed in heavy flooding caused by tropical storms in Mexico,The storms have caused devastation nationwide as rains are expected to continue through Sunday.,https://www.aljazeera.com/news/2025/10/11/at-least-28-killed-in-heavy-flooding-caused-by-tropical-storms-in-mexico,https://www.aljazeera.com/wp-content/uploads/2025/10/afp_68e9ea5dc576-1760160349.jpg?resize=1920%2C1440,,"Flooding set off by heavy rainfall in Mexico has left at least 28 people dead and more missing, and has caused landslides, damaged homes and highways, according to local authorities.
Downpours in th… [+3683 chars]",
9905d191b3ddddda216c7e535d7680ba,2025-10-11T14:51:01Z,'hurricane',www.surfer.com,en,0.0,Huge Hurricane Waves Flood Hotel in Mexico (Video),Hurricane Priscilla struck Mexico with life-threatening surf; footage from a hotel in Puerto Vallarta shows waves pummeling the coastline.,https://www.surfer.com/news/hurricane-priscilla-big-waves-mexico-video,https://media.zenfs.com/en/surfer_magazine_140/dbd16f8bd5d2c3d4e41ee6178f790afa,,"Earlier this week, Hurricane Priscilla spun off the shores of Mexico, churning up wind and waves, and sending that energy towards certain coastlines.
By Tuesday, the storm neared major hurricane sta… [+2198 chars]",
51e84a3453349b762f9ae0b86dd47d32,2025-10-11T18:37:03Z,'flooding tropical',www.foxweather.com,en,0.0,Flash flooding sweeps away cars in New Mexico as Desert Southwest braces for another round of tropical rain,"Remnant tropical moisture from post-tropical Priscilla soaked areas of the Desert Southwest since Friday, resulting in flash flooding that swallowed cars in ...",https://www.foxweather.com/extreme-weather/flash-flooding-new-mexico-desert-southwest-tropical-rain,https://media.zenfs.com/en/fox_weather_articles_483/fb6ad920a6a315590e592916224121eb,,"SAN JUAN COUNTY, NEW MEXICO Remnant tropical moisture from post-tropical storm Priscilla has soaked areas of the Desert Southwest since Friday, resulting in flash flooding that swallowed at least two… [+1572 chars]",
67c6409c9be0ef72bb640f4ce3611085,2025-10-11T21:21:32Z,'tropical depression',www.nhc.noaa.gov,en,0.1,Remnants of Jerry Graphics,"5-Day Uncertainty Track last updated Sat, 11 Oct 2025 20:35:16 GMT


 
Wind Speed Probabilities last updated Sat, 11 Oct 2025 21:21:32 GMT",https://www.nhc.noaa.gov/refresh/graphics_at5+shtml/212132.shtml?cone,,,"Coastal Watches/Warnings and Forecast Cone for Storm Center
* If the storm is forecast to dissipate within 3 days, the ""Full Forecast"" and ""3 day"" graphic will be identical
Click Here for a 5-day C… [+2926 chars]",
5c6d9ccc0cc27d8880d98b496ee18794,2025-10-12T10:30:03Z,'storm surge',ritholtz.com,en,0.1,10 Sunday Reads,"Avert your eyes! My Sunday morning look at incompetency, corruption and policy failures: • Who maintains the scaffolding of freedom? The prosperity the western world enjoyed for decades was the result of ideas, specifically classical liberal ideas about free …",https://ritholtz.com/2025/10/10-sunday-reads-203/,https://ritholtz.com/wp-content/uploads/2026/12/apps.png,,"Avert your eyes! My Sunday morning look at incompetency, corruption and policy failures:Who maintains the scaffolding of freedom? The prosperity the western world enjoyed for decades was the result o… [+4527 chars]",
26f024ef38fae397ae6edd1e733a2980,2025-10-12T14:23:15Z,'flooding',www.bostonherald.com,en,0.0,"New Jersey declares emergency as nor’easter approaches, while Alaska flooding carries away homes","A nor’easter churned its way up the East Coast on Sunday, with New Jersey declaring a state of emergency and some airports posting delays and cancellations in advance of anticipated coastal flooding, and strong winds, as another storm system struck farther so…",https://www.bostonherald.com/2025/10/12/new-jersey-declares-emergency-as-noreaster-approaches-while-alaska-flooding-carries-away-homes/,https://www.bostonherald.com/wp-content/uploads/2025/10/APTOPIX_Tropical_Weather_47838-1.jpg?w=1024&h=683,,"By KATHY McCORMACK
A nor’easter churned its way up the East Coast on Sunday, washing out roads and prompting air travel delays as heavily populated areas of the Northeast experienced excessive rain,… [+4852 chars]",
