index,published,keyword,domain,language,valid,title,description,url,image,archive,content,quote
7d94adcea1c5b78a0eea3a7bada63c30,2025-11-11T06:26:39Z,'storm surge',economictimes.indiatimes.com,en,0.1,"Tired and craving sweets? Gastro doctor, Dr Pal warns about 5 foods spiking your blood sugar levels secretly","Feeling tired or bloated could signal blood sugar issues. Gastroenterologist Dr Pal warns that everyday foods like white bread, white rice, sugary cereals, pastries, and sodas are major culprits. These items cause rapid sugar spikes, leading to energy slumps …",https://economictimes.indiatimes.com/magazines/panache/tired-and-craving-sweets-gastro-doctor-dr-pal-warns-about-5-foods-spiking-your-blood-sugar-levels-secretly/articleshow/125241349.cms,"https://img.etimg.com/thumb/msid-125242007,width-1200,height-630,imgsize-91866,overlay-etpanache/articleshow.jpg",,"If you often feel tired, crave sweets for no reason, or feel bloated even after eating normal meals, your blood sugar might be quietly misbehaving. Gastroenterologist Dr Pal recently took to Instagra… [+2000 chars]",
02e1a9fdbc0113ae9e1bb6c4bfd8a4cb,2025-11-11T06:58:25Z,'hurricane warning',abcnews.go.com,en,0.1,WATCH: Massive spider web on Greece-Albania border might be world's largest,"Scientists have discovered what might be the largest spider web in the world, found in a cave straddling the border of Greece and Albania.",https://abcnews.go.com/International/video/massive-spider-web-greece-albania-border-worlds-largest-127403282,https://i.abcnewsfe.com/a/eefee998-0996-4d5f-9cec-2f7d782c000e/251111_abc_social_big_web_hpMain_9x16.jpg?w=992,,"<ul><li>Senate passes bill that could end longest shutdown in U.S. history, heads to House
</li><li>Travel nightmare grows as over 7,000 flights canceled since FAA's capacity limit
</li><li>Trump p… [+4682 chars]",
6baed4b56f58e827fbd3963eca0bfb2d,2025-11-11T07:25:16Z,'storm surge',www.yahoo.com,en,0.1,Pakistan foils a militant attempt to seize cadets at an army-run college,A swift response by security forces foiled an attempt by Pakistani Taliban militants to take cadets hostage at an army-run college overnight when a suicide...,https://www.yahoo.com/news/articles/pakistan-foils-militant-attempt-seize-072516062.html,https://media.zenfs.com/en/ap.org/af3982ac54c47c4141ad6c1ffea6671e,,"DERA ISMAIL KHAN, Pakistan (AP) A swift response by security forces foiled an attempt by Pakistani Taliban militants to take cadets hostage at an army-run college overnight when a suicide car bomber … [+3295 chars]",
84b92e2a7358840564a7936ededd7731,2025-11-11T08:15:19Z,'storm surge',abcnews.go.com,en,0.1,Pakistan foils a militant attempt to seize cadets at an army-run college,"Police say a swift response by security forces has foiled an attempt by Pakistani Taliban militants to take cadets hostage at a college overnight, when attackers targeted the facility in northwestern Pakistan",https://abcnews.go.com/International/wireStory/pakistan-foils-militant-attempt-seize-cadets-army-run-127405119,https://i.abcnewsfe.com/a/99e1ea2d-ad70-461f-b0e0-3913ab1ba60c/wirestory_2e3bac61594df30ea14ae97facda37d0_16x9.jpg?w=1600,,"DERA ISMAIL KHAN, Pakistan -- A swift response by security forces foiled an attempt by Pakistani Taliban militants to take cadets hostage at an army-run college overnight when a suicide car bomber an… [+3295 chars]",
138c19d71513da669f691e90560e5da2,2025-11-11T09:21:32Z,'storm surge',www.abc.net.au,en,0.1,Breaking: Bombing outside court in Pakistan's capital kills 12 people,Pakistan's interior minister says a suicide bomber detonated explosives near a police vehicle outside the gate of a district court in Islamabad on Tuesday.,https://www.abc.net.au/news/2025-11-11/explosion-pakistan-kills-12-dozens-more-injured/105998546,https://live-production.wcms.abc-cdn.net.au/978aea7deb3571e71632ff393be6fda7?impolicy=wcms_watermark_news&cropH=2154&cropW=3829&xPos=0&yPos=200&width=862&height=485&imformat=generic,,"Pakistan's interior minister says a suicide bomber detonated explosives near a police vehicle outside the gate of a district court in Islamabad on Tuesday, killing 12 people and wounding 27.
The att… [+3379 chars]",
0f17d0e3acb15c1eacc994080cb6df98,2025-11-11T10:33:04Z,'storm surge',www.cbc.ca,en,0.1,"Suicide bomber attacks outside Islamabad court, killing 12, says Pakistan’s interior minister","Pakistan’s interior minister says a suicide bomber detonated his explosives near a police vehicle outside the gate of a district court in Islamabad on Tuesday, killing 12 people and wounding 27.",https://www.cbc.ca/news/world/suicide-bomber-islamabad-pakistan-9.6974537,"https://i.cbc.ca/ais/2ad5cc9f-3a5f-44f7-a78e-0e2c53b13a36,1762855899015/full/max/0/default.jpg?im=Crop%2Crect%3D%280%2C459%2C4408%2C2479%29%3BResize%3D620",,"Pakistans interior minister says a suicide bomber detonated his explosives near a police vehicle outside the gate of a district court in Islamabad on Tuesday, killing 12 people and wounding 27.
The … [+3159 chars]",
2accfb9622982b86ae3ff1ad7dacb302,2025-11-11T10:55:43Z,'storm surge',www.npr.org,en,0.1,"A suicide bomber targets an Islamabad court, killing 12 people and wounding 27","No group immediately claimed responsibility for the explosion, which also wounded at least 27 people, but Pakistan has struggled over the past months with a resurgent Pakistani Taliban.",https://www.npr.org/2025/11/11/nx-s1-5605375/a-suicide-bomber-targets-an-islamabad-court-killing-12-people-and-wounding-27,https://npr.brightspotcdn.com/dims3/default/strip/false/crop/2280x1283+0+119/resize/1400/quality/100/format/jpeg/?url=http%3A%2F%2Fnpr-brightspot.s3.amazonaws.com%2Fa4%2F91%2F9f19546940f99b8f385e2a127cb0%2Fap25315339427930.jpg,http://web.archive.org/web/20251112053257/https://www.npr.org/2025/11/11/nx-s1-5605375/a-suicide-bomber-targets-an-islamabad-court-killing-12-people-and-wounding-27,"ISLAMABAD A suicide bomber struck outside the gates of a district court in Islamabad on Tuesday, detonating his explosives next to a police car and killing 12 people, Pakistan's interior minister sai… [+3607 chars]",
3687f6812694d0e905cd0c72c01307fe,2025-11-11T11:08:37Z,'hurricane warning',abcnews.go.com,en,0.1,WATCH: Beautiful bioluminescence wows beachgoers in New Zealand,"Beachgoers in Auckland, New Zealand got a evening treat, as they got to frolic in neon-blue waves caused by bioluminescence.",https://abcnews.go.com/International/video/beautiful-bioluminescence-wows-beachgoers-new-zealand-127405764,https://i.abcnewsfe.com/a/89dc00c5-e68d-42e9-a3e6-d2ae6c59439b/251111_abc_social_Bioluminesence_new_zealand_beach_hpMain_9x16.jpg?w=992,,"<ul><li>Senate passes bill that could end longest shutdown in U.S. history, heads to House
</li><li>Travel nightmare grows as over 7,000 flights canceled since FAA's capacity limit
</li><li>Trump p… [+4682 chars]",
c9dde0000566a195340ca34d07c4e49c,2025-11-11T11:42:00Z,'storm surge',www.globenewswire.com,en,0.1,"Radiation Hardened Electronics Industry Research Report 2025: A $2.3 Billion Market by 2030, Driven by Expanding ISR Applications and Demand for Radiation-Tolerant Components","The global radiation-hardened electronics market is poised for growth, expanding from USD 1.77 billion in 2025 to USD 2.30 billion by 2030, at a CAGR of 5.4%. This surge is driven by increased reliance on radiation-tolerant components in ISR platforms like sa…",https://www.globenewswire.com/news-release/2025/11/11/3185280/28124/en/Radiation-Hardened-Electronics-Industry-Research-Report-2025-A-2-3-Billion-Market-by-2030-Driven-by-Expanding-ISR-Applications-and-Demand-for-Radiation-Tolerant-Components.html,https://ml.globenewswire.com/Resource/Download/908fb457-7f8e-4a08-9081-5565e3dfb3d7,,"Dublin, Nov. 11, 2025 (GLOBE NEWSWIRE) -- The ""Radiation Hardened Electronics Market by Component (Mixed Signal ICs, Processors &amp; Controllers, Memory, Power Management), Manufacturing Technique (… [+8895 chars]",
2e65984566eb8904a761178078e6dc2a,2025-11-11T12:40:37Z,'storm surge',www.space.com,en,0.1,"Sun unleashes strongest solar flare of 2025, sparking radio blackouts across Africa and Europe",The X5.1-class eruption from sunspot AR4274 is this year's most powerful solar flare and Earth is in the firing line.,https://www.space.com/astronomy/sun/sun-unleashes-strongest-solar-flare-of-2025-sparking-radio-blackouts-across-africa-and-europe,https://cdn.mos.cms.futurecdn.net/oDTQww7bjZcuCNJppKRpk3-1920-80.jpg,http://web.archive.org/web/20251112012645/https://www.space.com/astronomy/sun/sun-unleashes-strongest-solar-flare-of-2025-sparking-radio-blackouts-across-africa-and-europe,"Check out the ripples from the coronal wave lifting off during the X5.1 solar flare. (Image credit: NOAA Space Weather Prediction Center)
The sun erupted in spectacular fashion this morning (Nov. 11… [+2629 chars]",
85db7b4d9a4624cc85ce149d5a7b0880,2025-11-11T13:19:41Z,'storm surge',nypost.com,en,0.1,"Suicide bomber targets Islamabad court, killing 12 people: official","A suicide bomber struck outside the gates of a district court in Islamabad on Tuesday, detonating his explosives next to a police car and killing 12 people, Pakistan’s interior minister said.",https://nypost.com/2025/11/11/world-news/suicide-bomber-targets-islamabad-court-killing-12-people-official/,https://nypost.com/wp-content/uploads/sites/2/2025/11/pakistan-suicide-bombing-comp.jpg?quality=75&strip=all&1762846405&w=1200,,"ISLAMABAD A suicide bomber struck outside the gates of a district court in Islamabad on Tuesday, detonating his explosives next to a police car and killing 12 people, Pakistans interior minister said… [+6478 chars]",
5fed3dca58bb89444bee344cd0f4e32e,2025-11-11T14:16:40Z,'storm surge',truthout.org,en,0.1,ICE Is Functioning Like an Occupying Army. I Know Because I Served in One.,Veteran-led protests against Trump's National Guard deployments encourage soldiers to resist Trump's illegal orders.,https://truthout.org/articles/ice-is-functioning-like-an-occupying-army-i-know-because-i-served-in-one/,https://truthout.org/app/uploads/2025/11/GettyImages-2241666954-scaled.jpg,,"Truthout is a vital news source and a living history of political struggle. If you think our work is valuable, support us with a donation of any size.
Immigration and Customs Enforcement (ICE) helic… [+10068 chars]",
de39feea35847e3510dd1b2577ede81e,2025-11-11T15:19:46Z,'storm surge',economictimes.indiatimes.com,en,0.1,"Consumer debt crisis deepens: Americans are falling behind on credit cards, loans, and mortgages - is it time to worry?","Americans now owe $18.6 trillion in household debt. United States consumer debt crisis is growing fast. Millions of borrowers are struggling to keep up with credit cards, car loans, student loans, and even mortgages. Data from the Federal Reserve Bank of New …",https://economictimes.indiatimes.com/news/international/us/consumer-debt-crisis-deepens-americans-are-falling-behind-on-credit-cards-loans-and-mortgages-is-it-time-to-worry/articleshow/125251364.cms,"https://img.etimg.com/thumb/msid-125251359,width-1200,height-630,imgsize-46188,overlay-economictimes/articleshow.jpg",,"Consumer debt crisis deepens. Americans now owe nearly $18.6 trillion in household debt. Thats a record high. Mortgages, credit cards, and student loans are driving the surge. Even prime borrowers ar… [+8398 chars]",
896744ef12b93af51f12629bc3b57cc5,2025-11-11T15:58:26Z,'hurricane warning',abcnews.go.com,en,0.1,"WATCH: Suspect with fake limp, neck brace robs Louisiana bank","A suspect with a fake limp carried out a very real bank robbery in broad daylight in Louisiana, police said.",https://abcnews.go.com/US/video/suspect-fake-limp-neck-brace-robs-louisiana-bank-127415645,https://i.abcnewsfe.com/a/1fa32f03-eda5-4c63-92b6-57c36f5b1193/251111_abc_social_robbery_hpMain_9x16.jpg?w=992,,"<ul><li>Millions wake to snow, arctic temperatures
</li><li>Brutal cold and snow with wind chill in the teens
</li><li>Senate passes bill to reopen government
</li><li>Food insecurity and SNAP ben… [+4400 chars]",
922da483276213d8b1ee1ed2e4026383,2025-11-11T16:28:16Z,'storm surge',worldsoccertalk.com,en,0.1,"Red flag for Massimiliano Allegri as Christian Pulisic’s absence takes its toll: USMNT star returned from injury, but Milan’s struggles without him backed by shocking major stat","Christian Pulisic’s comeback for Milan was supposed to bring calm and control for Massimiliano Allegri after weeks of frustrating draws. Instead, his return highlighted just how fragile the Rossoneri’s recent performances have been without him.
 Christian Pul…",https://worldsoccertalk.com/news/red-flag-for-massimiliano-allegri-as-christian-pulisics-absence-takes-its-toll-usmnt-star-returned-from-injury-but-milans-struggles-without-him-backed-by-shocking-major-stat/,https://ds-images.bolavip.com/news/image?src=https://images.worldsoccertalk.com/webp/1200_740/WST_20251111_WST_602739_christian-pulisic-ac-milan-3.webp&width=1200&height=740,,"Christian Pulisics comeback for Milan was supposed to bring calm and control for Massimiliano Allegri after weeks of frustrating draws. Instead, his return highlighted just how fragile the Rossoneris… [+3131 chars]",
8aff867e0c2fc14a5eefca08c8fd7678,2025-11-11T17:29:52Z,'hurricane victims',www.bbc.com,en,0.1,Families of Camp Mystic victims sue owners over deadly Texas flood,"Seven families have sued the owners of the Texas camp where 27 girls and counsellors died, alleging gross negligence.",https://www.bbc.com/news/articles/cdegj3g6gg3o,https://ichef.bbci.co.uk/news/1024/branded_news/2657/live/22a729b0-bf1e-11f0-8456-eff94716b162.jpg,,"The families of some of the victims who died in devastating floods at Camp Mystic have sued the Texas Christian camp, accusing its owners of gross negligence and failing to protect children in their … [+2909 chars]",
daa04cfaefbd04f1aa0504fbe444dd69,2025-11-11T17:51:29Z,'hurricane warning',abcnews.go.com,en,0.1,WATCH: Trump honors veterans at Arlington National Cemetery,"President Donald Trump delivers remarks at Arlington National Cemetery on Veterans Day, honoring the ""more than 1 million American service members who have made the supreme sacrifice.""",https://abcnews.go.com/US/video/trump-honors-veterans-arlington-national-cemetery-127421520,https://i.abcnewsfe.com/a/5b1d7b36-86e0-4eda-b121-f33a4f1f5db7/251111_abc_social_trump_arlington_speech_hpMain_9x16.jpg?w=992,,"<ul><li>Senate Democrats 'caved' in voting for funding bill: Congresswoman
</li><li>'I'm too dumb to fail': Ring doorbell inventor shares untold story in new book
</li><li>Millions wake to snow, ar… [+4479 chars]",
29997409cd86de6112d7957cfe3e65c5,2025-11-11T18:40:16Z,'storm surge',theintercept.com,en,0.1,Trump’s Military Occupations of U.S. Cities Cost $473 Million and Rising,"Trump’s campaign to quell dissent by deploying the American military to U.S. cities comes at an immense price.
The post Trump’s Military Occupations of U.S. Cities Cost $473 Million and Rising appeared first on The Intercept.",https://theintercept.com/2025/11/11/cost-trump-national-guard-military-occupation/,https://theintercept.com/wp-content/uploads/2025/11/AP25298452623739-e1762880217673.jpg?fit=5120%2C2560&w=1200&h=800,,"President Donald Trumps military occupations of U.S. cities have cost nearly half a billion dollars, according to an expert estimate provided exclusively to The Intercept.
The current $473 million p… [+15145 chars]",
3c30deb5e42820b31b9f91e14bc1f6a5,2025-11-11T18:59:00Z,'storm surge',www.activistpost.com,en,0.1,How To Survive What Comes Next,"Here’s How a Cashless Society Will Impact the World Aside from economic collapse scenarios, many countries are in the process of eliminating physical cash and coins. Instead, everyone has an account that holds their money. You cannot purchase goods or service…",https://www.activistpost.com/how-to-survive-what-comes-next/,https://www.activistpost.com/wp-content/uploads/2025/11/knife-7061376_640.jpg,,"Aside from economic collapse scenarios, many countries are in the process of eliminating physical cash and coins. Instead, everyone has an account that holds their money. You cannot purchase goods or… [+118586 chars]",
7c9adf80a23c4d4af5bc4b6e89dc60b4,2025-11-11T19:19:28Z,'hurricane warning',abcnews.go.com,en,0.1,WATCH: Millions of Americans experience first major snowfall of the season,More than 200 million people across multiple U.S. states woke up on Tuesday to an early blast of winter with the first major snowfall of the season.,https://abcnews.go.com/US/video/millions-americans-experience-major-snowfall-season-127423670,https://i.abcnewsfe.com/a/e5bac55a-ed9b-4f96-8d33-7e3ac5f4e1c0/251111_abc_social_first_snow_2025_hpMain_9x16.jpg?w=992,,"<ul><li>House could vote on government funding bill as early as Wednesday
</li><li>Frustration grows as FAA increases flight reductions
</li><li>Obama surprises veterans arriving on Honor Flight to… [+4470 chars]",
35857207c180ea4db849aa35d086b764,2025-11-11T20:04:34Z,'storm surge',www.bluetracker.gg,en,0.1,[US] Midnight Beta Test Development Notes,"[Blue Topic] Midnight Beta Development Notes NEW FEATURES Expansion Introduction and Midnight Campaign Leveling 81-90 All Zones The battle between Light and the Void spans across four new zones: Eversong Woods, Zul’Aman, Harandar, and Voidstorm. Silvermoon Ci…",https://www.bluetracker.gg/wow/topic/us-en/2174760-midnight-beta-test-development-notes/,https://www.bluetracker.gg/static/images/logo.webp,,"Midnight Alpha Test Development Notes
CHARACTER LEVEL
Developers notes: With each phase, we encourage players to make a new template character and avoid using their previous characters as they coul… [+99706 chars]",
82cbc8f79261f590df192656239ab228,2025-11-11T20:18:34Z,'storm surge',www.ibtimes.com,en,0.1,Personal Injury Lawyers Are Failing the People Who Need Them Most,"Legal realities intensify the moral duty civil trial attorneys carry. We are often the first, and sometimes the only, people who can translate chaos into order. That duty calls us to act as emotional first responders, steady hands in the storm, guided by grac…",https://www.ibtimes.com/personal-injury-lawyers-are-failing-people-who-need-them-most-3790137,https://d.ibtimes.com/en/full/4633817/jerry-pitkin.png,,"One moment you are driving home, the next you are bleeding on asphalt, and the first call you make should not land in a sales funnel. Yet that is exactly what personal injury law has become. A market… [+5168 chars]",
02918296c84a65162b4756708f2eea0a,2025-11-12T02:10:39Z,'typhoon sea surface temperature',www.designboom.com,en,0.1,SCUT punctuates vast mangrove forest in china with perforated lunar tower,"perforated aluminum panels filter light and air through the lunar tower’s skin
The post SCUT punctuates vast mangrove forest in china with perforated lunar tower appeared first on designboom | architecture & design magazine.",https://www.designboom.com/architecture/scut-mangrove-forest-china-perforated-lunar-tower-11-12-2025/,https://www.designboom.com/twitterimages/uploads/2025/11/lunar-observation-tower-dongzhai-harbor-mangrove-natural-reserve-area-architectural-design-research-institute-scut-designboom-FB-1.jpg,,"a lunar tower overlooks coastal wetlands
Rising from the eastern edge of the Hainan Dongzhaigang National Nature Reserve, the Lunar Tower by the South China University of Technology Architectural De… [+3420 chars]",
30654d61895d389ae766931b5ce62dd1,2025-11-12T03:38:15Z,'hurricane warning',www.tallahassee.com,en,0.1,"Northern lights return to the Deep South with sightings in Tallahassee, Florida","Twice in 2024, Florida residents experienced the rare display of the aurora borealis in the Sunshine State. Tuesday night the northern lights returned.",https://www.tallahassee.com/story/news/2025/11/11/northern-lights-spotted-in-florida-tallahassee/87224337007/,https://s.yimg.com/ny/api/res/1.2/S3FethvhfTRGemHiRL72wg--/YXBwaWQ9aGlnaGxhbmRlcjt3PTEyMDA7aD04MDA7Y2Y9d2VicA--/https://media.zenfs.com/en/tallahassee-democrat/99c54a997c454f28860bb09d6f13c8ec,,"Let there be lights again!
The northern lights were expected to illuminate the night skies in nearly two dozen states across the U.S., as a powerful solar storm approached Earth starting Tuesday, No… [+3561 chars]",
431cb3f2f13f517b2ae1797eb5d529d8,2025-11-12T06:15:50Z,'hurricane evacuation',www.insurancejournal.com,en,0.1,Hurricane Melissa Shows How Quickly Climate Change Is Outstripping Defenses,"Jamaica has invested tens of millions of dollars in bolstering coastal defenses by planting mangroves, building seawalls and strengthening urban infrastructure. It wasn’t close to enough to withstand Hurricane Melissa’s 185-mile-an-hour winds and 13-foot stor…",https://www.insurancejournal.com/news/international/2025/11/12/847125.htm,https://www.insurancejournal.com/app/uploads/2025/10/destroyed-neighborhood-in-jamaica-after-hurricane-melissa-getty-scaled.jpg,,"Jamaica has invested tens of millions of dollars in bolstering coastal defenses by planting mangroves, building seawalls and strengthening urban infrastructure. It wasn’t close to enough to withstand… [+6003 chars]",
f34e2e15f27709c1817ebfbe709d1553,2025-11-12T10:30:00Z,'hurricane evacuation',www.npr.org,en,0.1,It's harder to get home insurance. That's changing communities across the U.S.,"Home insurance is getting less affordable, and less available, as insurers raise prices and pull back from areas with extreme weather. That's forcing families across the country to make tough choices.",https://www.npr.org/2025/11/12/nx-s1-5546754/climate-home-insurance-cop30-prices-expensive-disasters,https://npr.brightspotcdn.com/dims3/default/strip/false/crop/1024x576+0+95/resize/1400/quality/100/format/jpeg/?url=http%3A%2F%2Fnpr-brightspot.s3.amazonaws.com%2F38%2Fb2%2Fbf3e535148eda8dee76ad54abbf8%2Fap131284227692-1.jpg,http://web.archive.org/web/20251112221932/https://www.npr.org/2025/11/12/nx-s1-5546754/climate-home-insurance-cop30-prices-expensive-disasters,"Home insurance is getting more expensive in the United States, and insurers are pulling back from some regions as the cost of disasters grows.That trend is stretching the limits of what ordinary Amer… [+10755 chars]",
577011f34e0de18c049ba40900da56ae,2025-11-05T11:00:07Z,'flooding tropical',www.ibtimes.com,en,0.8,Early New Typhoon Heading Toward Philippines After Kalmaegi Devastates the Nation,"At least 40 people have died and hundreds of thousands have been displaced as Typhoon Kalmaegi devastates the Philippines, flooding Cebu and surrounding islands, while a new tropical system threatens to follow.",https://www.ibtimes.com/early-new-typhoon-heading-toward-philippines-after-kalmaegi-devastates-nation-3789659,https://d.ibtimes.com/en/full/4633070/typhoon-kalmaegi-ravages-philippines.png,,"When dawn broke over the central Philippines, communities woke to scenes of heartache and ruin.
Typhoon Kalmaegi, one of the strongest storms to strike the region this year, has unleashed devastatio… [+4003 chars]",
024cb7124055544855d77fbf8d6982a1,2025-11-11T13:00:00Z,'storm surge',www.menshealth.com,en,0.8,The Surprising Reason Some People Shouldn't Run Right After a Thunderstorm,"New research uncovers a unique surge of emergency room visits following a thunderstorm. The reason behind it may impact people frequently outside, like runners.",https://www.menshealth.com/health/a69274317/run-after-a-thunderstorm-asthma/,"https://hips.hearstapps.com/hmg-prod/images/gettyimages-525877208-690cc3a645e9e.jpg?crop=1.00xw:0.751xh;0,0.187xh&resize=1200:*",,"DEPENDING ON WHO you ask, there are plenty of ways the weather can impact human health. People with knee arthritis say they feel stiffness when temperatures drop. Some claim that changes in air press… [+5162 chars]",
d876a44fbec56e2970349e9fdc8d28b6,2025-11-01T08:00:00Z,'hurricane',www.cbc.ca,en,0.9,"My country has been 'ripped apart,' Jamaican farm worker says as people in Niagara call out for help","Rohan Thompson was keeping a close eye on Melissa from St. Catharines, Ont., where he works as a temporary farm worker, as the Category 5 hurricane approached his homeland earlier this week.",https://www.cbc.ca/news/canada/hamilton/niagara-disaster-relief-hurricane-melissa-9.6962253,"https://i.cbc.ca/ais/fb05a246-c7d8-4fef-88e9-d8a3a0c3b574,1762002420722/full/max/0/default.jpg?im=Crop%2Crect%3D%280%2C0%2C4154%2C2336%29%3BResize%3D620",,"Rohan Thompson was keeping a close eye on Melissa from St. Catharines, Ont., where he works as a temporary farm worker, as the Category 5 hurricane approached his homeland earlier this week.
The sea… [+6773 chars]",
0c248fc3635c1929498e93073175be95,2025-11-02T13:15:02Z,'hurricane',www.commondreams.org,en,0.9,"With Hurricane Melissa, Capitalism and Climate Chaos Bring Devastation to Jamaica","Kingston buzzed with feverish preparations and anxious alerts in the days before Melissa, a powerful Category 5 hurricane, made landfall earlier this week on the island of Jamaica. Supermarkets and hardware stores endured the crush of customers scrambling to …",https://www.commondreams.org/opinion/hurricane-melissa-climate-jamaica,https://www.commondreams.org/media-library/image.jpg?id=62002486&width=1200&height=600&coordinates=0%2C344%2C0%2C344,,"Kingston buzzed with feverish preparations and anxious alerts in the days before Melissa, a powerful Category 5 hurricane, made landfall earlier this week on the island of Jamaica. Supermarkets and h… [+8179 chars]",
