index,published,keyword,domain,language,valid,title,description,url,image,archive,content,quote,de,en,la,added
a35fc1285611100ff2e4d86b83d73a83,2026-05-03T20:56:00Z,'typhoon',securityaffairs.com,en,0.7,Salt Typhoon breach IBM subsidiary in Italy: a warning for Europe’s digital defenses,"April 2026 breach at Sistemi Informativi (IBM Italy) raises concerns over Chinese-linked cyber ops in Europe, including Salt Typhoon. In late April 2026, the Italian cybersecurity landscape was shaken by a significant breach targeting Sistemi Informativi, a c…",https://securityaffairs.com/191638/apt/salt-typhoon-breach-ibm-subsidiary-in-italy-a-warning-for-europes-digital-defenses.html,https://securityaffairs.com/wp-content/uploads/2014/07/Chinese-hackers-espionage.jpg,,"Salt Typhoon breach IBM subsidiary in Italy: a warning for Europes digital defenses
In late April 2026, the Italian cybersecurity landscape was shaken by a significant breach targeting Sistemi Infor… [+3260 chars]",,"Salt Typhoon durchbricht IBM-Tochtergesellschaft in Italien: eine Warnung für Europas digitale Verteidigung. Ein Verstoß bei Sistemi Informativi (IBM Italien) im April 2026 gibt Anlass zur Besorgnis über mit China verbundene Cyberoperationen in Europa, darunter Salt Typhoon. Ende April 2026 wurde die italienische Cybersicherheitslandschaft durch einen schwerwiegenden Verstoß gegen Sistemi Informativi, ein Unternehmen, erschüttert.","Salt Typhoon breach IBM subsidiary in Italy: a warning for Europe’s digital defenses. April 2026 breach at Sistemi Informativi (IBM Italy) raises concerns over Chinese-linked cyber ops in Europe, including Salt Typhoon. In late April 2026, the Italian cybersecurity landscape was shaken by a significant breach targeting Sistemi Informativi, a c…","Sal Typhonis contritio IBM subsidiaria in Italia: monitum pro praesidiis digitales Europaeis. Aprilis 2026 contritio apud Sistemi Informativi (IBM Italy) curam de Opis cybericis Sinensi connexis in Europa, excepto Typhoni Salis, movet. Nuper Aprili 2026, Italiae cybersecuritas topiorum terra concussa est notabili fractura Sistemi Informativi, a e…",2026-05-05 05:50:16+00:00
109e0182754a5f566133100eca86624b,2026-05-04T08:45:00Z,'hurricane death',grist.org,en,0.7,Hurricane Helene shattered lives — and the systems that keep people sober,Recovery from substance use disorder requires community. What happens when a disaster tears that apart?,https://grist.org/health/hurricane-helene-shattered-lives-and-the-systems-that-keep-people-sober/,https://grist.org/wp-content/uploads/2026/04/Barber_GRIST_SubtanceUse_Helene_27-SocialCrop.jpg?quality=75&strip=all,,This story was published in partnership with The Assembly. It was produced as a project for USC Annenbergs Center for Health Journalism and Center for Climate Journalism and Communication 2025 Health… [+21359 chars],,"Hurrikan Helene zerstörte Leben – und die Systeme, die Menschen nüchtern halten. Die Genesung von einer Substanzstörung erfordert Gemeinschaft. Was passiert, wenn eine Katastrophe das zerstört?",Hurricane Helene shattered lives — and the systems that keep people sober. Recovery from substance use disorder requires community. What happens when a disaster tears that apart?,"Procellae Helene quassata vitas — et disciplinas quae homines sobrios servant. Recuperatio a substantia usus inordinatio communitatem requirit. Quid accidit cum calamitate lacrimarum, qui secernunt?",2026-05-06 16:08:16+00:00
6658d19676bb6d6abb4d6867f39f4b50,2026-05-01T06:00:00Z,'hurricane warning',www.naturalnews.com,en,0.9,The Twin Economic Superstorms: Why Your Financial Future Is at Risk from Energy Collapse and AI Job Replacement,"Two Storms Are About to Hit I have been warning for years that an economic hurricane is bearing down on the United States, and now I see two distinct superstorms converging at once. The first is an energy collapse driven by war and supply chain breakdown. The…",https://www.naturalnews.com/2026-05-01-twin-economic-superstorms-financial-future-at-risk.html,https://www.naturalnews.com/wp-content/uploads/sites/91/2026/05/economic-superstorms-energy-collapse-ai-job-replacement-1223-original.jpg,,"Two Storms Are About to Hit
I have been warning for years that an economic hurricane is bearing down on the United States, and now I see two distinct superstorms converging at once. The first is an … [+9125 chars]",,"Die Zwillings-Wirtschafts-Superstürme: Warum Ihre finanzielle Zukunft durch den Energiekollaps und die Ersetzung von KI-Arbeitsplätzen gefährdet ist. Zwei Stürme stehen vor der Tür Ich warne seit Jahren davor, dass ein wirtschaftlicher Hurrikan auf die Vereinigten Staaten zukommt, und jetzt sehe ich, wie zwei verschiedene Superstürme gleichzeitig zusammenlaufen. Der erste ist ein Energiekollaps, der durch Krieg und den Zusammenbruch der Lieferkette verursacht wird. Der…","The Twin Economic Superstorms: Why Your Financial Future Is at Risk from Energy Collapse and AI Job Replacement. Two Storms Are About to Hit I have been warning for years that an economic hurricane is bearing down on the United States, and now I see two distinct superstorms converging at once. The first is an energy collapse driven by war and supply chain breakdown. The…","Didymus Economic Superstorms: Cur Financial Future Tuus in Risk ab Energy Collapse et AI Job replacement. Duae procellae incipientes percutere monui per annos tempestatem oeconomicam in Civitatibus Foederatis deferre, et nunc duas superstitias distinctas simul convergentes video. Primum est industria belli et copia catenae naufragii ruina acti. The…",2026-05-06 16:08:16+00:00
