index,published,keyword,domain,language,valid,title,description,url,image,archive,content,quote,de,en,la,added
324b3eed2b6a33de870bd63de667c88f,2025-07-01T07:44:20Z,veryUnusualAndNeverUsedKeyword,www.nbcnews.com,en,0.9,Flossie becomes a hurricane off Mexico's Pacific coast after rapidly strengthening,MEXICO CITY — Flossie has strengthened into a hurricane off Mexico's southwestern Pacific coast.,https://www.nbcnews.com/weather/hurricanes/flossie-becomes-hurricane-mexicos-pacific-coast-rapidly-strengthening-rcna216149,"https://media-cldnry.s-nbcnews.com/image/upload/t_nbcnews-fp-1200-630,f_auto,q_auto:best/rockcms/2025-07/250701-hurricane-flossie-rs-9b2a5f.jpg",http://web.archive.org/web/20250702011118/https://www.nbcnews.com/weather/hurricanes/flossie-becomes-hurricane-mexicos-pacific-coast-rapidly-strengthening-rcna216149,MEXICO CITY Flossie has strengthened into a hurricane off Mexico's southwestern Pacific coast. The U.S. National Hurricane Center in Miami said Flossie became a Category 1 hurricane Monday night and … [+973 chars],,"Flossie wird vor der mexikanischen Pazifikküste zu einem Hurrikan, nachdem er sich schnell verstärkt hat. MEXIKO-STADT – Flossie hat sich vor der südwestlichen Pazifikküste Mexikos zu einem Hurrikan entwickelt.",Flossie becomes a hurricane off Mexico's Pacific coast after rapidly strengthening. MEXICO CITY — Flossie has strengthened into a hurricane off Mexico's southwestern Pacific coast.,Flossie turbo fit oram Pacifici Mexici off postquam celeriter corroboratur. MEXICO CITY - Flossie in oram Pacifici occidentis meridiem occidentalem Mexici in procellam confirmavit.,2025-12-17 12:46:33+00:00
6100e2552e7d71ae92e630c9f9d6111d,2025-07-01T15:46:05Z,'hurricane',insidethemagic.net,en,0.9,Severe Weather Forces Warning: Disney World Vacations in Jeopardy,"With hurricane season off to a slow start, things might be ramping up as a tropical disturbance could make things very difficult for Disney World vacationers this 4th of July. Is it too late to reverse course? Let’s find out. National Weather Service Said It …",https://insidethemagic.net/2025/07/disney-world-tropical-disturbance-summer-emd1/,https://insidethemagic.net/wp-content/uploads/2024/09/Untitled-design-2024-09-28T161050.484.jpg,,"With hurricane season off to a slow start, things might be ramping up as a tropical disturbance could make things very difficult for Disney World vacationers this 4th of July. Is it too late to rever… [+4754 chars]",,"Unwetterwarnung: Disney World-Urlaub in Gefahr. Da die Hurrikan-Saison langsam beginnt, könnte sich die Situation noch verschärfen, da eine tropische Störung die Lage für Disney-World-Urlauber am 4. Juli sehr erschweren könnte. Ist es zu spät, den Kurs umzukehren? Finden wir es heraus. Der Nationale Wetterdienst sagte es …","Severe Weather Forces Warning: Disney World Vacations in Jeopardy. With hurricane season off to a slow start, things might be ramping up as a tropical disturbance could make things very difficult for Disney World vacationers this 4th of July. Is it too late to reverse course? Let’s find out. National Weather Service Said It …","Gravis Tempestas Virium Admonitio: Disney Vacationes Mundi in Periculo. Procellae temporis ad lentum initium, res rapientes ut tropicae perturbatio res difficillimas facere potuerunt pro Disney Vacationibus Mundi hoc die 4 mensis Iulii. Estne nimis sero ad cursum revocandum? Inveniamus. National Tempestas Service dixit ...",2025-12-17 12:46:33+00:00
2466162cea8dda607debbe32e6e1214c,2025-07-06T14:01:22Z,'hurricane season',biztoc.com,en,0.9,"Tropical Storm Chantal Makes Landfall, Map Shows Path Update","Voice is AI-generated. Inconsistencies may occur.
Tropical Storm Chantal has made landfall on the East Coast, impacting the Carolinas on Sunday morning.
Why It Matters
Chantal is the third tropical storm of the 2025 Atlantic hurricane season so far, following…",https://biztoc.com/x/0493a9e8830dcc9d,https://biztoc.com/cdn/0493a9e8830dcc9d_s.webp,http://web.archive.org/web/20250707020216/https://biztoc.com/x/0493a9e8830dcc9d,"Voice is AI-generated. Inconsistencies may occur.Tropical Storm Chantal has made landfall on the East Coast, impacting the Carolinas on Sunday morning.Why It MattersChantal is the third tropical stor… [+141 chars]",,"Tropensturm Chantal trifft auf Land, Karte zeigt Pfadaktualisierung. Die Stimme wird KI-generiert. Es kann zu Inkonsistenzen kommen.
Der Tropensturm Chantal hat die Ostküste erreicht und am Sonntagmorgen die Carolinas getroffen.
Warum es wichtig ist
Chantal ist der bisher dritte Tropensturm der atlantischen Hurrikansaison 2025, nach…","Tropical Storm Chantal Makes Landfall, Map Shows Path Update. Voice is AI-generated. Inconsistencies may occur.
Tropical Storm Chantal has made landfall on the East Coast, impacting the Carolinas on Sunday morning.
Why It Matters
Chantal is the third tropical storm of the 2025 Atlantic hurricane season so far, following…","Tropical Chantal Landfall Facit, Map Update Path ostendit. Vox est AI-generata. Inconvenientia fieri potest.
Tropical Storm Chantal land ruinam in Orientem Coast fecit, Carolinas impacto die Dominico mane.
Quid refert
Chantal est tertia tropica tempestas 2025 temporis Atlantici turbinis tam longe sequens…",2025-12-17 12:46:33+00:00
610ca2ab095db1678b37923fa03cff27,2025-07-09T14:00:00Z,veryUnusualAndNeverUsedKeyword,journals.plos.org,en,0.9,Cyclone vulnerability assessment of the central coast of Bangladesh: A comprehensive study utilizing FAHP and geospatial techniques,The coastal areas of Bangladesh are recognized as a major South Asian center for cyclone landfall. This research develops a comprehensive tropical cyclone mapping strategy utilizing the Fuzzy Analytical Hierarchy Process (FAHP) and geospatial techniques to an…,https://journals.plos.org/plosone/article?id=10.1371/journal.pone.0326965,https://journals.plos.org/plosone/article/figure/image?id=10.1371/journal.pone.0326965.g007&size=inline,http://web.archive.org/web/20250803090148/https://journals.plos.org/plosone/article?id=10.1371/journal.pone.0326965,"Abstract
The coastal areas of Bangladesh are recognized as a major South Asian center for cyclone landfall. This research develops a comprehensive tropical cyclone mapping strategy utilizing the Fuz… [+76255 chars]",,"Bewertung der Anfälligkeit für Wirbelstürme an der zentralen Küste von Bangladesch: Eine umfassende Studie unter Verwendung von FAHP und Geodatentechniken. Die Küstengebiete von Bangladesch gelten als wichtiges südasiatisches Zentrum für Zyklonanlandungen. Diese Forschung entwickelt eine umfassende Kartierungsstrategie für tropische Wirbelstürme unter Verwendung des Fuzzy Analytical Hierarchy Process (FAHP) und Geodatentechniken, um…",Cyclone vulnerability assessment of the central coast of Bangladesh: A comprehensive study utilizing FAHP and geospatial techniques. The coastal areas of Bangladesh are recognized as a major South Asian center for cyclone landfall. This research develops a comprehensive tropical cyclone mapping strategy utilizing the Fuzzy Analytical Hierarchy Process (FAHP) and geospatial techniques to an…,vulnerabilitas cyclonum aestimatio oram centralis Bangladesh: studium comprehendens FAHP et geospatiales artes adhibens. Regiones maritimae Bangladesh cognoscuntur ut centrum maioris Asiae meridionalis pro cyclone trahentis. Investigatio haec evolvit comprehensivam cyclonem tropicam destinata consilio adhibitis quamquam processu analytico Hierarchia (FAHP) et artificiis geospatialibus ad ...,2025-12-17 12:46:33+00:00
0fbde455bcacff8e23d3b4b0ec68323e,2025-07-12T20:14:41Z,veryUnusualAndNeverUsedKeyword,www.usatoday.com,en,0.9,"Tropical trouble could be brewing around Florida, hurricane forecasters say",A broad area of low pressure could develop offshore of the southeastern U.S. coast.,https://www.usatoday.com/story/news/nation/2025/07/12/hurricane-forecasters-eyeing-a-potential-system-near-florida/84821117007/,https://media.zenfs.com/en/usa_today_news_641/1ef2e29c17ef4fa56e60506c81af3685,http://web.archive.org/web/20250712233943/https://www.usatoday.com/story/news/nation/2025/07/12/hurricane-forecasters-eyeing-a-potential-system-near-florida/84821117007/,"Another potential tropical disturbance popped up on the National Hurricane Center's tracking chart on Saturday, July 12.
For those who watch every potential storm closely, this initial map looks a l… [+3525 chars]",,Laut Hurrikan-Prognostikern könnten sich rund um Florida tropische Probleme zusammenbrauen. Vor der südöstlichen US-Küste könnte sich ein ausgedehntes Tiefdruckgebiet entwickeln.,"Tropical trouble could be brewing around Florida, hurricane forecasters say. A broad area of low pressure could develop offshore of the southeastern U.S. coast.","Tropical tribulatio potest esse circa Floridam, forecasters turbinibus miscere. Lata area humilis pressura potest evolvere ipsam orientalem US oram orientalem.",2025-12-17 12:46:33+00:00
988825f2809f465fa223741ac98abac8,2025-07-15T13:54:11Z,'tropical depression',www.newsweek.com,en,0.9,Tropical Storm Dexter Update: Spaghetti Models Show Potential Florida Path,"A disturbance near Florida could evolve into a tropical depression or Tropical Storm Dexter this week, according to forecasters.",https://www.newsweek.com/tropical-storm-dexter-update-spaghetto-models-show-potenital-florida-path-2099120,https://d.newsweek.com/en/full/2683423/nhc-map.jpg,http://web.archive.org/web/20250715173013/https://www.newsweek.com/tropical-storm-dexter-update-spaghetto-models-show-potenital-florida-path-2099120,"Forecast models show possible paths for a disturbance near Florida that could develop into Tropical Storm Dexter this week.
Why It Matters
The Atlantic Hurricane season has seen three named systems… [+3912 chars]",,Update zum Tropensturm Dexter: Spaghetti-Modelle zeigen potenziellen Weg nach Florida. Meteorologen zufolge könnte sich eine Störung in der Nähe von Florida diese Woche zu einem tropischen Tiefdruckgebiet oder dem Tropensturm Dexter entwickeln.,"Tropical Storm Dexter Update: Spaghetti Models Show Potential Florida Path. A disturbance near Florida could evolve into a tropical depression or Tropical Storm Dexter this week, according to forecasters.",Tropical Procella Dextera Renovatio: Spaghetti exemplum monstra Potentiale Florida Path. Commotio prope Floridam potuit evolvere in depressionem tropicam vel Tropical Dextera hac septimana secundum forecasters.,2025-12-17 12:46:33+00:00
e8781e2ec0634607631be165fe705370,2025-07-19T13:10:00Z,'typhoon',www.thestar.com.my,en,0.9,SIA and Cathay Pacific cancel flights as typhoon nears Hong Kong,Singapore Airlines (SIA) and Cathay Pacific Airways delayed and cancelled flights in and out of Hong Kong on July 20 as tropical cyclone Wipha approached the city. Read full story,https://www.thestar.com.my/aseanplus/aseanplus-news/2025/07/19/sia-and-cathay-pacific-cancel-flights-as-typhoon-nears-hong-kong,https://apicms.thestar.com.my/uploads/images/2025/07/19/3425295.jpg,http://web.archive.org/web/20250719205956/https://www.thestar.com.my/aseanplus/aseanplus-news/2025/07/19/sia-and-cathay-pacific-cancel-flights-as-typhoon-nears-hong-kong,"HONG KONG (Bloomberg): Singapore Airlines (SIA) and Cathay Pacific Airways delayed and cancelled flights in and out of Hong Kong on July 20 as tropical cyclone Wipha approached the city.
According t… [+1727 chars]",,"SIA und Cathay Pacific stornieren Flüge, da sich der Taifun Hongkong nähert. Singapore Airlines (SIA) und Cathay Pacific Airways verspäteten und stornierten am 20. Juli Flüge von und nach Hongkong, als sich der tropische Wirbelsturm Wipha der Stadt näherte. Lesen Sie die ganze Geschichte",SIA and Cathay Pacific cancel flights as typhoon nears Hong Kong. Singapore Airlines (SIA) and Cathay Pacific Airways delayed and cancelled flights in and out of Hong Kong on July 20 as tropical cyclone Wipha approached the city. Read full story,"SIA et Cathay Pacific volatus excludit sicut typhon, iam Hong Kong. Singapore Airlines (SIA) et Cathay Pacific Airlines morati sunt et volatus in et e Hong Kong die 20 Iulii retardati sunt sicut cyclus tropicus Wipha urbi appropinquavit. Read full story",2025-12-17 12:46:33+00:00
07eedd790e1e4340197757db3c4f6029,2025-07-19T14:52:26Z,'typhoon',slashdot.org,en,0.9,Tropical storm Wipha threatens southern China after battering Taiwan and the Philippines - AP News,"Tropical storm Wipha threatens southern China after battering Taiwan and the PhilippinesAP News Developing Hong Kong to issue T8 signal at 12.20am on Sunday, higher typhoon alert possibleSouth China Morning Post Cathay Pacific Cancels Sunday Flights as Typhoo…",https://slashdot.org/firehose.pl?op=view&amp;id=178418020,,http://web.archive.org/web/20160119174443/http://slashdot.org/firehose.pl?op=view,The Fine Print: The following comments are owned by whoever posted them. We are not responsible for them in any way.,,"Tropensturm Wipha bedroht Südchina, nachdem er Taiwan und die Philippinen heimgesucht hat – AP News. Tropensturm Wipha bedroht Südchina, nachdem er Taiwan und die Philippinen heimgesucht hatAP News Hongkong wird am Sonntag um 00:20 Uhr T8-Signal aussenden, höhere Taifunwarnung möglichSouth China Morning Post Cathay Pacific bricht Sonntagsflüge ab, da Taifun…","Tropical storm Wipha threatens southern China after battering Taiwan and the Philippines - AP News. Tropical storm Wipha threatens southern China after battering Taiwan and the PhilippinesAP News Developing Hong Kong to issue T8 signal at 12.20am on Sunday, higher typhoon alert possibleSouth China Morning Post Cathay Pacific Cancels Sunday Flights as Typhoo…","Tropical Wipha tempestas Sinas meridionales minatur post Taiwan et Philippinas - AP News. Tropical Wipha tempestas Sinis meridionalibus minatur post Taiwan et PhilippinesAP Nuntii evolutionis Hong Kong ut signum T8 in 12.20am die Dominico emittat, altior typhon erectus potestSouth Sina Mane Post Cathay Pacific Cancels volatus Solis ut Typhoo…",2025-12-17 12:46:33+00:00
4a1b9c2d66f133151d00155eb95b5978,2025-07-19T17:58:57Z,'tropical cyclone',timesofindia.indiatimes.com,en,0.9,"Hong Kong axes flights, classes as Typhoon Wipha nears","Hong Kong issued its third-highest tropical cyclone warning in the early hours of Sunday as Typhoon Wipha drew nearer, with authorities cancelling classes and grounding hundreds of flights. Hong Kong's Airport Authority asked travellers to prepare for ""signif…",https://timesofindia.indiatimes.com/world/rest-of-world/hong-kong-axes-flights-classes-as-typhoon-wipha-nears/articleshow/122786109.cms,"https://static.toiimg.com/thumb/msid-122786198,width-1070,height-580,imgsize-1121215,resizemode-75,overlay-toi_sw,pt-32,y_pad-40/photo.jpg",http://web.archive.org/web/20250720000528/https://timesofindia.indiatimes.com/world/rest-of-world/hong-kong-axes-flights-classes-as-typhoon-wipha-nears/articleshow/122786109.cms,Feeling bloated? 10 foods approved by top doc for instant relief,,"Hongkong stellt Flüge ein, Klassen, da Taifun Wipha näher rückt. Hongkong gab in den frühen Morgenstunden des Sonntags seine dritthöchste Warnung vor einem tropischen Wirbelsturm heraus, als der Taifun Wipha näher rückte. Die Behörden sagten Kurse ab und stellten Hunderte von Flügen ein. Die Flughafenbehörde von Hongkong forderte Reisende auf, sich auf „erhebliche Ereignisse“ vorzubereiten.","Hong Kong axes flights, classes as Typhoon Wipha nears. Hong Kong issued its third-highest tropical cyclone warning in the early hours of Sunday as Typhoon Wipha drew nearer, with authorities cancelling classes and grounding hundreds of flights. Hong Kong's Airport Authority asked travellers to prepare for ""signif…","Hongcongum secures volatus, classes ut Typhoon Wipha appropinquat. Hong Kong tertium-summum cyclum tropicum praemonuit monens in horis Dominicis primis ut Typhoon Wipha propius accessisset, cum auctoritatibus elisis classes et centenis volatus constituendis. Hongcongum Airport auctoritati quaesivit viatores parare ""signif…",2025-12-17 12:46:33+00:00
119bb9846167a540d2e9f5fbb015b00d,2025-07-20T04:25:52Z,'tropical cyclone',www.bloomberg.com,en,0.9,Hong Kong Issues Highest Storm Alert as Typhoon Wipha Moves In,"Hong Kong raised its storm alert to the highest level as tropical cyclone Wipha moved closer, with Cathay Pacific Airways Ltd. delaying and canceling flights in and out of the city on Sunday.",https://www.bloomberg.com/news/articles/2025-07-20/hong-kong-issues-highest-storm-alert-as-typhoon-wipha-approaches,https://assets.bwbx.io/images/users/iqjWHBFdfxIU/i0AsGC8iB04k/v1/1200x800.jpg,http://web.archive.org/web/20250830070505/https://www.bloomberg.com/news/articles/2025-07-20/hong-kong-issues-highest-storm-alert-as-typhoon-wipha-approaches,"Hong Kong raised its storm alert to the highest level as tropical cyclone Wipha moved closer, with Cathay Pacific Airways Ltd. delaying and canceling flights in and out of the city on Sunday.
The Ho… [+335 chars]",,"Hongkong gibt höchste Sturmwarnung aus, da der Taifun Wipha einzieht. Hongkong erhöhte seine Sturmwarnung auf die höchste Stufe, als der tropische Wirbelsturm Wipha näher rückte, wobei Cathay Pacific Airways Ltd. am Sonntag Flüge in und aus der Stadt verzögerte und annullierte.","Hong Kong Issues Highest Storm Alert as Typhoon Wipha Moves In. Hong Kong raised its storm alert to the highest level as tropical cyclone Wipha moved closer, with Cathay Pacific Airways Ltd. delaying and canceling flights in and out of the city on Sunday.","Hong Kong Exitus altissimum Tempestatem erecti ut Typhoon Wipha movet in. Hong Kong tempestatem suam ad summum gradum excitavit ut cyclus tropicus Wipha propius movetur, cum Cathay Pacific Airlines Ltd. morando et rescindendo volatus in et extra urbem die Dominico.",2025-12-17 12:46:33+00:00
534d8246d6420af06e9d2af430b13e71,2025-07-20T05:04:15Z,'tropical cyclone',www.ndtvprofit.com,en,0.9,Hong Kong Issues Highest Storm Alert As Typhoon Wipha Moves In,"Hong Kong raised its storm alert to the highest level as tropical cyclone Wipha moved closer, with Cathay Pacific Airways Ltd. delaying and canceling flights in and out of the city on Sunday.",https://www.ndtvprofit.com/world/hong-kong-issues-highest-storm-alert-as-typhoon-wipha-moves-in,https://media.assettype.com/bloombergquint%2F2024-06%2Fb01d5ef8-57ab-4e6e-9257-25e408936f89%2F_1x_1.jpg?rect=0%2C0%2C2000%2C1050&w=1200&auto=format%2Ccompress&ogImage=true,,"Hong Kong raised its storm alert to the highest level as tropical cyclone Wipha moved closer, with Cathay Pacific Airways Ltd. delaying and canceling flights in and out of the city on Sunday.
The Ho… [+1103 chars]",,"Hongkong gibt höchste Sturmwarnung aus, da der Taifun Wipha aufzieht. Hongkong erhöhte seine Sturmwarnung auf die höchste Stufe, als der tropische Wirbelsturm Wipha näher rückte, wobei Cathay Pacific Airways Ltd. am Sonntag Flüge in und aus der Stadt verzögerte und annullierte.","Hong Kong Issues Highest Storm Alert As Typhoon Wipha Moves In. Hong Kong raised its storm alert to the highest level as tropical cyclone Wipha moved closer, with Cathay Pacific Airways Ltd. delaying and canceling flights in and out of the city on Sunday.","Hong Kong Exitus altissimum Tempestatem erecti sicut Typhoon Wipha movet in. Hong Kong tempestatem suam ad summum gradum excitavit ut cyclus tropicus Wipha propius movetur, cum Cathay Pacific Airlines Ltd. morando et rescindendo volatus in et extra urbem die Dominico.",2025-12-17 12:46:33+00:00
c864b3d7a2570085dbcf7c13b1b90a58,2025-07-20T06:34:32Z,'typhoon',www.aljazeera.com,en,0.9,"Typhoon Wipha causes flight disruptions in Hong Kong, southern China",Hong Kong issues highest tropical cyclone warning and China's Hainan and Guangdong provinces are put on high alert.,https://www.aljazeera.com/news/2025/7/20/typhoon-wipha-causes-flight-disruptions-in-hong-kong-southern-china,https://www.aljazeera.com/wp-content/uploads/2025/07/AFP__20250720__67AN23A__v1__HighRes__HongKongChinaWeatherTyphoon-1752991253.jpg?resize=1920%2C1440,,"Hong Kong has issued its highest tropical cyclone warning as Typhoon Wipha batters the city, with authorities cancelling classes and grounding hundreds of flights and other transport services.
Wipha… [+2273 chars]",,"Taifun Wipha verursacht Flugstörungen in Hongkong, Südchina. Hongkong gibt die höchste Warnung vor tropischen Wirbelstürmen heraus und die chinesischen Provinzen Hainan und Guangdong werden in höchste Alarmbereitschaft versetzt.","Typhoon Wipha causes flight disruptions in Hong Kong, southern China. Hong Kong issues highest tropical cyclone warning and China's Hainan and Guangdong provinces are put on high alert.","Typhoon Wipha perturbationes fugat in Hong Kong, Sinis meridionalibus. Hong Kong constitutiones cyclo tropicae supremi monitus et provinciae Sinarum Haman et Guangdong in altum erecti sunt.",2025-12-17 12:46:33+00:00
7a828e2093b83beda1fab13a8f160783,2025-07-28T10:30:01Z,'typhoon',www.yahoo.com,en,0.9,Officials issue highest alert as massive typhoon barrels toward coastline: 'Do not go outside',Hurricane-force winds are expected.,https://www.yahoo.com/news/articles/officials-issue-highest-alert-massive-103001700.html,https://s.yimg.com/ny/api/res/1.2/D9wtnKMsRpxK1PCOkyxJNA--/YXBwaWQ9aGlnaGxhbmRlcjt3PTEyMDA7aD04MDA7Y2Y9d2VicA--/https://media.zenfs.com/en/the_cool_down_737/9b750c58fde52d504cd67bdb49db53a6,http://web.archive.org/web/20250803030552/https://www.yahoo.com/news/articles/officials-issue-highest-alert-massive-103001700.html,"Typhoon Wipha's approach has led Hong Kong to hoist its highest T10 warning. With winds topping 103 mph and severe flooding, the region braced for impact, paralleling escalating Pacific typhoons scie… [+2809 chars]",,"Beamte geben höchste Alarmstufe, während der gewaltige Taifun auf die Küste zurollt: „Gehen Sie nicht nach draußen.“ Es wird mit Winden in Orkanstärke gerechnet.",Officials issue highest alert as massive typhoon barrels toward coastline: 'Do not go outside'. Hurricane-force winds are expected.,"Magistratus summi intenti sunt ut dolia typhonia ingens ad oram maritimam: ""Noli exire"". Procellae vis ventorum exspectatur.",2025-12-17 12:46:33+00:00
7c2de9376926d61dd1847dbad6988d64,2025-07-02T17:40:16Z,veryUnusualAndNeverUsedKeyword,www.newsweek.com,en,0.2,Potential Tropical Storm Chantal Map Shows States at Risk,Four states in the U.S. Southeast could see heavy rain from Tropical Storm Chantal if it forms this weekend.,https://www.newsweek.com/tropical-storm-chantal-map-states-risk-2093711,https://d.newsweek.com/en/full/2675784/potential-tropical-storm-chantal-states-risk.png,http://web.archive.org/web/20250703091846/https://www.newsweek.com/tropical-storm-chantal-map-states-risk-2093711,"Four states are at risk of seeing impacts from Tropical Storm Chantal should it form over the holiday weekend.
AccuWeather Lead Hurricane Expert Alex DaSilva told Newsweek that if the storm appears … [+2978 chars]",,Die Karte des potenziellen Tropensturms Chantal zeigt gefährdete Staaten. In vier Bundesstaaten im Südosten der USA könnte es an diesem Wochenende zu heftigen Regenfällen durch den Tropensturm Chantal kommen.,Potential Tropical Storm Chantal Map Shows States at Risk. Four states in the U.S. Southeast could see heavy rain from Tropical Storm Chantal if it forms this weekend.,Potentia Tropical Storm Chantal Map Show States in Risk. Quattuor civitates in Americae Southeast pluviam gravem videre potuerunt ex Tropical Chantal si format hoc weekend.,2025-12-17 21:07:00+00:00
bd8ad555d5f4d8b5e82a886fdeebbea6,2025-07-03T11:10:34Z,'hurricane victims',www.newsweek.com,en,0.2,Florida Cyclone Update as Chances of Storm Keep Growing,Forecasters continue to monitor a disturbance along the southeast coast.,https://www.newsweek.com/florida-cyclone-update-chances-storm-keep-growing-2094086,https://d.newsweek.com/en/full/2676242/nhc-map.jpg,http://web.archive.org/web/20250704070525/https://www.newsweek.com/florida-cyclone-update-chances-storm-keep-growing-2094086,"The chances of a cyclone forming near Florida have again increased, forecasters at the National Hurricane Center (NHC) say.
Why It Matters
If tropical storm formation occurs, it will become the thi… [+2956 chars]",,"Update zum Florida-Zyklon, da die Wahrscheinlichkeit eines Sturms weiter steigt. Meteorologen beobachten weiterhin eine Störung entlang der Südostküste.",Florida Cyclone Update as Chances of Storm Keep Growing. Forecasters continue to monitor a disturbance along the southeast coast.,Florida Cyclone Update sicut casus tempestatis Serva Crescit. Vates pergunt perturbationem monitorem in ora orientis orae.,2025-12-17 21:07:00+00:00
