index,published,keyword,domain,language,valid,title,description,url,image,archive,content,quote
e1ade737f7f179ea41840c9eb1abad4a,2025-10-27T09:43:02Z,'storm surge',www.nbcnews.com,en,1.0,"Hurricane Melissa intensifies to Category 5 storm, threatens Jamaica with 'catastrophic' flooding","Hurricane Melissa intensified to a powerful Category 5 storm early Monday as forecasters warned it would cause catastrophic flash flooding, life-threatening landslides and extremely strong winds across the Caribbean",https://www.nbcnews.com/weather/hurricanes/hurricane-melissa-intensifies-category-5-storm-jamaica-flooding-rcna239989,"https://media-cldnry.s-nbcnews.com/image/upload/t_nbcnews-fp-1200-630,f_auto,q_auto:best/rockcms/2025-10/251027-jamaica-2-rs-71265f.jpg",http://web.archive.org/web/20251105051617/https://www.nbcnews.com/weather/hurricanes/hurricane-melissa-intensifies-category-5-storm-jamaica-flooding-rcna239989,"Hurricane Melissa intensified to a powerful Category 5 storm early Monday as forecasters warned it would cause catastrophic flash flooding, life-threatening landslides and extremely strong winds acro… [+2447 chars]",
4eacaaed464db52a260d0bbe8613064c,2025-10-27T09:43:15Z,'hurricane alert',www.huffpost.com,en,0.1,Melissa Strengthens To A Category 5 Hurricane As It Nears Jamaica,Melissa is forecast to make landfall on the island Tuesday and cross Cuba and the Bahamas through Wednesday.,https://www.huffpost.com/entry/melissa-strengthens-as-it-nears-jamaica_n_68ff3cbee4b0ebfddfba7691,https://img.huffingtonpost.com/asset/68ff3e181800003ac0e8f636.jpeg?cache=DJRFCCXoV4&ops=1200_630,,"Clouds cover Kingston, Jamaica, ahead of the forecast arrival of Hurricane Melissa on Oct. 26, 2025.
KINGSTON, Jamaica (AP) Hurricane Melissa intensified to Category 5 strength Monday as it neared J… [+4982 chars]",
61b4d7f7e9d99ffa60592430ebaa62ce,2025-10-27T09:57:00Z,'hurricane',www.cbc.ca,en,0.9,Melissa now a Category 5 hurricane as it approaches Jamaica,"Hurricane Melissa intensified to Category 5 strength on Monday as it neared Jamaica, with up to 76 centimetres of rain and a life-threatening storm surge.",https://www.cbc.ca/news/world/jamaica-hurricane-melissa-9.6954551,"https://i.cbc.ca/ais/7e28687e-322c-4863-9821-16bee34f714b,1761559153427/full/max/0/default.jpg?im=Crop%2Crect%3D%280%2C307%2C2947%2C1657%29%3BResize%3D620",http://web.archive.org/web/20251111132734/https://www.cbc.ca/news/world/jamaica-hurricane-melissa-9.6954551,"Hurricane Melissa intensified to Category 5 strength on Monday as it neared Jamaica, with up to 76 centimetres of rain and a life-threatening storm surge.
Melissa is forecast to make landfall on the… [+3523 chars]",
581aba81bceccdb51f7cbd0c7a95a965,2025-10-27T10:00:00Z,'hurricane season',www.yahoo.com,en,0.1,Researchers reveal major key in hunting down Florida's invasive pythons: 'Significantly increase removal efficiency',It’s possible that their population numbers in the hundreds of thousands.,https://www.yahoo.com/news/articles/researchers-reveal-major-key-hunting-100000413.html,https://s.yimg.com/ny/api/res/1.2/9qbk3fVeb0Ed5DQ7n3IX4Q--/YXBwaWQ9aGlnaGxhbmRlcjt3PTEyMDA7aD02NzU7Y2Y9d2VicA--/https://media.zenfs.com/en/the_cool_down_737/1dc65a32cc60f42baafd39d4eefdf929,,"Burmese pythons have taken over the Florida Everglades in just a few decades, but there is hope that the invasive species can be pulled back. A new study reveals how that might be done.
Published in… [+2630 chars]",
ca108251aa652deaebe9be4025e6b20f,2025-10-27T10:00:00Z,'hurricane',www.yahoo.com,en,1.0,Neighbors suffer relentless flooding after homeowner's careless mistake: 'An atrocious wrongdoing',"""One hurricane hits this community and it's over.""",https://www.yahoo.com/news/articles/neighbors-suffer-relentless-flooding-homeowners-100000968.html,https://media.zenfs.com/en/the_cool_down_737/27a317f3ab977b0d87e625145c6aabcd,,"A Florida neighborhood has been subjected to recurring flooding after one of its residents decided to plug a stormwater pipe that ran through their property with concrete.
As reported by the Orlando… [+2331 chars]",
0ff6b0316fa36b624f2a8c6122b1bcc4,2025-10-27T10:00:38Z,'hurricane death',www.thejournal.ie,en,0.0,Hurricane Melissa upgraded to Category five as it heads for Jamaica,The hurricane has been blamed for at least four deaths in Haiti and the Dominican Republic this week.,https://www.thejournal.ie/hurricane-melissa-upgrade-to-category-five-6857554-Oct2025/,https://img2.thejournal.ie/article/6857554/river/?height=400&version=6857557,,"HURRICAN MELISSA HAS been upgraded to a Category five storm as it heads for Jamaica and other parts of the Caribbean.
Forecasters are predicting catastrophic flooding and urging residents to seek sh… [+4118 chars]",
e48919b201d15d5c175a0dece5ca7658,2025-10-27T10:54:19Z,'hurricane evacuation',www.bbc.com,en,0.0,Hurricane Melissa could be strongest to ever hit Jamaica,Melissa has been upgraded to a category five storm and could become Jamaica's strongest on record.,https://www.bbc.com/news/articles/c2dr0z57nygo,https://ichef.bbci.co.uk/news/1024/branded_news/1e13/live/9c4a7270-b322-11f0-8419-83f831593ad2.jpg,,"Residents in Kingston prepare for the storm with sandbags
People in Jamaica are bracing for the impact of Hurricane Melissa, which is forecast to unleash destructive winds and bring catastrophic flo… [+2591 chars]",
fd1cbd846bc4d3ca73e3c1e72b4de4dd,2025-10-27T11:16:38Z,'hurricane',www.the-sun.com,en,0.0,MASS EVACUATIONS...,"MASS EVACUATIONS...

 
 
 
 (Third column, 3rd story, link)

 

 

 
 Related stories:CATASTROPHIC: HURRICANE MELISSA HISTORIC HIT FOR JAMACIA... DEVELOPING...
SLOW-MOVING MONSTER CLOSES IN...
CONE...
SATELLITE...

 

 
 
 Drudge Report Feed needs yo…",https://www.the-sun.com/news/15401432/mass-evacuations-jamaica-braces-devastating-storm/,https://www.the-sun.com/wp-content/uploads/sites/6/2025/10/palm-trees-shaken-wind-ahead-1034166267.jpg?quality=90&strip=all&w=1920&h=1080&crop=1,,"HURRICANE Melissa has exploded into a monstrous category five storm and is now charging towards Jamaica. 
The horror storm is threatening to unleash catastrophic flooding, deadly landslides and towe… [+7088 chars]",
3a98fb6e050f8c150b0c98b91e9df03b,2025-10-27T12:21:08Z,'hurricane',www.bostonherald.com,en,0.0,Melissa strengthens to a Category 5 hurricane and is forecast to make landfall in Jamaica,The hurricane is the strongest to hit Jamaica in recent history.,https://www.bostonherald.com/2025/10/27/hurricane-melissa-forecast-jamaica-landfall/,https://www.bostonherald.com/wp-content/uploads/2025/10/Jamaica_Extreme_Weather_58368_ebf85d-1.jpg?w=1024&h=682,,"By DÁNICA COTO and JOHN MYERS JR., Associated Press
KINGSTON, Jamaica (AP) Hurricane Melissa intensified to Category 5 strength Monday as it neared Jamaica, where forecasters said it would unleash c… [+4489 chars]",
e84062713aad9d9f2e659ac7b5c29753,2025-10-27T12:57:23Z,'hurricane death',dailycaller.com,en,0.0,Hurricane Melissa Becomes Category 5 Ahead Of Historic Landfall In Jamaica,Early Monday morning saw Hurricane Melissa become a monstrous Category 5 hurricane as the Caribbean storm is still on track to blast Jamaica.,https://dailycaller.com/2025/10/27/hurricane-melissa-category-5-landfall-jamaica-weather/,"https://images.dailycaller.com/image/width=1280,height=549,fit=cover,format=webp,f=auto/https://cdn01.dailycaller.com/wp-content/uploads/2025/10/GettyImages-2176954426-1-e1761569539172.jpg",,"Early Monday morning saw Hurricane Melissa become a monstrous Category 5 hurricane as the Caribbean storm is still on track to blast Jamaica with powerful storm surge, strong winds and flash flooding… [+2122 chars]",
16781c398141055c07866c034cd4823e,2025-10-27T13:00:55Z,'hurricane',www.jacksonville.com,en,1.0,Hurricane Melissa is now Cat 5 hurricane. See spaghetti models and Jacksonville forecast,Melissa developed into a deadly Category 5 hurricane on Monday. Here's a look at where it's headed and whether it will impact Jacksonville.,https://www.jacksonville.com/story/weather/hurricane/2025/10/27/hurricane-melissa-tracker-spaghetti-models-jacksonville-forecast/86925810007/,https://media.zenfs.com/en/the-florida-times-union/9d3ec1008f4f59dc44c734b7905a7e35,,"Hurricane Melissa surged into a powerful Category 5 storm Monday morning, Oct. 27, and is forecast to have devastating impacts on islands in the northern Caribbean with even stronger winds in elevate… [+4934 chars]",
7262950867cf811fb29e420a9ede949d,2025-10-27T13:37:16Z,'hurricane',nypost.com,en,0.9,Melissa upgrades to Category 5 hurricane as it nears Jamaica — with catastrophic flooding expected,"Hurricane Melissa intensified to Category 5 strength on Monday as it neared Jamaica, where forecasters said it would unleash catastrophic flooding and extensive infrastructure damage.",https://nypost.com/2025/10/27/us-news/melissa-upgrades-to-a-category-5-hurricane-as-it-nears-jamaica/,https://nypost.com/wp-content/uploads/sites/2/2025/10/jamaica-hurricane-melissa-comp.jpg?quality=75&strip=all&1761555130&w=1200,,"KINGSTON, Jamaica Hurricane Melissa intensified to Category 5 strength Monday as it neared Jamaica, where forecasters said it would unleash catastrophic flooding, multiple landslides, and extensive i… [+4845 chars]",
ed2955b6860ffeff780f45760254f82d,2025-10-27T14:09:33Z,'hurricane',travelhost.com,en,1.0,Cruise lines divert ships to avoid dangerous Hurricane Melissa,Hurricane Melissa has turned into an extremely dangerous Category 5 storm as it takes aim at multiple cruise destinations.,https://travelhost.com/cruises/hurricane-melissa-cruises,https://media.zenfs.com/en/come_cruise_with_me_articles_739/5cf717066cc18d62df9be53ceadfba88,,"As powerful Hurricane Melissa intensified on a path toward Jamaica and on through the Caribbean, multiple cruise lines charted new courses for ships sailing in the region this week.
Now a Category 5… [+4297 chars]",
c9218cba2e8777a3fec71bfa431bb2fe,2025-10-27T15:01:04Z,'hurricane evacuation',www.yahoo.com,en,0.0,Category 5 Hurricane Melissa to unleash life-threatening catastrophe in Jamaica,Category 5 Hurricane Melissa in the Caribbean will take a turn toward Jamaica and unleash some of nature's most intense fury on the island nation with a high...,https://www.yahoo.com/news/articles/category-5-hurricane-melissa-unleash-150104480.html,https://media.zenfs.com/en/accuweather_articles_339/a22ad8e1204b3506703235f50780594b,,"A dire situation is unfolding in the Caribbean as Category 5 Hurricane Melissa is forecast to make a right, northward turn and cross Jamaica like a giant buzzsaw and firehose at the same time. AccuWe… [+6211 chars]",
5f81449b5568854f0557ac619aa62e87,2025-10-27T15:07:49Z,'hurricane climate change',gizmodo.com,en,0.0,"Hurricane Melissa Could Make 3 Landfalls in 3 Days, Ravaging the Caribbean","As Jamaica braces for what may be the most powerful storm in the island nation’s history, Cuba and the Lucayan Archipelago may face direct hits soon after.",https://gizmodo.com/hurricane-melissa-could-make-3-landfalls-in-3-days-ravaging-the-caribbean-2000677476,https://gizmodo.com/app/uploads/2025/10/Hurricane-Melissa-1200x675.jpg,,"Category 5 Hurricane Melissa is barreling toward Jamaica after rapidly intensifying with unprecedented speed over the weekend. Forecasters warn this storm could dump up to 40 inches (1,000 millimeter… [+4080 chars]",
c2cd55341bc3a85dae24265b38a9018b,2025-10-27T15:17:30Z,'hurricane alert',thegatewithbriancohen.com,en,0.1,Hurricane Melissa Slams Jamaica; Landfall Still Has Not Occurred: October 2025 Travel Alert,"Because Hurricane Melissa slams Jamaica with gusty winds and significant precipitation, you may want to consider delaying your travel for the remainder of October of 2025 — or, at least, keep yourself updated as to the latest information pertaining to the wea…",https://thegatewithbriancohen.com/hurricane-melissa-slams-jamaica-landfall-still-has-not-occurred-october-2025-travel-alert/,https://thegatewithbriancohen.com/wp-content/uploads/2024/08/IMG_7484.jpg,,"Because Hurricane Melissa slams Jamaica with gusty winds and significant precipitation, you may want to consider delaying your travel for the remainder of October of 2025 or, at least, keep yourself … [+6698 chars]",
49c7a4704466ebeadd25e1f43d80d286,2025-10-27T15:30:00Z,'hurricane climate change',www.scientificamerican.com,en,0.0,Hurricane Melissa Makes 2025 Only Second Season with More Than Two Category 5 Storms,This is only the second time we’ve had more than two Category 5 storms in a single Atlantic hurricane season,https://www.scientificamerican.com/article/hurricane-melissa-makes-2025-only-second-season-with-more-than-two-category/,https://static.scientificamerican.com/dam/m/88efe836076165e/original/Hurricane-Melissa.gif?m=1761580296.79&w=1200,,"As it bears down on Jamaica, Hurricane Melissa has become the third Category 5 storm of the 2025 Atlantic season—just the second season on record to ever see more than two Category 5 hurricanes.
The… [+2283 chars]",
facece04062f51bf78d22b3d49074d04,2025-10-27T15:32:06Z,'hurricane',www.aljazeera.com,en,1.0,Hurricane Melissa: Where and when will it make landfall in Jamaica?,Melissa has strengthened into a major Category 5 storm. Here's what that means.,https://www.aljazeera.com/news/2025/10/27/hurricane-melissa-where-and-when-will-it-make-landfall-in-jamaica,https://www.aljazeera.com/wp-content/uploads/2025/10/afp_68ff7718eab8-1761572632.jpg?resize=1920%2C1031&quality=80,,"Hurricane Melissa, which has been barrelling towards Jamaica, is expected to be the most powerful hurricane to ever make a direct hit on the island.
The hurricane intensified on Monday into a Catego… [+4530 chars]",
c6e6ed156d3065659d1aca42a68a1b84,2025-10-27T15:40:25Z,'flooding',www.cbsnews.com,en,0.0,Alaska nonprofit rescues 180 dogs — and a turtle — after flooding,Bethel Friends of Canines​ has been working with pilots and others to rescue dogs left behind when remote villages in Alaska were hit by high surf and strong winds.,https://www.cbsnews.com/news/alaska-dog-rescues-bethel-friends-of-canines-flooding-villages/,https://assets1.cbsnewsstatic.com/hub/i/r/2025/10/27/59c675cd-4c27-4b43-b36c-12ebbe949c4e/thumbnail/1200x630/fc46a348f3595215e7269d995e163636/bfk9-3-dogs.jpg,,"A nonprofit organizationin Alaska has rescued at least 180 dogs — and a turtle — after flooding devastated several remote villages in Alaska earlier this month. 
Hundreds of people were airlifted ou… [+3125 chars]",
4ff8761a8ab329c736ec845767379951,2025-10-27T16:01:01Z,'typhoon',www.gov.uk,en,0.0,"20,000 UK jobs secured as Türkiye buys 20 Typhoon jets in biggest fighter jet deal in a generation",Thousands of skilled UK jobs have been secured for years to come as the UK and Türkiye sign a deal worth up to £8 billion for 20 UK Typhoon fighter jets – the biggest fighter jet exports deal in a generation.,https://www.gov.uk/government/news/20000-uk-jobs-secured-as-turkiye-buys-20-typhoon-jets-in-biggest-fighter-jet-deal-in-a-generation,https://www.gov.uk/assets/frontend/govuk-opengraph-image-4196a4d6333cf92aaf720047f56cfd91b3532d7635fc21ebcf0d5897df6b5f77.png,,"<ul><li>£8 billion deal struck with Türkiye for first new orders for UK Typhoons since 2017, as the Prime Minister visits Ankara for the first time. </li><li>Deal strengthens NATOs collective deterre… [+5263 chars]",
cc42740fce884d42b336d000900a1fd0,2025-10-27T17:02:43Z,'typhoon',theaviationist.com,en,0.0,Turkey Signs £8bn Deal With UK for 20 Eurofighter Typhoons,"The agreement was signed as the UK Prime Minister, Sir Keir Starmer, visited Ankara and met with Turkish President Recep Tayyip Erdoğan while touring Turkish aerospace facilities. An official release by the UK Government says the deal will guarantee the reten…",https://theaviationist.com/2025/10/27/turkey-signs-for-eurofighter-typhoons/,https://theaviationist.com/wp-content/uploads/2025/10/TurkeyUKTyphoonDeal_1.jpg,,"An official release by the UK Government says the deal will guarantee the retention of as many as 20,000 British jobs and sustain the Typhoon production line at BAE Systems’ Warton airfield, along wi… [+4095 chars]",
9c754ebaa6543b4596cfc8fe23b97302,2025-10-27T17:04:56Z,'typhoon',biztoc.com,en,0.0,"UK, Turkey seal $11 billion Eurofighter deal",British Prime Minister Keir Starmer announced at a press conference with Turkish President Recep Tayyip Erdogan on Monday that the UK and Turkey reached a deal to sell Eurofighter Typhoon jets worth a...,https://biztoc.com/x/8c2b7bf06291b421,https://biztoc.com/cdn/8c2b7bf06291b421_s.webp,,British Prime Minister Keir Starmer announced at a press conference with Turkish President Recep Tayyip Erdogan on Monday that the UK and Turkey reached a deal to sell Eurofighter Typhoon jets worth … [+69 chars],
9368f3480eaf9981038f371edb1c991e,2025-10-27T18:02:30Z,'hurricane',www.yahoo.com,en,1.0,Slow-moving storm dumps as much rain as a hurricane in parts of Central Florida,"Intense rains that stalled over Central Florida unleashed nearly 20 inches (508 millimeters) of rain in 24 hours, triggering dangerous flash floods that...",https://www.yahoo.com/news/articles/slow-moving-storm-dumps-much-180230060.html,https://s.yimg.com/ny/api/res/1.2/8pyYrNBrJgnRb0DJdONPng--/YXBwaWQ9aGlnaGxhbmRlcjt3PTEyMDA7aD03MTQ7Y2Y9d2VicA--/https://media.zenfs.com/en/ap.org/449a03e523d0f22105de14981b5cd08c,,"Intense rains that stalled over Central Florida unleashed nearly 20 inches (508 millimeters) of rain in 24 hours, triggering dangerous flash floods that stranded cars and inundated roadways, leaving … [+2337 chars]",
ab6b2a324c12339ce5eb9c093a17d462,2025-10-27T19:18:19Z,'hurricane season',phys.org,en,0.0,"When a hurricane threatens, these tips can help you prepare","Hurricane season can be stressful for anyone near the potential path of a storm, as powerful winds and heavy rain can cause widespread damage, cut power for days or weeks and otherwise upend people's lives.",https://phys.org/news/2025-10-hurricane-threatens.html,https://scx2.b-cdn.net/gfx/news/hires/2025/when-a-hurricane-threa.jpg,,"by Juan A. LozanoHurricane season can be stressful for anyone near the potential path of a storm, as powerful winds and heavy rain can cause widespread damage, cut power for days or weeks and otherwi… [+4087 chars]",
eb639296c2ad990a95717c25158aee7d,2025-10-27T19:45:33Z,'hurricane',www.miamiherald.com,en,0.9,‘I’m going to lose everything’: Jamaica farmers dread approach of Hurricane Melissa,"There is never a good time for a catastrophic hurricane to hit. But for Junior Ebanks, a farmer on Jamaica’s southern coast, Hurricane Melissa’s timing could...",https://www.miamiherald.com/news/nation-world/world/americas/article312662952.html,https://media.zenfs.com/en/miami_herald_mcclatchy_975/6760c78d848d496a45b5736e409b1e7c,,"There is never a good time for a catastrophic hurricane to hit. But for Junior Ebanks, a farmer on Jamaicas southern coast, Hurricane Melissas timing could not be worse.
We are just preparing to sta… [+8631 chars]",
aa6e05d04f411762aa94fbd5c44a1524,2025-10-27T20:04:16Z,'hurricane climate change',www.npr.org,en,0.0,Hurricane Melissa bears down on Jamaica as a dangerous Category 5 storm,"Hurricane Melissa will hit Jamaica as a massive Category 5 storm, and dump huge amounts of rain. Climate change makes large, rainy storms more likely.",https://www.npr.org/2025/10/27/nx-s1-5587335/hurricane-melissa-bears-down-on-jamaica-as-a-dangerous-category-5-storm,https://media.npr.org/include/images/facebook-default-wide-s1400-c100.jpg,,"Hurricane Melissa will hit Jamaica as a massive Category 5 storm, and dump huge amounts of rain. Climate change makes large, rainy storms more likely.",
94c5ea860fe6cc1405f80036913741d4,2025-10-27T20:22:13Z,'hurricane season',deadline.com,en,0.0,Justina Machado Joins Aida Rodriguez In Dramedy ‘Hurricane Seasons’,"EXCLUSIVE: Justina Machado (One Day at a Time) has signed on to star alongside Aida Rodriguez, Alycia Pascual-Peña, Elvis Nolasco and Jerry Minor in Hurricane Seasons, the indie dramedy from director Nicole Gomez Fisher (Good Egg), on which we were recently f…",http://deadline.com/2025/10/justina-machado-joins-hurricane-seasons-aida-rodriguez-1236599119/,https://deadline.com/wp-content/uploads/2024/02/Justina-Machado-Credit-Leigh-Keily.jpeg?w=1024,,"EXCLUSIVE:Justina Machado (One Day at a Time) has signed on to star alongside Aida Rodriguez, Alycia Pascual-Peña, Elvis Nolasco and Jerry Minor in Hurricane Seasons, the indie dramedy from director … [+1677 chars]",
b93601456bb7ef1ae3a9388cbb09cb8f,2025-10-27T20:53:22Z,'hurricane alert',www.forbes.com,en,0.1,"NYT Connections Sports Hints Today: Tuesday, October 28 Clues, Answers",Looking for some help with today's NYT Connections Sports Edition? Some hints and the answers for today's game are right here to help keep your streak alive. Go team!,https://www.forbes.com/sites/krisholt/2025/10/27/nyt-connections-sports-hints-today-tuesday-october-28-clues-answers/,https://imageio.forbes.com/specials-images/imageserve/68c244e2120b6050a5f03cca/0x0.jpg?format=jpg&height=900&width=1600&fit=bounds,,"Looking for some help with today's NYT Connections: Sports Edition? Hints and the answers for today's game are right here to help keep your streak alive.
getty
Each days game of NYT Connections Spo… [+4673 chars]",
7a798d2009658ffc4dd0833a372453c8,2025-10-27T21:17:48Z,'hurricane',grist.org,en,0.1,How Hurricane Melissa got so dangerous so fast,"As the storm threatens Jamaica, ""the role climate change has played in making Hurricane Melissa incredibly dangerous is undeniable.""",https://grist.org/extreme-weather/how-hurricane-melissa-got-so-dangerous-so-fast/,https://grist.org/wp-content/uploads/2025/10/hurricane-melissa-2.jpg?quality=75&strip=all,http://web.archive.org/web/20251111132600/https://grist.org/extreme-weather/how-hurricane-melissa-got-so-dangerous-so-fast/,"History is unfolding in the Atlantic Ocean right now. Hurricane Melissa has spun up into an extraordinarily dangerous Category 5 storm with maximum sustained winds of 175 mph, and is set to strike Ja… [+5415 chars]",
2f0569d91f40e040dee48f50bd24775b,2025-10-27T22:21:08Z,'hurricane',www.cbc.ca,en,1.0,"After pummelling Jamaica, Hurricane Melissa makes landfall in eastern Cuba","Hurricane Melissa made landfall in eastern Cuba near the city of Chivirico early Wednesday as a Category 3 storm after pummelling Jamaica as one of the strongest Atlantic hurricanes on record, the U.S. National Hurricane Center said.",https://www.cbc.ca/news/world/after-pummelling-jamaica-hurricane-melissa-makes-landfall-in-eastern-cuba-9.6957826,"https://i.cbc.ca/ais/117af3e0-5bc6-4969-afd9-10754785f6ec,1761726880225/full/max/0/default.jpg?im=Crop%2Crect%3D%280%2C287%2C5500%2C3093%29%3BResize%3D620",,"Hurricane Melissa made landfall in eastern Cuba near the city of Chivirico early Wednesday as a Category 3 storm after pummeling Jamaica as one of the strongest Atlantic hurricanes on record, the U.S… [+2971 chars]",
d46bdbb85c86465d4a9aa22318bec00f,2025-10-27T22:21:08Z,'hurricane',www.cbc.ca,en,0.1,How Hurricane Melissa went from tropical storm to Category 5 in just a few days,"Hurricane Melissa, one of the strongest ever recorded in the Caribbean, is set to hit Jamaica early on Tuesday after undergoing “rapid intensification” — a climate-charged phenomenon that’s increasingly sending devastating storms to the region.",https://www.cbc.ca/news/science/melissa-climate-jamaica-hurricane-9.6955507,"https://i.cbc.ca/ais/9444efd2-be97-477f-9080-c5571e7754b6,1761605779288/full/max/0/default.jpg?im=Crop%2Crect%3D%280%2C182%2C3500%2C1968%29%3BResize%3D620",,"Hurricane Melissa, one of the strongest ever recorded in the Caribbean, is set to hit Jamaica early on Tuesday after undergoing rapid intensification a climate-charged phenomenon thats increasingly s… [+2567 chars]",
8b4e3958bf74211b98beffc3a2200c19,2025-10-27T23:54:29Z,'tropical depression',www.nhc.noaa.gov,en,0.0,Hurricane Melissa Graphics,"5-Day Uncertainty Track last updated Mon, 27 Oct 2025 23:54:02 GMT



Wind Speed Probabilities last updated Mon, 27 Oct 2025 21:22:33 GMT",https://www.nhc.noaa.gov/refresh/graphics_at3+shtml/235429.shtml?cone,,,"Coastal Watches/Warnings and Forecast Cone for Storm Center
* If the storm is forecast to dissipate within 3 days, the ""Full Forecast"" and ""3 day"" graphic will be identical
Click Here for a 5-day C… [+2926 chars]",
e733853fe0ad68c3451474ac0b31d285,2025-10-28T00:00:00Z,'hurricane season',www.islands.com,en,0.1,This Southern American Attraction Unexpectedly Ranks Among The World's Best To Visit,This family-friendly attraction in a popular Southern U.S. state was ranked the No. 3 best thing to do in the world and the top attraction in the country.,https://www.islands.com/2002831/merritt-island-florida-kennedy-space-center-american-attraction-ranks-among-travelers-choice-worlds-best-visit/,https://s.yimg.com/ny/api/res/1.2/4NLVNLlnrE8JveCop.utfg--/YXBwaWQ9aGlnaGxhbmRlcjt3PTEyMDA7aD02NzU7Y2Y9d2VicA--/https://media.zenfs.com/en/islands_423/bae97f347236dea2d4c1f3fb7830bd40,,"In a state full of theme parks, costumed characters, and roller coasters, it can be easy to overlook what Tripadvisor has called the top attraction in the United States and the third best attraction … [+3373 chars]",
