index,published,keyword,domain,language,valid,title,description,url,image,archive,content,quote,de,en,la,added
45af47fda30b42a026132160725c3774,2026-01-11T01:38:00Z,'tropical cyclone',www.channelnewsasia.com,en,0.9,Cyclone Koji downgraded to storm after crossing Australia's northeast coast; flooding warning risks issued,"Koji's approach comes after Queensland was hit in March by Alfred, a downgraded tropical cyclone, which brought damaging winds and heavy rains, cutting power to hundreds of thousands.",https://www.channelnewsasia.com/world/australia-queensland-cyclone-koji-storm-flood-wind-5850936,"https://dam.mediacorp.sg/image/upload/s--ZtSoK-9O--/c_crop,h_444,w_790,x_11,y_56/c_fill,g_auto,h_676,w_1200/f_auto,q_auto/v1/mediacorp/cna/image/2026/01/11/612992643_1292967669530749_4092851367480589025_n.jpg?itok=ZvXN7faC",http://web.archive.org/web/20260111233933/https://www.channelnewsasia.com/world/australia-queensland-cyclone-koji-storm-flood-wind-5850936,"SYDNEY: Cyclone Koji crossed the far northeast coast of Australia on Sunday (Jan 11) and was downgraded to a tropical storm, but authorities warned of destructive winds and possible flooding.
Koji, … [+1504 chars]",,"Zyklon Koji wurde zum Sturm herabgestuft, nachdem er die Nordostküste Australiens überquert hatte; Warnung vor Überschwemmungen ausgegeben. Kojis Ansatz erfolgt, nachdem Queensland im März von Alfred, einem herabgestuften tropischen Wirbelsturm, heimgesucht wurde, der schädliche Winde und heftige Regenfälle mit sich brachte und Hunderttausende Menschen mit Strom versorgte.","Cyclone Koji downgraded to storm after crossing Australia's northeast coast; flooding warning risks issued. Koji's approach comes after Queensland was hit in March by Alfred, a downgraded tropical cyclone, which brought damaging winds and heavy rains, cutting power to hundreds of thousands.","Cyclone Koji gradatim expugnare, postquam oram Australiae septentrionalis transiit; infuso monitu metus edita. Adventus Koji venit postquam Queensland mense Martio ab Alfredo cyclo tropico percussus est, quae ventos graves et imbres damnosos attulit, potestatem ad centena milia secans.",2026-01-20 04:13:56+00:00
9efef00a439adf476f64317140fbb150,2026-01-17T14:00:00Z,'hurricane',wattsupwiththat.com,en,0.9,Landfalling Hurricane Trends,"As with US storms, there is no evidence of any long term trends, either in the frequency of hurricanes or the number of major, Cat3+ storms.",https://wattsupwiththat.com/2026/01/17/landfalling-hurricane-trends/,https://i0.wp.com/wattsupwiththat.com/wp-content/uploads/2024/09/1896-Hurricane-Big-Bend.webp?fit=1024%2C512&quality=75&ssl=1,http://web.archive.org/web/20260117165400/https://wattsupwiththat.com/2026/01/17/landfalling-hurricane-trends/,"From NOT A LOT OF PEOPLE KNOW THAT
By Paul Homewood
As I pointed out in my review of hurricanes last week, comprehensive observation and measurement on hurricanes globally really only became possib… [+691 chars]",,"Trends bei Hurrikanen, die auf Land treffen. Wie bei den Stürmen in den USA gibt es keine Hinweise auf langfristige Trends, weder bei der Häufigkeit von Hurrikanen noch bei der Anzahl schwerer Stürme der Kategorie 3+.","Landfalling Hurricane Trends. As with US storms, there is no evidence of any long term trends, either in the frequency of hurricanes or the number of major, Cat3+ storms.","Landfalling Hurricane Trends. Sicut in US tempestatibus nullum est testimonium longi termini trends, vel in frequentia turbinum vel in numero majorum, Cat3+procellarum.",2026-01-20 04:13:56+00:00
a5a271ea533355510ca5fc4e3638dead,2026-01-14T05:02:06Z,'hurricane death',www.espn.com,en,0.7,How Miami offensive coordinator Shannon Dawson emerged from nowhere,The architect of the Hurricane offense began his career grinding for a job at Southeastern Louisiana.,https://www.espn.com/college-football/story/_/id/47590059/college-football-playoff-shannon-dawson-miami,https://a3.espncdn.com/combiner/i?img=%2Fphoto%2F2026%2F0112%2Fr1599744_1296x729_16%2D9.jpg,http://web.archive.org/web/20260114103247/https://www.espn.com/college-football/story/_/id/47590059/college-football-playoff-shannon-dawson-miami,"AS MIAMI PUNCTUATED a gritty 15-play, 75-yard touchdown drive to beat Ole Miss in the closing seconds of the Vrbo Fiesta Bowl, Hal Mumme sat on his couch in Shreveport, Louisiana, watching and celebr… [+12298 chars]",,"Wie der Offensivkoordinator von Miami, Shannon Dawson, aus dem Nichts auftauchte. Der Architekt der Hurricane-Offensive begann seine Karriere mit der Suche nach einem Job im Südosten von Louisiana.",How Miami offensive coordinator Shannon Dawson emerged from nowhere. The architect of the Hurricane offense began his career grinding for a job at Southeastern Louisiana.,Quomodo Miami gravis coordinator Shannon Dawson nusquam emersit. Faber Procellae offensae suae cursum stridere coepit propter officium in Louisiana Southeastern.,2026-01-20 08:49:37+00:00
11727f2ad95f82008278783ee636313b,2026-01-03T13:30:10Z,'typhoon',bringatrailer.com,en,0.7,1992 GMC Typhoon,"This 1992 GMC Typhoon was acquired in 2015 by the owner, with whom it has subsequently traveled 1k of its 70k miles shown. The truck is finished in Forest Green Metallic over Charcoal leather, and it is powered by a turbocharged 4.3-liter V6 which drives all …",https://bringatrailer.com/listing/1992-gmc-typhoon-36/,https://bringatrailer.com/wp-content/uploads/2025/12/1992_gmc_typhoon_img_8585-36159.jpeg,http://web.archive.org/web/20260104221656/https://bringatrailer.com/listing/1992-gmc-typhoon-36/,"This 1992 GMC Typhoon was acquired in 2015 by the owner, with whom it has subsequently traveled 1k of its 70k miles shown. The truck is finished in Forest Green Metallic over Charcoal leather, and it… [+2599 chars]",,"1992 GMC Typhoon. Dieser GMC Typhoon aus dem Jahr 1992 wurde 2015 vom Besitzer erworben, mit dem er anschließend 1.000 der angezeigten 70.000 Meilen zurückgelegt hat. Der Truck ist in Forest Green Metallic über anthrazitfarbenem Leder lackiert und wird von einem turbogeladenen 4,3-Liter-V6 angetrieben, der alle …","1992 GMC Typhoon. This 1992 GMC Typhoon was acquired in 2015 by the owner, with whom it has subsequently traveled 1k of its 70k miles shown. The truck is finished in Forest Green Metallic over Charcoal leather, and it is powered by a turbocharged 4.3-liter V6 which drives all …","1992 GMC Typhoon. Hoc 1992 GMC Typhoon anno 2015 a domino quaesitum est, cum quo postea 1k sui 70k milium passuum iter monstravit. Salsissimus vir in Foresta viridi metallico super carbonem corium finitur, et potens est 4.3 sextarius V6 turbocharged quae omnia ... agit.",2026-01-20 20:48:13+00:00
96142be55000270120288fc417f27b76,2026-01-04T00:50:02Z,'typhoon',www.bbc.com,en,0.7,Joint UK-French air strike targets IS arms cache in Syria,"RAF Typhoon jets joined French aircraft in a strike on an underground Islamic State arms cache in Syria, UK officials say.",https://www.bbc.com/news/articles/c1m7l8keyexo,https://ichef.bbci.co.uk/news/1024/branded_news/a1ed/live/9198fad0-e8fc-11f0-a551-73d476d78ed7.jpg,,"Royal Air Force Typhoon jets have joined French aircraft in a joint strike on an underground arms cache in Syria used by the Islamic State group (IS), the UK Ministry of Defence says.
The facility, … [+1758 chars]",,"Gemeinsamer britisch-französischer Luftangriff zielt auf IS-Waffenlager in Syrien. RAF-Typhoon-Jets griffen zusammen mit französischen Flugzeugen ein unterirdisches Waffenlager des Islamischen Staates in Syrien an, sagen britische Beamte.","Joint UK-French air strike targets IS arms cache in Syria. RAF Typhoon jets joined French aircraft in a strike on an underground Islamic State arms cache in Syria, UK officials say.","Articulus UK-French aer scuta percutiunt IS arma cache in Syria. RAF Typhoon rumpit iunctas aircrafts Francogallicas in percussione in armis Civitatis islamicae subterranei cache in Syria, ministri UK dicunt.",2026-01-20 20:48:13+00:00
c8e9479f465ab5592b521978dd5feff3,2026-01-08T16:02:00Z,'typhoon',news.slashdot.org,en,0.7,China Hacked Email Systems of US Congressional Committee Staff,"China has hacked the emails used by congressional staff on powerful committees in the US House of Representatives, as part of a massive cyber espionage campaign known as Salt Typhoon. An anonymous reader shares a report: Chinese intelligence accessed email sy…",https://news.slashdot.org/story/26/01/08/1559224/china-hacked-email-systems-of-us-congressional-committee-staff,https://a.fsdn.com/sd/topics/china_64.png,,"Chinese intelligence accessed email systems used by some staffers[non-paywalled source] on the House China committee in addition to aides on the foreign affairs committee, intelligence committee and … [+724 chars]",,"China hat E-Mail-Systeme von Mitarbeitern des US-Kongressausschusses gehackt. China hat im Rahmen einer massiven Cyberspionagekampagne namens Salt Typhoon die E-Mails gehackt, die von Kongressmitarbeitern in mächtigen Ausschüssen des US-Repräsentantenhauses verwendet wurden. Ein anonymer Leser teilt einen Bericht: Chinesischer Geheimdienst hat auf E-Mail-System zugegriffen …","China Hacked Email Systems of US Congressional Committee Staff. China has hacked the emails used by congressional staff on powerful committees in the US House of Representatives, as part of a massive cyber espionage campaign known as Salt Typhoon. An anonymous reader shares a report: Chinese intelligence accessed email sy…","Sina Hacked Systema electronica in US Concilii Committee Staff. Sina emails electronicis adhibitis per virgam concilii de validis commissionibus in Repraesentantium Domo US detruncavit, ut partem expeditionis cybericae ingentis speculationis quae Sal Typhonis nota est. Anonymus lector relationem participat: Sinica intelligentia accessed inscriptio sy…",2026-01-20 20:48:13+00:00
6ef26e52c7ee511228c500139e20306d,2026-01-08T19:35:00Z,'typhoon',www.techradar.com,en,0.7,Congressional staff emails hacked as part of Salt Typhoon campaign,Emails used by staff members of “powerful committees in the US House of Representatives were allegedly breached.,https://www.techradar.com/pro/security/congressional-staff-emails-hacked-as-part-of-salt-typhoon-campaign,https://cdn.mos.cms.futurecdn.net/TJirAeNdL3RwDzNaPiWTc8-970-80.jpg,http://web.archive.org/web/20260108210758/https://www.techradar.com/pro/security/congressional-staff-emails-hacked-as-part-of-salt-typhoon-campaign,"<ul><li>Salt Typhoon allegedly compromised emails of US House committee staffers on China, foreign affairs, and defense</li><li>Scope of intrusion remains unclear; FBI and White House have not commen… [+2729 chars]",,"E-Mails von Kongressmitarbeitern wurden im Rahmen der Salt-Typhoon-Kampagne gehackt. E-Mails, die von Mitarbeitern „mächtiger Ausschüsse im US-Repräsentantenhaus“ verwendet wurden, wurden angeblich gehackt.",Congressional staff emails hacked as part of Salt Typhoon campaign. Emails used by staff members of “powerful committees in the US House of Representatives were allegedly breached.,"Inscriptiones Concilii virgam laceraverunt ut partem expeditionis Salinarum Typhoon. Inscriptiones adhibitae a membris virgam ""potentium commissionum in Repraesentatorum Domo US dissipatae sunt.",2026-01-20 20:48:13+00:00
2130389b7182d6692391cc152c5c8973,2026-01-09T13:24:28Z,'typhoon',www.techdirt.com,en,0.7,"Scope Of Chinese ‘Salt Typhoon’ Hack Keeps Getting Worse, As Trump Dismantles U.S. Cybersecurity Defenses","Late last year, most major U.S. telecoms were the victim of a massive, historic intrusion by Chinese hackers who managed to hack into U.S. communications networks and then spy on public U.S. officials for more than a year completely undetected. The “Salt Typh…",https://www.techdirt.com/2026/01/09/scope-of-chinese-salt-typhoon-hack-keeps-getting-worse-as-trump-dismantles-u-s-cybersecurity-defenses/,https://www.techdirt.com/wp-content/themes/techdirt/assets/images/td-rect-logo-white.png,http://web.archive.org/web/20260109145158/https://www.techdirt.com/2026/01/09/scope-of-chinese-salt-typhoon-hack-keeps-getting-worse-as-trump-dismantles-u-s-cybersecurity-defenses/,"from the we're-cooked dept
Late last year, most major U.S. telecoms were the victim of a massive, historic intrusion by Chinese hackers who managed to hack into U.S. communications networks and then… [+3612 chars]",,"Das Ausmaß des chinesischen „Salt Taifun“-Hacks wird immer schlimmer, da Trump die US-Cybersicherheitsabwehr abbaut. Ende letzten Jahres wurden die meisten großen US-amerikanischen Telekommunikationsunternehmen Opfer eines massiven, historischen Einbruchs chinesischer Hacker, denen es gelang, sich in US-Kommunikationsnetze zu hacken und dann mehr als ein Jahr lang völlig unentdeckt öffentliche US-Beamte auszuspionieren. Der „Salztyph…“","Scope Of Chinese ‘Salt Typhoon’ Hack Keeps Getting Worse, As Trump Dismantles U.S. Cybersecurity Defenses. Late last year, most major U.S. telecoms were the victim of a massive, historic intrusion by Chinese hackers who managed to hack into U.S. communications networks and then spy on public U.S. officials for more than a year completely undetected. The “Salt Typh…","Scopus Sinensium 'salis Typhon' Hack pejus custodit, sicut Trump dismantles Americae Cybersecurity defensiones. Nuper anno praeterito, maxima maior US telecomorum victima fuit ingens, historica intrusio a Sinensium hackers, quae in retiacula communicationum in US introduxit ac deinde magistratus US publicas exploraturus plus quam per annum omnino latent. ""Sal Typh…",2026-01-20 20:48:13+00:00
8213732201266af74faf6836e88b3d6f,2026-01-07T01:08:44Z,'typhoon',snook.ca,en,0.9,That One Time in Japan,I was in Japan with my mom and my son. The country had recently opened up again to tourism and I took the opportunity to take my son on a trip we were supposed to take pre-pandemic that was cancelled due to a typhoon. My mom tagging along this time was a bonu…,https://snook.ca/archives/other/that-one-time-in-japan,https://snk.ms/logo.gif,,I was in Japan with my mom and my son. The country had recently opened up again to tourism and I took the opportunity to take my son on a trip we were supposed to take pre-pandemic that was cancelled… [+1429 chars],,"Das eine Mal in Japan. Ich war mit meiner Mutter und meinem Sohn in Japan. Das Land hatte sich vor kurzem wieder für den Tourismus geöffnet und ich nutzte die Gelegenheit, um meinen Sohn auf eine Reise mitzunehmen, die wir vor der Pandemie unternehmen sollten, die jedoch aufgrund eines Taifuns abgesagt wurde. Dass meine Mutter dieses Mal dabei war, war ein Bonus …",That One Time in Japan. I was in Japan with my mom and my son. The country had recently opened up again to tourism and I took the opportunity to take my son on a trip we were supposed to take pre-pandemic that was cancelled due to a typhoon. My mom tagging along this time was a bonu…,Aliquam in eleifend ipsum. Fui in Iaponia cum matre mea et filio meo. Patria nuper voluptuaria similesve iterum patefacta est et occasionem cepi ut filium meum in itinere sumendi putamur prae-pandemicum quod ob typhonium abrogatum erat. My mom tagging along this time was a bonu...,2026-01-20 20:48:13+00:00
b920124be9f51e9e724b020e713c464a,2026-01-19T09:43:09Z,'hurricane',sports.yahoo.com,en,0.7,Clack and Tulsa host Rice,The Golden Hurricane are 8-0 in home games. Tulsa scores 71.6 points and has outscored opponents by 5.5 points per game. The Owls have gone 5-0 against AAC...,https://sports.yahoo.com/articles/clack-tulsa-host-rice-094309552.html,https://s.yimg.com/cv/apiv2/social/images/yahoo_default_logo-1200x1200.png,,"Rice Owls (15-3, 5-0 AAC) at Tulsa Golden Hurricane (12-5, 4-1 AAC)
Tulsa, Oklahoma; Tuesday, 7:30 p.m. EST
BOTTOM LINE: Tulsa takes on Rice after Jade Clack scored 22 points in Tulsa's 64-53 win a… [+1408 chars]",,"Clack und Tulsa sind Gastgeber von Rice. Die Golden Hurricane haben in ihren Heimspielen eine Bilanz von 8:0. Tulsa erzielt 71,6 Punkte und hat seine Gegner um 5,5 Punkte pro Spiel übertroffen. Die Owls haben gegen AAC mit 5:0 verloren...",Clack and Tulsa host Rice. The Golden Hurricane are 8-0 in home games. Tulsa scores 71.6 points and has outscored opponents by 5.5 points per game. The Owls have gone 5-0 against AAC...,Clack et Tulsa hospes Rice. Procellae aureae 8-0 in ludis domi sunt. Tulsa scores 71.6 puncta et adversarios per 5.5 puncta per ludum emisit. V-0 noctuae in AAC abierunt ...,2026-01-21 20:45:47+00:00
08b45f79fe83eb1ddb38ca385663e3ac,2026-01-19T11:06:44Z,'hurricane',www.usatoday.com,en,0.7,Why is Miami 'The U'? Explaining the Hurricanes distinctive nickname,Why is Miami referred to as 'The U'? Here's a look at the history of the Hurricanes' distinctive nickname,https://www.usatoday.com/story/sports/ncaaf/2026/01/19/miami-the-u-hurricanes-football-cfp-playoff-indiana/88247145007/,https://s.yimg.com/ny/api/res/1.2/LSYpAc5yHt77DTJbiQUAOg--/YXBwaWQ9aGlnaGxhbmRlcjt3PTEyMDA7aD04MDA7Y2Y9d2VicA--/https://media.zenfs.com/en/usa_today_sports_articles_558/b6ccae687ac33ba7accfcd0911728631,http://web.archive.org/web/20260120050157/https://www.usatoday.com/story/sports/ncaaf/2026/01/19/miami-the-u-hurricanes-football-cfp-playoff-indiana/88247145007/,"Football, as its often said, is a game of inches, but at the college level, its also a game of letters.
Teams across the country have the first initial of their schools emblazoned at midfield or on … [+3980 chars]",,Warum ist Miami „The U“? Erklären Sie den charakteristischen Spitznamen der Hurricanes. Warum wird Miami als „The U“ bezeichnet? Hier ist ein Blick auf die Geschichte des unverwechselbaren Spitznamens der Hurricanes,Why is Miami 'The U'? Explaining the Hurricanes distinctive nickname. Why is Miami referred to as 'The U'? Here's a look at the history of the Hurricanes' distinctive nickname,"Cur Miami 'The U'? Explicans cognomen Turbinum distinctivum. Cur Miami dicitur ""The U""? Ecce historia turbinum cognomentum proprium",2026-01-21 20:45:47+00:00
b81ab6102dd21be9f863ac92579d1e56,2026-01-19T12:30:31Z,'hurricane',ftw.usatoday.com,en,0.7,Did Miami recruit hometown prospect Fernando Mendoza in high school?,"Fernando Mendoza is a Miami native who grew up dreaming of being a Hurricane, but the two-star recruit never received an offer.",https://ftw.usatoday.com/story/sports/ncaaf/2026/01/19/indiana-fernando-mendoza-did-miami-recruit-high-school/88220744007/,https://s.yimg.com/ny/api/res/1.2/XzMEknqj1VacvRgLPuliUg--/YXBwaWQ9aGlnaGxhbmRlcjt3PTEyMDA7aD04MDA7Y2Y9d2VicA--/https://media.zenfs.com/en/ftw_outdoors_usa_today_article_609/80b6508b3dd5b94d6cf480bd879a913e,http://web.archive.org/web/20260120094713/https://ftw.usatoday.com/story/sports/ncaaf/2026/01/19/indiana-fernando-mendoza-did-miami-recruit-high-school/88220744007/,"Monday night's national championship game is going to carry a bit of extra meaning for Indiana quarterback Fernando Mendoza.
The 2025 Heisman Trophy winner is the talk of college football at the mom… [+1293 chars]",,"Hat Miami in der High School seinen Heimatstadt-Anwärter Fernando Mendoza rekrutiert? Fernando Mendoza stammt aus Miami und träumte als Kind davon, ein Hurricane zu werden. Der Zwei-Sterne-Rekrut erhielt jedoch nie ein Angebot.","Did Miami recruit hometown prospect Fernando Mendoza in high school?. Fernando Mendoza is a Miami native who grew up dreaming of being a Hurricane, but the two-star recruit never received an offer.","Nonne Miami patriam exspectavit Fernando Mendoza in alta schola? Fernando Mendoza indigena est Miami qui increvit somnians se Turbo esse, sed tirocinium duorum stellarum oblatum numquam accepit.",2026-01-21 20:45:47+00:00
515494f4a324839647706eb5ae3483ba,2026-01-19T13:57:21Z,'hurricane',www.usatoday.com,en,0.7,Indiana vs Miami prediction: Beat writers' picks for CFP national championship,"Will it be the Hoosiers or Hurricanes lifting the CFP national championship trophy tonight? Indiana, Miami beat writers make their predictions.",https://www.usatoday.com/story/sports/ncaaf/2026/01/19/indiana-vs-miami-picks-beat-writer-prediction-cfp-national-championship-hoosiers-hurricanes-football/88156164007/,https://s.yimg.com/ny/api/res/1.2/PfVRGolr3MpmP4wNbO6h0Q--/YXBwaWQ9aGlnaGxhbmRlcjt3PTEyMDA7aD04MDA7Y2Y9d2VicA--/https://media.zenfs.com/en/usa_today_sports_articles_558/3fdcdabc3c6345c91a9ece6fcca454b6,http://web.archive.org/web/20260120021816/https://www.usatoday.com/story/sports/ncaaf/2026/01/19/indiana-vs-miami-picks-beat-writer-prediction-cfp-national-championship-hoosiers-hurricanes-football/88156164007/,"The College Football Playoff national championship game is here. Will it be Indiana or Miami lifting the trophy after tonight's title game at Hard Rock Stadium?
Writers from IndyStar, The Herald-Tim… [+4264 chars]",,"Prognose „Indiana vs. Miami“: Schlagen Sie die Auswahl der Autoren für die nationale CFP-Meisterschaft. Werden es heute Abend die Hoosiers oder die Hurricanes sein, die den nationalen Meisterschaftspokal der CFP gewinnen? Die Beatwriter aus Indiana und Miami machen ihre Vorhersagen.","Indiana vs Miami prediction: Beat writers' picks for CFP national championship. Will it be the Hoosiers or Hurricanes lifting the CFP national championship trophy tonight? Indiana, Miami beat writers make their predictions.","Indiana vs Miami vaticinium: Ictus scriptorum arma pro patrocinio nationali CFP. Nunquid Hoosiers vel turbinum tropaeum hac nocte levantes CFP nationalis patrocinium? Indiana, Miami beat scriptores vaticinantur.",2026-01-21 20:45:47+00:00
cfd3457fadc3fe90aa5cd2bb5a8205e5,2026-01-19T16:59:47Z,'hurricane',ftw.usatoday.com,en,0.7,Why Michael Irvin and other Miami alums are on Hurricanes' sideline,"Michael Irvin has made headlines and got an ""SNL"" spoof thanks to his sideline antics and viral videos.",https://ftw.usatoday.com/story/sports/ncaaf/2026/01/19/michael-irvin-miami-sideline-why-mario-cristobal/88252910007/,https://s.yimg.com/ny/api/res/1.2/e3gTsw98I5zZ0phn9G5V2Q--/YXBwaWQ9aGlnaGxhbmRlcjt3PTEyMDA7aD04MDA7Y2Y9d2VicA--/https://media.zenfs.com/en/ftw_outdoors_usa_today_article_609/dda418dfb6ef1714bd66d9cb65c69162,http://web.archive.org/web/20260120030130/https://ftw.usatoday.com/story/sports/ncaaf/2026/01/19/michael-irvin-miami-sideline-why-mario-cristobal/88252910007/,"We've seen Michael Irvin going wild on the Miami sidelines or, er, spanking a Gatorade cooler during the Hurricanes' run in the College Football Playoff national championship. Heck, he's even given h… [+804 chars]",,Warum Michael Irvin und andere Miami-Alaune an der Seitenlinie der Hurricanes stehen. Michael Irvin hat dank seiner Nebentätigkeiten und viralen Videos für Schlagzeilen gesorgt und eine „SNL“-Parodie erhalten.,"Why Michael Irvin and other Miami alums are on Hurricanes' sideline. Michael Irvin has made headlines and got an ""SNL"" spoof thanks to his sideline antics and viral videos.","Quare Michael Irvin et alii alumnae Miami in sideline turbinum sunt. Michael Irvin headlines fecit et ""SNL"" spoof ob rationem eius sideline anticorum et viralium videos.",2026-01-21 20:45:47+00:00
70eed2189db2674487871f358e5239bb,2026-01-19T17:00:00Z,'hurricane season',www.stampedeblue.com,en,0.7,Mock Draft Monday: Championship Game Players heading to Indy,"As the National Championship kicks off today, it’s time for a Mock Draft Monday featuring a Hoosier and a Hurricane. Who could the Colts add to their team for their own quest for postseason glory?",https://www.stampedeblue.com/indianapolis-colts-mock-drafts/120703/mock-draft-monday-championship-game-players-heading-to-indy,https://s.yimg.com/ny/api/res/1.2/8OY55PgFZCtY40.OnCJYPA--/YXBwaWQ9aGlnaGxhbmRlcjt3PTEyMDA7aD04MDA7Y2Y9d2VicA--/https://media.zenfs.com/en/sb_nation_articles_115/758ddbed8e78b52062a65c076abf3281,http://web.archive.org/web/20260119205225/https://www.stampedeblue.com/indianapolis-colts-mock-drafts/120703/mock-draft-monday-championship-game-players-heading-to-indy,"Chris Ballards final press conference of the 2025 season looms large in the minds of fans and journalists alike, with one quote embodying what they can expect in the 2026 offseason:
We gotta get you… [+12488 chars]",,"Mock Draft Montag: Championship-Game-Spieler auf dem Weg nach Indy. Da heute die Nationalmeisterschaft beginnt, ist es Zeit für einen Mock Draft Monday mit einem Hoosier und einem Hurricane. Wen könnten die Colts für ihr eigenes Streben nach Nachsaison-Ruhm in ihr Team aufnehmen?","Mock Draft Monday: Championship Game Players heading to Indy. As the National Championship kicks off today, it’s time for a Mock Draft Monday featuring a Hoosier and a Hurricane. Who could the Colts add to their team for their own quest for postseason glory?","Ludite Draft Lunae: Championship Ludus Histriones petentis ad Indy. Cum National Championship hodie calcitret, tempus est pro Mock Draft Lunae featuring Hoosier et Procellae. Quis pulli equos suis augere potuerunt ad gloriae suae desiderium?",2026-01-21 20:45:47+00:00
