index,published,keyword,domain,language,valid,title,description,url,image,archive,content,quote,de,en,la,added
730bd2dbcf648bbb9c23983ee60531b7,2024-07-07T20:07:21Z,'hurricane',www.npr.org,en,0.9,Beryl is set to gain hurricane strength as it bears down on the Texas coast,Beryl is set to strengthen into a hurricane before making landfall along the Texas coast early Monday morning.,https://www.npr.org/2024/07/07/nx-s1-5032054/beryl-hurricane-texas-coast-prepares,https://npr.brightspotcdn.com/dims3/default/strip/false/crop/8667x4875+0+446/resize/1400/quality/100/format/jpeg/?url=http%3A%2F%2Fnpr-brightspot.s3.amazonaws.com%2Fb5%2F2c%2F45db8241474bb6dfa27f3a2a6ac2%2Fgettyimages-2161025110.jpg,http://web.archive.org/web/20240708053228/https://www.npr.org/2024/07/07/nx-s1-5032054/beryl-hurricane-texas-coast-prepares,"Beryl is set to make landfall early Monday morning along the Texas coast as the storm regains hurricane-level strength in the Gulf of Mexico, according to the National Weather Service. On Sunday, rai… [+3277 chars]",,"Beryl wird voraussichtlich an Stärke als Hurrikan gewinnen, wenn er auf die texanische Küste trifft. Beryl dürfte sich zu einem Hurrikan verstärken, bevor er am frühen Montagmorgen auf die texanische Küste trifft.",Beryl is set to gain hurricane strength as it bears down on the Texas coast. Beryl is set to strengthen into a hurricane before making landfall along the Texas coast early Monday morning.,Beryllus ad obtinendas ventosas fortitudines positus est sicut in litore Texas incumbit. Beryllus ad confirmandum in procellae positus est antequam descendat in oram Texas primo mane Lunae.,2025-12-17 13:40:36+00:00
77004f05af3cfe4074009c2d278761e2,2024-07-07T21:31:18Z,veryUnusualAndNeverUsedKeyword,www.npr.org,en,0.9,Texas residents prepare for Beryl,People along the Texas coast are preparing for the landfall of Beryl. Forecasters say it will likely be a hurricane when it hits.,https://www.npr.org/2024/07/07/nx-s1-5032041/texas-residents-prepare-for-beryl,https://media.npr.org/include/images/facebook-default-wide-s1400-c100.jpg,http://web.archive.org/web/20240708101740/https://www.npr.org/2024/07/07/nx-s1-5032041/texas-residents-prepare-for-beryl,People along the Texas coast are preparing for the landfall of Beryl. Forecasters say it will likely be a hurricane when it hits.,,"Einwohner von Texas bereiten sich auf Beryl vor. Die Menschen entlang der texanischen Küste bereiten sich auf die Landung von Beryl vor. Meteorologen gehen davon aus, dass es sich bei seinem Eintreffen wahrscheinlich um einen Hurrikan handeln wird.",Texas residents prepare for Beryl. People along the Texas coast are preparing for the landfall of Beryl. Forecasters say it will likely be a hurricane when it hits.,Texas habitant Beryllum para. Homines in ora Texas ad portum Beryli parant. Vatem dicunt futurum esse turbinem cum percusserit.,2025-12-17 13:40:36+00:00
a7ad90400d55f15f64fdb8124d615eb4,2024-07-08T08:28:08Z,veryUnusualAndNeverUsedKeyword,www.npr.org,en,0.9,Beryl strengthens into a hurricane again as it approaches Texas,"Texas Lt. Gov. Dan Patrick said more than 2,500 responders have been dispatched across the state, from departments including FEMA, parks and wildlife, health services and transportation.",https://www.npr.org/2024/07/08/g-s1-8743/hurricane-beryl-texas,https://npr.brightspotcdn.com/dims3/default/strip/false/crop/4488x2523+0+469/resize/1400/quality/100/format/jpeg/?url=http%3A%2F%2Fnpr-brightspot.s3.amazonaws.com%2F6a%2Fea%2F501192c349fab9029b53de83319f%2Fap24189594435104.jpg,,"Beryl returned to a hurricane-strength storm as it approached the central Texas coastline early Monday, spurring state officials to warn residents of the .
Beryl is now a Category 1 hurricane, and i… [+2124 chars]",,"Beryl verstärkt sich erneut zu einem Hurrikan, als er sich Texas nähert. Der Gouverneur von Texas, Dan Patrick, sagte, dass mehr als 2.500 Einsatzkräfte in den gesamten Bundesstaat entsandt worden seien, unter anderem von der FEMA, den Parks und Wildtieren, dem Gesundheitswesen und dem Transportwesen.","Beryl strengthens into a hurricane again as it approaches Texas. Texas Lt. Gov. Dan Patrick said more than 2,500 responders have been dispatched across the state, from departments including FEMA, parks and wildlife, health services and transportation.","Beryllus iterum confirmat turbinem cum appropinquat Texas. Texas Lt Gov. Dan Patrick dixit plus quam 2.500 responders trans statum missum fuisse, ex Dicasteriis in quibus FEMA, in hortis et in truculentia, officia salutis et translationem.",2025-12-17 13:40:36+00:00
7c2ad9943d8b9421c4546a190da0b18e,2024-07-08T11:26:49Z,'hurricane',www.livescience.com,en,0.9,Earth from space: 3 hurricanes form a perfect line before smashing into land,"A 2017 satellite photo captured three hurricanes — Katia, Irma and Jose — in a near-perfect line across ""hurricane alley"" in the Atlantic Ocean. Interestingly, the storms, which are named alphabetically, appeared to be in the wrong order.",https://www.livescience.com/planet-earth/weather/earth-from-space-3-hurricanes-form-a-perfect-line-before-smashing-into-land,https://cdn.mos.cms.futurecdn.net/3y3sejvrRtECnFXN5WG7sS-1200-80.jpg,http://web.archive.org/web/20240709022215/https://www.livescience.com/planet-earth/weather/earth-from-space-3-hurricanes-form-a-perfect-line-before-smashing-into-land,"Where is it? North Atlantic Ocean.
What's in the photo? Hurricanes Katia, Irma and Jose in a near-perfect line.
Which satellite took the photo? Suomi National Polar-orbiting Partnership (Suomi NPP)… [+3706 chars]",,"Die Erde aus dem Weltraum: Drei Hurrikane bilden eine perfekte Linie, bevor sie auf das Land prallen. Ein Satellitenfoto aus dem Jahr 2017 zeigte drei Hurrikane – Katia, Irma und Jose – in einer nahezu perfekten Linie über der „Hurrikangasse“ im Atlantischen Ozean. Interessanterweise schienen die alphabetisch benannten Stürme in der falschen Reihenfolge aufzutreten.","Earth from space: 3 hurricanes form a perfect line before smashing into land. A 2017 satellite photo captured three hurricanes — Katia, Irma and Jose — in a near-perfect line across ""hurricane alley"" in the Atlantic Ocean. Interestingly, the storms, which are named alphabetically, appeared to be in the wrong order.","Terra ex spatio: 3 procellae perfectam lineam faciunt antequam in terram conlisit. A 2017 satelles photographicus tres procellas - Katia, Irma et Jose cepit in linea prope perfectam trans ""procellae angiportum"" in Oceano Atlantico. Interestingly tempestates, quae alphabetice nominantur, in ordine praepostero esse visi sunt.",2025-12-17 13:40:36+00:00
46732cb940960b26c112dce7ec9679d3,2024-07-08T19:56:39Z,'hurricane',www.blogto.com,en,0.9,Remnants of a hurricane will hit Ontario this week and here's what to expect,"Southern Ontario will get a break from scorching temperatures this week, though that relief from the heat will come in the form of what meteorologists describe as ""torrential downpours"" on the tail end of the destructive Hurricane Beryl.
A large swath of Ont…",https://www.blogto.com/city/2024/07/remnants-hurricane-ontario-week-what-expect/,https://media.blogto.com/articles/202040708-hurricane-beryl-toronto.jpg?w=1200&cmd=resize_then_crop&height=630&quality=70,http://web.archive.org/web/20240708232407/https://www.blogto.com/city/2024/07/remnants-hurricane-ontario-week-what-expect/,"Southern Ontario will get a break from scorching temperatures this week, though that relief from the heat will come in the form of what meteorologists describe as ""torrential downpours"" on the tail e… [+1769 chars]",,"Überreste eines Hurrikans werden diese Woche Ontario treffen und hier erfahren Sie, was Sie erwartet. Süd-Ontario wird diese Woche eine Pause von den sengenden Temperaturen bekommen, doch die Linderung der Hitze wird in Form von „sturzflutartigen Regenfällen“ am Ende des zerstörerischen Hurrikans Beryl erfolgen, wie Meteorologen es nennen.
Ein großer Teil von Ontario…","Remnants of a hurricane will hit Ontario this week and here's what to expect. Southern Ontario will get a break from scorching temperatures this week, though that relief from the heat will come in the form of what meteorologists describe as ""torrential downpours"" on the tail end of the destructive Hurricane Beryl.
A large swath of Ont…","Reliquiae procellae Ontario hac septimana ferient, et hic expectandum est. Ontario Australis intermissum ab ustionis temperaturae hac septimana erit, quamquam id caloris levamen in specie veniet eorum quae astrologi ""flumina torrentium"" in extrema caudae perniciosi Beryli describent.
Magnum fasciculum Ont...",2025-12-17 13:40:36+00:00
830570bd748989c9145bdcdce6e85565,2024-07-08T21:46:53Z,veryUnusualAndNeverUsedKeyword,www.npr.org,en,0.9,Beryl made landfall in Texas as a Category 1 hurricane,"Beryl barreled ashore on Monday striking the central Texas coast. Along with high winds and heavy rain, a major concern is flooding — especially inland.",https://www.npr.org/2024/07/08/nx-s1-5032095/beryl-made-landfall-in-texas-as-a-category-1-hurricane,https://media.npr.org/include/images/facebook-default-wide-s1400-c100.jpg,http://web.archive.org/web/20240709014410/https://www.npr.org/2024/07/08/nx-s1-5032095/beryl-made-landfall-in-texas-as-a-category-1-hurricane,"Beryl barreled ashore on Monday striking the central Texas coast. Along with high winds and heavy rain, a major concern is flooding especially inland.",,Beryl traf als Hurrikan der Kategorie 1 in Texas auf Land. Beryl stürzte am Montag an Land und traf die Küste von Zentral-Texas. Neben starkem Wind und starkem Regen sind Überschwemmungen ein großes Problem – insbesondere im Landesinneren.,"Beryl made landfall in Texas as a Category 1 hurricane. Beryl barreled ashore on Monday striking the central Texas coast. Along with high winds and heavy rain, a major concern is flooding — especially inland.","Beryllus iacturam fecit in Texas sicut categoria 1 turbinis. Beryllus in terra cadens die Lunae mediam Texas oram percutiens. Inter ventos altos et imbres graves, maior cura inundat - praesertim in mediterraneis.",2025-12-17 13:40:36+00:00
ff7ec7727e42c66719948e669a952498,2024-07-09T09:15:00Z,veryUnusualAndNeverUsedKeyword,www.npr.org,en,0.9,"Far from the ocean, remnants of storms like Beryl can cause severe floods","Even after storms lose their hurricane status and head far inland, they can still cause dangerous floods. Storms like Beryl pose risks far from the coast, even in Canada.",https://www.npr.org/2024/07/09/nx-s1-5033210/hurricane-beryl-dangerous-floods-inland-midwest,https://npr.brightspotcdn.com/dims3/default/strip/false/crop/8667x4875+0+446/resize/1400/quality/100/format/jpeg/?url=http%3A%2F%2Fnpr-brightspot.s3.amazonaws.com%2F9e%2Fff%2F295ab68e4a03aaad8bbf38142157%2Fgettyimages-2161205522-2.jpg,http://web.archive.org/web/20240709230238/https://www.npr.org/2024/07/09/nx-s1-5033210/hurricane-beryl-dangerous-floods-inland-midwest,"Beryl made landfall as a hurricane in Texas, and there are forecasts that as the storm breaks apart it will drive deeper into Midwestern states like Missouri, Illinois, Indiana, Michigan even Ontario… [+4283 chars]",,"Weit entfernt vom Meer können Überreste von Stürmen wie Beryl schwere Überschwemmungen verursachen. Selbst wenn Stürme ihren Hurrikanstatus verlieren und weit ins Landesinnere vordringen, können sie immer noch gefährliche Überschwemmungen verursachen. Stürme wie Beryl stellen fernab der Küste eine Gefahr dar, selbst in Kanada.","Far from the ocean, remnants of storms like Beryl can cause severe floods. Even after storms lose their hurricane status and head far inland, they can still cause dangerous floods. Storms like Beryl pose risks far from the coast, even in Canada.","Longe ab oceano reliquiae tempestatum sicut Beryllus graves inundationes causare possunt. Etiam postquam procellae statum tempestatis amittunt et caput longe mediterraneum, adhuc periculosas inundationes facere possunt. Tempestates sicut Beryllus pose pericula longe a litore, etiam in Canada.",2025-12-17 13:40:36+00:00
41f27271c97139540d086ff1704508ee,2024-07-09T23:50:00Z,'tropical cyclone',www.cbsnews.com,en,0.9,Millions in Texas remain without power after Beryl,"Millions are without power in Texas after Beryl, now a post-tropical cyclone, brought heavy winds, rain and flooding to the region Monday. CBS News correspondent Omar Villafranca has the latest from Houston.",https://www.cbsnews.com/video/millions-in-texas-remain-without-power-after-beryl/,https://assets3.cbsnewsstatic.com/hub/i/r/2024/07/09/fe4dc775-f412-4458-b0e7-c959902cf535/thumbnail/1200x630/ed5bf12b565f05a6274c3e5a52331a3f/cbsn-fusion-millions-in-texas-remain-without-power-after-beryl-thumbnail.jpg?v=2287029998c5246c93d6dd038eb30603,http://web.archive.org/web/20240710111912/https://www.cbsnews.com/video/millions-in-texas-remain-without-power-after-beryl/,"Watch CBS News
Copyright ©2024 CBS Interactive Inc. All rights reserved.
Get browser notifications for breaking news, live events, and exclusive reporting.
Not NowTurn On",,"Nach Beryl bleiben Millionen in Texas ohne Strom. Millionen Menschen sind in Texas ohne Strom, nachdem Beryl, mittlerweile ein posttropischer Wirbelsturm, am Montag starke Winde, Regen und Überschwemmungen in die Region gebracht hat. CBS News-Korrespondent Omar Villafranca hat das Neueste aus Houston.","Millions in Texas remain without power after Beryl. Millions are without power in Texas after Beryl, now a post-tropical cyclone, brought heavy winds, rain and flooding to the region Monday. CBS News correspondent Omar Villafranca has the latest from Houston.","Millions in Texas sine potentia post Beryllum manent. Milia sine viribus in Texas post Beryl, nunc cyclo tropico, graves ventos, pluvias et inundationem regioni Lunae attulerunt. CBS Nova correspondentia Omar Villafranca novissimam habet ab Houston.",2025-12-17 13:40:36+00:00
b7011a4417cedd20a51482cc28b92e5f,2024-07-10T09:10:23Z,veryUnusualAndNeverUsedKeyword,www.aljazeera.com,en,0.9,"From the Caribbean to Texas, Beryl leaves a trail of destruction","The hurricane, which has since been downgraded, destroyed two islands in Saint Vincent and the Grenadines.",https://www.aljazeera.com/gallery/2024/7/10/from-the-caribbean-to-texas-beryl-leaves-a-trail-of-destruction,https://www.aljazeera.com/wp-content/uploads/2024/07/AP24191488140182-1720596740.jpg?resize=1920%2C1440,http://web.archive.org/web/20240711032736/https://www.aljazeera.com/gallery/2024/7/10/from-the-caribbean-to-texas-beryl-leaves-a-trail-of-destruction,"Beryl has been barreling through the Atlantic for more than a week, fuelled by exceptionally warm waters, and became the earliest Category 5 hurricane.
It decimated Caribbean islands like Barbados a… [+1680 chars]",,Von der Karibik bis nach Texas hinterlässt Beryl eine Spur der Zerstörung. Der mittlerweile abgeschwächte Hurrikan zerstörte zwei Inseln in St. Vincent und den Grenadinen.,"From the Caribbean to Texas, Beryl leaves a trail of destruction. The hurricane, which has since been downgraded, destroyed two islands in Saint Vincent and the Grenadines.","Ab Caribbean ad Texas, Beryllus vestigia exitii relinquit. Procellae, quae postea deiectae est, duas insulas apud Sanctum Vincentium et Grenadinen delevit.",2025-12-17 13:40:36+00:00
ec9e9ebfe72432628c4ac68ebf692a6d,2024-07-10T17:36:04Z,veryUnusualAndNeverUsedKeyword,phys.org,en,0.9,Beryl sets off alarm bells among hurricane experts,"This year, hurricane season has taken off with a ferocious, ominous start thanks to Beryl—the earliest Category 5 hurricane ever recorded, with winds topping out at 165 mph. Beryl bulldozed the Caribbean, made its way through Mexico and then plowed into Texas…",https://phys.org/news/2024-07-beryl-alarm-bells-hurricane-experts.html,https://scx2.b-cdn.net/gfx/news/2024/beryl-sets-off-alarm-b.jpg,http://web.archive.org/web/20240711033416/https://phys.org/news/2024-07-beryl-alarm-bells-hurricane-experts.html,"This year, hurricane season has taken off with a ferocious, ominous start thanks to Berylthe earliest Category 5 hurricane ever recorded, with winds topping out at 165 mph. Beryl bulldozed the Caribb… [+5545 chars]",,"Beryl lässt bei Hurrikan-Experten die Alarmglocken schrillen. In diesem Jahr hat die Hurrikansaison dank Beryl mit einem heftigen, bedrohlichen Start begonnen – dem frühesten Hurrikan der Kategorie 5, der jemals registriert wurde, mit Windgeschwindigkeiten von bis zu 165 Meilen pro Stunde. Beryl zerstörte die Karibik, gelangte durch Mexiko und drang dann nach Texas ein …","Beryl sets off alarm bells among hurricane experts. This year, hurricane season has taken off with a ferocious, ominous start thanks to Beryl—the earliest Category 5 hurricane ever recorded, with winds topping out at 165 mph. Beryl bulldozed the Caribbean, made its way through Mexico and then plowed into Texas…","Beryllus inter peritos procellae terrorem campanarum ponit. Hoc anno, tempestas cum ferocia et ominosa initium Beryli-primum Categoriae 5 turbinis unquam expositae ablatum est, ventisque 165 mph eiectantem. Beryllus bulldozed Caribbean, iter fecit per Mexicum et deinde in Texas aravit.",2025-12-17 13:40:36+00:00
9a9790f438d23e740f1d98d12d6600d4,2024-07-12T08:32:47Z,'hurricane',phys.org,en,0.9,'We can't wait another year': disaster-hit nations call for climate aid,Countries on the frontlines of climate change have warned they cannot wait another year for long-sought aid to recover from disasters as floods and hurricanes wreak havoc across the globe.,https://phys.org/news/2024-07-year-disaster-nations-climate-aid.html,https://scx2.b-cdn.net/gfx/news/2024/delegates-met-in-south.jpg,http://web.archive.org/web/20240713071625/https://phys.org/news/2024-07-year-disaster-nations-climate-aid.html,"Countries on the frontlines of climate change have warned they cannot wait another year for long-sought aid to recover from disasters as floods and hurricanes wreak havoc across the globe.
The appea… [+4555 chars]",,"„Wir können nicht noch ein Jahr warten“: Von der Katastrophe betroffene Länder fordern Klimahilfe. Länder, die an vorderster Front des Klimawandels stehen, haben gewarnt, dass sie nicht noch ein Jahr auf die lang ersehnte Hilfe warten können, um sich von Katastrophen zu erholen, da Überschwemmungen und Hurrikane auf der ganzen Welt verheerende Schäden anrichten.",'We can't wait another year': disaster-hit nations call for climate aid. Countries on the frontlines of climate change have warned they cannot wait another year for long-sought aid to recover from disasters as floods and hurricanes wreak havoc across the globe.,"""Alium annum exspectare non possumus"": calamitates pulsae nationes auxilium climatis vocant. Regiones in frontibus mutationis climatis monuerunt se alium annum expectare non posse ut auxilium diu quaesitum ex calamitatibus recipiendis sicut inundationes et procellae per orbem vastationem perdant.",2025-12-17 13:40:36+00:00
3610bc12c80666a62a30301e0e496c14,2024-07-12T17:15:02Z,'hurricane',www.cbsnews.com,en,0.9,Watch: Satellite video tracks Beryl's deadly 2-week journey,"The 2024 Atlantic hurricane season got off to a deadly start as Hurricane Beryl tore across the Caribbean, Mexico and eventually the U.S.",https://www.cbsnews.com/news/watch-hurricane-beryl-path-atlantic-caribbean-us/,https://assets2.cbsnewsstatic.com/hub/i/r/2024/07/12/0697b3b7-ef55-448a-a77c-4684fe0c3d1f/thumbnail/1200x630/29dac6f229f0ea5583929715f1164c75/202407011800-202407012130-g16-meso-band2geocolorglm-breathtaking-beryl-lightning-nolabels0.png?v=bc37a4cad39dacb7e4b48f11b71f691b,,"Beryl, which formed in the Atlantic Ocean at the end of June, quickly strengthened to become a multiple-record-breaking hurricane that left a trail of death and disaster across multiple countries. Ov… [+6187 chars]",,"Ansehen: Satellitenvideo zeigt Beryls tödliche zweiwöchige Reise. Die atlantische Hurrikansaison 2024 hatte einen tödlichen Start, als Hurrikan Beryl über die Karibik, Mexiko und schließlich die USA fegte.","Watch: Satellite video tracks Beryl's deadly 2-week journey. The 2024 Atlantic hurricane season got off to a deadly start as Hurricane Beryl tore across the Caribbean, Mexico and eventually the U.S.","Vide: Satellite video vestigia Beryllorum funestum 2-septimana iter. 2024 Oceanus Atlanticus ad initium funestum discessit sicut Beryllus Turbo per Caribbean, Mexicum ac tandem US.",2025-12-17 13:40:36+00:00
7d7c1d36fb08cdd789887c4607110076,2024-07-13T10:00:00Z,'tropical cyclone',www.motherjones.com,en,0.9,"Such a Devastating Hurricane This Early Is a “Big Wake-Up Call,” Experts Say",This story was originally published by the Guardian and is reproduced here as part of the Climate Desk collaboration. The poignancy was unmistakable: Prognosticators at Colorado State University amended their already miserable seasonal tropical cyclone foreca…,https://www.motherjones.com/environment/2024/07/hurricane-beryl-destruction-wake-up-call/,https://www.motherjones.com/wp-content/uploads/2024/07/20240713-veracruz.jpg?w=1200&h=630&crop=1,http://web.archive.org/web/20240714012803/https://www.motherjones.com/environment/2024/07/hurricane-beryl-destruction-wake-up-call/,"Damage unleashed by Hurricane Beryl in Veracruz, Mexico.Felix Marquez/dpa via ZUMA Pres
This story was originally published by the Guardian and is reproduced here as part of the Climate Desk collabo… [+5424 chars]",,"Ein so verheerender Hurrikan so früh sei ein „großer Weckruf“, sagen Experten. Diese Geschichte wurde ursprünglich vom Guardian veröffentlicht und wird hier im Rahmen der Zusammenarbeit mit Climate Desk wiedergegeben. Die Eindringlichkeit war unverkennbar: Prognostiker der Colorado State University änderten ihre ohnehin schon miserable Vorhersage saisonaler tropischer Wirbelstürme …","Such a Devastating Hurricane This Early Is a “Big Wake-Up Call,” Experts Say. This story was originally published by the Guardian and is reproduced here as part of the Climate Desk collaboration. The poignancy was unmistakable: Prognosticators at Colorado State University amended their already miserable seasonal tropical cyclone foreca…","Talis vastitas Procellae Hoc mane est ""Big Wake-Up Voca,"" periti Loquere. Haec fabula a tutorīno tutorōris primo vulgata est et hic ut pars Clima Desk collaborationis proponitur. Poignancy haud dubia est: Prognosticatores in Universitate Colorado Civitatis suas iam miseri temporis tropicae cyclone forec emendaverunt.",2025-12-17 13:40:36+00:00
88884f92cc8c9fc084d80a177af36b51,2024-07-15T21:07:16Z,'hurricane season',www.bostonglobe.com,en,0.9,"In beachy Galveston, locals buckle down without power after Beryl’s blow during peak tourist season","Crashing unusually early in the calendar, the Category 1 hurricane brought the island’s tourism-based economy to a halt during a time when local restaurants rely on an influx of beachgoers to lift revenues.",https://www.bostonglobe.com/2024/07/15/lifestyle/beachy-galveston-locals-buckle-down-without-power-after-beryls-blow-during-peak-tourist-season/,https://bostonglobe-prod.cdn.arcpublishing.com/resizer/Ijn3Xvm3neWNhaQyHDIXyW2Z8fY=/506x0/cloudfront-us-east-1.images.arcpublishing.com/bostonglobe/6ZJ7G4DYJGIDWFLRI5QIWFMTSY.jpg,http://web.archive.org/web/20240715233800/https://www.bostonglobe.com/2024/07/15/lifestyle/beachy-galveston-locals-buckle-down-without-power-after-beryls-blow-during-peak-tourist-season/,"GALVESTON, Texas Vacuums sucked the water out of the seaside inn run by Nick Gaidos family in Galveston since 1911 as power was still spotty nearly one week after a resurgent Hurricane Beryl swept in… [+3755 chars]",,"Im Strandort Galveston sind die Einheimischen nach Beryls Schlaganfall während der Haupttouristensaison ohne Strom. Der Hurrikan der Kategorie 1 ereignete sich ungewöhnlich früh im Kalender und brachte die Tourismuswirtschaft der Insel zum Erliegen, während die örtlichen Restaurants auf den Zustrom von Strandbesuchern angewiesen waren, um ihre Einnahmen zu steigern.","In beachy Galveston, locals buckle down without power after Beryl’s blow during peak tourist season. Crashing unusually early in the calendar, the Category 1 hurricane brought the island’s tourism-based economy to a halt during a time when local restaurants rely on an influx of beachgoers to lift revenues.","In beachy Galveston, incolis fibula sine potentia post ictu Beryli in apicem VIATOR temporum. Census solito mane in calendario, Categoria 1 turbo oeconomiam insulae voluptuaria-basi substitit in tempore quo popinae locales confidebant influxu litoreorum ad vectigalia levanda.",2025-12-17 13:40:36+00:00
