index,published,keyword,domain,language,valid,title,description,url,image,archive,content,quote,de,en,la,added
f1e06688fc97621daaf298f494718973,2026-01-06T21:36:22Z,'hurricane death',nypost.com,en,0.9,Teacher’s alleged killer stalked separate family for over a year — ‘Like a horror movie’,"""It was like a horror movie, like he was standing there in a black jacket, staring at us in front of our house during a hurricane,"" the alleged stalking victim said.",https://nypost.com/2026/01/06/us-news/north-carolina-teachers-murder-suspect-stalked-family-for-years/,https://nypost.com/wp-content/uploads/sites/2/2026/01/118388192.jpg?quality=75&strip=all&w=1200,,The alleged killer of a beloved mom and teacher slain in her home while she begged to 911 dispatchers for help has been accused of stalking a separate family for over a year forcing them to move twic… [+3857 chars],,"Der mutmaßliche Lehrermörder verfolgte über ein Jahr lang eine getrennte Familie – „Wie in einem Horrorfilm“. „Es war wie in einem Horrorfilm, als stünde er in einer schwarzen Jacke da und starrte uns während eines Hurrikans vor unserem Haus an“, sagte das mutmaßliche Stalking-Opfer.","Teacher’s alleged killer stalked separate family for over a year — ‘Like a horror movie’. ""It was like a horror movie, like he was standing there in a black jacket, staring at us in front of our house during a hurricane,"" the alleged stalking victim said.","Praeceptorem interfectorem ultra annum separatam familiam obiecerat — 'Sicut horror pellicula'. ""Similis erat pelliculae horroris, sicut ibi stabat in iacco nigro, nos intuentes ante domum nostram in procella tempestatis"" allegata incedit victima dixit.",2026-01-13 14:38:50+00:00
fd7aa24fa140595760ced04268894e0f,2026-01-07T02:12:39Z,'hurricane death',timesofindia.indiatimes.com,en,0.9,Stephen Curry’s wife Ayesha Curry steps up to promote Jamaican tourism after devastating hurricane,"Ayesha Curry is urging fans to support Jamaica's recovery from Hurricane Melissa by visiting the island. She highlighted that tourism is crucial for the Jamaican economy, with nearly 30% of the workforce dependent on it. Curry emphasized that a vacation serve…",https://timesofindia.indiatimes.com/sports/nba/top-stories/stephen-currys-wife-ayesha-curry-steps-up-to-promote-jamaican-tourism-after-devastating-hurricane/articleshow/126385098.cms,"https://static.toiimg.com/thumb/msid-126385092,width-1070,height-580,imgsize-1074796,resizemode-75,overlay-toi_sw,pt-32,y_pad-500/photo.jpg",,"<ul><li>News</li>
<li>Sports News</li>
<li>NBA News</li>
<li>Stephen Currys wife Ayesha Curry steps up to promote Jamaican tourism after devastating hurricane</li></ul>
Follow Us On Social Media… [+2117 chars]",,"Stephen Currys Frau Ayesha Curry engagiert sich nach dem verheerenden Hurrikan, um den Tourismus in Jamaika zu fördern. Ayesha Curry fordert die Fans auf, Jamaikas Erholung vom Hurrikan Melissa durch einen Besuch auf der Insel zu unterstützen. Sie betonte, dass der Tourismus für die jamaikanische Wirtschaft von entscheidender Bedeutung sei und fast 30 % der Arbeitskräfte davon abhängig seien. Curry betonte, dass ein Urlaubsdienst …","Stephen Curry’s wife Ayesha Curry steps up to promote Jamaican tourism after devastating hurricane. Ayesha Curry is urging fans to support Jamaica's recovery from Hurricane Melissa by visiting the island. She highlighted that tourism is crucial for the Jamaican economy, with nearly 30% of the workforce dependent on it. Curry emphasized that a vacation serve…","Stephen Curry uxor Ayesha Curry incedit ad voluptuaria similesve Iamaican post vastitatem procellae promovendam. Ayesha Curry fana suadet ad recuperandam Iamaicam ab Hurricane Melissa insulam invisendam. Illa illustravit voluptuaria similesve oeconomiae Iamaicanae crucialus, cum fere 30% of vis vis laboris ab ea dependens. Currite inculcavit vacation serve…",2026-01-13 14:38:50+00:00
dd36fc84f7b78984350cdfb076efd920,2026-01-09T05:25:00Z,'hurricane victims',www.stateoftheu.com,en,0.2,Three Stars: Miami vs Ole Miss,Miami is playing for the 2026 Natty!,https://www.stateoftheu.com/football-news/84286/three-stars-miami-vs-ole-miss,https://s.yimg.com/ny/api/res/1.2/CU0X9hL8EIeS3PPbIynx5Q--/YXBwaWQ9aGlnaGxhbmRlcjt3PTEyMDA7aD04MDA7Y2Y9d2VicA--/https://media.zenfs.com/en/sb_nation_articles_115/39652f0f785f65475b49f003abb00f9a,,"The Fiesta Bowl curse has been lifted! The Miami Hurricanes beat the Ole Miss Rebels tonight in the 2026 Vrbo Fiesta Bowl, 31-27. The Canes will now return home to play for the 2026 National Champion… [+2685 chars]",,Three Stars: Miami gegen Ole Miss. Miami spielt um den Natty 2026!,Three Stars: Miami vs Ole Miss. Miami is playing for the 2026 Natty!,Tres stellae: Miami vs Ole Miss. Miami ludit pro 2026 Natty!,2026-01-14 08:45:24+00:00
dd555e2d5dc4721d2cf19d3e0a0add12,2026-01-09T05:49:46Z,'hurricane victims',www.redcuprebellion.com,en,0.2,Historic season for Ole Miss ends in heartbreak,Miami’s offensive line and gameplan of keep away were too much to combat in the Fiesta Bowl,https://www.redcuprebellion.com/ole-miss-rebels-football/40331/historic-season-for-ole-miss-ends-in-heartbreak,https://s.yimg.com/ny/api/res/1.2/5ayBHNnvXuOxyxJUvNt99Q--/YXBwaWQ9aGlnaGxhbmRlcjt3PTEyMDA7aD04MDA7Y2Y9d2VicA--/https://media.zenfs.com/en/sb_nation_articles_115/af92d279c7120a123a6f64d1b5768264,,"Miami used an enormous time of possession advantage and one timely scramble to dash Ole Miss hopes of playing for a national title in a 31-27 loss in the Fiesta Bowl.
The Hurricanes (13-2) had the b… [+2547 chars]",,"Die historische Saison für Ole Miss endet mit Herzschmerz. Miamis Offensivlinie und der Spielplan, sich fernzuhalten, waren im Fiesta Bowl zu schwer zu bekämpfen",Historic season for Ole Miss ends in heartbreak. Miami’s offensive line and gameplan of keep away were too much to combat in the Fiesta Bowl,Temporum historicum pro Ole Miss finit in heartbreak. Miami linea gravis et lusus abstinendi nimium erant pugnandi in Fiesta Bowl,2026-01-14 08:45:24+00:00
3c7e9a78f172a22ac50b4d270956e34e,2026-01-09T06:24:00Z,'hurricane victims',www.cbsnews.com,en,0.3,"LAFD vehicle numbers decrease 1 year after Palisades Fire, latest data shows",The CBS News California Investigates team recently obtained new data from the LAFD that shows more than 100 trucks were out of service during the Palisades Fire.,https://www.cbsnews.com/news/investgation-lafd-data-out-of-service-vehicles-palisades-fire/,https://assets1.cbsnewsstatic.com/hub/i/r/2026/01/09/7538969f-4ea2-4303-8d5b-55f69a1fddb6/thumbnail/1200x630/4e00759f8e37956c837fe4e1d47d4286/lafd-boneyard.jpg,,"As the Palisades Fire burned out of control under hurricane-force winds, some residents chose to stay and fight, like Cort Wagner. 
Wagner picked up a garden hose to take a stand against the flames … [+6020 chars]",,"Neueste Daten zeigen, dass die Zahl der LAFD-Fahrzeuge ein Jahr nach dem Brand in Palisades zurückgeht. Das Team von CBS News California Investigates hat kürzlich vom LAFD neue Daten erhalten, aus denen hervorgeht, dass während des Brandes in Palisades mehr als 100 Lastwagen außer Betrieb waren.","LAFD vehicle numbers decrease 1 year after Palisades Fire, latest data shows. The CBS News California Investigates team recently obtained new data from the LAFD that shows more than 100 trucks were out of service during the Palisades Fire.","LAFD vehiculum numeri decrescunt 1 anno post Palisades Ignis, notitias recentissimas ostendit. The CBS News California Investigat turmas nuper consecutas novas notitias ex LAFD quae plus quam 100 trucks erant extra servitium per Palisades Ignis.",2026-01-14 08:45:24+00:00
9b1c1313093414a2da8d7839e01d00fc,2026-01-09T04:07:57Z,'hurricane',www.palmbeachpost.com,en,0.7,"Ahkeem Mesidor injury: Miami football star hurt, returns vs Ole Miss",Miami Hurricanes defensive lineman Ahkeem Mesidor suffered an apparent arm injury in the fourth quarter of the Fiesta Bowl against Ole Miss.,https://www.palmbeachpost.com/story/sports/college/hurricanes/2026/01/08/ahkeem-mesidor-injury-miami-football-fiesta-bowl-ole-miss/88095258007/,https://s.yimg.com/ny/api/res/1.2/8YcTHyvE5wyUewXxSI4Egw--/YXBwaWQ9aGlnaGxhbmRlcjt3PTEyMDA7aD04MDA7Y2Y9d2VicA--/https://media.zenfs.com/en/palm_beach_post_natl_articles_437/5dddefdba30efe3375a510ca9a6be580,,"Miami Hurricanes defensive lineman Ahkeem Mesidor suffered an apparent arm injury in the fourth quarter of the Fiesta Bowl against Ole Miss on Jan. 8 in Glendale, Arizona.
During a first-and-goal fo… [+970 chars]",,"Ahkeem Mesidor-Verletzung: Miami-Football-Star verletzt, kehrt gegen Ole Miss zurück. Ahkeem Mesidor, Defensive Lineman der Miami Hurricanes, erlitt im vierten Viertel des Fiesta Bowl gegen Ole Miss offensichtlich eine Armverletzung.","Ahkeem Mesidor injury: Miami football star hurt, returns vs Ole Miss. Miami Hurricanes defensive lineman Ahkeem Mesidor suffered an apparent arm injury in the fourth quarter of the Fiesta Bowl against Ole Miss.","Ahkeem Mesidor iniuria: Miami eu stella laesa, redit vs Ole Miss. Miami turbinum lineman defensus Ahkeem Mesidor iniuriam passa apparens in quarta parte Fiestae Crater contra Ole Miss.",2026-01-14 08:45:24+00:00
c58a0101c2171883576ee9ea3d780754,2026-01-08T19:52:48Z,'hurricane',slashdot.org,en,0.9,U.S Disasters Cost U.S. More Than $100 Billion in 2025 - The New York Times,U.S Disasters Cost U.S. More Than $100 Billion in 2025The New York Times Private sector revives the climate disaster database Trump tried to squashCNN Extreme Weather Disasters Cost the U.S. $115 Billion in 2025Time Magazine Though it was a calm hurricane sea…,https://slashdot.org/firehose.pl?op=view&amp;id=180549759,,http://web.archive.org/web/20160119174443/http://slashdot.org/firehose.pl?op=view,The Fine Print: The following comments are owned by whoever posted them. We are not responsible for them in any way.,,US-Katastrophen kosten die USA im Jahr 2025 mehr als 100 Milliarden US-Dollar – The New York Times. US-Katastrophen kosten die USA im Jahr 2025 mehr als 100 Milliarden US-Dollar. Der Privatsektor der New York Times belebt die Datenbank zu Klimakatastrophen wieder. Trump versuchte zu unterdrücken. CNN: Extreme Wetterkatastrophen kosteten die USA im Jahr 2025 115 Milliarden US-Dollar. Time Magazine Obwohl es eine ruhige Hurrikansee war…,U.S Disasters Cost U.S. More Than $100 Billion in 2025 - The New York Times. U.S Disasters Cost U.S. More Than $100 Billion in 2025The New York Times Private sector revives the climate disaster database Trump tried to squashCNN Extreme Weather Disasters Cost the U.S. $115 Billion in 2025Time Magazine Though it was a calm hurricane sea…,US clades sumptus US plus quam $ C Billion in MMXXV - The New York Times. US clades Const US plus quam $ C Billion indicem in 2025The New York Times privata sector recreat calamitatem caeli database Trump conatus ad squashCNN Extremae tempestatis clades sumptus US $ CXV Billion in 2025Time Magazine Etsi erat tranquillitas procellae maris ...,2026-01-14 08:45:24+00:00
c53d1c7077618c5f18b2e95a050e3c99,2026-01-09T12:20:46Z,'hurricane',financialpost.com,en,0.9,"Storm Goretti Batters Europe With Violent Winds, Power Cuts","Storm Goretti lashed England and France with hurricane-force winds, causing widespread disruption as it swept through northwest Europe and cut power to hundreds of thousands of homes.",https://financialpost.com/pmn/business-pmn/storm-goretti-batters-europe-with-violent-winds-power-cuts,,,"(Bloomberg) Storm Goretti lashed England and France with hurricane-force winds, causing widespread disruption as it swept through northwest Europe and cut power to hundreds of thousands of homes.
TH… [+5186 chars]",,"Sturm Goretti verwüstet Europa mit heftigen Winden und Stromausfällen. Sturm Goretti peitschte England und Frankreich mit orkanartigen Winden und verursachte weitreichende Störungen, als er durch Nordwesteuropa fegte und Hunderttausende Haushalte von der Stromversorgung trennte.","Storm Goretti Batters Europe With Violent Winds, Power Cuts. Storm Goretti lashed England and France with hurricane-force winds, causing widespread disruption as it swept through northwest Europe and cut power to hundreds of thousands of homes.","Storm Goretti Batters Europe With Violent Winds, Power Cuts. Tempestas Goretti Angliam et Franciam ventis vi tempestatis verberavit, disseminans late per Europam chorum evertens et potestatem ad centena milia domuum concidit.",2026-01-14 08:45:24+00:00
10395f3d4cd01cf75f27eef309bf44e9,2026-01-10T22:22:51Z,'hurricane alert',collegefootballnews.com,en,0.2,Indiana vs Miami: First Thoughts on the CFP National Championship,"It's Indiana vs Miami for the College Football Playoff National Championship, and it's going to be wild no matter what. Here are the first thoughts on the title game.",https://collegefootballnews.com/college-football/indiana-miami-cfp-national-championship-first-thoughts,https://s.yimg.com/os/en/college_football_news_725/60c738b7f2d8ffcd15e826e5643d8180,http://web.archive.org/web/20260111204141/https://collegefootballnews.com/college-football/indiana-miami-cfp-national-championship-first-thoughts,"Could we get a more interesting College Football Playoff National Championship than Indiana vs Miami?
It's the unbeaten No. 1 team in the country against a red-hot Hurricane squad playing at home. I… [+4769 chars]",,"Indiana vs. Miami: Erste Gedanken zur CFP National Championship. In der College-Football-Playoff-Nationalmeisterschaft heißt es Indiana gegen Miami, und es wird auf jeden Fall wild zugehen. Hier sind die ersten Gedanken zum Titelspiel.","Indiana vs Miami: First Thoughts on the CFP National Championship. It's Indiana vs Miami for the College Football Playoff National Championship, and it's going to be wild no matter what. Here are the first thoughts on the title game.","Indiana vs Miami: Prima Cogitatio in CFP National Championship. Est Indiana vs Miami ad Collegium ipsum Playoff National Championship, et futurum est utcumque fera. Hic sunt primae meditationes de titulo ludi.",2026-01-14 14:38:45+00:00
82d4bc0e9c0b511494b332c3b1e3f933,2026-01-12T13:13:47Z,'hurricane alert',theconversation.com,en,0.2,The economics of climate risk ignores the value of natural habitats,"Where risk rises, returns have to rise too. Where ecosystems are protected, financing becomes cheaper.",https://theconversation.com/the-economics-of-climate-risk-ignores-the-value-of-natural-habitats-272769,https://images.theconversation.com/files/711462/original/file-20260108-76-oia3g9.jpg?ixlib=rb-4.1.0&rect=0%2C434%2C5300%2C2650&q=45&auto=format&w=1356&h=668&fit=crop,http://web.archive.org/web/20260112194240/https://theconversation.com/the-economics-of-climate-risk-ignores-the-value-of-natural-habitats-272769,"Coral reefs in Quintana Roo, Mexico. Connect Images - Curated/Shutterstock
When Hurricane Delta hit Mexico’s Caribbean coast in 2020, insurance payouts were released within days – not to rebuild hot… [+5094 chars]",,"Die Ökonomie des Klimarisikos ignoriert den Wert natürlicher Lebensräume. Wo das Risiko steigt, müssen auch die Renditen steigen. Wo Ökosysteme geschützt werden, wird die Finanzierung günstiger.","The economics of climate risk ignores the value of natural habitats. Where risk rises, returns have to rise too. Where ecosystems are protected, financing becomes cheaper.","Oeconomica climatis periculum valorem locorum naturalium ignorat. Ubi periculum oritur, redit quoque ad resurgendum. Ubi oecosystematis muniuntur, imperdiet vilis fit.",2026-01-14 14:38:45+00:00
8d5c0719f7ae6974c1b61e3effee182d,2026-01-09T23:38:00Z,'hurricane',www.globenewswire.com,en,0.7,The Bahamas Congratulates Miami Hurricanes on Historic College Football Playoff Run as Official Destination Partner,"Nassau, The Bahamas, Jan. 09, 2026 (GLOBE NEWSWIRE) -- The Bahamas Ministry of Tourism, Investments & Aviation (BMOTIA) proudly celebrates its ongoing partnership with the the Miami Hurricanes as their official destination partner, spotlighting the team’s rem…",https://www.globenewswire.com/news-release/2026/01/09/3216387/0/en/The-Bahamas-Congratulates-Miami-Hurricanes-on-Historic-College-Football-Playoff-Run-as-Official-Destination-Partner.html,https://ml.globenewswire.com/Resource/Download/9207dc94-ca75-483f-b8b5-5b3f044dbdc0,http://web.archive.org/web/20260113191156/https://www.globenewswire.com/news-release/2026/01/09/3216387/0/en/The-Bahamas-Congratulates-Miami-Hurricanes-on-Historic-College-Football-Playoff-Run-as-Official-Destination-Partner.html,"Nassau, The Bahamas, Jan. 09, 2026 (GLOBE NEWSWIRE) -- The Bahamas Ministry of Tourism, Investments &amp; Aviation (BMOTIA) proudly celebrates its ongoing partnership with the the Miami Hurricanes as… [+4552 chars]",,"Die Bahamas gratulieren den Miami Hurricanes als offizieller Zielpartner zum historischen College-Football-Playoff-Lauf. Nassau, Bahamas, 9. Januar 2026 (GLOBE NEWSWIRE) – Das Ministerium für Tourismus, Investitionen und Luftfahrt der Bahamas (BMOTIA) feiert stolz seine laufende Partnerschaft mit den Miami Hurricanes als offiziellem Zielpartner und hebt die herausragende Leistung des Teams hervor…","The Bahamas Congratulates Miami Hurricanes on Historic College Football Playoff Run as Official Destination Partner. Nassau, The Bahamas, Jan. 09, 2026 (GLOBE NEWSWIRE) -- The Bahamas Ministry of Tourism, Investments & Aviation (BMOTIA) proudly celebrates its ongoing partnership with the the Miami Hurricanes as their official destination partner, spotlighting the team’s rem…","Bahamas gratulatur Miami turbinum in Collegium Historicum ipsum Playoff Curre ut Destinatio Officialis Socius. Nassau, The Bahamas, Jan. 09, 2026 (GLOBE NEWSWIRE) -- The Bahamas Ministerium Tourism, Investments & Aviation (BMOTIA) superbe celebrat suam permanentem societatem cum Miami Hurricanes, ut socium destinationem officialis, intendens rem quadrigis…",2026-01-14 14:38:45+00:00
7254a12b87ef9b8029fc305f2d510645,2026-01-10T13:12:10Z,'hurricane',www.fairobserver.com,en,0.7,Jamaica Needs Digital Disaster Infrastructure,"On New Year’s Eve, Jamaican Prime Minister Andrew Holness declared that recovery from Hurricane Melissa must spark “national transformation.” On October 28, 2025, Hurricane Melissa made landfall in Jamaica. Cell towers across Jamaica’s southeastern parishes f…",https://www.fairobserver.com/more/environment/jamaica-needs-digital-disaster-infrastructure/,https://www.fairobserver.com/wp-content/uploads/2026/01/tufaan.jpg,http://web.archive.org/web/20260110155023/https://www.fairobserver.com/more/environment/jamaica-needs-digital-disaster-infrastructure/,"On New Years Eve, Jamaican Prime Minister Andrew Holness declared that recovery from Hurricane Melissa must spark national transformation.
On October 28, 2025, Hurricane Melissa made landfall in Jam… [+7388 chars]",,"Jamaika braucht eine digitale Katastropheninfrastruktur. Am Silvesterabend erklärte der jamaikanische Premierminister Andrew Holness, dass die Erholung nach Hurrikan Melissa einen „nationalen Wandel“ auslösen müsse. Am 28. Oktober 2025 traf Hurrikan Melissa auf Jamaika. Mobilfunkmasten in den südöstlichen Gemeinden Jamaikas …","Jamaica Needs Digital Disaster Infrastructure. On New Year’s Eve, Jamaican Prime Minister Andrew Holness declared that recovery from Hurricane Melissa must spark “national transformation.” On October 28, 2025, Hurricane Melissa made landfall in Jamaica. Cell towers across Jamaica’s southeastern parishes f…","Jamaica eget Digital Calamitas Infrastructure. Novo anno in Eva, Primus minister Andreas Holness Jamaican declaravit recuperationem ab Hurricane Melissa ""transfigurationem nationalem"" debere scintillare. Die 28 mensis Octobris anno 2025, Turbo Melissa in Iamaica lapsus factus est. Cellulae turres trans Iamaicae paroeciae meridionales f…",2026-01-14 14:38:45+00:00
5d76de8619d6300265f343d0fe13a650,2026-01-10T14:00:02Z,'hurricane',www.commondreams.org,en,0.7,The FEMA Workers Fired on New Year’s Eve Won’t Be There for the Next Hurricane,"While Americans were preparing to ring in the new year, Department of Homeland Security Secretary Kristi Noem and Federal Emergency Management Agency Chief Karen Evans were firing
 dozens of disaster response workers. The employees who lost their jobs on New…",https://www.commondreams.org/opinion/fema-workers-fired,https://www.commondreams.org/media-library/image.jpg?id=56517431&width=1200&height=600&coordinates=0%2C92%2C0%2C92,http://web.archive.org/web/20260112074821/https://www.commondreams.org/opinion/fema-workers-fired,"While Americans were preparing to ring in the new year, Department of Homeland Security Secretary Kristi Noem and Federal Emergency Management Agency Chief Karen Evans were firing
 dozens of disaste… [+4790 chars]",,"Die am Silvesterabend entlassenen FEMA-Mitarbeiter werden beim nächsten Hurrikan nicht da sein. Während sich die Amerikaner darauf vorbereiteten, das neue Jahr einzuläuten, feuerten die Ministerin des Heimatschutzministeriums Kristi Noem und die Chefin der Federal Emergency Management Agency Karen Evans
 Dutzende Katastrophenhelfer. Die Mitarbeiter, die am New York ihren Job verloren haben…","The FEMA Workers Fired on New Year’s Eve Won’t Be There for the Next Hurricane. While Americans were preparing to ring in the new year, Department of Homeland Security Secretary Kristi Noem and Federal Emergency Management Agency Chief Karen Evans were firing
 dozens of disaster response workers. The employees who lost their jobs on New…","FEMA Operarii in Novo Anno Eve incensus non esto Ibi in Proximo Hurricane. Dum Americani in novo anno anulum parabant, Department of Patria Securitatis Secretarius Kristi Noem et Federal Subitis Procuratio Procuratio Foederalis Dux Karen Evans accendebant
 de dozens cladis responsum operarios. Ministri qui amiserunt jobs in Nova ...",2026-01-14 14:38:45+00:00
246ce9973f85a73938d3210cfc56d9d6,2026-01-10T16:42:41Z,'hurricane',www.canescountry.com,en,0.7,"Hurricanes Host Kraken: Preview, How to Watch, Game Thread",The Canes seem to be preparing for one more big return,https://www.canescountry.com/carolina-hurricanes-game-day-previews/52676/hurricanes-host-kraken-preview-how-to-watch-game-thread,https://s.yimg.com/ny/api/res/1.2/FcXTrU2Fnf6ycsxp9QVziw--/YXBwaWQ9aGlnaGxhbmRlcjt3PTEyMDA7aD04MDA7Y2Y9d2VicA--/https://media.zenfs.com/en/sb_nation_articles_115/edb6c92dc6bf6b3c321c98d9f5c15c31,http://web.archive.org/web/20260110171737/https://www.canescountry.com/carolina-hurricanes-game-day-previews/52676/hurricanes-host-kraken-preview-how-to-watch-game-thread,"Were at that time of year where many sports collide on the calendar, and today is no different.
Thanks to the Carolina Panthers having a Hurricanes-like resurgence, they will open up the NFL playoff… [+7616 chars]",,"Hurricanes Host Kraken: Vorschau, Anschauen, Spielthread. Die Canes scheinen sich auf eine weitere große Rückkehr vorzubereiten","Hurricanes Host Kraken: Preview, How to Watch, Game Thread. The Canes seem to be preparing for one more big return","Procellae Hostiae Kraken: Preview, Quam vigilare, Ludus Thread. Canes videntur unum magnum reditus parare",2026-01-14 14:38:45+00:00
2878a47426ca2afc8154b569418ca958,2026-01-11T15:33:25Z,'hurricane',slickdeals.net,en,0.7,"Isaac's Storm: A Man, a Time, and the Deadliest Hurricane in History (ebook) $1.99 (2 replies)","Ebook version. Has a 4.4 rating with over 10,000 reviews on Amazon.

https://www.amazon.com/gp/product...1332411080",https://slickdeals.net/f/19086583-isaac-s-storm-a-man-a-time-and-the-deadliest-hurricane-in-history-ebook-1-99,https://slickdeals.net/attachment/4/6/2/7/4/3/8/450x450/19292839.thumb,,"This collaborative space allows users to contribute additional information, tips, and insights to enhance the original deal post. Feel free to share your knowledge and help fellow shoppers make infor… [+26 chars]",,"Isaacs Sturm: Ein Mann, eine Zeit und der tödlichste Hurrikan der Geschichte (E-Book) 1,99 $ (2 Antworten). Ebook-Version. Hat eine Bewertung von 4,4 bei über 10.000 Rezensionen auf Amazon.

https://www.amazon.com/gp/product...1332411080","Isaac's Storm: A Man, a Time, and the Deadliest Hurricane in History (ebook) $1.99 (2 replies). Ebook version. Has a 4.4 rating with over 10,000 reviews on Amazon.

https://www.amazon.com/gp/product...1332411080","Isaac's Storm: Homo, tempus, et Procellae Mortuorum in Historia (ebook) $1.99 (2 replies). Ebook version. Habet 4.4 ratings cum supra 10,000 recognitiones on Amazon.

https://www.amazon.com/gp/product...1332411080",2026-01-14 14:38:45+00:00
