index,published,keyword,domain,language,valid,title,description,url,image,archive,content,quote,de,en,la,added
333282496ff54e5bb7b435871281f87a,2025-12-01T18:21:39Z,'hurricane',www.aljazeera.com,en,0.9,Jamaica secures $6.7bn for hurricane recovery and reconstruction plan,"Up to $3.6bn in government financing included, with major contributions from global financial institutions.",https://www.aljazeera.com/economy/2025/12/1/jamaica-secures-6-7bn-for-hurricane-recovery-and-reconstruction-plan,https://www.aljazeera.com/wp-content/uploads/2025/12/reuters_692dd424-1764611108.jpg?resize=1920%2C1440,,"Jamaica has secured up to $6.7bn in support from international agencies to fund reconstruction over the next three years in the wake of Hurricane Melissa in October.
Melissa, one of the strongest st… [+1779 chars]",,"Jamaika sichert sich 6,7 Milliarden US-Dollar für den Wiederherstellungs- und Wiederaufbauplan nach Hurrikan. Darin sind bis zu 3,6 Milliarden US-Dollar an Staatsfinanzierungen enthalten, mit erheblichen Beiträgen von globalen Finanzinstituten.","Jamaica secures $6.7bn for hurricane recovery and reconstruction plan. Up to $3.6bn in government financing included, with major contributions from global financial institutions.","Jamaica $6.7bn ad consilium recuperandae et instaurationis procellae tutatur. Usque ad $3.6bn in regimine nummarias comprehendit, cum maioribus contributionibus ex global oeconomicis institutis.",2025-12-05 08:40:10+00:00
ff29b1dce1ebe427d56be88880cd5563,2025-12-01T09:45:00Z,'hurricane season',grist.org,en,0.9,Hurricane season is over. Here’s why the US never got hit.,"For the first time in a decade, the country avoided landfall, thanks to an atmospheric anomaly. But this hurricane season was exceptional in other bad ways, too.",https://grist.org/climate/hurricane-season-is-over-heres-why-the-u-s-never-got-hit/,https://grist.org/wp-content/uploads/2025/11/GettyImages-2243296389.jpeg?quality=75&strip=all,,"Back in April, scientists read the tea leaves or, more accurately, heaps of data and predicted an above-average hurricane season over the summer and autumn, with nine or 10 named storms, four of whic… [+4414 chars]",,Die Hurrikansaison ist vorbei. Aus diesem Grund wurden die USA nie getroffen. Zum ersten Mal seit einem Jahrzehnt konnte das Land dank einer atmosphärischen Anomalie die Landung vermeiden. Aber diese Hurrikansaison war auch in anderer Hinsicht außergewöhnlich.,"Hurricane season is over. Here’s why the US never got hit.. For the first time in a decade, the country avoided landfall, thanks to an atmospheric anomaly. But this hurricane season was exceptional in other bad ways, too.","Procellae tempus desinit. Hic est cur US numquam percussum est.. Primum in decennium terra land ruinae vitavit, per anomalia atmosphaerica. Sed hoc tempestatis tempus in aliis quoque malis eximium fuit.",2025-12-06 14:28:19+00:00
4b244427f09ad5799e74eee267ea08b7,2025-12-01T18:33:53Z,'hurricane',skift.com,en,0.9,Jamaica’s Tourism Faces Long Recovery After Hurricane Melissa Shuts at least 26 Resorts,"Hurricane Melissa, the strongest storm to hit Jamaica in more than 30 years, made landfall in late October and forced the closure of at least 26 resorts, Two months after the Jamaica hurricane, 26 resorts remain closed and the island’s peak tourism season is …",http://skift.com/2025/12/01/jamaicas-tourism-faces-long-recovery-after-hurricane-melissa-shuts-at-least-26-resorts/,"https://skift.com/wp-content/uploads/2025/12/sandalls-resort-image-1-e1764612916216.jpg?resize=1024,652",,"Hurricane Melissa, the strongest storm to hit Jamaica in more than 30 years, made landfall in late October and forced the closure of at least 26 resorts, wiping out months of peak-season bookings and… [+746 chars]",,"Jamaikas Tourismus steht vor einer langen Erholung, nachdem Hurrikan Melissa mindestens 26 Resorts geschlossen hat. Hurrikan Melissa, der stärkste Sturm, der Jamaika seit mehr als 30 Jahren heimgesucht hat, traf Ende Oktober auf Land und erzwang die Schließung von mindestens 26 Resorts. Zwei Monate nach dem Hurrikan auf Jamaika bleiben 26 Resorts geschlossen und die Hochsaison für den Tourismus auf der Insel ist …","Jamaica’s Tourism Faces Long Recovery After Hurricane Melissa Shuts at least 26 Resorts. Hurricane Melissa, the strongest storm to hit Jamaica in more than 30 years, made landfall in late October and forced the closure of at least 26 resorts, Two months after the Jamaica hurricane, 26 resorts remain closed and the island’s peak tourism season is …","Iamaicae Tourism Faces Long Recuperatio Post Procellae Melissa Shuts saltem 26 Obstinatus. Procellae Melissa, tempestas validissima ut iamaicam plus quam XXX annis feriret, descensus in mense Octobri factus est et clausuram saltem 26 frequentiorum compulit, Duobus mensibus post Iamaica turbo, 26 frequentia clausa manent et apicem voluptuariae insulae tempus est …",2025-12-06 14:28:19+00:00
1e21358c59eb3e5270c6dc0c6906da74,2025-12-03T19:40:17Z,'hurricane',www.aljazeera.com,en,0.9,Western Cuba faces blackout as government seeks to update energy grid,"Electrical failures due to ageing infrastructure, hurricanes and a struggling economy have prompted widespread protests.",https://www.aljazeera.com/news/2025/12/3/western-cuba-faces-blackout-as-government-seeks-to-update-energy-grid,https://www.aljazeera.com/wp-content/uploads/2025/12/2025-12-03T150929Z_819452323_RC209IAKNZWK_RTRMADP_3_CUBA-CRISIS-BLACKOUT-1764781799.jpg?resize=1920%2C1440,,"Cuba has suffered another blackout that temporarily knocked out power to the western side of the Caribbean island, a region that includes the capital Havana.
The countrys Ministry of Energy and Mine… [+4869 chars]",,"Im Westen Kubas droht ein Stromausfall, da die Regierung versucht, das Energienetz zu modernisieren. Stromausfälle aufgrund alternder Infrastruktur, Wirbelstürme und eine angeschlagene Wirtschaft haben zu weit verbreiteten Protesten geführt.","Western Cuba faces blackout as government seeks to update energy grid. Electrical failures due to ageing infrastructure, hurricanes and a struggling economy have prompted widespread protests.","Western Cubae nigram spectat ut regimen energiae energiae renovandae quaerit. Defectus electricae propter infrastructuram senescentis, turbinum et oeconomiae luctantium latissime protestationes concitaverunt.",2025-12-06 14:28:19+00:00
