index,published,keyword,domain,language,valid,title,description,url,image,archive,content,quote,de,en,la,added
a35fc1285611100ff2e4d86b83d73a83,2026-05-03T20:56:00Z,'typhoon',securityaffairs.com,en,0.7,Salt Typhoon breach IBM subsidiary in Italy: a warning for Europe’s digital defenses,"April 2026 breach at Sistemi Informativi (IBM Italy) raises concerns over Chinese-linked cyber ops in Europe, including Salt Typhoon. In late April 2026, the Italian cybersecurity landscape was shaken by a significant breach targeting Sistemi Informativi, a c…",https://securityaffairs.com/191638/apt/salt-typhoon-breach-ibm-subsidiary-in-italy-a-warning-for-europes-digital-defenses.html,https://securityaffairs.com/wp-content/uploads/2014/07/Chinese-hackers-espionage.jpg,,"Salt Typhoon breach IBM subsidiary in Italy: a warning for Europes digital defenses
In late April 2026, the Italian cybersecurity landscape was shaken by a significant breach targeting Sistemi Infor… [+3260 chars]",,"Salt Typhoon durchbricht IBM-Tochtergesellschaft in Italien: eine Warnung für Europas digitale Verteidigung. Ein Verstoß bei Sistemi Informativi (IBM Italien) im April 2026 gibt Anlass zur Besorgnis über mit China verbundene Cyberoperationen in Europa, darunter Salt Typhoon. Ende April 2026 wurde die italienische Cybersicherheitslandschaft durch einen schwerwiegenden Verstoß gegen Sistemi Informativi, ein Unternehmen, erschüttert.","Salt Typhoon breach IBM subsidiary in Italy: a warning for Europe’s digital defenses. April 2026 breach at Sistemi Informativi (IBM Italy) raises concerns over Chinese-linked cyber ops in Europe, including Salt Typhoon. In late April 2026, the Italian cybersecurity landscape was shaken by a significant breach targeting Sistemi Informativi, a c…","Sal Typhonis contritio IBM subsidiaria in Italia: monitum pro praesidiis digitales Europaeis. Aprilis 2026 contritio apud Sistemi Informativi (IBM Italy) curam de Opis cybericis Sinensi connexis in Europa, excepto Typhoni Salis, movet. Nuper Aprili 2026, Italiae cybersecuritas topiorum terra concussa est notabili fractura Sistemi Informativi, a e…",2026-05-05 05:50:16+00:00
109e0182754a5f566133100eca86624b,2026-05-04T08:45:00Z,'hurricane death',grist.org,en,0.7,Hurricane Helene shattered lives — and the systems that keep people sober,Recovery from substance use disorder requires community. What happens when a disaster tears that apart?,https://grist.org/health/hurricane-helene-shattered-lives-and-the-systems-that-keep-people-sober/,https://grist.org/wp-content/uploads/2026/04/Barber_GRIST_SubtanceUse_Helene_27-SocialCrop.jpg?quality=75&strip=all,,This story was published in partnership with The Assembly. It was produced as a project for USC Annenbergs Center for Health Journalism and Center for Climate Journalism and Communication 2025 Health… [+21359 chars],,"Hurrikan Helene zerstörte Leben – und die Systeme, die Menschen nüchtern halten. Die Genesung von einer Substanzstörung erfordert Gemeinschaft. Was passiert, wenn eine Katastrophe das zerstört?",Hurricane Helene shattered lives — and the systems that keep people sober. Recovery from substance use disorder requires community. What happens when a disaster tears that apart?,"Procellae Helene quassata vitas — et disciplinas quae homines sobrios servant. Recuperatio a substantia usus inordinatio communitatem requirit. Quid accidit cum calamitate lacrimarum, qui secernunt?",2026-05-06 16:08:16+00:00
6658d19676bb6d6abb4d6867f39f4b50,2026-05-01T06:00:00Z,'hurricane warning',www.naturalnews.com,en,0.9,The Twin Economic Superstorms: Why Your Financial Future Is at Risk from Energy Collapse and AI Job Replacement,"Two Storms Are About to Hit I have been warning for years that an economic hurricane is bearing down on the United States, and now I see two distinct superstorms converging at once. The first is an energy collapse driven by war and supply chain breakdown. The…",https://www.naturalnews.com/2026-05-01-twin-economic-superstorms-financial-future-at-risk.html,https://www.naturalnews.com/wp-content/uploads/sites/91/2026/05/economic-superstorms-energy-collapse-ai-job-replacement-1223-original.jpg,,"Two Storms Are About to Hit
I have been warning for years that an economic hurricane is bearing down on the United States, and now I see two distinct superstorms converging at once. The first is an … [+9125 chars]",,"Die Zwillings-Wirtschafts-Superstürme: Warum Ihre finanzielle Zukunft durch den Energiekollaps und die Ersetzung von KI-Arbeitsplätzen gefährdet ist. Zwei Stürme stehen vor der Tür Ich warne seit Jahren davor, dass ein wirtschaftlicher Hurrikan auf die Vereinigten Staaten zukommt, und jetzt sehe ich, wie zwei verschiedene Superstürme gleichzeitig zusammenlaufen. Der erste ist ein Energiekollaps, der durch Krieg und den Zusammenbruch der Lieferkette verursacht wird. Der…","The Twin Economic Superstorms: Why Your Financial Future Is at Risk from Energy Collapse and AI Job Replacement. Two Storms Are About to Hit I have been warning for years that an economic hurricane is bearing down on the United States, and now I see two distinct superstorms converging at once. The first is an energy collapse driven by war and supply chain breakdown. The…","Didymus Economic Superstorms: Cur Financial Future Tuus in Risk ab Energy Collapse et AI Job replacement. Duae procellae incipientes percutere monui per annos tempestatem oeconomicam in Civitatibus Foederatis deferre, et nunc duas superstitias distinctas simul convergentes video. Primum est industria belli et copia catenae naufragii ruina acti. The…",2026-05-06 16:08:16+00:00
bd449cb3d30aeabace92cbdc990d6543,2026-05-04T10:36:51Z,'hurricane season',ahouseinthehills.com,en,0.7,Hurricane Season is Coming: Warning Signs Your New Orleans Roof Needs Attention Now,"New Orleans homeowners have a unique relationship with weather anxiety. When the National Hurricane Center starts talking about a system organizing in the Gulf, the mental checklist kicks in immediately: boards for the windows, supplies in the pantry, a plan …",https://ahouseinthehills.com/hurricane-season-is-coming-warning-signs-your-new-orleans-roof-needs-attention-now/,https://ahouseinthehills.com/wp-content/uploads/2026/05/word-image-161262-1.png,,"New Orleans homeowners have a unique relationship with weather anxiety. When the National Hurricane Center starts talking about a system organizing in the Gulf, the mental checklist kicks in immediat… [+4902 chars]",,"Die Hurrikan-Saison naht: Warnsignale Ihr Dach in New Orleans braucht jetzt Aufmerksamkeit. Hausbesitzer in New Orleans haben eine einzigartige Beziehung zur Wetterangst. Als das National Hurricane Center anfängt, über ein Organisationssystem im Golf zu sprechen, greift sofort die mentale Checkliste: Bretter für die Fenster, Vorräte in der Speisekammer, ein Plan …","Hurricane Season is Coming: Warning Signs Your New Orleans Roof Needs Attention Now. New Orleans homeowners have a unique relationship with weather anxiety. When the National Hurricane Center starts talking about a system organizing in the Gulf, the mental checklist kicks in immediately: boards for the windows, supplies in the pantry, a plan …","Procellae Season venit: Monitum signa tua New Orleans Tectum eget nunc. Novi Orleans homeowners singularem necessitudinem cum tempestatibus anxietatem habent. Cum National Procellae Centre incipit loqui de systemate ordinando in Sinu, maculosus mentis calcibus statim: tabulas fenestrarum, commeatus in cellario, consilium ...",2026-05-07 06:17:35+00:00
155071c77c29266f90027708a018fecc,2026-05-01T04:01:00Z,'tropical cyclone',science.nasa.gov,en,0.7,Cyclone Rains Spur Papua New Guinea Landslides,Heavy rains from Tropical Cyclone Maila triggered a deadly landslide in the mountains of East New Britain.,https://science.nasa.gov/earth/earth-observatory/cyclone-rains-spur-papua-new-guinea-landslides/,https://assets.science.nasa.gov/content/dam/science/esd/eo/images/iotd/2026/cyclone-rains-spur-papua-new-guinea-landslides/papuanewguinea_landslide_oli2_20260420_th.jpg/jcr:content/renditions/cq5dam.web.1280.1280.jpeg,,"Since much of Papua New Guinea lies close to the equator where the Coriolis effect is weak, the risk of tropical cyclones striking the island nation is relatively low, especially in its northern area… [+3491 chars]",,Zyklonregen treiben Erdrutsche in Papua-Neuguinea voran. Heftige Regenfälle des tropischen Wirbelsturms Maila lösten einen tödlichen Erdrutsch in den Bergen von East New Britain aus.,Cyclone Rains Spur Papua New Guinea Landslides. Heavy rains from Tropical Cyclone Maila triggered a deadly landslide in the mountains of East New Britain.,Cyclone Rain Spur Papua Nova Guinea Landslides. Imbres graves e Cyclone Tropical Maila exitialem ruinam in montibus Orientis Novae Britanniae urgent.,2026-05-07 16:14:26+00:00
d44c157ad041697eb636f92e8869f3a6,2026-05-06T17:00:24Z,'hurricane',www.disneyfoodblog.com,en,0.9,3 Updates to Know Before Visiting Disney World During Hurricane Season in 2026,We're breaking down three Disney World policies you need to know before hurricane season!,https://www.disneyfoodblog.com/2026/05/06/3-updates-to-know-before-visiting-disney-world-during-hurricane-season-in-2026/,https://www.disneyfoodblog.com/wp-content/uploads/2026/04/2026-WDW-magic-kingdom-cinderella-castle-rainy-storm-atmo-1-700x525.jpg,,"Hurricane season lasts about half of the year in Florida, and the weather during that time can impact your vacation plans, particularly if you’re visiting Disney World.
Magic Kingdom on a cloudy day… [+3984 chars]",,"3 Updates, die Sie wissen sollten, bevor Sie Disney World während der Hurrikansaison 2026 besuchen. Wir stellen drei Disney World-Richtlinien vor, die Sie vor der Hurrikansaison kennen müssen!",3 Updates to Know Before Visiting Disney World During Hurricane Season in 2026. We're breaking down three Disney World policies you need to know before hurricane season!,3 Updates cognoscere Ante Visitationem Disney Orbis Terrarum Tempore Procellae Tempore 2026. Tres Disney Politiae Mundi disrumpentes perrumpentes ante tempus tempestatis scire debes!,2026-05-07 21:15:01+00:00
8cb8cb8725b50e2eef55fd146d214dcc,2026-05-01T16:30:00Z,'hurricane season',wattsupwiththat.com,en,0.7,Live at 1 pm ET: It’s ‘Weather’ Season … Again. What to Expect – The Climate Realism Show #200,"Spring is here, which means it is Hurricane Season, Tornado Season, Allergy Season, all normal and natural aspects of life on Earth. Climate alarmists, however, will be telling you this year promises to be the worst season ever, and it’s your fault. We will p…",https://wattsupwiththat.com/2026/05/01/live-at-1-pm-et-its-weather-season-again-what-to-expect-the-climate-realism-show-200/,https://wattsupwiththat.com/wp-content/uploads/2026/05/crs200.webp,,".The Heartland Institute
Spring is here, which means it is Hurricane Season, Tornado Season, Allergy Season, all normal and natural aspects of life on Earth. Climate alarmists, however, will be tell… [+1024 chars]",,"Live um 13 Uhr ET: Es ist wieder „Wettersaison“. Was Sie erwartet – The Climate Realism Show #200. Der Frühling ist da, das heißt, es ist Hurrikan-Saison, Tornado-Saison, Allergie-Saison, alles normale und natürliche Aspekte des Lebens auf der Erde. Klimaalarmisten werden Ihnen jedoch sagen, dass dieses Jahr die schlechteste Saison aller Zeiten zu werden droht und dass Sie daran schuld sind. Wir werden p…","Live at 1 pm ET: It’s ‘Weather’ Season … Again. What to Expect – The Climate Realism Show #200. Spring is here, which means it is Hurricane Season, Tornado Season, Allergy Season, all normal and natural aspects of life on Earth. Climate alarmists, however, will be telling you this year promises to be the worst season ever, and it’s your fault. We will p…","Vive hora 1 post meridiem ET: Est 'Tempestas' tempus ... Iterum. Quid expectes - Clima Realismus Show #200. Ver adest, quod significat Tempus est Procellae, Turbo Season, Allergy Temporum, omnes rationes normales et naturales vitae in Terra. Sed terrores caeli narrabunt tibi hoc anno promittit tempus pessimum esse semper, et culpa tua est. Volumus p…",2026-05-08 05:35:54+00:00
a072004027f2fa31b634c5e130c8b4fd,2026-05-06T13:32:43Z,'hurricane',www.insurancejournal.com,en,0.9,"Pacific Hurricane Season Brings Higher Risk of Tropical Impacts for Hawaii, SoCal, Mexico","Exceptionally warm waters and a developing El Niño will increase the risk of direct hurricane impacts in Hawaii, Southern California and parts of Mexico this year, according to an AccuWeather analysis out on Wednesday. The forecast shows the Eastern and …",https://www.insurancejournal.com/news/west/2026/05/06/868735.htm,https://www.insurancejournal.com/app/uploads/2026/05/Pac-hurrican-season_AccuWeather.jpg,,"Exceptionally warm waters and a developing El Niño will increase the risk of direct hurricane impacts in Hawaii, Southern California and parts of Mexico this year, according to an AccuWeather analysi… [+1387 chars]",,"Die Hurrikansaison im Pazifik birgt ein höheres Risiko tropischer Auswirkungen für Hawaii, Südkalifornien und Mexiko. Laut einer am Mittwoch veröffentlichten AccuWeather-Analyse werden außergewöhnlich warme Gewässer und ein sich entwickelnder El Niño das Risiko direkter Hurrikanauswirkungen auf Hawaii, Südkalifornien und Teilen Mexikos in diesem Jahr erhöhen. Die Vorhersage zeigt den Osten und …","Pacific Hurricane Season Brings Higher Risk of Tropical Impacts for Hawaii, SoCal, Mexico. Exceptionally warm waters and a developing El Niño will increase the risk of direct hurricane impacts in Hawaii, Southern California and parts of Mexico this year, according to an AccuWeather analysis out on Wednesday. The forecast shows the Eastern and …","Pacificus Procellae Season altiorem periculum of Tropical Impacts affert pro Hawaii, SoCal, Mexico. Aquae calidae eximie et El Niño evolutionis periculum augebunt directi impetus turbinum in Hawaii, California Australi et partes Mexici hoc anno, secundum analysin AccuWeather die Mercurii. Praesagium ostendit Orientis et ...",2026-05-08 05:35:54+00:00
9f02d25758de3d1eaed0464bf09a4896,2026-05-02T15:34:29Z,'hurricane',www.canescountry.com,en,0.7,"Hurricanes host Flyers: Round 2 Game 1—Preview, How to Watch, Game Thread","After a week off, it’s time for action again",https://www.canescountry.com/carolina-hurricanes-game-day-previews/53548/hurricanes-host-flyers-round-2-game-1-preview-how-to-watch-game-thread,https://s.yimg.com/ny/api/res/1.2/PNIV.9x.w0Odzb_7FlWGsg--/YXBwaWQ9aGlnaGxhbmRlcjt3PTEyMDA7aD04MDA7Y2Y9d2VicA--/https://media.zenfs.com/en/sb_nation_articles_115/82c17875d2fdfc2dc60ae9de973cb164,,"Did you have a good week off? After the grind of the hockey season and then the routine of basically every night with the playoffs, the sweep of the Ottawa Senators last Saturday afternoon has has th… [+6375 chars]",,"Hurricanes hosten Flyers: Runde 2, Spiel 1 – Vorschau, Anschauen, Spielthread. Nach einer Woche Pause ist es wieder Zeit zum Handeln","Hurricanes host Flyers: Round 2 Game 1—Preview, How to Watch, Game Thread. After a week off, it’s time for action again","Turbinum hospes volaces: circum 2 Ludus 1—Praevius, Spectare, Ludus Thread. Post dies octo, tempus agendi est iterum",2026-05-08 15:48:01+00:00
bdf557f34ee74a4541a701dfeca2a3cc,2026-05-03T17:53:55Z,'hurricane season',www.pbs.org,en,0.9,What Florida's extreme drought means for the upcoming hurricane season,"Florida is experiencing one of its worst droughts in decades, but Gov. Ron DeSantis says there could be a silver lining: a less active hurricane season. Does dry weather correlate with fewer hurricanes? PolitiFact says not typically.",https://www.pbs.org/newshour/science/what-floridas-extreme-drought-means-for-the-upcoming-hurricane-season,https://d3i6fh83elv35t.cloudfront.net/static/2026/05/2026-02-24T211929Z_1198115461_RC2QRJA1HSZW_RTRMADP_3_FLORIDA-DROUGHT-1024x576.jpg,,"This article originally appeared on PolitiFact
Florida is experiencing one of its worst droughts in decades, causing widespread wildfires and evacuation orders in large swaths of the state.
Republi… [+4089 chars]",,"Was Floridas extreme Dürre für die kommende Hurrikansaison bedeutet. Florida erlebt eine der schlimmsten Dürren seit Jahrzehnten, aber Gouverneur Ron DeSantis sagt, dass es einen Lichtblick geben könnte: eine weniger aktive Hurrikansaison. Korreliert trockenes Wetter mit weniger Hurrikanen? PolitiFact sagt, normalerweise nicht.","What Florida's extreme drought means for the upcoming hurricane season. Florida is experiencing one of its worst droughts in decades, but Gov. Ron DeSantis says there could be a silver lining: a less active hurricane season. Does dry weather correlate with fewer hurricanes? PolitiFact says not typically.","Quid est extrema siccitas Floridae significat pro tempore venturi tempestatis. Florida unam e siccitatibus suis pessimis in decenniis experitur, sed Gov. Ron DeSantis dicit tunicam argenteam posse esse: tempus minus activum procellae. Num siccitatem cum paucioribus turbinum referunt? PolitiFact non dicit typice.",2026-05-08 15:48:01+00:00
f7a38d88a22afce2a90874c366ea944e,2026-05-07T00:00:00Z,'tropical cyclone',www.nature.com,en,0.9,Subsurface messenger for the annual maximum lifetime maximum intensity of tropical cyclones in the western North Pacific,"This study shows that the western North Pacific tropical cyclone peak intensity correlates with a subsurface water mass formed under the North Pacific High in the eastern North Pacific, allowing tropical cyclone intensity to be predicted years ahead.",https://www.nature.com/articles/s41467-026-72770-5,,,"Open Access This article is licensed under a Creative Commons Attribution 4.0 International License, which permits use, sharing, adaptation, distribution and reproduction in any medium or format, as … [+676 chars]",,"Unterirdischer Bote für die jährliche maximale Intensität tropischer Wirbelstürme im westlichen Nordpazifik. Diese Studie zeigt, dass die Spitzenintensität tropischer Wirbelstürme im westlichen Nordpazifik mit einer unterirdischen Wassermasse korreliert, die sich unter dem Nordpazifikhoch im östlichen Nordpazifik gebildet hat, was eine Vorhersage der Intensität tropischer Wirbelstürme für Jahre im Voraus ermöglicht.","Subsurface messenger for the annual maximum lifetime maximum intensity of tropical cyclones in the western North Pacific. This study shows that the western North Pacific tropical cyclone peak intensity correlates with a subsurface water mass formed under the North Pacific High in the eastern North Pacific, allowing tropical cyclone intensity to be predicted years ahead.","Subsurface nuntius pro annuo maximam vitam maximam intensio cyclonum tropicarum in Pacifico Septentrionali occidentali. Hoc studium demonstrat occidentalem cycli tropici Pacifici septentrionalis cacumen intensio correlate cum subsurface aquae massae sub Altissimo Septentrionali Pacifico factae in Pacifico Septentrionali Orientali, permittens cyclo tropico intensio ante annos praedici.",2026-05-08 21:14:57+00:00
789088229c9c6bdb16bd8c553ef17725,2026-05-05T19:02:44Z,'hurricane season',insidethemagic.net,en,0.7,Hurricane Cancellation Policy Returns to Walt Disney World in 2026,"It’s one of those things Disney fans don’t love to think about—but if you’ve ever planned a summer or fall trip to Walt Disney World, it’s always sitting in the back of your mind. The skies look clear when you book. The countdown feels exciting. And then, sud…",https://insidethemagic.net/?p=826568&preview=true&preview_id=826568,https://insidethemagic.net/wp-content/uploads/2026/04/disney-world-hurricane-2.jpg,,"Its one of those things Disney fans dont love to think aboutbut if youve ever planned a summer or fall trip to Walt Disney World, its always sitting in the back of your mind. The skies look clear whe… [+5556 chars]",,"Die Stornierungsbedingungen für Hurrikane gelten ab 2026 wieder für Walt Disney World. Es ist eines der Dinge, über die Disney-Fans nicht gerne nachdenken – aber wenn Sie schon einmal eine Sommer- oder Herbstreise nach Walt Disney World geplant haben, haben Sie es immer im Hinterkopf. Der Himmel sieht klar aus, wenn Sie buchen. Der Countdown fühlt sich aufregend an. Und dann, plötzlich...","Hurricane Cancellation Policy Returns to Walt Disney World in 2026. It’s one of those things Disney fans don’t love to think about—but if you’ve ever planned a summer or fall trip to Walt Disney World, it’s always sitting in the back of your mind. The skies look clear when you book. The countdown feels exciting. And then, sud…","Hurricane Cancellation Policy Returns to Walt Disney World in 2026. Est earum rerum Disney fans cogitare de non amant - sed si aestatem cogitasti aut iter ad Walt Disney Mundi incidit, semper in tergo mentis tuae sedet. Aethera serenum cum librum aspice. In venenatis suscipit suscipit. Tum, sud...",2026-05-09 09:42:12+00:00
508c65855300d015f277c04ce2becd2c,2026-05-07T13:53:12Z,'hurricane',www.insurancejournal.com,en,0.7,A Quieter Hurricane Season This Year Could Still Pummel the US Power Grid,"Meteorologists are forecasting about 13 named Atlantic storms this season, or a little less activity than average. That sounds like good news for the US power grid and everyone who relies on it. But a look back at recent years …",https://www.insurancejournal.com/news/national/2026/05/07/868926.htm,https://www.insurancejournal.com/app/uploads/2026/05/power-lines-hurricane-beryl-Bloomberg-scaled.jpg,,"Meteorologists are forecasting about 13 named Atlantic storms this season, or a little less activity than average. That sounds like good news for the US power grid and everyone who relies on it.
But… [+2776 chars]",,"Eine ruhigere Hurrikansaison in diesem Jahr könnte das US-Stromnetz dennoch beeinträchtigen. Meteorologen prognostizieren für diese Saison etwa 13 benannte Atlantikstürme oder etwas weniger Aktivität als der Durchschnitt. Das klingt nach einer guten Nachricht für das US-Stromnetz und alle, die darauf angewiesen sind. Aber ein Blick zurück auf die letzten Jahre …","A Quieter Hurricane Season This Year Could Still Pummel the US Power Grid. Meteorologists are forecasting about 13 named Atlantic storms this season, or a little less activity than average. That sounds like good news for the US power grid and everyone who relies on it. But a look back at recent years …","A quietior Procellae Season hoc anno adhuc Pomum US Power Grid. Meteorologi praenuntiant circiter 13 tempestates Atlanticas hoc tempore nominatas, vel paulo minus actuositatis quam mediocris. Quod bonum nuntium sonat pro potentia US eget et omnes qui in eo fient. Sed vide recentibus annis...",2026-05-09 09:42:12+00:00
e9f05ebe706b3f2095641fda81a44db3,2026-05-07T16:52:19Z,'hurricane',www.foxweather.com,en,0.9,New data reveals 100% chance of strong ‘Super’ El Nino forming this year,"The latest long-range European forecast shows there’s a 100% chance of a super El Niño, potentially suppressing hurricane activity and making for a wetter fall and winter in the southern U.S.…",https://www.foxweather.com/weather-news/european-forecast-super-el-nino-strongest-ever-ocean-pacific-atlantic-hurricane-season,https://nypost.com/wp-content/uploads/sites/2/2026/05/127195259.jpg?quality=75&strip=all&w=1200,,"The latest long-range European forecast shows there’s a 100% chance of a super El Niño, potentially suppressing hurricane activity and making for a wetter fall and winter in the southern U.S. 
The E… [+2657 chars]",,"Neue Daten zeigen eine 100-prozentige Wahrscheinlichkeit, dass in diesem Jahr ein starker „Super“-El Niño entsteht. Die neueste langfristige Prognose für Europa zeigt, dass die Wahrscheinlichkeit eines Super-El Niño bei 100 % liegt, was möglicherweise die Hurrikanaktivität unterdrückt und für einen feuchteren Herbst und Winter im Süden der USA sorgt …","New data reveals 100% chance of strong ‘Super’ El Nino forming this year. The latest long-range European forecast shows there’s a 100% chance of a super El Niño, potentially suppressing hurricane activity and making for a wetter fall and winter in the southern U.S.…","Nova data manifestat 100% casum fortium 'Super' El Nino hoc anno formantem. Tardus praenuntiatio Europaea diuturna ostendit casum C% super El Niño in potentia deprimendi procellae activitatis actionem, ut aquosus casus et hiemps in australi U.S.",2026-05-09 09:42:12+00:00
