index,published,keyword,domain,language,valid,title,description,url,image,archive,content,quote,de,en,la,added
a287b697e3a6a5ad105ed0cbf1e11092,2026-05-21T22:18:00Z,'hurricane',nypost.com,en,0.9,NYC surpasses Miami and Houston as America’s highest-risk city for hurricanes: Study,"New York is America’s biggest hurricane bullseye — and last night’s floods prove it. The images were jarring: commuters clinging to the roofs of their submerged cars on the Jackie Robinson Parkway, subway lines grinding to a halt, and floodwaters swallowing t…",https://nypost.com/2026/05/21/real-estate/nyc-surpasses-miami-and-houston-as-americas-highest-risk-city-for-hurricanes/,https://nypost.com/wp-content/uploads/sites/2/2026/05/128427540-1.jpg?quality=75&strip=all&w=1200,,"New York is Americas biggest hurricane bullseye and last nights floods prove it.
The images were jarring: commuters clinging to the roofs of their submerged cars on the Jackie Robinson Parkway, subw… [+5656 chars]",,"NYC übertrifft Miami und Houston als Amerikas Stadt mit dem höchsten Hurrikanrisiko: Studie. New York ist Amerikas größter Hurrikan – und die Überschwemmungen der letzten Nacht beweisen es. Die Bilder waren erschütternd: Pendler, die sich auf dem Jackie Robinson Parkway an die Dächer ihrer untergetauchten Autos klammerten, U-Bahn-Linien, die zum Stillstand kamen, und Überschwemmungen, die sie verschluckten …","NYC surpasses Miami and Houston as America’s highest-risk city for hurricanes: Study. New York is America’s biggest hurricane bullseye — and last night’s floods prove it. The images were jarring: commuters clinging to the roofs of their submerged cars on the Jackie Robinson Parkway, subway lines grinding to a halt, and floodwaters swallowing t…","NYC Miami et Houston urbem summum periculum Americae superat pro turbinum: Study. New York est American maximus turbo bullseye est - et noctis inundationes id probant. Imagines obstrepebant: commuters inhaerentes tectis carros submersos in Jackie Robinson Parkway, lineas tectas sistere stridentes, et aquae diluvii t…",2026-05-23 10:03:58+00:00
729c6907ddcee82691be86f030bb611d,2026-05-21T23:15:17Z,'hurricane',insidethemagic.net,en,0.9,‘Word of Advice’ From National Agency Given to Walt Disney World Vacations,"The results are in: How will this year’s hurricane season turn out for Disney World guests? The Disney World Hurricane Season Prediction Results Are In For families planning a Walt Disney World vacation, summer and fall travel always come with a familiar kind…",https://insidethemagic.net/2026/05/disney-world-hurricane-season-2026-emd1/,https://insidethemagic.net/wp-content/uploads/2023/08/Untitled-design-88-1.jpg,,"The results are in: How will this year’s hurricane season turn out for Disney World guests?
Credit: Jamie S., Inside The Magic
The Disney World Hurricane Season Prediction Results Are In
For famil… [+8217 chars]",,"„Ratschlag“ der Nationalen Agentur an Walt Disney World Vacations. Die Ergebnisse liegen vor: Wie wird die diesjährige Hurrikansaison für die Gäste von Disney World ausgehen? Die Ergebnisse der Vorhersage der Hurrikan-Saison in Disney World liegen vor. Für Familien, die einen Urlaub in Walt Disney World planen, bringen Sommer- und Herbstreisen immer etwas Vertrautes mit sich …","‘Word of Advice’ From National Agency Given to Walt Disney World Vacations. The results are in: How will this year’s hurricane season turn out for Disney World guests? The Disney World Hurricane Season Prediction Results Are In For families planning a Walt Disney World vacation, summer and fall travel always come with a familiar kind…","'Verbum Advice' Ex National Agency Datum Walt Disney Vacations World. Eventus sunt in: Quomodo tempus anni huius tempestatis proveniet Disney Convivis Mundi? Disney Mundi Procellae Season Praedictio Proventus In Pro familiis disponendis Vacationum Mundialis Walt Disney, aestas et casus peregrinationes semper veniunt cum familiari genere…",2026-05-23 10:03:58+00:00
b38ab5f62b49c684444e88424ce2fada,2026-05-22T00:01:04Z,'hurricane season',www.nationalobserver.com,en,0.9,El Nino expected to lessen the number of tropical storms and hurricanes this season,"The Canadian Hurricane Centre is predicting a slightly below average hurricane season because of the anticipated arrival of a disruptive El Nino climate pattern, but a senior meteorologist says Canadians should not let their guard down.",https://www.nationalobserver.com/2026/05/21/news/el-nino-expected-lessen-number-tropical-storms-hurricanes-season,https://www.nationalobserver.com/sites/default/files/img/2026/05/21/edit_52b6fec7-d975-4b81-b9d1-4862baeee71e.jpg,,"The Canadian Hurricane Centre is predicting a slightly below average hurricane season because of the anticipated arrival of a disruptive El Nino climate pattern, but a senior meteorologist says Canad… [+3349 chars]",,"Es wird erwartet, dass El Nino in dieser Saison die Zahl tropischer Stürme und Hurrikane verringern wird. Das Canadian Hurricane Center prognostiziert eine leicht unterdurchschnittliche Hurrikansaison, da ein störendes El-Nino-Klimamuster erwartet wird. Ein leitender Meteorologe sagt jedoch, dass die Kanadier nicht nachlassen sollten.","El Nino expected to lessen the number of tropical storms and hurricanes this season. The Canadian Hurricane Centre is predicting a slightly below average hurricane season because of the anticipated arrival of a disruptive El Nino climate pattern, but a senior meteorologist says Canadians should not let their guard down.","El Nino expectatur numerus procellarum tropicarum et turbinum hoc tempore minuere. Canadian Hurricane Centrum paulo infra medium tempestatis tempestatis praedicit propter adventum caeli Nino turbulenti, sed senior meteorologus dicit Canadenses cavere debere.",2026-05-23 10:03:58+00:00
dda5caeb57bdc30202f7a8f7a25c4ab9,2026-05-22T01:00:00Z,'hurricane season',wattsupwiththat.com,en,0.9,GOOD: NEWS: NOAA predicts a below-normal 2026 Atlantic hurricane season,"Early preparation essential to staying safe all season Forecasters with NOAA’s National Weather Service are predicting a below-normal hurricane season for the Atlantic basin this year. NOAA’s outlook for the… 
The post GOOD: NEWS: NOAA predicts a below-normal…",https://wattsupwiththat.com/2026/05/21/good-news-noaa-predicts-a-below-normal-2026-atlantic-hurricane-season/,https://wattsupwiththat.com/wp-content/uploads/2026/05/NOAA-2026-hurricane-outlook.webp,,"Early preparation essential to staying safe all season
Forecasters with NOAAs National Weather Service are predicting a below-normal hurricane season for the Atlantic basin this year. NOAAs outlook … [+5478 chars]",,"GUT: NACHRICHTEN: NOAA prognostiziert eine unterdurchschnittliche Hurrikansaison 2026 im Atlantik. Um die ganze Saison über sicher zu bleiben, ist eine frühzeitige Vorbereitung unerlässlich. Prognostiker des Nationalen Wetterdienstes der NOAA prognostizieren für das Atlantikbecken in diesem Jahr eine unterdurchschnittliche Hurrikansaison. NOAAs Ausblick für die… 
Der Beitrag GUT: NACHRICHTEN: NOAA prognostiziert einen unterdurchschnittlichen…","GOOD: NEWS: NOAA predicts a below-normal 2026 Atlantic hurricane season. Early preparation essential to staying safe all season Forecasters with NOAA’s National Weather Service are predicting a below-normal hurricane season for the Atlantic basin this year. NOAA’s outlook for the… 
The post GOOD: NEWS: NOAA predicts a below-normal…","GOOD: NUNTII: NOAA praedicat infra-normalem 2026 Atlanticum Arctos. Praeparatio necessaria ad tutum manendi omne tempus Weatherers cum NOAA's National Tempestatem Service praedicunt tempus infra-normalem procellae pro basi Atlantico hoc anno. NOAA prospectum est… 
Post GOOD: NUNTII: NOAA praedicat infra-normalem…",2026-05-23 10:03:58+00:00
f118e43f94427f1ee7c1e9ac2f2820c2,2026-05-22T02:32:15Z,'hurricane season',timesofindia.indiatimes.com,en,0.9,Atlantic hurricane season forecast to be milder than normal thanks to El Nino,"Environment News: A developing El Nino that is forecast to get quite strong will likely dampen the upcoming Atlantic hurricane season, but it won't make the potentially.",https://timesofindia.indiatimes.com/home/environment/atlantic-hurricane-season-forecast-to-be-milder-than-normal-thanks-to-el-nino/articleshow/131255068.cms,"https://static.toiimg.com/thumb/msid-131255105,width-1280,height-720,resizemode-6,overlay-toi_sw,pt-32,y_pad-600/photo.jpg",,"<ul><li>News</li>
<li>Atlantic hurricane season forecast to be milder than normal thanks to El Nino</li></ul>
Follow Us On Social Media
Copyright © 2026 Bennett, Coleman &amp; Co. Ltd. All rights … [+54 chars]",,"Dank El Niño wird die Hurrikansaison im Atlantik voraussichtlich milder als normal ausfallen. Umweltnachrichten: Ein sich entwickelnder El Niño, von dem vorhergesagt wird, dass er ziemlich stark wird, wird die kommende Hurrikansaison im Atlantik wahrscheinlich dämpfen, aber das wird nicht der Fall sein.","Atlantic hurricane season forecast to be milder than normal thanks to El Nino. Environment News: A developing El Nino that is forecast to get quite strong will likely dampen the upcoming Atlantic hurricane season, but it won't make the potentially.","Tempestates Atlantici tempestatis praesagiunt mitiora esse quam normales gratias El Nino. Environment News: A El Nino evolvens id est praenuntiativum ut satis validum futurum tempus Atlantici tempestatis madefaciat verisimile, sed potentia non faciet.",2026-05-23 10:03:58+00:00
fbe1a51b6ae3d7a801ae21b151a9cf65,2026-05-22T03:27:23Z,'hurricane',abcnews.com,en,0.9,Atlantic hurricane season forecast to be milder than normal thanks to El Nino,"Meteorologists predict a developing El Nino could dampen the upcoming Atlantic hurricane season, but it won't eliminate storms",https://abcnews.com/US/wireStory/atlantic-hurricane-season-forecast-milder-normal-el-nino-133208151,https://i.abcnewsfe.com/a/4ca15887-16a5-427e-b726-d53f900033cd/wirestory_419de66615c5eb9b2974ef14b4d2f50b_16x9.jpg?w=1600,,"A developing El Nino that is forecast to get quite strong will likely dampen the upcoming Atlantic hurricane season, but it won't make the potentially deadly storms disappear, federal and outside met… [+7390 chars]",,"Dank El Niño wird die Hurrikansaison im Atlantik voraussichtlich milder als normal ausfallen. Meteorologen gehen davon aus, dass ein sich entwickelnder El Niño die kommende Hurrikansaison im Atlantik dämpfen könnte, aber Stürme dadurch nicht beseitigen wird","Atlantic hurricane season forecast to be milder than normal thanks to El Nino. Meteorologists predict a developing El Nino could dampen the upcoming Atlantic hurricane season, but it won't eliminate storms","Tempestates Atlantici tempestatis praesagiunt mitiora esse quam normales gratias El Nino. Meteorologistae progressionem El Nino praedicere posse tempestatum Atlanticum venturam madefacere temporum, sed procellas non exterminare.",2026-05-23 10:03:58+00:00
c562cc49d3b6a051397767631feaf3df,2026-05-22T08:43:06Z,'hurricane season',www.npr.org,en,0.9,Forecasters predict fewer storms than average this hurricane season,"The National Hurricane Center predicts eight to 14 storms will form during this year's Atlantic hurricane season, which begins June 1.",https://www.npr.org/2026/05/22/nx-s1-5825892/forecasters-predict-fewer-storms-than-average-this-hurricane-season,https://media.npr.org/include/images/facebook-default-wide-s1400-c85.jpg,,"The National Hurricane Center predicts eight to 14 storms will form during this year's Atlantic hurricane season, which begins June 1.",,"Meteorologen sagen für diese Hurrikansaison weniger Stürme als durchschnittlich voraus. Das National Hurricane Center prognostiziert, dass sich während der diesjährigen Hurrikansaison im Atlantik, die am 1. Juni beginnt, acht bis 14 Stürme bilden werden.","Forecasters predict fewer storms than average this hurricane season. The National Hurricane Center predicts eight to 14 storms will form during this year's Atlantic hurricane season, which begins June 1.","Vates praenuntiant tempestates pauciores quam hoc tempore tempestatis mediocris. Centrum Hurricane Nationale praedicat octo ad 14 procellas tempore huius anni tempestatum Atlanticum formabit, quod ante 1 Iunii incipit.",2026-05-23 10:03:58+00:00
d482eb3eacfe0b07fa8953436810db17,2026-05-17T11:00:00Z,'hurricane victims',finance.yahoo.com,en,0.3,‘The Butterfly Trust’: How Deutsche Bank maintained Jeffrey Epstein as a client until he was arrested,"The bank said it fired Epstein as a client in 2018. In reality, it kept his accounts open until after he was jailed in 2019.",https://finance.yahoo.com/markets/stocks/articles/butterfly-trust-deutsche-bank-maintained-110000749.html,https://s.yimg.com/ny/api/res/1.2/IEYqpUB5PM.delxAQKsz4w--/YXBwaWQ9aGlnaGxhbmRlcjt3PTEyMDA7aD04MDA-/https://media.zenfs.com/en/fortune_175/6a07374931ea266b868991de4f390cd4,,"Deutsche Bank went on to pay $150 million to New York regulators and $75 million to Epsteins victims.
Internal communications, trading confirmations, and cashhandling emails released by the DOJ show… [+36927 chars]",,"„The Butterfly Trust“: Wie die Deutsche Bank Jeffrey Epstein bis zu seiner Verhaftung als Kunden pflegte. Die Bank sagte, sie habe Epstein 2018 als Kunden entlassen. In Wirklichkeit behielt sie seine Konten offen, bis er 2019 inhaftiert wurde.","‘The Butterfly Trust’: How Deutsche Bank maintained Jeffrey Epstein as a client until he was arrested. The bank said it fired Epstein as a client in 2018. In reality, it kept his accounts open until after he was jailed in 2019.",'De Butterfly Trust': Quomodo Deutsche Bank Jeffrey Epstein in clientelam servavit donec captus est. Argentaria dixit eam in clientelam Epstein accensam anno 2018. Re vera rationes suas apertas servavit donec postquam in MMXIX est inclusus est.,2026-05-23 15:14:52+00:00
365c535a9500f1346da59cd87ab99f71,2026-05-01T14:05:10Z,'hurricane warning',www.techradar.com,en,0.3,"From 'encryption backdoor' to 'lawful access' — is a compromise between privacy, security, and law enforcement needs actually possible?","After ongoing attempts in Europe, Canada is the latest country pushing for ""lawful access"" to data for law enforcement. This, despite cybersecurity experts warning that breaking encryption would threaten everyone's privacy and security.",https://www.techradar.com/vpn/vpn-privacy-security/from-encryption-backdoor-to-lawful-access-is-a-compromise-between-privacy-security-and-law-enforcement-needs-actually-possible,https://cdn.mos.cms.futurecdn.net/9kTjCEy37gh8ucdaDhrVoU-2153-80.jpg,http://web.archive.org/web/20260513130041/https://www.techradar.com/vpn/vpn-privacy-security/from-encryption-backdoor-to-lawful-access-is-a-compromise-between-privacy-security-and-law-enforcement-needs-actually-possible,"When privacy advocates thought they had won the Crypto Wars in the 1990s, they probably wouldn’t have guessed they’d still be discussing whether decrypting private data is a bad or good idea 30 years… [+6540 chars]",,"Von der „Verschlüsselungs-Hintertür“ zum „rechtmäßigen Zugriff“ – ist ein Kompromiss zwischen Datenschutz, Sicherheit und Strafverfolgungsanforderungen tatsächlich möglich? Nach anhaltenden Versuchen in Europa drängt Kanada als jüngstes Land auf einen „rechtmäßigen Zugriff“ auf Daten für die Strafverfolgung. Und das, obwohl Cybersicherheitsexperten warnten, dass das Brechen der Verschlüsselung die Privatsphäre und Sicherheit aller gefährden würde.","From 'encryption backdoor' to 'lawful access' — is a compromise between privacy, security, and law enforcement needs actually possible?. After ongoing attempts in Europe, Canada is the latest country pushing for ""lawful access"" to data for law enforcement. This, despite cybersecurity experts warning that breaking encryption would threaten everyone's privacy and security.","Ex ""postico encryptionis"" ad ""licitum accessum"" - compromissum est inter secretum, securitatem et legis necessitatem actu fieri posse. Post continuas in Europa conatus, Canada est terra novissima pro ""licitum accessum"" ad notitias legis necessarias. Hoc, quamvis periti cybersecurity monent ne encryption fractionis omnium secreti et securitatis immineat.",2026-05-23 21:05:54+00:00
959473fbc32497721ebec020f5028167,2026-05-21T16:44:57Z,'hurricane warning',www.bbc.com,en,0.3,New surveillance aircraft arrives at RAF Lossiemouth,The Wedgetail is the first of a fleet of the planes to be based in Moray.,https://www.bbc.com/news/articles/czd2q27j9rmo?xtor=AL-72-%5Bpartner%5D-%5Byahoo.north.america%5D-%5Bheadline%5D-%5Bnews%5D-%5Bbizdev%5D-%5Bisapi%5D,https://s.yimg.com/os/en/bbc_us_articles_995/78a0dd5b9800b150745963e84e0e4616,,"The first of a fleet of new surveillance aircraft to be stationed at RAF Lossiemouth has arrived at the Moray base.
The RAF said the Wedgetail was equipped with technology to provide early warnings … [+1223 chars]",,"Neues Überwachungsflugzeug kommt bei RAF Lossiemouth an. Die Wedgetail ist das erste einer Flotte von Flugzeugen, die in Moray stationiert sind.",New surveillance aircraft arrives at RAF Lossiemouth. The Wedgetail is the first of a fleet of the planes to be based in Moray.,Novae custodiae aircraft ad RAF Lossiemouth pervenit. Wedgetail est prima classis planorum in Moravia fundata.,2026-05-23 21:05:54+00:00
f2ae61881689f580508b34f3ec99057e,2026-05-11T20:02:25Z,'typhoon',kottke.org,en,0.7,Mesmerizing 4K Video of a Cat-5 Super Typhoon,"Seán Doran, who I’ve featured here many times before for his remastered astronomy photos & videos, has taken photographs captured by a Japanese weather satellite of Typhoon Sinlaku in April 2026 a",https://kottke.org/26/05/mesmerizing-4k-video-of-a-cat-5-super-typhoon,https://i.ytimg.com/vi/OTPUxMBD2Z8/sddefault.jpg,http://web.archive.org/web/20260514082829/https://kottke.org/26/05/mesmerizing-4k-video-of-a-cat-5-super-typhoon,"Seán Doran, who I’ve featured here many times before for his remastered astronomy photos & videos, has taken photographs captured by a Japanese weather satellite of Typhoon Sinlaku in April 2026 and … [+493 chars]",,"Faszinierendes 4K-Video eines Cat-5 Super Taifuns. Seán Doran, den ich hier schon oft für seine überarbeiteten Astronomiefotos und -videos vorgestellt habe, hat im April 2026 von einem japanischen Wettersatelliten Fotos vom Taifun Sinlaku gemacht","Mesmerizing 4K Video of a Cat-5 Super Typhoon. Seán Doran, who I’ve featured here many times before for his remastered astronomy photos & videos, has taken photographs captured by a Japanese weather satellite of Typhoon Sinlaku in April 2026 a","Mesmerizing 4K Video Cat-5 Super Typhoon. Seán Doran, qui hic pluries ante egi propter astronomiam suam imagines & videos, imagines photographicas captas a satellite Typhonis Sinlaku mense Aprili 2026 a tempestatibus Iaponica.",2026-05-23 21:05:54+00:00
85c70960695ecf135e42a7d0beeb751f,2026-05-19T10:28:00Z,'typhoon',www.theregister.com,en,0.7,UK Typhoon jets fitted with bargain-bin drone busters for Middle East sorties,Low-cost laser-guided rockets offer cheaper way to swat Shahed-style threats than firing pricey air-to-air missiles,https://www.theregister.com/offbeat/2026/05/19/uk-typhoon-jets-fitted-with-bargain-bin-drone-busters-for-middle-east-sorties/5242412,https://image.theregister.com/5242428.jpg?imageId=5242428&x=0&y=0&cropw=100&croph=100&panox=0&panoy=0&panow=100&panoh=100&width=1200&height=683,,"Britain has deployed low-cost anti-drone rockets to the
Middle East, just weeks after successful tests of the equipment were announced.
The Ministry of Defence (MoD) says the Advanced
Precision Ki… [+2378 chars]",,"Britische Typhoon-Jets sind für Einsätze im Nahen Osten mit preiswerten Drohnenjägern ausgestattet. Kostengünstige lasergelenkte Raketen bieten eine kostengünstigere Möglichkeit, Bedrohungen im Shahed-Stil zu bekämpfen, als teure Luft-Luft-Raketen abzufeuern",UK Typhoon jets fitted with bargain-bin drone busters for Middle East sorties. Low-cost laser-guided rockets offer cheaper way to swat Shahed-style threats than firing pricey air-to-air missiles,UK Typhoon rumpit aptata cum fuco-bin busters pacti pro eruptionibus Medio Oriente. Low-sumptus laser-ductus nisl offerre vilius ad abi- genda Shahed-stilo minas quam incendere carus aer-ad-aera missilia,2026-05-23 21:05:54+00:00
8a1ca44613789196ed79a1e135950fe0,2026-05-21T16:01:39Z,'typhoon',apnews.com,en,0.9,Hurricane season forecast 'below normal'...,"Meteorologists predict a developing El Nino could dampen the upcoming Atlantic hurricane season, but it won't eliminate storms. The National Oceanic and Atmospheric Administration forecasts a below-average season with fewer named storms and hurricanes. Colora…",https://apnews.com/article/hurricanes-atlantic-pacific-el-nino-damage-risk-419de66615c5eb9b2974ef14b4d2f50b,https://dims.apnews.com/dims4/default/2785f26/2147483647/strip/true/crop/6321x4212+0+1/resize/980x653!/quality/90/?url=https%3A%2F%2Fassets.apnews.com%2F98%2Ff5%2F770d63a187428a2f6d2cfb1449fe%2Fa4e0969b50904f20908334c4719bd85a,http://web.archive.org/web/20260522201712/https://apnews.com/article/hurricanes-atlantic-pacific-el-nino-damage-risk-419de66615c5eb9b2974ef14b4d2f50b,"A developing El Nino that is forecast to get quite strong will likely dampen the upcoming Atlantic hurricane season, but it wont make the potentially deadly storms disappear, federal and outside mete… [+6743 chars]",,"Vorhersage für Hurrikansaison „unter dem Normalwert“... Meteorologen gehen davon aus, dass ein sich entwickelnder El Niño die kommende Hurrikansaison im Atlantik dämpfen könnte, aber Stürme dadurch nicht beseitigen wird. Die National Oceanic and Atmospheric Administration prognostiziert eine unterdurchschnittliche Saison mit weniger benannten Stürmen und Hurrikanen. Farbe…","Hurricane season forecast 'below normal'.... Meteorologists predict a developing El Nino could dampen the upcoming Atlantic hurricane season, but it won't eliminate storms. The National Oceanic and Atmospheric Administration forecasts a below-average season with fewer named storms and hurricanes. Colora…","Procellae temporum praenuntientur ""infra normalem"".... Meteorologi praedicunt progressionem El Nino venturum tempestatis Atlantici madefacere potuisse, sed procellas non eliminare. National Oceanica et Atmosphaerica Administrationis tempus infra medium praenuntiat cum paucioribus tempestatibus et turbinibus nominatis. Colora…",2026-05-23 21:05:54+00:00
01c778d19ec56bfabb235a693757dbd0,2026-05-21T18:00:03Z,'hurricane season',www.si.com,en,0.7,What Happened Last Time Oklahoma State Cowboys Played Tulsa Golden Hurricane,"The Oklahoma State Cowboys and the Tulsa Golden Hurricane meet often, but last year's meeting hit the Cowboys hard.",https://www.si.com/college/oklahomastate/football/what-happened-last-time-oklahoma-state-cowboys-played-tulsa-golden-hurricane,https://s.yimg.com/os/en/oklahoma_state_cowboys_on_si_articles_832/61058e97efbc5b8c359ad55e215aadc3,,"Oklahoma State was used to getting its way on the football field when it comes to Tulsa.
The Cowboys have a record of 44-28-5 against the Golden Hurricane. That includes a 28-7-3 record at home. Und… [+3245 chars]",,"Was geschah das letzte Mal, als die Oklahoma State Cowboys gegen Tulsa Golden Hurricane spielten? Die Oklahoma State Cowboys und der Tulsa Golden Hurricane treffen oft aufeinander, aber das Aufeinandertreffen im letzten Jahr traf die Cowboys hart.","What Happened Last Time Oklahoma State Cowboys Played Tulsa Golden Hurricane. The Oklahoma State Cowboys and the Tulsa Golden Hurricane meet often, but last year's meeting hit the Cowboys hard.","Quid Last Tempus Oklahoma Civitatis Cowboys lusit Tulsa Hurricane Golden. Civitas Oklahoma Cowboys et Tulsa Aureae Procellae saepe concurrunt, sed anni proximi conventus Cowboys difficiles percusserunt.",2026-05-24 10:04:23+00:00
99ddc0ee2e31d7e15f49d4e42e8fda44,2026-05-21T16:38:13Z,'hurricane',www.cbc.ca,en,0.9,"This year’s Atlantic hurricane season expected to be below average, thanks to El Niño","Thanks to the workings of an as-yet-to-form El Niño, the Atlantic basin is expected to see a quieter-than-normal hurricane season.",https://www.cbc.ca/news/science/2026-atlantic-hurricane-forecast-9.7206140,"https://i.cbc.ca/ais/bbb67939-48a7-4bf1-8061-3611e76c0439,1779302972930/full/max/0/default.jpg?im=Crop%2Crect%3D%280%2C0%2C1920%2C1080%29%3BResize%3D620",,"The U.S. National Hurricane Center (NHC) is calling for a below-average Atlantic hurricane season this year.
It is forecasting between eight and 14 named storms, with three to six of them becoming h… [+3609 chars]",,"Dank El Niño wird die diesjährige Hurrikansaison im Atlantik voraussichtlich unterdurchschnittlich ausfallen. Dank der Auswirkungen eines sich noch nicht entwickelnden El Niño wird im Atlantikbecken eine Hurrikansaison erwartet, die ruhiger als normal ausfallen wird.","This year’s Atlantic hurricane season expected to be below average, thanks to El Niño. Thanks to the workings of an as-yet-to-form El Niño, the Atlantic basin is expected to see a quieter-than-normal hurricane season.","Hoc anno tempestatum Atlanticum infra medium futurum expectatur, gratias El Niño. Propter operationes in forma El Niño as-tamen-ad-forma Atlantica pelvis expectatur ut tempestatis tempus quietius quam normale videatur.",2026-05-24 10:04:23+00:00
