index,published,keyword,domain,language,valid,title,description,url,image,archive,content,quote,de,en,la,added
4e352b799a9eb77b508155ed775bf71e,2024-11-06T09:17:10Z,'hurricane',www.newsweek.com,en,0.7,"Hurricane Rafael Path Update, Tracker as Storm Set for Rare Landfall","The National Hurricane Center has said ""environmental conditions are very favorable for continued intensification.""",https://www.newsweek.com/hurricane-rafael-path-update-tracker-rare-landfall-1981094,https://d.newsweek.com/en/full/2513741/rafael.png,,"Hurricane Rafael could make landfall in the U.S. later this week, as it continues to barrel over the Gulf of Mexico.
According to the latest National Hurricane Center update, issued at 1 a.m. ET on … [+3425 chars]",,"Hurrikan-Rafael-Pfad-Update, Tracker als Sturm-Set für seltene Landung. Das National Hurricane Center sagte, dass „die Umweltbedingungen für eine weitere Intensivierung sehr günstig sind“.","Hurricane Rafael Path Update, Tracker as Storm Set for Rare Landfall. The National Hurricane Center has said ""environmental conditions are very favorable for continued intensification.""","Procellae Rafael Path Update, Tracker pro Tempestas Pone Rare Landfall. National Hurricane Centrum dixit ""condiciones environmentales valde favorabiles ad intensionem continuam"".",2025-12-18 08:42:37+00:00
339ec3b2c5c4faaaac2af1917dad8b53,2024-11-06T12:58:07Z,'hurricane',www.cbsnews.com,en,0.7,Hurricane Rafael grows into a Category 2 storm as it bears down on Cuba,Hurricane Rafael has grown into a Category 2 storm with maximum sustained winds of 100 mph as it heads for landfall on Cuba's southern coast.,https://www.cbsnews.com/news/hurricane-rafael-forecast-path-maps-expected-landfall-cuba/,https://assets2.cbsnewsstatic.com/hub/i/r/2024/11/06/9743e647-5d7f-4d29-8851-9e5168b7c71a/thumbnail/1200x630g4/c47b97819990edfc19db73bfea743900/hurricane-rafael-nov6-7a.jpg?v=c1d30b1df13c40bf65c6c1e6d9ac4ad7,http://web.archive.org/web/20241106210543/https://www.cbsnews.com/news/hurricane-rafael-forecast-path-maps-expected-landfall-cuba/,"San Juan, Puerto Rico — Hurricane Rafael swelled into a Category 2 storm early Wednesday as it swirled past the Cayman Islands, and it was forecast to rapidly intensify before making landfall later i… [+4183 chars]",,"Hurrikan Rafael entwickelt sich zu einem Sturm der Kategorie 2, als er auf Kuba trifft. Hurrikan Rafael hat sich zu einem Sturm der Kategorie 2 mit maximalen Dauerwindgeschwindigkeiten von 100 Meilen pro Stunde entwickelt und steuert auf die Südküste Kubas zu.",Hurricane Rafael grows into a Category 2 storm as it bears down on Cuba. Hurricane Rafael has grown into a Category 2 storm with maximum sustained winds of 100 mph as it heads for landfall on Cuba's southern coast.,"Procellae Rafael crescit in Categoriam 2 procellam in Cuba. Procellae Rafael in Categoriam 2 procellam maximis ventis sustinentibus 100 mph crevit, cum in oram Cubae meridionalem cadit.",2025-12-18 08:42:37+00:00
ba8533a034286a3d06ba5f1c9f5cfa16,2024-11-06T13:31:37Z,veryUnusualAndNeverUsedKeyword,finance.yahoo.com,en,0.7,Menaces Florida Keys...,"Menaces Florida Keys...

 
 
 
 (Third column, 5th story, link)

 

 

 
 Related stories:November Hurricane in Caribbean!
CONE...
COMPUTER MODELS...",https://finance.yahoo.com/news/hurricane-rafael-menaces-florida-keys-004154167.html,https://s.yimg.com/ny/api/res/1.2/gsPm4DAuSeBj.Fbf6y8KOA--/YXBwaWQ9aGlnaGxhbmRlcjt3PTEyMDA7aD03OTk-/https://media.zenfs.com/en/bloomberg_markets_842/09a301e42413cdf6f1fe2584bfd3b266,http://web.archive.org/web/20241106064511/https://finance.yahoo.com/news/hurricane-rafael-menaces-florida-keys-004154167.html,"(Bloomberg) -- Hurricane Rafael is quickly strengthening as it churns toward the Gulf of Mexico, threatening to bring damaging gusts and heavy rains to populated areas from the Cayman Islands to Sout… [+1761 chars]",,"Bedrohungen für Florida Keys... Bedrohungen für Florida Keys...

 
 
 
 (Dritte Spalte, 5. Geschichte, Link)

 

 

 
 Ähnliche Geschichten:November-Hurrikan in der Karibik!
KEGEL...
COMPUTERMODELLE...","Menaces Florida Keys.... Menaces Florida Keys...

 
 
 
 (Third column, 5th story, link)

 

 

 
 Related stories:November Hurricane in Caribbean!
CONE...
COMPUTER MODELS...","Minas Florida Keys.... Minas Florida Keys...

 
 
 
 (Columna tertia, 5th story, link)

 

 

 
 Related fabulas: November Turbo in Caribbean!
CONIS...
COMPUTER MODELS...",2025-12-18 08:42:37+00:00
f5296f0817c30c4418ae1dcd6cab0b77,2024-11-06T14:14:42Z,'hurricane warning',www.newsweek.com,en,0.7,Rafael: Hurricane Center Issues Florida Keys Storm Surge Warning,"""There is high confidence that human-caused climate change has already increased the intensity of rainfall in the storms,"" an expert told Newsweek.",https://www.newsweek.com/hurricane-center-rafael-storm-surge-florida-keys-rainfall-flooding-cuba-1981294,https://d.newsweek.com/en/full/2514029/hurricane-rafael-path-florida-keys.jpg,http://web.archive.org/web/20241107000538/https://www.newsweek.com/hurricane-center-rafael-storm-surge-florida-keys-rainfall-flooding-cuba-1981294,"Residents in the Florida Keys have been warned that powerful storm surges could be headed their way as Hurricane Rafael barrels across the Gulf of Mexico.
Rafael, which is currently a Category 2 hur… [+4787 chars]",,"Rafael: Hurricane Center gibt Sturmflutwarnung für Florida Keys heraus. „Es besteht großes Vertrauen, dass der vom Menschen verursachte Klimawandel die Niederschlagsintensität der Stürme bereits erhöht hat“, sagte ein Experte gegenüber Newsweek.","Rafael: Hurricane Center Issues Florida Keys Storm Surge Warning. ""There is high confidence that human-caused climate change has already increased the intensity of rainfall in the storms,"" an expert told Newsweek.","Rafael: Procellae Centrum Proventus Florida Keys Storm Surge Monitum. ""Magna fiducia est quod motus climatis humano-actionem pluviae in procellis iam auxit"", vir peritus Newsweek nuntiavit.",2025-12-18 08:42:37+00:00
81a367ee9d3ae366f1cf09618153be5f,2024-11-06T18:18:01Z,veryUnusualAndNeverUsedKeyword,www.miamiherald.com,en,0.7,"Latest update from the NHC on Category 3 Hurricane Rafael for Wednesday, Nov 6",Here’s the latest on Category 3 Hurricane Rafael,https://www.miamiherald.com/news/weather/hurricane/article295145954.html,https://media.zenfs.com/en/miami_herald_mcclatchy_975/b9d75ee851bacb033f1b64da18df53f1,,"Article first published: Wednesday, Nov. 6, 2024, 4 a.m. ET
Article last updated: Wednesday, Nov. 6, 2024, 1 p.m. ET
The National Hurricane Center's 1 pm Wednesday advisory reported that Category 3… [+4245 chars]",,"Neuestes Update des NHC zum Hurrikan Rafael der Kategorie 3 für Mittwoch, den 6. November. Hier ist das Neueste zum Hurrikan Rafael der Kategorie 3","Latest update from the NHC on Category 3 Hurricane Rafael for Wednesday, Nov 6. Here’s the latest on Category 3 Hurricane Rafael","Ultimae renovationis ex NHC in Categoria 3 Procellae Rafael pro Mercurii, Nov. 6 Hic est tardus in Categoria 3 Hurricane Rafael",2025-12-18 08:42:37+00:00
c658612809902cdb9e927c6d69fa3dad,2024-11-06T18:21:55Z,'hurricane',www.newsweek.com,en,0.7,Will Hurricane Rafael Reach Texas? Storm Forecast Amid Path Shift,Hurricane Rafael is expected to become a major storm later Wednesday before hitting Cuba and then exiting into the Gulf of Mexico.,https://www.newsweek.com/hurricane-rafael-texas-storm-forecast-amid-path-shift-1981523,https://d.newsweek.com/en/full/2514440/will-hurricane-rafael-reach-texas-storm-forecast.png,http://web.archive.org/web/20241106185748/https://www.newsweek.com/hurricane-rafael-texas-storm-forecast-amid-path-shift-1981523,"Hurricane Rafael's path has shifted slightly to the west, with the storm now taking aim at southern Texas after it enters the Gulf of Mexico later this week.
Rafael became a hurricane on Tuesday nig… [+3024 chars]",,"Wird Hurrikan Rafael Texas erreichen? Sturmvorhersage inmitten von Pfadverschiebung. Es wird erwartet, dass sich Hurrikan Rafael im Laufe des Mittwochs zu einem schweren Sturm entwickelt, bevor er Kuba trifft und dann in den Golf von Mexiko mündet.",Will Hurricane Rafael Reach Texas? Storm Forecast Amid Path Shift. Hurricane Rafael is expected to become a major storm later Wednesday before hitting Cuba and then exiting into the Gulf of Mexico.,Rafael et Procellae Texas pervenire? Procella Data Inter Path Shift. Procellae Rafael ampliorem tempestatem futuram Mercurii ante Cubam ferendi expectat ac deinde in Sinum Mexicanum exivit.,2025-12-18 08:42:37+00:00
f54606b29e587ecd986665a1d80a3a3b,2024-11-06T22:03:16Z,veryUnusualAndNeverUsedKeyword,www.ibtimes.com,en,0.7,Hurricane Rafael Triggers Nationwide Blackout In Cuba,"Hurricane Rafael knocked out power to all of Cuba on Wednesday as it made landfall on the island still reeling from a recent blackout and a previous major storm, the national power company said.",https://www.ibtimes.com/hurricane-rafael-triggers-nationwide-blackout-cuba-3749936,https://d.ibtimes.com/en/full/4559756/evacuation-residents-guanimar-western-cuba-left-streets-empty-ahead-arrival-hurricane-rafael.jpg,http://web.archive.org/web/20241107183939/https://www.ibtimes.com/hurricane-rafael-triggers-nationwide-blackout-cuba-3749936,"Hurricane Rafael knocked out power to all of Cuba on Wednesday as it made landfall on the island still reeling from a recent blackout and a previous major storm, the national power company said.
""St… [+2474 chars]",,"Hurrikan Rafael löst in Kuba einen landesweiten Stromausfall aus. Hurrikan Rafael hat am Mittwoch in ganz Kuba die Stromversorgung unterbrochen, als er auf der Insel landete, die noch immer von einem kürzlichen Stromausfall und einem früheren schweren Sturm betroffen war, teilte der staatliche Energieversorger mit.","Hurricane Rafael Triggers Nationwide Blackout In Cuba. Hurricane Rafael knocked out power to all of Cuba on Wednesday as it made landfall on the island still reeling from a recent blackout and a previous major storm, the national power company said.","Procellae Rafael Triggers Nationwide Blackout In Cuba. Procellae Rafael potestatem omnibus Cubae pulsavit die mercurii, dum in insula lapsus est, adhuc ex recenti niger et priore tempestate maiore fluctuante, societatis potentiae nationalis dixit.",2025-12-18 08:42:37+00:00
ecd47060f9a26a8013811a773dbb3198,2024-11-08T03:30:00Z,veryUnusualAndNeverUsedKeyword,www.bangkokpost.com,en,0.7,Typhoon Yinxing hits Philippines as a powerful storm,"<p>MANILA &mdash; Typhoon Yinxing made landfall in the Philippines on Thursday, bringing dangerous winds and intense rainfall to Luzon, the nation's most populous island.</p>",https://www.bangkokpost.com/world/2898573/typhoon-yinxing-hits-philippines-as-a-powerful-storm,https://static.bangkokpost.com/media/content/20241108/c1_2898573_700.jpg,http://web.archive.org/web/20241109010048/https://www.bangkokpost.com/world/2898573/typhoon-yinxing-hits-philippines-as-a-powerful-storm,"MANILA — Typhoon Yinxing made landfall in the Philippines on Thursday, bringing dangerous winds and intense rainfall to Luzon, the nation's most populous island.
The tropical cyclone, known locally … [+2931 chars]",,"Taifun Yinxing trifft als heftiger Sturm auf die Philippinen. <p>MANILA &ndash; Der Taifun Yinxing traf am Donnerstag auf den Philippinen und brachte gefährliche Winde und heftige Regenfälle auf Luzon, der bevölkerungsreichsten Insel des Landes.</p>","Typhoon Yinxing hits Philippines as a powerful storm. <p>MANILA &mdash; Typhoon Yinxing made landfall in the Philippines on Thursday, bringing dangerous winds and intense rainfall to Luzon, the nation's most populous island.</p>","Typhon Yinxing Philippines quasi tempestas valida pervenit. <p>MANILA & ecfa; Typhon Yinxing lapsus in Philippinis die Iovis fecit, ventos periculosos et imbres maximos in Luzon, insulae celeberrimae nationis afferens.</p>",2025-12-18 08:42:37+00:00
c07d218d509287f59c228c4435fbd0dc,2024-11-10T09:12:54Z,'typhoon',securityaffairs.com,en,0.7,U.S. agency cautions employees to limit phone use due to Salt Typhoon hack of telco providers,US CFPB warns employees to avoid work-related mobile calls and texts following China-linked Salt Typhoon hack over security concerns. The US government’s Consumer Financial Protection Bureau (CFPB) advises employees to avoid using cellphones for work after Ch…,https://securityaffairs.com/170737/hacking/u-s-agency-limit-phone-use-due-to-salt-typhoon-hack.html,https://securityaffairs.com/wp-content/uploads/2014/07/Chinese-hackers-espionage.jpg,,"U.S. agency cautions employees to limit phone use due to Salt Typhoon hack of telco providers
 | Mazda Connect flaws allow to hack some Mazda vehicles
 | Veeam Backup &amp; Replication exploit reus… [+115357 chars]",,"US-Behörde warnt Mitarbeiter, die Telefonnutzung aufgrund des Salt-Typhoon-Hackangriffs auf Telekommunikationsanbieter einzuschränken. Die US-amerikanische CFPB warnt ihre Mitarbeiter nach dem mit China in Zusammenhang stehenden Salt-Typhoon-Angriff wegen Sicherheitsbedenken davor, arbeitsbedingte Mobiltelefonanrufe und Textnachrichten zu versenden. Das Consumer Financial Protection Bureau (CFPB) der US-Regierung rät Mitarbeitern, die Nutzung von Mobiltelefonen bei der Arbeit nach Ch… zu vermeiden.",U.S. agency cautions employees to limit phone use due to Salt Typhoon hack of telco providers. US CFPB warns employees to avoid work-related mobile calls and texts following China-linked Salt Typhoon hack over security concerns. The US government’s Consumer Financial Protection Bureau (CFPB) advises employees to avoid using cellphones for work after Ch…,US procurationis cautiones conductorum ad circumscribendam phone usum debitum ad Typhoon Salinarum telco provisoribus. US CFPB monet operarios ad vitanda opus mobiles relatas vocat et textus sequentes Sinis-coniunctos Sal Typhonis super curas securitatis trucidant. Consumer Consumer Praesidium Financial US imperii hendrerit (CFPB) operarios monet ne cellphones usui operis post Ch…,2025-12-18 08:42:37+00:00
c0ae96c0f752e7db7695104cd9d104dc,2024-11-14T10:29:00Z,veryUnusualAndNeverUsedKeyword,www.dw.com,en,0.7,Mass evacuations as Typhoon Usagi hits Philippines,A fifth major storm in the space of the month slammed into the Philippines on Thursday. Over 160 people have already been killed and millions displaced. A sixth storm is expected over the weekend. Thousands of people were ordered to evacuate northeastern area…,https://www.dw.com/en/mass-evacuations-as-typhoon-usagi-hits-philippines/a-70775901,https://static.dw.com/image/70776434_6.jpg,http://web.archive.org/web/20241114105637/https://www.dw.com/en/mass-evacuations-as-typhoon-usagi-hits-philippines/a-70775901,"Thousands of people were ordered to evacuate northeastern areas of the Philippines as Typhoon Usagi made landfall on Thursday, marking the fifth major storm to hit the island nation in less than a mo… [+2650 chars]",,"Massenevakuierungen, als Taifun Usagi die Philippinen trifft. Der fünfte große Sturm innerhalb des Monats wütete am Donnerstag über die Philippinen. Über 160 Menschen wurden bereits getötet und Millionen vertrieben. Am Wochenende wird ein sechster Sturm erwartet. Tausende Menschen wurden angewiesen, das nordöstliche Gebiet zu evakuieren …",Mass evacuations as Typhoon Usagi hits Philippines. A fifth major storm in the space of the month slammed into the Philippines on Thursday. Over 160 people have already been killed and millions displaced. A sixth storm is expected over the weekend. Thousands of people were ordered to evacuate northeastern area…,Missae evacuationes sicut Typhoon Usagi Philippines percusserit. Quinta tempestas maior in spatio mensis Iovis in Philippenses impulit. Plus 160 homines iam sunt interfecti et decies centena milia sunt. Sexta tempestas super weekend expectatur. Mille hominum decedere aream septentrionalem iussi sunt ...,2025-12-18 08:42:37+00:00
7f9d02f5f4f9f8cf4b2a362369f5e3d7,2024-11-16T22:00:00Z,veryUnusualAndNeverUsedKeyword,wattsupwiththat.com,en,0.7,"No, Hurricanes Helene and Milton Were Not “Supercharged” by Climate Change","We may live in the 21st century, but when it comes to the weather, the human mind has not evolved past Dark Age superstition.",https://wattsupwiththat.com/2024/11/16/no-hurricanes-helene-and-milton-were-not-supercharged-by-climate-change/,https://i0.wp.com/wattsupwiththat.com/wp-content/uploads/2024/10/hurricane-milton.webp?fit=1200%2C600&ssl=1,http://web.archive.org/web/20241116220056/https://wattsupwiththat.com/2024/11/16/no-hurricanes-helene-and-milton-were-not-supercharged-by-climate-change/,"From Chris Martz Weather
by Chris Martz
We may live in the 21st century, but when it comes to the weather, the human mind has not evolved past Dark Age superstition.
No matter what the weather is … [+37958 chars]",,"Nein, die Hurrikane Helene und Milton wurden durch den Klimawandel nicht „aufgeladen“. Wir leben vielleicht im 21. Jahrhundert, aber wenn es um das Wetter geht, hat sich der menschliche Geist nicht über den Aberglauben des dunklen Zeitalters hinaus entwickelt.","No, Hurricanes Helene and Milton Were Not “Supercharged” by Climate Change. We may live in the 21st century, but when it comes to the weather, the human mind has not evolved past Dark Age superstition.","Imo turbinum Helene et Milton non erant ""supercharge"" a Clima Muta. Vivere possumus saeculo XXI, sed cum tempestas venit, mens humana superstitionem saeculi obscuritatis non evolvit.",2025-12-18 08:42:37+00:00
