index,published,keyword,domain,language,valid,title,description,url,image,archive,content,quote
a7ce62114806c6276afe69dd806ab0c7,2025-11-04T10:03:00Z,'hurricane warning',www.npr.org,en,0.1,When SNAP benefits will arrive is still in flux. Here's what communities are doing to fill the gap,Reporters from the NPR Network are covering the uncertainty and lapse in benefits in states across the country.,https://www.npr.org/2025/11/04/g-s1-96372/snap-benefits-november-government-shutdown,https://npr.brightspotcdn.com/dims3/default/strip/false/crop/5611x3156+0+0/resize/1400/quality/100/format/jpeg/?url=http%3A%2F%2Fnpr-brightspot.s3.amazonaws.com%2F77%2F9a%2F4ac8f4fd4922a1b7c6deb1875775%2F20251101-5.jpg,http://web.archive.org/web/20251104194459/https://www.npr.org/2025/11/04/g-s1-96372/snap-benefits-november-government-shutdown,"The Trump administration says it will restart the national food aid program known as SNAP 
using money from a Department of Agriculture contingency fund but will only pay out half the amount partici… [+39174 chars]",
8523c1425cec17761c409d9a6a9c889d,2025-11-04T16:11:08Z,'typhoon climate change',www.haaretz.com,en,0.1,Wind farms facing existential risk as global warming ramps up,"As the weather grows fiercer, many wind turbines designed for 'normal' winds are already facing extremes beyond their maximum design loads, according to a new study",https://www.haaretz.com/science-and-health/climate-change/2025-11-04/ty-article/wind-farms-facing-existential-risk-as-global-warming-ramps-up/0000019a-4f80-d22e-a39b-6ff8db580000,"https://img.haarets.co.il/bs/0000019a-4f80-d22e-a39b-6ff8db580000/83/65/4835bc4a48d7af86b84f15fe8023/63658612.JPG?precrop=2504,1456,x0,y80&width=1200&height=630&cmsprod",,"The extreme winds generated by climate change-driven monster storms are already pushing against the limits of some wind turbines, it turns out.
The research question is how resilient wind farms are … [+7200 chars]",
a390ca6fbcf650679dfdb5f40e514633,2025-11-04T16:38:00Z,'hurricane sea surface temperature',news.sky.com,en,0.1,This bold new strategy could 'buy time' against global warming - if 'rogue nations' don't go it alone,"Reducing the amount of sunlight reaching the Earth could take the edge off global warming and limit the damage caused by climate change, according to Britain's leading scientific body.",https://news.sky.com/story/reflecting-sunlight-into-space-could-buy-time-against-global-warming-but-experts-warn-of-rogue-nations-risk-13463849,https://e3.365dm.com/25/11/1600x900/skynews-sea-clouds_7071989.jpg?20251104180119,,"Reducing the amount of sunlight reaching the Earth could take the edge off global warming and limit the damage caused by climate change, according to Britain's leading scientific body.
But the Royal… [+3270 chars]",
b3a47737469da5db27af1b34d8d02e98,2025-11-04T16:44:12Z,'hurricane season',deadline.com,en,0.1,WME’s Student Short Film Showcase Futurefest Sets 2025 Lineup,"EXCLUSIVE: WME has unveiled the 2025 lineup for FutureFest, its student short film showcase spotlighting diverse filmmakers, which is in its third year. This year’s showcase will take place at the American Film Institute on Saturday, November 8. Filmmakers se…",http://deadline.com/2025/11/futurefest-2025-lineup-exclusive-1236606612/,https://deadline.com/wp-content/uploads/2025/03/wme-logo-white.jpg?w=1024,,"EXCLUSIVE: WME has unveiled the 2025 lineup for FutureFest, its student short film showcase spotlighting diverse filmmakers, which is in its third year.
This year’s showcase will take place at the A… [+1844 chars]",
22a186784d220bfc6864b452e2c16c9a,2025-11-04T22:06:00Z,'hurricane season',gothamist.com,en,0.1,NYC budget watchdog warns cuts to federal emergency aid will be disastrous,"A USGS worker records a high-water mark outside a flooded home in Woodside, Queens, after the remnants of Hurricane Ida struck New York City in September 2021.
 

A new report released by New York City’s Independent Budget Office found that the city received …",https://gothamist.com/news/nyc-budget-watchdog-warns-cuts-to-federal-emergency-aid-will-be-disastrous,https://api-prod.gothamist.com/images/333646/fill-1200x650|format-webp|webpquality-85/,,A new report that crunched the numbers federal money aiding in New York Citys recovery from disasters over the last decade is raising alarms on what it would mean if Washington doesnt pitch in next t… [+3987 chars],
7e02226b17d8411918ff23c507770465,2025-11-05T02:07:20Z,'typhoon',www.digitaljournal.com,en,0.1,Typhoon death toll climbs to 66 in the Philippines,The death toll from Typhoon Kalmaegi in the Philippines climbed to 66 on Wednesday as residents of hardest-hit Cebu province began picking through homes and businesses devastated by the worst flooding in recent memory. Floodwaters described as unprecedented h…,https://www.digitaljournal.com/world/typhoon-death-toll-climbs-to-66-in-the-philippines/article,https://www.digitaljournal.com/wp-content/uploads/2025/11/eac90e658ca68f3b541c6d7bdc0b047aa9a387fc.jpg,,"Rescuers carry a resident past cars washed away by floods at the height of Typhoon Kalmaegi in the Philippines' Cebu City - Copyright AFP Alan TANGCAWAN
The death toll from Typhoon Kalmaegi in the P… [+3444 chars]",
1f27f281b485ee57bf1ed0672e3633e5,2025-11-05T03:57:41Z,'typhoon climate change',abcnews.go.com,en,0.1,Vietnam rethinks its flood strategy as climate change drives storms and devastation,Vietnam is rethinking how it copes with floods after a year of relentless storms has collapsed hillsides and turned streets into rivers,https://abcnews.go.com/Business/wireStory/vietnam-rethinks-flood-strategy-climate-change-drives-storms-127200731,https://i.abcnewsfe.com/a/ec425acb-3b3d-4a8b-91ef-ebb9483e7894/wirestory_bc9a27d709c17db2d02be30e689f4b98_16x9.jpg?w=1600,,"HANOI, Vietnam -- Vietnam is rethinking how it copes with floods after a year of relentless storms collapsed hillsides and left vast parts of cities under water. 
From mapping high-risk areas to rei… [+5601 chars]",
c7a564f19b32be000b6d936d90b17151,2025-11-05T06:42:28Z,'typhoon',economictimes.indiatimes.com,en,0.1,Typhoon death toll soars past 90 in the Philippines,The death toll from Typhoon Kalmaegi in the Philippines climbed past 90 on Wednesday as the devastating impact on hard-hit Cebu province became clearer after the worst flooding in recent memory. The grim news brought the toll for Cebu to 76.,https://economictimes.indiatimes.com/news/international/world-news/typhoon-death-toll-soars-past-90-in-the-philippines/articleshow/125103334.cms,"https://img.etimg.com/thumb/msid-125103411,width-1200,height-630,imgsize-279084,overlay-economictimes/articleshow.jpg",,The death toll from Typhoon Kalmaegi in the Philippines climbed past 90 on Wednesday as the devastating impact on hard-hit Cebu province became clearer after the worst flooding in recent memory.Flood… [+3354 chars],
93b66e458befaa14ba7e6205c6296537,2025-11-05T21:40:54Z,'typhoon climate change',foreignpolicy.com,en,0.1,Sweeping Democratic Wins Serve as a Referendum on Trump 2.0,State and local election results cast hope for Democratic ambitions in next year’s midterms.,http://foreignpolicy.com/2025/11/05/us-elections-democrats-mamdani-trump-cuomo-government-shutdown/,https://foreignpolicy.com/wp-content/uploads/2025/11/USLocalElections-GettyImages-2244567198.jpg?w=1000,http://web.archive.org/web/20251105224251/https://foreignpolicy.com/2025/11/05/us-elections-democrats-mamdani-trump-cuomo-government-shutdown/,"Welcome back to World Brief, where were looking at the big winners and losers of state and local U.S. elections, the European Unions weakened emissions reduction target, and a devastating typhoon in … [+7993 chars]",
7f2ddfe0dda116068d38d318fb0aefd7,2025-11-06T06:54:01Z,'typhoon',www.thejournal.ie,en,0.1,Typhoon Kalmaegi kills at least 140 in Philippines as storm heads towards Vietnam,Typhoon Kalmaegi is expected to make landfall in Vietnam by later today.,https://www.thejournal.ie/typhoon-philippines-death-toll-vietnam-6866102-Nov2025/,https://img2.thejournal.ie/article/6866102/river/?height=400&version=6866104,,"A MAJOR TYPHOON has killed at least 140 people and left another 127 missing after unleashing devastating flooding across the central Philippines, official figures show, as the storm heads towards Vie… [+4492 chars]",
a594503f9b196df4eb407ad6e22444fe,2025-11-06T07:09:11Z,'hurricane',www.globalsecurity.org,en,0.1,Hurricane Melissa: UN launches $74 million response for 2.2 million in Cuba,"Around 2.2 million Cubans remain in dire need of assistance across the eastern provinces of Granma, Santiago de Cuba, Holguin, and Guantanamo as the after effects of Hurricane Mellisa continue, UN aid workers said on Wednesday.",https://www.globalsecurity.org/wmd/library/news/cuba/cuba-251105-unnews01.htm,,,"5 November 2025 - Around 2.2 million Cubans remain in dire need of assistance across the eastern provinces of Granma, Santiago de Cuba, Holguin, and Guantanamo as the after effects of Hurricane Melli… [+2436 chars]",
755897ddd2c06cc9661c9939f5ebb001,2025-11-06T11:55:13Z,'typhoon climate change',www.nakedcapitalism.com,en,0.1,Links 11/6/2025,"Our tantalizing daily links, including AI bailout groundwork, Senate considers blocking war with Venezuela, Lina Khan joins Mamdani team, and cat belly rubs.",https://www.nakedcapitalism.com/2025/11/links-11-6-2025.html,https://www.nakedcapitalism.com/wp-content/uploads/2025/11/Screenshot-2025-11-05-at-5.12.41 PM-710x1024.png,,"Belly Rubs Gone Dangerously Awry: Why So Many Humans Miss Grumpy Cat Signals StudyFinds
Kentucky woman expecting meds in mail gets box of human hands, fingers instead NBC News
Explosion at Mississi… [+8378 chars]",
e88d526864f6be5fa3dfc71f4b9610c1,2025-11-06T13:00:04Z,'storm surge',gizmodo.com,en,0.1,"When Thunderstorms Hit, Asthma Can Become an ER Nightmare",New research is the latest to find that thunderstorms can worsen your odds of a serious seasonal asthma attack.,https://gizmodo.com/thunderstorms-could-turn-your-asthma-into-a-nightmare-2000682082,https://gizmodo.com/app/uploads/2025/11/thunderstorm-1200x675.jpg,http://web.archive.org/web/20251111105555/https://gizmodo.com/thunderstorms-could-turn-your-asthma-into-a-nightmare-2000682082,"Has your asthma ever acted up during or shortly after stormy weather? Turns out, there’s a perfectly good reason for that. Research out today links thunderstorms to worsening asthma attacks.
Doctors… [+4476 chars]",
86f8dde5782fc51e66495048c0ada0c3,2025-11-06T15:29:57Z,'typhoon',abcnews.go.com,en,0.1,Deadly Typhoon Kalmaegi makes landfall in Vietnam,Philippines President Ferdinand R. Marcos Jr. approved a state of emergency declaration on Thursday as the storm response continued.,https://abcnews.go.com/International/vietnam-braces-typhoon-kalmaegi-after-storms-deadly-path/story?id=127245561,https://i.abcnewsfe.com/a/ed6b8dc1-a76c-478c-a97b-23dc372b41af/vietnam-main_1762419557878_hpMain_16x9.jpg?w=1600,,"Typhoon Kalmaegi made landfall on the central coast of Vietnam on Thursday evening, local weather officials said, after leaving a trail of destruction in the Philippines.
The powerful storm was chur… [+2345 chars]",
b8115146e18482fe442162a827479e3b,2025-11-07T02:13:53Z,'storm surge',abcnews.go.com,en,0.1,Airlines cancel hundreds of flights Friday as shutdown stretches on,Major airlines say they are planning to cancel hundreds of flights on Friday -- out of thousands of daily flights -- as the FAA is set to begin limiting flight capacity.,https://abcnews.go.com/US/airlines-cancel-hundreds-flights-friday-shutdown-stretches/story?id=127278529,https://i.abcnewsfe.com/a/e2fbc16b-6fec-4800-bc7e-83b49a2373df/filghts-shutdown-3_1762479052148_hpMain_16x9.jpg?w=1600,,Major airlines say they are planning to cancel hundreds of flights on Friday -- out of thousands of daily flights -- as the Federal Aviation Administration is set to begin limiting flight capacity at… [+3052 chars],
d3a811715b7f71669e56aa6c31e3e3bd,2025-11-07T04:35:00Z,'hurricane season',www.yahoo.com,en,0.1,Officials issue warnings as powerful storm is set to make landfall: 'Not encountering anything to weaken it',Forecasters expect the storm’s maximum sustained winds to increase to near 132 mph.,https://www.yahoo.com/news/articles/officials-issue-warnings-powerful-storm-043500807.html,https://s.yimg.com/ny/api/res/1.2/UskBnLuVTbVY2mTA_QqfgA--/YXBwaWQ9aGlnaGxhbmRlcjt3PTEyMDA7aD03OTk7Y2Y9d2VicA--/https://media.zenfs.com/en/the_cool_down_737/dfa716797f262efddbde028d8b99aafb,,Another tropical cyclone has the potential to become a super typhoon before striking the northern Philippines by the end of this weekend. This comes just after the central area of the country was sla… [+2835 chars],
4a188060f927cb091ce3cd66db8c6105,2025-11-07T22:44:20Z,'hurricane alert',www.ibtimes.com,en,0.1,AI Layoffs: US Market's Worst in 20 Years – Could the UK Be Next?,"US tech layoffs hit a 20-year high, raising fears of a bubble bursting that could impact the UK economy. Experts warn of potential spillovers and market risks.",https://www.ibtimes.com/ai-layoffs-us-markets-worst-20-years-could-uk-next-3789953,https://d.ibtimes.com/en/full/4633212/bank-england.jpg,,"Bank of England Governor Andrew Bailey has issued a stark warning that a speculative 'AI bubble' could be forming. This concern is rooted in the US, where the worst tech layoffs in two decades are se… [+3427 chars]",
61f0a2e814402cf55ca12f5858d06ae8,2025-11-09T07:44:21Z,'storm surge',www.aljazeera.com,en,0.1,Nearly 1 million Filipinos evacuate as Super Typhoon Fung-wong approaches,Philippines weather bureau warns of 'life-threatening conditions' as super storm heads for its largest island.,https://www.aljazeera.com/news/2025/11/9/nearly-1-million-filipinos-evacuate-as-super-typhoon-fung-wong-approaches,https://www.aljazeera.com/wp-content/uploads/2025/11/2025-11-07T235956Z_1273815168_RC2ZRHAN0BNK_RTRMADP_3_ASIA-WEATHER-1762666232.jpg?resize=1920%2C1149,,"Nearly a million people have evacuated their homes in the Philippines as the country braced for another powerful storm, days after a typhoon killed more than 200 people.
The storm, named Fung-wong, … [+4225 chars]",
7676987b996e75f7529ffbd15cc854d6,2025-11-10T10:00:00Z,'storm surge',www.npr.org,en,0.1,Alaska's public schools can serve as emergency shelters. The buildings are in crisis,"Alaska's public schools are being used as emergency shelters, though many of the buildings are crumbling.",https://www.npr.org/2025/11/10/g-s1-96847/alaska-schools-emergency-shelter-disaster,https://npr.brightspotcdn.com/dims3/default/strip/false/crop/1600x900+0+83/resize/1400/quality/100/format/jpeg/?url=http%3A%2F%2Fnpr-brightspot.s3.amazonaws.com%2F32%2Fe2%2Fcc4f23834da1b61f34be70b07358%2F20251019-stone-ak-crumbling-schools-sequence-1-preview.jpeg,http://web.archive.org/web/20251110141750/https://www.npr.org/2025/11/10/g-s1-96847/alaska-schools-emergency-shelter-disaster,"On a Sunday morning last month, James Taq'ac Amik was huddled on a small bridge with his girlfriend. At 4 a.m., they had scrambled into an 18-foot aluminum motor boat, fleeing floodwaters from a mass… [+10338 chars]",
86e53668c7fcd5bc4ecac9bd46db0eca,2025-11-10T10:00:00Z,'hurricane sea surface temperature',wattsupwiththat.com,en,0.1,Weekly Climate and Energy News Roundup #665,"“Without Freedom of Thought there can be no such Thing as Wisdom; and no such Thing as Public Liberty, without Freedom of Speech” — Benjamin Franklin (1722)",https://wattsupwiththat.com/2025/11/10/weekly-climate-and-energy-news-roundup-665/,https://i0.wp.com/wattsupwiththat.com/wp-content/uploads/2025/11/charlesrotter_a_photo_of_arches_national_park_at_sunset_in_the__1b54f36midjourney.webp?fit=1024%2C512&quality=75&ssl=1,,"Quote of the Week: Without Freedom of Thought there can be no such Thing as Wisdom; and no such Thing as Public Liberty, without Freedom of Speech 
 Benjamin Franklin (1722)
Number of the Week: $1.… [+70510 chars]",
c1d6733421ee0b91ccb3337c72b16550,2025-11-10T11:00:00Z,'hurricane evacuation',www.theatlantic.com,en,0.1,What Climate Change Will Do to America by Mid-Century,Many places may become uninhabitable. Many people may be on their own.,https://www.theatlantic.com/magazine/2025/12/trump-climate-change-acceleration/684632/,https://cdn.theatlantic.com/thumbor/yt4e9yqEb7aNRftQlyCxqUOaPkk=/210x1089:4269x3203/1200x625/media/img/2025/10/20250109NAT_LA_WINDSTORM0269/original.jpg,http://web.archive.org/web/20251110193752/https://www.theatlantic.com/magazine/2025/12/trump-climate-change-acceleration/684632/,"Earlier this year, in the foothills of the San Gabriel Mountains, a graveyard was spared by the fire that sent thousands of Los Angeles residents fleeing into the coal-black night. Here, in Mountain … [+43687 chars]",
402e3cbc2c3f9df3e43d6d7ebeeb85fc,2025-11-10T11:02:28Z,'typhoon',www.insurancejournal.com,en,0.1,Typhoon Set to Swing Toward Taiwan After Ripping Philippines,"Typhoon Fung-Wong is forecast to swing toward Taiwan after the powerful storm struck the Philippines’ northeast late on Sunday, causing widespread flooding and the suspension of government operations. The cyclone — known locally as Uwan — has now moved over …",https://www.insurancejournal.com/news/international/2025/11/10/847008.htm,https://www.insurancejournal.com/app/uploads/2025/11/damage-from-typhoon-fung-wong-in-manila-getty-scaled.jpg,,"Typhoon Fung-Wong is forecast to swing toward Taiwan after the powerful storm struck the Philippines’ northeast late on Sunday, causing widespread flooding and the suspension of government operations… [+3031 chars]",
038c28f55c317f7428fd137d8338eb7c,2025-11-10T11:11:38Z,'storm surge',biztoc.com,en,0.1,One photo that captures tenderness amid chaos in the Philippines as Typhoon Fung-wong hits,,https://biztoc.com/x/413e8a12375cd379,https://biztoc.com/cdn/950/og.png,,"{ window.open(this.href, '_blank'); }, 200); return false;""&gt;Why is the US government shutdown nearing an end? { window.open(this.href, '_blank'); }, 200); return false;""&gt;How will ending the shu… [+774 chars]",
3aefa58d619e4d1e6af627dc5ea29b07,2025-11-10T11:26:08Z,'storm surge',www.ibtimes.com,en,0.1,Will Typhoon Uwan Be as Deadly as Typhoon Haiyan? Fears Grow as 'Fung-wong' Batters the Philippines,"As Super Typhoon Uwan (Fung-wong) lashes the Philippines with life-threatening winds and torrential rains, comparisons to 2013's deadly Typhoon Haiyan raise growing fears across the nation.",https://www.ibtimes.com/will-typhoon-uwan-deadly-typhoon-haiyan-fears-grow-fung-wong-batters-philippines-3790003,https://d.ibtimes.com/en/full/4633639/typhoon-uwan.jpg,,"For many Filipinos, the wind outside is not the only thing howling. It is also the echo of memory, of roofs ripped off, of waves swallowing entire villages, of names read from endless casualty lists.… [+3525 chars]",
46e4a2e19a66cd9b97f6cd9393ac38b1,2025-11-10T12:34:09Z,'storm surge',financialpost.com,en,0.1,Investors may be shocked at Canada’s debt. Will this scare them off our bonds?,Martin Pelletier: Without prudent fiscal leadership we may not have what it takes to survive another debt crisis. Find out more.,https://financialpost.com/investing/investors-shocked-canada-debt-scare-bonds,https://smartcdn.gprod.postmedia.digital/financialpost/wp-content/uploads/2025/11/1111-bc-stocks.jpg,,"Ignoring provincial debt in global comparisons is akin to evaluating Frances fiscal health without accounting for its regional governments, or assessing Japans without its prefectures. But in Canadas… [+3748 chars]",
83df7448b62464fe33e2fd86f5705327,2025-11-10T16:28:56Z,'storm surge',www.insurancejournal.com,en,0.1,Crews Are Working to Fix Alaska Native Villages Devastated by Floods. But Will Residents Return?,"Darrel John watched the final evacuees depart his village on the western coast of Alaska in helicopters and small planes and walked home, avoiding the debris piled on the boardwalks over the swampy land. He is one of seven residents …",https://www.insurancejournal.com/news/west/2025/11/10/847059.htm,https://www.insurancejournal.com/img/social/opengraph/ij-social-flood-1200x630.png,,"Darrel John watched the final evacuees depart his village on the western coast of Alaska in helicopters and small planes and walked home, avoiding the debris piled on the boardwalks over the swampy l… [+7603 chars]",
a766b172e2835e0e835bcfc9fc02e911,2025-11-10T17:46:08Z,'storm surge',www.staradvertiser.com,en,0.1,Trump orders air traffic controllers back as flight cancellations surge | Honolulu Star-Advertiser,WASHINGTON >> President Donald Trump demanded air traffic controllers return to work today as government-directed flight cuts and air traffic staffing absences continue to wreak havoc with U.S. air travel.,https://www.staradvertiser.com/2025/11/10/breaking-news/trump-orders-air-traffic-controllers-back-as-flight-cancellations-surge/,https://www.staradvertiser.com/wp-content/uploads/2025/11/web1_2025-11-10T134139Z_1833095382_RC29THAXSRDK_RTRMADP_3_USA-SHUTDOWN-AVIATION.JPG,http://web.archive.org/web/20251110180305/https://www.staradvertiser.com/2025/11/10/breaking-news/trump-orders-air-traffic-controllers-back-as-flight-cancellations-surge/,WASHINGTON &gt;&gt; President Donald Trump demanded air traffic controllers return to work today as government-directed flight cuts and air traffic staffing absences continue to wreak havoc with U.S.… [+3359 chars],
6f1dd97be5bf6489d7ccc42be2d7ae28,2025-11-10T18:33:27Z,'hurricane warning',www.mlive.com,en,0.1,The Edmund Fitzgerald’s doomed journey began 50 years ago today,This heartbreaking story of loss amid the gales of November is forever part of our Great Lakes history.,https://www.mlive.com/life/2025/11/the-edmund-fitzgeralds-doomed-journey-began-50-years-ago-today.html,https://s.yimg.com/ny/api/res/1.2/swWh2N1kHKygFMXp17er0A--/YXBwaWQ9aGlnaGxhbmRlcjt3PTEyMDA7aD04MDA7Y2Y9d2VicA--/https://media.zenfs.com/en/mlive_com_articles_368/d08b259a33915b2eb51c203a6f6180ec,,"LAKE SUPERIOR, MI - It was 50 years ago today that the Edmund Fitzgerald was being loaded with 26,000 tons of iron ore, prepped for what would become her tragic final voyage.
Once the largest ship o… [+6363 chars]",
54e0d2f6353cdc1c737823721d6f6962,2025-11-10T20:31:39Z,'hurricane sea surface temperature',dailycaller.com,en,0.1,The Sinking Of The Edmund Fitzgerald,Sailors who once scoffed at forecasts now plan around them.,https://dailycaller.com/2025/11/10/sinking-edmund-fitzgerald-great-lakes-freighter-gordon-lightfoot/,"https://images.dailycaller.com/image/width=1280,height=549,fit=cover,format=webp,f=auto/https://cdn01.dailycaller.com/wp-content/uploads/2025/11/Edmund_Fitzgerald_1971_3_of_4_restored_cropped-scaled-e1762805840734.jpg",,"Fifty years ago today, the SS Edmund Fitzgerald sank. For any child of the Great Lakes growing up in the 1990s, as I did, the event is infamous; not only because Gordon Lightfoot’s song was constantl… [+8390 chars]",
1291319c571c98054904ee27ecf6831e,2025-11-10T21:32:15Z,'storm surge',japantoday.com,en,0.1,Pakistan says troops killed 20 militants in a region bordering Afghanistan,"Pakistani security forces killed 20 Pakistani Taliban insurgents in raids on hideouts in the northwest region bordering Afghanistan, the military said Monday, as tensions between the two countries escalated. Separately, militants including a suicide bomber tr…",https://japantoday.com/category/world/pakistan-says-troops-killed-20-militants-in-a-region-bordering-afghanistan,,http://web.archive.org/web/20251111075327/https://japantoday.com/category/world/pakistan-says-troops-killed-20-militants-in-a-region-bordering-afghanistan,"Pakistani security forces killed 20 Pakistani Taliban insurgents in raids on hideouts in the northwest region bordering Afghanistan, the military said Monday, as tensions between the two countries es… [+3670 chars]",
dfc951d8f9f6a8d74f6a6fd389071c37,2025-11-11T03:34:22Z,'storm surge',www.nbcnews.com,en,0.1,Families of girls and counselors who died in Texas floods allege negligence by Camp Mystic,"The families of six children and two counselors killed in a flooding disaster that struck a Texas summer camp for girls in July filed two separate lawsuits Monday against the camp’s owners and others, alleging negligence",https://www.nbcnews.com/news/us-news/families-girls-counselors-died-texas-floods-camp-mystic-negligent-rcna243134,"https://media-cldnry.s-nbcnews.com/image/upload/t_nbcnews-fp-1200-630,f_auto,q_auto:best/rockcms/2025-07/250707-camp-mystic-vl-1214p-9abe2d.jpg",,"The families of six children and two counselors killed in a flooding disaster that struck a Texas summer camp for girls in July filed two separatelawsuits Monday against the camps owners and others, … [+4544 chars]",
89d52c572c0b4e8ccf172c028a03336e,2025-11-11T06:22:07Z,'storm surge',kyweathercenter.com,en,0.1,A Warning Shot from Old Man Winter,"Good Tuesday, everyone. Let’s start things out by giving a big thank you to all our Veterans out there! You are very much appreciated! I wish I could give our vets some better weather because it’s still pretty nasty out there. Wicked wind chills start the day…",https://kyweathercenter.com/?p=73571,,,"Good Tuesday, everyone. Let’s start things out by giving a big thank you to all our Veterans out there! You are very much appreciated! I wish I could give our vets some better weather because it’s st… [+2538 chars]",
