index,published,keyword,domain,language,valid,title,description,url,image,archive,content,quote,de,en,la,added
a24fdb8713587465048e03ae842231e4,2023-09-20T15:15:00Z,'tropical depression',www.sun-sentinel.com,en,0.7,Tropical depression may form from system off Africa; Nigel forecast to weaken,"Hurricane Nigel has “likely reached its peak intensity,” National Hurricane Center forecasters said Wednesday, as attention turns to a system off Africa that...",https://www.sun-sentinel.com/2023/09/20/hurricane-nigel-poised-to-rapidly-intensify-into-major-category-3-storm-by-tuesday/,https://s.yimg.com/ny/api/res/1.2/.TzDYchPlUE2EH6tZUET7A--/YXBwaWQ9aGlnaGxhbmRlcjt3PTEyMDA7aD02NTg-/https://media.zenfs.com/en/south_florida_sun_sentinel_national_820/e01a5c02c68d33ad360db935aee7ec7f,http://web.archive.org/web/20230920111511/https://www.sun-sentinel.com/2023/09/20/hurricane-nigel-poised-to-rapidly-intensify-into-major-category-3-storm-by-tuesday/,"Hurricane Nigel has likely reached its peak intensity, National Hurricane Center forecasters said Wednesday, as attention turns to a system off Africa that is likely to become a tropical depression l… [+3871 chars]",,"Tropische Depressionen können sich in einem System vor Afrika bilden; Nigel prognostizierte eine Abschwächung. Hurrikan Nigel hat „wahrscheinlich seinen Höhepunkt erreicht“, sagten Prognostiker des National Hurricane Center am Mittwoch, als sich die Aufmerksamkeit auf ein System vor Afrika richtete, das...","Tropical depression may form from system off Africa; Nigel forecast to weaken. Hurricane Nigel has “likely reached its peak intensity,” National Hurricane Center forecasters said Wednesday, as attention turns to a system off Africa that...","Tropical depression may form from system off Africa; Nigellus prospicere infirmare. Procellae Nigel ""verisimile suum apicem intensionem attigit"", forecasters National Hurricane Center said Wednesday, as attention turns to a system off Africa that...",2025-12-18 15:40:26+00:00
bcf8d6bc0a00fa7674a0bb0cabfd4da7,2023-09-21T04:01:21Z,veryUnusualAndNeverUsedKeyword,www.huffpost.com,en,0.7,DeSantis Says Humanity ‘Safer Than Ever’ From Climate Change… Weeks After Major Hurricane,"Warnings about a future of climate-related disasters, the GOP governor and presidential candidate said, were merely “fear tactics.”",https://www.huffpost.com/entry/ron-desantis-climate-change-safer_n_650bb87ae4b0e190a3a7e445,https://img.huffingtonpost.com/asset/650bba7422000032005f75cd.jpeg?cache=ZSm7KZNyGy&ops=1200_630,http://web.archive.org/web/20230921191238/https://www.huffpost.com/entry/ron-desantis-climate-change-safer_n_650bb87ae4b0e190a3a7e445,"Florida Gov. Ron DeSantis (R) said humans are safer than ever from the threat of climate change, and he blasted the Biden administrations effort to address the phenomenon as he unveiled an oil- and g… [+3054 chars]",,"DeSantis sagt, die Menschheit sei „sicherer als je zuvor“ vor dem Klimawandel … Wochen nach dem schweren Hurrikan. Warnungen vor einer Zukunft klimabedingter Katastrophen, sagte der GOP-Gouverneur und Präsidentschaftskandidat, seien lediglich „Angsttaktiken“.","DeSantis Says Humanity ‘Safer Than Ever’ From Climate Change… Weeks After Major Hurricane. Warnings about a future of climate-related disasters, the GOP governor and presidential candidate said, were merely “fear tactics.”","DeSantis dicit Humanitas 'tutior quam umquam a Clima mutatione. Monitiones de futuris calamitatibus climatis relatis, GOP praefectus et candidatus praesidentialis dixerunt mere ""molestiam timere"".",2025-12-18 15:40:26+00:00
6416a6eb63bfd15e0b5e8100b7a05070,2023-09-21T05:00:00Z,'hurricane',www.americanthinker.com,en,0.7,"Hurricane devastates Libya, and who's to blame? Why, the Jews!","What if the U.N. held a Climate Ambition Summit (sic!), and no one — well, okay, just a few — came?  Being the U.N., it would carry on anyway because",https://www.americanthinker.com/blog/2023/09/hurricane_devastates_libya_and_whos_to_blame_why_the_jews.html,https://www.americanthinker.com/images/bucket/2023-08/248449.jpg,,"What if the U.N. held a Climate Ambition Summit (sic!), and no one — well, okay, just a few — came?  Being the U.N., it would carry on anyway because ""humanity has opened the gates to hell,"" U.N. sec… [+3163 chars]",,"Hurrikan verwüstet Libyen – und wer ist schuld? Warum, die Juden!. Was wäre, wenn die Vereinten Nationen einen Climate Ambition Summit (sic!) abhalten würden und niemand – na ja, nur ein paar – käme?  Da es sich um die Vereinten Nationen handelt, würde es sowieso weitermachen, weil","Hurricane devastates Libya, and who's to blame? Why, the Jews!. What if the U.N. held a Climate Ambition Summit (sic!), and no one — well, okay, just a few — came?  Being the U.N., it would carry on anyway because","Procellae vastat Libyam, et quis culpet? Quid, Judaei. Quid si U.N. Clima Ambitionis culmen (sic!) tenuit, et nemo — bene, pauci — venerunt?  Esse U.N., esset usquam quod",2025-12-18 15:40:26+00:00
78837c674fa822abe9eee63a9244f29b,2023-09-21T08:42:20Z,veryUnusualAndNeverUsedKeyword,www.nhc.noaa.gov,en,0.7,Hurricane Nigel Graphics,"5-Day Uncertainty Track last updated Thu, 21 Sep 2023 08:42:20 GMT

 
Wind Speed Probabilities last updated Thu, 21 Sep 2023 08:42:20 GMT",https://www.nhc.noaa.gov/refresh/graphics_at5+shtml/084220.shtml?cone,,,"Coastal Watches/Warnings and Forecast Cone for Storm Center
* If the storm is forecast to dissipate within 3 days, the ""Full Forecast"" and ""3 day"" graphic will be identical
Click Here for a 5-day C… [+2926 chars]",,"Hurrikan Nigel Grafiken. 5-Tage-Unsicherheits-Track zuletzt aktualisiert am Do, 21. September 2023 08:42:20 GMT

 
Die Windgeschwindigkeitswahrscheinlichkeiten wurden zuletzt am Do, 21. September 2023 um 08:42:20 GMT aktualisiert","Hurricane Nigel Graphics. 5-Day Uncertainty Track last updated Thu, 21 Sep 2023 08:42:20 GMT

 
Wind Speed Probabilities last updated Thu, 21 Sep 2023 08:42:20 GMT","Procellae Nigelli Graphics. 5-Dies Incertae semita renovationis Sat, 21 Sep 2023 08:42:20 GMT

 
Ventus Speed Probabilitates renovatio Thu, 21 Sep 2023 08:42:20 GMT",2025-12-18 15:40:26+00:00
c7476739d9d48483e5e0a1e6cc1a37f1,2023-09-21T11:07:44Z,veryUnusualAndNeverUsedKeyword,www.miamiherald.com,en,0.7,"A disturbance near Florida could get serious, and Hurricane Nigel is quickly on the move",The latest on the weather systems in the Atlantic Ocean.,https://www.miamiherald.com/news/weather/hurricane/article279590739.html,https://media.zenfs.com/en/miami_herald_mcclatchy_975/0d9f08d3bc5c44b59811cadddfd3fbc0,,"Hurricane Nigel still brings the strongest winds in the Atlantic Ocean, but the two other systems have more potential for affecting United States and Caribbean life over the next week.
Heres the lat… [+2199 chars]",,"In der Nähe von Florida könnte es zu schweren Unruhen kommen, und Hurrikan Nigel ist schnell auf dem Vormarsch. Das Neueste über die Wettersysteme im Atlantischen Ozean.","A disturbance near Florida could get serious, and Hurricane Nigel is quickly on the move. The latest on the weather systems in the Atlantic Ocean.","Tumultus prope Floridam gravem fieri potuit, et Hurricane Nigel celeriter in motu est. Aliquam in systematibus tempestatum in Oceano Atlantico.",2025-12-18 15:40:26+00:00
98fcb0c24dedbfaeeddbea785a8bca75,2023-09-21T17:26:09Z,'hurricane',finance.yahoo.com,en,0.7,"Florida agriculture losses between $78M and $371M from Hurricane Idalia, preliminary estimate says","Florida agriculture losses from Hurricane Idalia are estimated at between $78 million and $371 million, with producers also suffering widespread damage to...",https://finance.yahoo.com/news/florida-agriculture-losses-between-78m-172609805.html,https://s.yimg.com/ny/api/res/1.2/haZPyxxZwN9BmMRsktV_pg--/YXBwaWQ9aGlnaGxhbmRlcjt3PTEyMDA7aD04MDA-/https://media.zenfs.com/en/ap_finance_articles_694/31abe0a178894c8ebd97efdd52d7c571,http://web.archive.org/web/20230921173249/https://finance.yahoo.com/news/florida-agriculture-losses-between-78m-172609805.html,"ST. PETERSBURG, Fla. (AP) Florida agriculture losses from Hurricane Idalia are estimated at between $78 million and $371 million, with producers also suffering widespread damage to such infrastructur… [+3176 chars]",,"Laut vorläufiger Schätzung verursacht der Hurrikan Idalia in der Landwirtschaft Floridas Verluste zwischen 78 und 371 Millionen US-Dollar. Die Verluste der Landwirtschaft in Florida durch Hurrikan Idalia werden auf 78 bis 371 Millionen US-Dollar geschätzt, wobei die Erzeuger auch weitreichende Schäden erleiden...","Florida agriculture losses between $78M and $371M from Hurricane Idalia, preliminary estimate says. Florida agriculture losses from Hurricane Idalia are estimated at between $78 million and $371 million, with producers also suffering widespread damage to...","Florida agri culturae damna inter $78M et $371M ex Idalia Turbo, aestimatio praevia dicit. Damna agri culturae Floridae ab Idalia Hurricane inter $78 miliones et $371 decies centena milia aestimantur, cum effectrix etiam damnum latissime sustinens.",2025-12-18 15:40:26+00:00
6f9e9a8afc72d3fab2d1974abcfdfa23,2023-09-21T17:42:07Z,veryUnusualAndNeverUsedKeyword,biztoc.com,en,0.7,"Florida agriculture losses between $78M and $371M from Hurricane Idalia, preliminary estimate says","ST. PETERSBURG, Fla. (AP) — Florida agriculture losses from Hurricane Idalia are estimated at between $78 million and $371 million, with producers also suffering widespread damage to such infrastructure as irrigation rigs and fences, according to a preliminar…",https://biztoc.com/x/a186bc7bd00c7dfc,https://c.biztoc.com/p/a186bc7bd00c7dfc/s.webp,,"ST. PETERSBURG, Fla. (AP) Florida agriculture losses from Hurricane Idalia are estimated at between $78 million and $371 million, with producers also suffering widespread damage to such infrastructur… [+307 chars]",,"Laut vorläufiger Schätzung verursacht der Hurrikan Idalia in der Landwirtschaft Floridas Verluste zwischen 78 und 371 Millionen US-Dollar. ST. PETERSBURG, Florida (AP) – Die Verluste der Landwirtschaft in Florida durch Hurrikan Idalia werden auf 78 bis 371 Millionen US-Dollar geschätzt, wobei die Erzeuger laut einer vorläufigen Studie auch weitreichende Schäden an Infrastrukturen wie Bewässerungsanlagen und Zäunen erleiden …","Florida agriculture losses between $78M and $371M from Hurricane Idalia, preliminary estimate says. ST. PETERSBURG, Fla. (AP) — Florida agriculture losses from Hurricane Idalia are estimated at between $78 million and $371 million, with producers also suffering widespread damage to such infrastructure as irrigation rigs and fences, according to a preliminar…","Florida agri culturae damna inter $78M et $371M ex Idalia Turbo, aestimatio praevia dicit. ST. PETERSBURG, Fla (AP) — Damna agriculturae Floridae ab Idalia Hurricane inter $78 miliones et $371 decies centena millia aestimantur, cum effectoribus etiam latissime damnum tam infrastructurae passis quam aggeribus et sepibus irrigationes, secundum praeliminarium…",2025-12-18 15:40:26+00:00
4870ede9c00497b4a238fafde6d76be0,2023-09-21T17:42:39Z,veryUnusualAndNeverUsedKeyword,abcnews.go.com,en,0.7,"Florida agriculture losses between $78M and $371M from Hurricane Idalia, preliminary estimate says","Florida agriculture losses from Hurricane Idalia are estimated at between $78 million and $371 million, with producers also suffering widespread damage to such infrastructure as irrigation rigs and fences",https://abcnews.go.com/Business/wireStory/florida-agriculture-losses-78m-371m-hurricane-idalia-preliminary-103384672,https://i.abcnewsfe.com/a/cc52c95f-fa07-4b91-85f1-131190d2d7b7/wirestory_c63b7d3b3e1f6deb6022be5068d3a5e7_16x9.jpg?w=992,http://web.archive.org/web/20230922041210/https://abcnews.go.com/Business/wireStory/florida-agriculture-losses-78m-371m-hurricane-idalia-preliminary-103384672,"ST. PETERSBURG, Fla. -- Florida agriculture losses from Hurricane Idalia are estimated at between $78 million and $371 million, with producers also suffering widespread damage to such infrastructure … [+3175 chars]",,"Laut vorläufiger Schätzung verursacht der Hurrikan Idalia in der Landwirtschaft Floridas Verluste zwischen 78 und 371 Millionen US-Dollar. Die Verluste der Landwirtschaft in Florida durch Hurrikan Idalia werden auf 78 bis 371 Millionen US-Dollar geschätzt, wobei die Erzeuger auch weitreichende Schäden an Infrastrukturen wie Bewässerungsanlagen und Zäunen erleiden","Florida agriculture losses between $78M and $371M from Hurricane Idalia, preliminary estimate says. Florida agriculture losses from Hurricane Idalia are estimated at between $78 million and $371 million, with producers also suffering widespread damage to such infrastructure as irrigation rigs and fences","Florida agri culturae damna inter $78M et $371M ex Idalia Turbo, aestimatio praevia dicit. Damna agri culturae Floridae ex Turbo Idalia aestimantur inter $78 miliones et $371 decies centena millia, cum effectoribus etiam latissime detrimentum patientibus tam infrastructuris quam rigandis aggeribus et sepibus",2025-12-18 15:40:26+00:00
43c023663b9185775433cb7584dc1560,2023-09-22T02:44:06Z,'hurricane',www.nhc.noaa.gov,en,0.7,Hurricane Nigel Graphics,"5-Day Uncertainty Track last updated Fri, 22 Sep 2023 02:44:06 GMT

 
Wind Speed Probabilities last updated Fri, 22 Sep 2023 02:44:06 GMT",https://www.nhc.noaa.gov/refresh/graphics_at5+shtml/024406.shtml?cone,,,"Coastal Watches/Warnings and Forecast Cone for Storm Center
* If the storm is forecast to dissipate within 3 days, the ""Full Forecast"" and ""3 day"" graphic will be identical
Click Here for a 5-day C… [+2926 chars]",,"Hurrikan Nigel Grafiken. 5-Tage-Unsicherheits-Track zuletzt aktualisiert am Fr, 22. Sep 2023 02:44:06 GMT

 
Die Windgeschwindigkeitswahrscheinlichkeiten wurden zuletzt am Freitag, den 22. September 2023 um 02:44:06 Uhr GMT aktualisiert","Hurricane Nigel Graphics. 5-Day Uncertainty Track last updated Fri, 22 Sep 2023 02:44:06 GMT

 
Wind Speed Probabilities last updated Fri, 22 Sep 2023 02:44:06 GMT","Procellae Nigelli Graphics. 5-Dies Incertus Track renovatio Sat, 22 Sep 2023 02:44:06 GMT

 
Ventus Speed Probabilitates renovatio Fri, 22 Sep 2023 02:44:06 GMT",2025-12-18 15:40:26+00:00
4b76f4d4379a477c7571863dff9bc023,2023-09-22T04:18:11Z,'hurricane warning',www.bostonglobe.com,en,0.7,Tropical storm warning issued for US East Coast with landfall expected in North Carolina on Friday,The National Hurricane Center says a storm churning in waters off the eastern US has increased to tropical storm strength and is forecast to reach the North Carolina coast.,https://www.bostonglobe.com/2023/09/22/nation/tropical-storm-warning-issued-us-east-coast-with-landfall-expected-north-carolina-friday/,https://bostonglobe-prod.cdn.arcpublishing.com/resizer/BpDJ5vHodz23M17-hawIFnszKX8=/506x0/cloudfront-us-east-1.images.arcpublishing.com/bostonglobe/GHJO7VZCNYMFRO3X3PFCYV4BWI.jpg,http://web.archive.org/web/20231016220709/https://www.bostonglobe.com/2023/09/22/nation/tropical-storm-warning-issued-us-east-coast-with-landfall-expected-north-carolina-friday/,"As of Thursday night, the storm was located about 355 miles (570 kilometers) southeast of Charleston, South Carolina, and about 395 miles (635 kilometers) south Cape Hatteras, North Carolina, and mov… [+2823 chars]",,"Für die US-Ostküste wurde eine Tropensturmwarnung ausgegeben, deren Landung am Freitag in North Carolina erwartet wird. Nach Angaben des National Hurricane Center hat ein Sturm in den Gewässern vor dem Osten der USA die Stärke eines tropischen Sturms erreicht und wird voraussichtlich die Küste von North Carolina erreichen.",Tropical storm warning issued for US East Coast with landfall expected in North Carolina on Friday. The National Hurricane Center says a storm churning in waters off the eastern US has increased to tropical storm strength and is forecast to reach the North Carolina coast.,Tropical tempestas admonitionis US Orientalis Coast cum landum expectatur in Carolina Septentrionali die Veneris. Procellae Nationalis Hurricane Centrum dicit tempestas in aquis ab oriente US aucta ad robur tropicae tempestatis et praenuntiat ut ad oram Carolinam Septentrionalem perveniat.,2025-12-18 15:40:26+00:00
0b84e96f399b3d65c89531edd1efaa40,2023-09-22T04:45:00Z,'tropical cyclone',apnews.com,en,0.7,Tropical storm warning issued for US East Coast with landfall expected in North Carolina on Friday,"The National Hurricane Center says a storm churning in waters off the eastern U.S. has increased to tropical storm strength and is forecast to reach the North Carolina coast. The center reports the storm, currently designated Potential Tropical Cyclone Sixtee…",https://apnews.com/article/tropical-storm-carolina-delaware-nigel-atlantic-d977a22f70a6f96ce136a710988d9f60,https://bloximages.newyork1.vip.townnews.com/richmond.com/content/tncms/assets/v3/editorial/f/a7/fa78f2d0-8685-550e-acb5-1d4d5b050fd7/650d6e9674ade.image.jpg?crop=1459%2C766%2C0%2C326&resize=1200%2C630&order=crop%2Cresize,http://web.archive.org/web/20230922123755/https://apnews.com/article/tropical-storm-carolina-delaware-nigel-atlantic-d977a22f70a6f96ce136a710988d9f60,"MIAMI (AP) A storm churning in waters off the eastern U.S. has increased to tropical storm strength and is forecast to reach the North Carolina coast Friday morning, the National Hurricane Center sai… [+4759 chars]",,"Für die US-Ostküste wurde eine Tropensturmwarnung ausgegeben, deren Landung am Freitag in North Carolina erwartet wird. Nach Angaben des National Hurricane Center hat ein Sturm in den Gewässern vor dem Osten der USA die Stärke eines tropischen Sturms erreicht und wird voraussichtlich die Küste von North Carolina erreichen. Das Zentrum meldet den Sturm, der derzeit als potenzieller tropischer Wirbelsturm Sixte bezeichnet wird…","Tropical storm warning issued for US East Coast with landfall expected in North Carolina on Friday. The National Hurricane Center says a storm churning in waters off the eastern U.S. has increased to tropical storm strength and is forecast to reach the North Carolina coast. The center reports the storm, currently designated Potential Tropical Cyclone Sixtee…","Tropical tempestas admonitionis US Orientem Coast cum land ruinae in Carolina Septentrionali die Veneris expectata edita est. In National Hurricane Centrum dicit procellam turbantem in aquis ab US Orientalibus US auctum ad vires tropicae tempestatis et praenuntiat ut ad oram Carolinae Septentrionalis perveniat. Media tempestas refert, nunc Potentia tropica Cyclone Sixtee designata.",2025-12-18 15:40:26+00:00
48b2939b6c794c3827c53df3d6681ebc,2023-09-22T07:30:41Z,'hurricane',www.voanews.com,en,0.7,Tropical Storm Warning Issued for US East Coast,"A storm churning in waters off the eastern U.S. has increased to tropical storm strength and is forecast to reach the North Carolina coast Friday morning, the National Hurricane Center said.


The storm was off the coast of South Carolina and North Carolina l…",https://www.voanews.com/a/tropical-storm-warning-issued-for-us-east-coast-/7279377.html,https://gdb.voanews.com/01000000-0a00-0242-307b-08dbbb3d9e42_cx0_cy26_cw0_w1200_r1.jpg,http://web.archive.org/web/20230922131445/https://www.voanews.com/a/tropical-storm-warning-issued-for-us-east-coast-/7279377.html,"MIAMI  A storm churning in waters off the eastern U.S. has increased to tropical storm strength and is forecast to reach the North Carolina coast Friday morning, the National Hurricane Center said.
… [+2841 chars]",,"Tropensturmwarnung für die Ostküste der USA herausgegeben. Ein Sturm, der in den Gewässern vor dem Osten der USA wütet, hat die Stärke eines tropischen Sturms erreicht und wird voraussichtlich am Freitagmorgen die Küste von North Carolina erreichen, teilte das National Hurricane Center mit.


Der Sturm war vor der Küste von South Carolina und North Carolina …","Tropical Storm Warning Issued for US East Coast. A storm churning in waters off the eastern U.S. has increased to tropical storm strength and is forecast to reach the North Carolina coast Friday morning, the National Hurricane Center said.


The storm was off the coast of South Carolina and North Carolina l…","Tropical Procella Monitum pro US Oriente Coast. Tempestas turbans in aquis ab US orientem orientem ad vires tropicae crevit et praenuntiatur ut mane Veneris septentrionalis Carolinae oram attingat, quod Centrum National Hurricane dixit.


Procella oram Carolinae Meridionalis et Carolinae Septentrionalis l…",2025-12-18 15:40:26+00:00
9d527920344f6919385c5297c2d0472e,2023-09-22T11:13:56Z,veryUnusualAndNeverUsedKeyword,www.newsweek.com,en,0.7,Tropical Storm Ophelia To Drench Atlantic States With Month's Worth of Rain,"A brewing cyclone is expected to bring 3-6 inches of rain to the Carolinas over the weekend, with much of the East Coast facing the threat of flooding.",https://www.newsweek.com/tropical-storm-ophelia-atlantic-rainfall-east-coast-1829089,https://d.newsweek.com/en/full/2285447/tropical-cyclone-ophelia.png,http://web.archive.org/web/20230923003034/https://www.newsweek.com/tropical-storm-ophelia-atlantic-rainfall-east-coast-1829089,A cyclone in the Atlantic Ocean that is expected to become a subtropical or tropical storm on Friday is anticipated to dump a month's worth of rain on parts of the U.S. as it barrels up the East Coas… [+3160 chars],,"Tropischer Sturm Ophelia überschwemmt die Atlantikstaaten mit monatelangem Regen. Es wird erwartet, dass ein sich zusammenbrauender Zyklon am Wochenende 3 bis 6 Zoll Regen in die Carolinas bringen wird, wobei ein Großteil der Ostküste von Überschwemmungen bedroht ist.","Tropical Storm Ophelia To Drench Atlantic States With Month's Worth of Rain. A brewing cyclone is expected to bring 3-6 inches of rain to the Carolinas over the weekend, with much of the East Coast facing the threat of flooding.","Tropical Storm Ophelia To Drench Civitates Atlanticas Cum Mensis Pretium Pluviae. Cyclone medicandi expectatur pluviae 3-6 pollices ad Carolinas per volutpat perducere, cum multa orientali plaga contra comminationem inundationis.",2025-12-18 15:40:26+00:00
9312cdb311f679300f7a47d30edb807f,2023-09-22T13:28:35Z,'tropical cyclone',www.cbssports.com,en,0.7,"NFL Week 3 weather: Tropical Cyclone could affect Bills at Commanders, Ravens at Colts and Patriots at Jets",A few teams could deal with poor playing conditions this weekend,https://www.cbssports.com/nfl/news/nfl-week-3-weather-tropical-cyclone-could-affect-bills-at-commanders-ravens-at-colts-and-patriots-at-jets/,https://sportshub.cbsistatic.com/i/r/2023/09/22/b394adc5-4a3c-4766-a79d-6d1258bffa71/thumbnail/1200x675/9048acae422bb0c36e94052e43c84828/garrett-wilson-new-york-jets-usatsi.jpg,http://web.archive.org/web/20230923083054/https://www.cbssports.com/nfl/news/nfl-week-3-weather-tropical-cyclone-could-affect-bills-at-commanders-ravens-at-colts-and-patriots-at-jets/,"Hurricane season runs through late November, so it's expected that a few NFL games will be affected by bad weather. While the United States is currently not in the path of any major hurricane, a cycl… [+953 chars]",,"Wetter in Woche 3 der NFL: Tropischer Wirbelsturm könnte sich auf Bills bei Commanders, Ravens bei Colts und Patriots bei Jets auswirken. Einige Teams könnten an diesem Wochenende mit schlechten Spielbedingungen zu kämpfen haben","NFL Week 3 weather: Tropical Cyclone could affect Bills at Commanders, Ravens at Colts and Patriots at Jets. A few teams could deal with poor playing conditions this weekend","NFL Hebdomadae III tempestas: Tropical Cyclone rogationes ad Imperatores, corvi apud Colts et Patriots apud turpis. Paucis teams potest agere cum pauperes ludentem condiciones volutpat vestibulum",2025-12-18 15:40:26+00:00
51b6de77867ccd5620a0eef8294881b5,2023-09-22T13:52:02Z,'flooding tropical',www.forbes.com,en,0.7,Latest Atlantic Storm Prompts Tropical Storm Warnings Along East Coast,"Tropical Depression 16 carries maximum sustained winds of 50 mph, and could cause intense flooding and wind damage as it approaches North Carolina and Virginia.",https://www.forbes.com/sites/brianbushard/2023/09/22/latest-atlantic-storm-prompts-tropical-storm-warnings-along-east-coast/,"https://imageio.forbes.com/specials-images/imageserve/650d956341d1911cb6091fa5/0x0.jpg?format=jpg&crop=1583,891,x0,y375,safe&width=1200",http://web.archive.org/web/20230923002950/https://www.forbes.com/sites/brianbushard/2023/09/22/latest-atlantic-storm-prompts-tropical-storm-warnings-along-east-coast/,"Tropical storm warnings are in effect from the coast of Florida to Maryland on Friday as the latest in a series of Atlantic storms barrels toward North Carolina, potentially becoming the 16th named s… [+3539 chars]",,Der jüngste Sturm im Atlantik löst Tropensturmwarnungen entlang der Ostküste aus. Das tropische Tiefdruckgebiet 16 bringt maximale Dauerwindgeschwindigkeiten von 50 Meilen pro Stunde mit sich und könnte bei seiner Annäherung an North Carolina und Virginia zu starken Überschwemmungen und Windschäden führen.,"Latest Atlantic Storm Prompts Tropical Storm Warnings Along East Coast. Tropical Depression 16 carries maximum sustained winds of 50 mph, and could cause intense flooding and wind damage as it approaches North Carolina and Virginia.","Tardus Storm Atlanticus Promptus Tropical Admonitiones Per Orientem Coast. Depressione tropica 16 maximum ventorum 50 mph sustinentium sustinet, et intensiorem inundationem et ventum damnum inferre potuit cum appropinquat Carolinae Septentrionalis et Virginiae.",2025-12-18 15:40:26+00:00
