index,published,keyword,domain,language,valid,title,description,url,image,archive,content,quote,de,en,la,added
5ca48554bfc7d59cfdda6b90f9a5457b,2024-06-14T11:26:57Z,veryUnusualAndNeverUsedKeyword,www.insurancejournal.com,en,0.8,Hurricane Season Ushered in With a Deluge in South Florida,"Dangerous flooding from a tropical disturbance inundated much of southern Florida on Wednesday, blocking roads, floating vehicles and delaying the Florida Panthers on their way to Stanley Cup games in Canada against the Edmonton Oilers. The disorganized storm…",https://www.insurancejournal.com/news/southeast/2024/06/14/779539.htm,https://www.insurancejournal.com/app/uploads/2024/06/s-fla-flood.jpg,,"Dangerous flooding from a tropical disturbance inundated much of southern Florida on Wednesday, blocking roads, floating vehicles and delaying the Florida Panthers on their way to Stanley Cup games i… [+5427 chars]",,"Die Hurrikansaison hat mit einer Überschwemmung in Südflorida begonnen. Gefährliche Überschwemmungen aufgrund einer tropischen Störung überschwemmten am Mittwoch weite Teile Südfloridas, blockierten Straßen, ließen Fahrzeuge schwimmen und verzögerten den Weg der Florida Panthers zu den Stanley-Cup-Spielen in Kanada gegen die Edmonton Oilers. Der unorganisierte Sturm ...","Hurricane Season Ushered in With a Deluge in South Florida. Dangerous flooding from a tropical disturbance inundated much of southern Florida on Wednesday, blocking roads, floating vehicles and delaying the Florida Panthers on their way to Stanley Cup games in Canada against the Edmonton Oilers. The disorganized storm…","Procellae Season inauguratus cum diluvio in South Florida. Periculosus inundatio ex perturbatione tropica multum inundavit Florida meridionali die Mercurii, interclusio viae, vehicula natantia et Pantherae Floridae morantes iter ad ludos Stanley Calicem in Canada contra Edmonton Oilers. Inordinata tempestas…",2025-12-17 13:40:36+00:00
a4a743228e34e02bc10b968be00f520e,2024-06-04T00:27:47Z,'hurricane season',www.sciencealert.com,en,0.9,"This Hurricane Season Could Be So Bad, We Might Run Out of Names",Communities along America's North Atlantic coast are bracing for yet another exceptional hurricane season.,https://www.sciencealert.com/this-hurricane-season-could-be-so-bad-we-might-run-out-of-names,https://www.sciencealert.com/images/2024/06/HurricaneFlorida.jpg,http://web.archive.org/web/20240605024258/https://www.sciencealert.com/this-hurricane-season-could-be-so-bad-we-might-run-out-of-names,"Communities along America's North Atlantic coast are bracing for yet another exceptional hurricane season.
Not only are tropical cyclones brewing earlier than usual, they are also growing in number … [+3935 chars]",,"Diese Hurrikansaison könnte so schlimm sein, dass uns die Namen ausgehen könnten. Gemeinden entlang der amerikanischen Nordatlantikküste bereiten sich auf eine weitere außergewöhnliche Hurrikansaison vor.","This Hurricane Season Could Be So Bad, We Might Run Out of Names. Communities along America's North Atlantic coast are bracing for yet another exceptional hurricane season.","Procellae hoc tempore potuit esse tam malum, ut nomina excurreremus. Communitates secundum litus Atlanticum Americae Septentrionalis aliud comprehendunt adhuc eximium tempus tempestatis.",2025-12-17 13:40:36+00:00
842ef81b2c9ee07823309e1c46af3dfe,2024-06-05T15:20:00Z,veryUnusualAndNeverUsedKeyword,www.discovermagazine.com,en,0.9,"The Atlantic Ocean is primed to deliver ""high-octane jet fuel for hurricanes""",The conditions favoring formation of Atlantic hurricanes are more extreme than ever seen before.,https://www.discovermagazine.com/environment/the-atlantic-ocean-is-primed-to-deliver-high-octane-jet-fuel-for-hurricanes,https://images.ctfassets.net/cnu0m8re1exe/LAAuMuFH1cf608fNQMFg5/2f946e475a37d6e0fe839be94eb214e4/SSTA_MDR.jpg,http://web.archive.org/web/20240605190919/https://www.discovermagazine.com/environment/the-atlantic-ocean-is-primed-to-deliver-high-octane-jet-fuel-for-hurricanes,"The much anticipated 2024 Atlantic hurricane season is here, and with ocean heat setting records, plus a looming La Niña, it may well take an appalling toll. 
Tropical cyclones are fueled by oceanic… [+4080 chars]",,"Der Atlantische Ozean ist darauf vorbereitet, „hochoktanigen Treibstoff für Hurrikane“ zu liefern. Die Bedingungen, die die Entstehung von Hurrikanen im Atlantik begünstigen, sind extremer als je zuvor.","The Atlantic Ocean is primed to deliver ""high-octane jet fuel for hurricanes"". The conditions favoring formation of Atlantic hurricanes are more extreme than ever seen before.","Oceanus Atlanticus ad ""octanum jet fomitem procellarum"" tradendum paratum est. Conditiones procellarum Atlanticarum formationi faventes magis extremae sunt quam umquam antea.",2025-12-17 13:40:36+00:00
656cb43721c089ff7437beea17859ce0,2024-06-12T17:50:54Z,'hurricane',abcnews.go.com,en,0.9,Florida's hurricane season arrives with a rainy deluge,"The annual rainy season has arrived with a wallop in much of Florida, where a disorganized disturbance of tropical weather from the Gulf of Mexico has caused street flooding and triggered tornado watches but so far has not caused major damage or injuries",https://abcnews.go.com/US/wireStory/floridas-hurricane-season-arrives-rainy-deluge-111064614,https://i.abcnewsfe.com/a/671bbdeb-072c-4fc4-9009-5f60876fe9d2/wirestory_a37631902e119c0036d1fd51da2dba15_16x9.jpg?w=1600,http://web.archive.org/web/20240612224349/https://abcnews.go.com/US/wireStory/floridas-hurricane-season-arrives-rainy-deluge-111064614,"The annual rainy season has arrived with a wallop in much of Florida, where a disorganized disturbance of tropical weather from the Gulf of Mexico has caused street flooding and triggered tornado wat… [+1869 chars]",,"Die Hurrikansaison in Florida beginnt mit einer regnerischen Überschwemmung. Die jährliche Regenzeit hat in weiten Teilen Floridas mit einem gewaltigen Durcheinander begonnen, wo eine unorganisierte Störung des tropischen Wetters aus dem Golf von Mexiko zu Straßenüberschwemmungen und Tornadowarnungen geführt hat, bisher jedoch keine größeren Schäden oder Verletzungen verursacht hat","Florida's hurricane season arrives with a rainy deluge. The annual rainy season has arrived with a wallop in much of Florida, where a disorganized disturbance of tropical weather from the Gulf of Mexico has caused street flooding and triggered tornado watches but so far has not caused major damage or injuries","Florida tempestas cum pluvioso advenit diluvio. Annuum tempus pluviosum cum vallo in multo Floridae advenit, ubi inordinata perturbatio tempestatum tropicae e Sinu Mexicano vicum inundationem et vigilias turbinis Urguet attulit sed tantum detrimentum maiorem vel iniurias non attulit.",2025-12-17 13:40:36+00:00
280927e5ed45ab7e1d0d5dff3b259ddc,2024-06-13T00:43:00Z,'hurricane',www.cnbc.com,en,0.9,Florida's 2024 hurricane season arrives with a rainy deluge,"Dangerous flooding from a tropical disturbance inundated much of southern Florida on Wednesday, blocking roads, floating vehicles and delaying the Florida Panthers on their way to Stanley Cup games in Canada against the Edmonton Oilers.",https://www.cnbc.com/2024/06/12/floridas-2024-hurricane-season-arrives-with-a-rainy-deluge.html,,http://web.archive.org/web/20240613091429/https://www.cnbc.com/2024/06/12/floridas-2024-hurricane-season-arrives-with-a-rainy-deluge.html,"People walk through a flooded street on June 12, 2024, in Aventura, Florida. The region is being adversely impacted as tropical moisture passes through the area. 
Dangerous flooding from a tropical … [+5636 chars]",,"Die Hurrikansaison 2024 in Florida beginnt mit einer regnerischen Überschwemmung. Gefährliche Überschwemmungen aufgrund einer tropischen Störung überschwemmten am Mittwoch weite Teile Südfloridas, blockierten Straßen, ließen Fahrzeuge schwimmen und verzögerten den Weg der Florida Panthers zu den Stanley-Cup-Spielen in Kanada gegen die Edmonton Oilers.","Florida's 2024 hurricane season arrives with a rainy deluge. Dangerous flooding from a tropical disturbance inundated much of southern Florida on Wednesday, blocking roads, floating vehicles and delaying the Florida Panthers on their way to Stanley Cup games in Canada against the Edmonton Oilers.","Florida 2024 tempus tempestatis advenit cum diluvio pluvioso. Periculosus inundatio ex perturbatione tropica multum inundavit Florida meridionali die Mercurii, interclusio viae, vehicula natantia et Pantherae Floridae morantes iter ad ludos Stanley Calicem in Canada contra Edmonton Oilers.",2025-12-17 13:40:36+00:00
4c0808bed7be1a21a20dd315d3153cfa,2024-06-13T12:30:48Z,'flooding tropical',www.fastcompany.com,en,0.9,‘We are in trouble.’ Rare flash flood emergency hits south Florida as hurricane season begins,"A tropical disturbance has brought a rare flash flood emergency to much of southern Florida as residents prepared to weather more heavy rainfall on Thursday and Friday.Wednesday’s downpours and subsequent flooding blocked roads, floated vehicles and delayed t…",https://www.fastcompany.com/91140453/we-are-trouble-rare-flash-flood-emergency-hits-south-florida-hurricane-season-begins,"https://images.fastcompany.com/image/upload/f_auto,q_auto,c_fit/wp-cms-2/2024/06/AP24164777028963.jpg",http://web.archive.org/web/20240614002200/https://www.fastcompany.com/91140453/we-are-trouble-rare-flash-flood-emergency-hits-south-florida-hurricane-season-begins,"A tropical disturbance has brought a rare flash flood emergency to much of southern Florida as residents prepared to weather more heavy rainfall on Thursday and Friday.
Wednesdays downpours and subs… [+5014 chars]",,"„Wir stecken in Schwierigkeiten.“ Zu Beginn der Hurrikansaison kommt es zu einer seltenen Sturzflut im Süden Floridas. Eine tropische Störung hat in weiten Teilen Südfloridas zu einer seltenen Sturzflutkatastrophe geführt, da sich die Bewohner auf weitere heftige Regenfälle am Donnerstag und Freitag vorbereiteten. Die Regengüsse und die anschließenden Überschwemmungen am Mittwoch blockierten Straßen, ließen Fahrzeuge schwimmen und verzögerten die Fahrt.","‘We are in trouble.’ Rare flash flood emergency hits south Florida as hurricane season begins. A tropical disturbance has brought a rare flash flood emergency to much of southern Florida as residents prepared to weather more heavy rainfall on Thursday and Friday.Wednesday’s downpours and subsequent flooding blocked roads, floated vehicles and delayed t…","`Contristati sumus.' Rara mico inundatio repentina pervenit ad Floridam meridianam sicut tempus tempestatis incipit. Tropicus commotio rara mico inundatione multum in Florida meridionali intulit, sicut incolas tempestatibus gravioribus pluviis die Jovis et Veneris paraverunt. Meridiani imbres et inundationes sequentes vias obstruxerunt, vehiculis morati sunt et t…",2025-12-17 13:40:36+00:00
cfe2f875de1cba160adb71201c9ba178,2024-06-13T15:45:14Z,'tropical cyclone',www.marketscreener.com,en,0.9,"Low-Pressure Areas Near Florida, US Gulf Could Become Cyclones : NHC -- OPIS","(marketscreener.com) 
 Low-pressure systems off the U.S. Southeast coast and in the southwest Gulf of Mexico could develop into the first tropical cyclones of the 2024 Atlantic hurricane season, the Hurricane Center said on Thursday. 

 In an 8 a.m. ET update…",https://www.marketscreener.com/news/latest/Low-Pressure-Areas-Near-Florida-US-Gulf-Could-Become-Cyclones-NHC-OPIS-46968656/,https://www.marketscreener.com/images/twitter_MS_fdblanc.png,http://web.archive.org/web/20240613155156/https://www.marketscreener.com/news/latest/Low-Pressure-Areas-Near-Florida-US-Gulf-Could-Become-Cyclones-NHC-OPIS-46968656/,"Low-pressure systems off the U.S. Southeast coast and in the southwest Gulf of Mexico could develop into the first tropical cyclones of the 2024 Atlantic hurricane season, the Hurricane Center said o… [+2065 chars]",,"Tiefdruckgebiete in der Nähe von Florida und dem US-Golf könnten zu Wirbelstürmen werden: NHC – OPIS. (marketscreener.com) 
 Tiefdruckgebiete vor der Südostküste der USA und im südwestlichen Golf von Mexiko könnten sich zu den ersten tropischen Wirbelstürmen der atlantischen Hurrikansaison 2024 entwickeln, teilte das Hurricane Center am Donnerstag mit. 

 In einem Update um 8 Uhr ET…","Low-Pressure Areas Near Florida, US Gulf Could Become Cyclones : NHC -- OPIS. (marketscreener.com) 
 Low-pressure systems off the U.S. Southeast coast and in the southwest Gulf of Mexico could develop into the first tropical cyclones of the 2024 Atlantic hurricane season, the Hurricane Center said on Thursday. 

 In an 8 a.m. ET update…","Areas Low-Pressure Near Florida, US Sinus Cyclones fieri poterant : NHC -- OPIS. (marketscreener.com) 
 Systema depressum ab US Southeast oram et in Africo sinu Mexici evolvere potuerunt in primos cyclos tropicos temporis procellae Atlantici MMXXIV, Centrum Hurricane die Iovis dixit. 

 In an VIII a.m. ET renovatio…",2025-12-17 13:40:36+00:00
162f3e565aec0a65118e9b59114452fe,2024-06-17T07:01:00Z,'hurricane season',www.dailysignal.com,en,0.9,Fact Check: Is Climate Change Really Causing More Frequent or More Severe Hurricanes?,"Every year at this time, when hurricane season rolls around, corporate media start pumping out headlines linking the severity of hurricanes to climate change. But... Read More
The post Fact Check: Is Climate Change Really Causing More Frequent or More Severe …",https://www.dailysignal.com/2024/06/17/fact-check-climate-change-really-causing-more-severe-hurricanes/,https://first-heritage-foundation.s3.amazonaws.com/live_files/2024/06/Huricane.jpg,,"Every year at this time, when hurricane season rolls around, corporate media start pumping out headlines linking the severity of hurricanes to climate change. But is there causation or correlation? A… [+19219 chars]",,"Faktencheck: Verursacht der Klimawandel tatsächlich häufigere oder schwerere Hurrikane? Jedes Jahr zu dieser Zeit, wenn die Hurrikansaison beginnt, verbreiten die Konzernmedien Schlagzeilen, die die Schwere der Hurrikane mit dem Klimawandel in Verbindung bringen. Aber... Lesen Sie mehr
Der Beitrag Faktencheck: Verursacht der Klimawandel tatsächlich häufigere oder schwerwiegendere …","Fact Check: Is Climate Change Really Causing More Frequent or More Severe Hurricanes?. Every year at this time, when hurricane season rolls around, corporate media start pumping out headlines linking the severity of hurricanes to climate change. But... Read More
The post Fact Check: Is Climate Change Really Causing More Frequent or More Severe …","Re perscriptio: Estne Clima Mutationem vere causans frequentiorem vel graviorem turbinum?. Singulis annis hoc tempore, cum tempestas tempestatis circumvolvitur, media corporata fundamenta exhaurire incipiunt, quae gravitatem turbinum ad mutationem climatis coniungunt. Sed... Read More
Post Res perscriptio: Est Clima Mutationem vere causando crebriores vel graviores ...",2025-12-17 13:40:36+00:00
960792e868fb01ec9da069e98c5da1f4,2024-06-17T16:13:13Z,'tropical cyclone',www.marketscreener.com,en,0.9,"First Tropical Cyclone of 2024 Season Likely to Form in GOM by Midweek, NHC Says --OPIS","(marketscreener.com) 
 A tropical depression or tropical storm is likely to form in the southwestern Gulf of Mexico by midweek, which would mark the first tropical cyclone of the 2024 Atlantic hurricane season, the National Hurricane Center said Monday. 

 NH…",https://www.marketscreener.com/news/latest/First-Tropical-Cyclone-of-2024-Season-Likely-to-Form-in-GOM-by-Midweek-NHC-Says-OPIS-46987240/,https://www.marketscreener.com/images/twitter_MS_fdnoir.png,,"A tropical depression or tropical storm is likely to form in the southwestern Gulf of Mexico by midweek, which would mark the first tropical cyclone of the 2024 Atlantic hurricane season, the Nationa… [+1575 chars]",,"Der erste tropische Wirbelsturm der Saison 2024 dürfte sich bis zur Wochenmitte in GOM bilden, sagt NHC – OPIS. (marketscreener.com) 
 Bis zur Wochenmitte dürfte sich im südwestlichen Golf von Mexiko ein tropisches Tiefdruckgebiet oder ein tropischer Sturm bilden, was den ersten tropischen Wirbelsturm der atlantischen Hurrikansaison 2024 markieren würde, teilte das National Hurricane Center am Montag mit. 

 NH…","First Tropical Cyclone of 2024 Season Likely to Form in GOM by Midweek, NHC Says --OPIS. (marketscreener.com) 
 A tropical depression or tropical storm is likely to form in the southwestern Gulf of Mexico by midweek, which would mark the first tropical cyclone of the 2024 Atlantic hurricane season, the National Hurricane Center said Monday. 

 NH…","Primum Tropical Cyclone 2024 Temporum in GOM by Midweek, NHC dicit --OPIS. (marketscreener.com) 
 Depressio tropica seu tempestas tropica verisimile est formare in Sinum meridio-occidentali Mexicani ab midweek, quod primum cyclum tropicum anni 2024 notaret tempestatis Atlantici, National Hurricane Centrum Lunae dixit. 

 NH…",2025-12-17 13:40:36+00:00
17f27bb57fdb38e7a09947feadd22ca7,2024-06-17T23:48:20Z,'hurricane',www.cnn.com,en,0.9,First tropical storm watch of hurricane season issued for South Texas and Mexico as storm takes shape | CNN,"The Atlantic hurricane season is ready to kick into gear with two potential tropical threats this week, one of which has a serious flood threat.",https://www.cnn.com/2024/06/17/weather/hurricane-season-gulf-coast-flooding/index.html,"https://media.cnn.com/api/v1/images/stellar/prod/cnn-digital-tracker-tropical-cyclone-track-storm-stats.png?c=16x9&q=w_800,c_fill",http://web.archive.org/web/20240618011535/https://www.cnn.com/2024/06/17/weather/hurricane-season-gulf-coast-flooding/index.html,"The Atlantic hurricane season is kicking into gear with two potential tropical threats this week, one of which will deliver drenching rainfall and serious flood threats to parts of Mexico, Central Am… [+3511 chars]",,"Erste Tropensturmwarnung der Hurrikansaison für Südtexas und Mexiko herausgegeben, während der Sturm Gestalt annimmt | CNN. Die Hurrikansaison im Atlantik steht diese Woche mit zwei potenziellen tropischen Bedrohungen vor dem Start, von denen eine eine ernsthafte Überschwemmungsgefahr mit sich bringt.","First tropical storm watch of hurricane season issued for South Texas and Mexico as storm takes shape | CNN. The Atlantic hurricane season is ready to kick into gear with two potential tropical threats this week, one of which has a serious flood threat.","Primae tropicae tempestatis vigiliae tempestatis tempestatisque tempore edita in Texas Meridionalis et Mexici sicut tempestas formatur | Rhoncus. Tempus tempestatis Atlantici in calces calcitrare paratus est cum duabus minis tropicis potentialibus hac septimana, quarum altera gravem comminationem inundationis habet.",2025-12-17 13:40:36+00:00
58b55705b9ce55e27df989098371a94a,2024-06-19T10:44:43Z,'hurricane',www.nbcnews.com,en,0.9,First tropical storm of the season heads for Texas as extreme heat wave hits the Northeast,"The United States was buffeted by extreme weather on Wednesday, with Texas braced for the first tropical storm of the hurricane season while the Northeast still faced a major heat wave.",https://www.nbcnews.com/news/us-news/tropical-storm-texas-extreme-heat-wave-northeast-rcna157893,"https://media-cldnry.s-nbcnews.com/image/upload/t_nbcnews-fp-1200-630,f_auto,q_auto:best/rockcms/2023-11/nebula-cms-fallback-logos-nbcnews-81f6e4.jpg",http://web.archive.org/web/20240619235729/https://www.nbcnews.com/news/us-news/tropical-storm-texas-extreme-heat-wave-northeast-rcna157893,"The United States was buffeted by extreme weather on Wednesday, with Texas braced for the first tropical storm of the hurricane season while the Northeast still faced a major heat wave.
Southern Tex… [+3187 chars]",,"Der erste Tropensturm der Saison zieht auf Texas zu, während eine extreme Hitzewelle den Nordosten trifft. Die Vereinigten Staaten wurden am Mittwoch von extremen Wetterbedingungen heimgesucht. Texas bereitete sich auf den ersten Tropensturm der Hurrikansaison vor, während der Nordosten immer noch einer großen Hitzewelle ausgesetzt war.","First tropical storm of the season heads for Texas as extreme heat wave hits the Northeast. The United States was buffeted by extreme weather on Wednesday, with Texas braced for the first tropical storm of the hurricane season while the Northeast still faced a major heat wave.","Prima tropica tempestas temporum capitum Texas sicut calor extremus fluctus Orientem ferit. Civitatibus Foederatis die Mercurii extrema tempestate iactata est, cum Texas primum tropica tempestas tempestatis incubuisset, dum Orientem brumalem adhuc ad maiorem aestum fluctuantem convertebat.",2025-12-17 13:40:36+00:00
d5f92dd4af5e0973b7fe90cd04c92dc1,2024-06-25T16:57:00Z,'hurricane',www.cbsnews.com,en,0.9,Powerful weather satellite ready to launch for hurricane-hunting duty,The latest GOES satellite will play a critical role in tracking hurricanes and other dangerous storms across North America.,https://www.cbsnews.com/news/goes-weather-satellite-launch/,https://assets2.cbsnewsstatic.com/hub/i/r/2024/06/25/ea8e3318-9dcf-470a-bf2c-17eb184569c3/thumbnail/1200x630/16f763a7a520b7e10bd10c58d9b23a6c/062524-fh-sfn-padview.jpg?v=d44ea471ad55b1f821a0763c85064960,http://web.archive.org/web/20240626013544/https://www.cbsnews.com/news/goes-weather-satellite-launch/,"A hurricane-tracking GOES weather satellite, the final member of a four-satellite fleet at the heart of an $11 billion upgrade to the nation's forecasting infrastructure, is poised for a late-afterno… [+3983 chars]",,Leistungsstarker Wettersatellit bereit für den Start zur Hurrikanjagd. Der neueste GOES-Satellit wird eine entscheidende Rolle bei der Verfolgung von Hurrikanen und anderen gefährlichen Stürmen in ganz Nordamerika spielen.,Powerful weather satellite ready to launch for hurricane-hunting duty. The latest GOES satellite will play a critical role in tracking hurricanes and other dangerous storms across North America.,Satelles tempestatis validus paratus est ad officium procellae-venationis deducendum. Novissima satellite GOES munus criticum exercebit in sequi turbinum et alias tempestates periculosas per Americam Septentrionalem.,2025-12-17 13:40:36+00:00
51fbb241008f03418c113c262911771d,2024-06-26T15:41:14Z,'hurricane',www.ndtv.com,en,0.9,"Saharan Dust Cloud Crosses Atlantic Ocean, Threatens Florida","A massive plume of Saharan dust, the largest of the 2024 hurricane season, is moving across the Atlantic towards the Gulf of Mexico and Florida.",https://www.ndtv.com/science/saharan-dust-cloud-crosses-atlantic-ocean-threatens-florida-5976283,https://c.ndtvimg.com/2024-06/cevb51go_saharan-dust_625x300_26_June_24.jpeg?ver-20240615.100,,"The dust is kicked up from thunderstorms in northern Africa.
A massive plume of Saharan dust, the largest seen so far this hurricane season, is on its way across the Atlantic Ocean. This dusty giant… [+1911 chars]",,"Sahara-Staubwolke überquert den Atlantik und bedroht Florida. Eine gewaltige Staubwolke aus der Sahara, die größte der Hurrikansaison 2024, bewegt sich über den Atlantik in Richtung Golf von Mexiko und Florida.","Saharan Dust Cloud Crosses Atlantic Ocean, Threatens Florida. A massive plume of Saharan dust, the largest of the 2024 hurricane season, is moving across the Atlantic towards the Gulf of Mexico and Florida.","Saharan Pulvis Cloud Atlanticum Oceanum transit, Floridam minatur. Ingens pluma pulveris Saharensia, maxima temporis 2024 procellae, trans Atlanticum versus Sinum Mexicanum et Floridam movetur.",2025-12-17 13:40:36+00:00
920ceb3486012e10e14ea8b41a060021,2024-06-28T10:18:02Z,'hurricane',www.news-journalonline.com,en,0.9,Tropical Storm Beryl expected soon as system approaches Caribbean. See spaghetti models,"AccuWeather forecasters warned Invest 95L ""has the potential to ramp up quickly,"" possibly into a major hurricane.",https://www.news-journalonline.com/story/weather/hurricane/2024/06/28/tropical-storm-beryl-hurricane-possible-spaghetti-models/74234331007/,https://media.zenfs.com/en/daytona-beach-news-journal/d90297b3d45bdf49ff61a9768d233552,http://web.archive.org/web/20240628164109/https://www.news-journalonline.com/story/weather/hurricane/2024/06/28/tropical-storm-beryl-hurricane-possible-spaghetti-models/74234331007/,"The tropics are heating up, and one system is expected to become either a tropical depression or Tropical Storm Beryl later today or Saturday, according to the latest advisory from the National Hurri… [+8655 chars]",,"Tropischer Sturm Beryl wird erwartet, sobald sich das System der Karibik nähert. Siehe Spaghetti-Modelle. AccuWeather-Prognostiker warnten, dass Invest 95L „das Potenzial hat, schnell anzusteigen“, möglicherweise zu einem großen Hurrikan.","Tropical Storm Beryl expected soon as system approaches Caribbean. See spaghetti models. AccuWeather forecasters warned Invest 95L ""has the potential to ramp up quickly,"" possibly into a major hurricane.","Tropical Storm Beryl expected simul ac systema Caribbean appropinquat. Vide Spaghetti exempla. AccuWeather forecasters admonuit Invest 95L ""potestatem habet celeriter conscendendi"", fortasse in maiorem procellam.",2025-12-17 13:40:36+00:00
