index,published,keyword,domain,language,valid,title,description,url,image,archive,content,quote,de,en,la,added
9ca618ded499a1a62a59afee4dea8653,2023-09-07T21:58:57Z,veryUnusualAndNeverUsedKeyword,www.forbes.com,en,0.9,"Hurricane Lee Strengthens To Cat. 4 At ‘Exceptional Rate’—Will Become Rare Cat. 5 Within Hours, Forecasters Say",Lee is now officially a major hurricane and is likely to become a Category 5—the strongest hurricane designation.,https://www.forbes.com/sites/mollybohannon/2023/09/07/hurricane-lee-strengthens-to-cat-4-at-exceptional-rate-will-become-rare-cat-5-within-hours-forecasters-say/,"https://imageio.forbes.com/specials-images/imageserve/64fa479829c76d62a6f9e2c7/0x0.jpg?format=jpg&crop=1371,770,x0,y29,safe&width=1200",http://web.archive.org/web/20230907233951/https://www.forbes.com/sites/mollybohannon/2023/09/07/hurricane-lee-strengthens-to-cat-4-at-exceptional-rate-will-become-rare-cat-5-within-hours-forecasters-say/,Hurricane Lee continued to gain strength over the Atlantic throughout Thursday and shot right from a Category 2 storm to a Category 4 storm in a late afternoon update from the National Hurricane Cent… [+3399 chars],,"Hurrikan Lee verstärkt sich auf Kat. 4 zum „Außergewöhnlichen Preis“ – wird zur seltenen Katze. 5 Innerhalb weniger Stunden, sagen Prognostiker. Lee ist jetzt offiziell ein schwerer Hurrikan und wird wahrscheinlich in die Kategorie 5 – die Einstufung als stärkster Hurrikan – eingestuft.","Hurricane Lee Strengthens To Cat. 4 At ‘Exceptional Rate’—Will Become Rare Cat. 5 Within Hours, Forecasters Say. Lee is now officially a major hurricane and is likely to become a Category 5—the strongest hurricane designation.","Procellae Lee Confirmat Cat. 4 At 'Rat'-exceptionalis fiet Rare Cat. 5 Within Hours, Forecasters Say. Lee nunc officialiter turbo major est et solet fieri Categoria 5 - validissima designatio turbinis.",2025-12-18 14:59:04+00:00
9bbb0087eb689cd2b24a3983452cc780,2023-09-07T23:24:33Z,'hurricane',dailycaller.com,en,0.9,"Tropical Storm Margot Officially Forms In Atlantic, Expected To Become Hurricane","Tropical Depression 14 is now officially Tropical Storm Margot, strengthening up Thursday afternoon. The system is expected to become a hurricane this weekend.",https://dailycaller.com/2023/09/07/tropical-storm-margot-atlantic-hurricane-nhc-depression-14/,https://cdn01.dailycaller.com/wp-content/uploads/2023/09/Collage-Maker-07-Sep-2023-07-13-PM-4199-scaled-e1694128467452.jpg,http://web.archive.org/web/20230908141402/https://dailycaller.com/2023/09/07/tropical-storm-margot-atlantic-hurricane-nhc-depression-14/,"Another one. (*DJ Khaled voice*)
Tropical Depression 14 is now officially Tropical Storm Margot, strengthening up Thursday afternoon. The system is expected to become a hurricane this weekend, accor… [+1931 chars]",,"Im Atlantik bildet sich offiziell der Tropensturm Margot, der voraussichtlich zu einem Hurrikan wird. Tropisches Tiefdruckgebiet 14 heißt nun offiziell Tropensturm Margot und verstärkt sich am Donnerstagnachmittag. Es wird erwartet, dass sich das System an diesem Wochenende zu einem Hurrikan entwickelt.","Tropical Storm Margot Officially Forms In Atlantic, Expected To Become Hurricane. Tropical Depression 14 is now officially Tropical Storm Margot, strengthening up Thursday afternoon. The system is expected to become a hurricane this weekend.","Tropical Margot Officially Forms In Atlantic, Expected To Fieri Procellae. Tropical Depression 14 Nunc publice Tropical Margot est, firmans usque Iovis post meridiem. Aliquam sit amet orci id tortor volutpat vestibulum.",2025-12-18 14:59:04+00:00
674f90fbb9deeb0fc617b0c309121678,2023-09-08T11:37:28Z,'hurricane',www.bostonherald.com,en,0.9,Hurricane Lee barrels through open Atlantic waters as the season’s first Category 5 storm,"Hurricane Lee is charging through warm Atlantic waters as the season’s first Category 5 storm and threatening to unleash heavy swells across the northeast Caribbean. The hurricane is not expected to make landfall. The hurricane was located about 630 miles (1,…",https://www.bostonherald.com/2023/09/08/hurricane-lee-barrels-through-open-atlantic-waters-as-the-seasons-first-category-5-storm/,https://www.bostonherald.com/wp-content/uploads/2023/09/Tropical_Weather_73954-1.jpg?w=1024&h=622,,"SAN JUAN, Puerto Rico (AP) — Hurricane Lee on Friday charged through warm Atlantic waters as the season’s first Category 5 storm, threatening to unleash heavy swells across the northeast Caribbean.
… [+3068 chars]",,"Hurrikan Lee fegt als erster Sturm der Kategorie 5 der Saison über die offenen Gewässer des Atlantiks. Hurrikan Lee rast als erster Sturm der Kategorie 5 der Saison durch die warmen Gewässer des Atlantiks und droht, im Nordosten der Karibik schwere Wellen auszulösen. Es wird nicht erwartet, dass der Hurrikan auf Land trifft. Der Hurrikan befand sich etwa 630 Meilen (1,…)","Hurricane Lee barrels through open Atlantic waters as the season’s first Category 5 storm. Hurricane Lee is charging through warm Atlantic waters as the season’s first Category 5 storm and threatening to unleash heavy swells across the northeast Caribbean. The hurricane is not expected to make landfall. The hurricane was located about 630 miles (1,…","Procellae Lee dolia per aquas Atlanticas apertas sicut primi Categoriae 5 tempestatis temporis. Procellae Lee per aquas Atlanticas calidas ut tempestatis primum Categoriae 5 tempestatis incurrens minatur graves tumores erumpere trans Caribbean septentrionalem. Turbo non expectatur ut traham. Turbo stabat circiter milia passuum DCXXX (1,…",2025-12-18 14:59:04+00:00
c23e2035d50ced2fd4fa3a4e4fb303c8,2023-09-08T11:37:28Z,'hurricane season',www.denverpost.com,en,0.9,Hurricane Lee barrels through open Atlantic waters as the season’s first Category 5 storm,"Hurricane Lee is charging through warm Atlantic waters as the season’s first Category 5 storm and threatening to unleash heavy swells across the northeast Caribbean. The hurricane is not expected to make landfall. The hurricane was located about 630 miles (1,…",https://www.denverpost.com/2023/09/08/hurricane-lee-barrels-through-open-atlantic-waters-as-the-seasons-first-category-5-storm/,https://www.denverpost.com/wp-content/uploads/2023/09/Tropical_Weather_73954-1.jpg?w=1024&h=622,,"SAN JUAN, Puerto Rico (AP) — Hurricane Lee on Friday charged through warm Atlantic waters as the season’s first Category 5 storm, threatening to unleash heavy swells across the northeast Caribbean.
… [+3068 chars]",,"Hurrikan Lee fegt als erster Sturm der Kategorie 5 der Saison über die offenen Gewässer des Atlantiks. Hurrikan Lee rast als erster Sturm der Kategorie 5 der Saison durch die warmen Gewässer des Atlantiks und droht, im Nordosten der Karibik schwere Wellen auszulösen. Es wird nicht erwartet, dass der Hurrikan auf Land trifft. Der Hurrikan befand sich etwa 630 Meilen (1,…)","Hurricane Lee barrels through open Atlantic waters as the season’s first Category 5 storm. Hurricane Lee is charging through warm Atlantic waters as the season’s first Category 5 storm and threatening to unleash heavy swells across the northeast Caribbean. The hurricane is not expected to make landfall. The hurricane was located about 630 miles (1,…","Procellae Lee dolia per aquas Atlanticas apertas sicut primi Categoriae 5 tempestatis temporis. Procellae Lee per aquas Atlanticas calidas ut tempestatis primum Categoriae 5 tempestatis incurrens minatur graves tumores erumpere trans Caribbean septentrionalem. Turbo non expectatur ut traham. Turbo stabat circiter milia passuum DCXXX (1,…",2025-12-18 14:59:04+00:00
dc387dada855fab7cebab60870887ba7,2023-09-08T12:25:04Z,'hurricane',www.huffpost.com,en,0.9,Hurricane Lee Barrels Through Atlantic Waters As Season’s First Category 5 Storm,"The hurricane is not expected to make landfall, but meteorologists warned it would generate dangerous waves of up to 15 feet across the northern coast of Puerto Rico.",https://www.huffpost.com/entry/hurricane-lee-barrels-atlantic-waters-seasons-first-category-5-storm_n_64fb112ce4b0e2b6718ea883,https://img.huffingtonpost.com/asset/64fb11722300003100cd6644.jpeg?cache=e6y9zBa5y8&ops=1200_630,http://web.archive.org/web/20230909022111/https://www.huffpost.com/entry/hurricane-lee-barrels-atlantic-waters-seasons-first-category-5-storm_n_64fb112ce4b0e2b6718ea883,"This Wednesday, Sept. 6, 2023, satellite image provided by the National Oceanic and Atmospheric Administration shows Hurricane Lee, right, off in the central tropical Atlantic Ocean. (NOAA via AP)
S… [+3446 chars]",,"Hurrikan Lee fegt als erster Sturm der Kategorie 5 durch die Gewässer des Atlantiks. Es wird nicht erwartet, dass der Hurrikan auf Land trifft, Meteorologen warnten jedoch, dass er an der Nordküste von Puerto Rico gefährliche Wellen von bis zu 15 Fuß Höhe erzeugen würde.","Hurricane Lee Barrels Through Atlantic Waters As Season’s First Category 5 Storm. The hurricane is not expected to make landfall, but meteorologists warned it would generate dangerous waves of up to 15 feet across the northern coast of Puerto Rico.","Procellae Lee Barrels Per Aquas Atlanticas As Season's Primum Categoria 5 Tempestas. Procellae non expectatur ut casus iacturam faciat, sed astrologi monuerunt mares periculosos generare usque ad 15 pedes per oram septentrionalem Puerto Rico.",2025-12-18 14:59:04+00:00
5790357420df767dfffad6962ed5e178,2023-09-08T14:14:43Z,veryUnusualAndNeverUsedKeyword,www.npr.org,en,0.9,"'Incredibly powerful' Hurricane Lee will see 180 mph winds, forecasters say",It took just 24 hours for Lee's maximum sustained winds to rocket from 80 mph to 160 mph. But that was yesterday — now the hurricane is getting even stronger.,https://www.npr.org/2023/09/08/1198384019/hurricane-lee-will-see-180-mph-winds-forecasters-say,https://media.npr.org/assets/img/2023/09/08/cone-hurricane-lee_wide-4be869d65b3131dd32aef9879bec2cb4888ad246-s1400-c100.png,http://web.archive.org/web/20230909024803/https://www.npr.org/2023/09/08/1198384019/hurricane-lee-will-see-180-mph-winds-forecasters-say,"Hurricane Lee isn't currently predicted to make landfall but all eyes will be on the intense storm's path as it slows down near the U.S. East Coast and Bermuda.
National Hurricane Center
Hurricane … [+4355 chars]",,"„Unglaublich starker“ Hurrikan Lee wird Windgeschwindigkeiten von 180 Meilen pro Stunde erleben, sagen Prognostiker. Es dauerte nur 24 Stunden, bis Lees maximale Dauerwindgeschwindigkeit von 80 Meilen pro Stunde auf 160 Meilen pro Stunde anstieg. Aber das war gestern – jetzt wird der Hurrikan noch stärker.","'Incredibly powerful' Hurricane Lee will see 180 mph winds, forecasters say. It took just 24 hours for Lee's maximum sustained winds to rocket from 80 mph to 160 mph. But that was yesterday — now the hurricane is getting even stronger.","'Incredibiliter potentem' Procellae Lee videbis 180 Nubila ventis, vatems dicere. Accepit tantum 24 horas pro Lee maximam sustentationem ventis ad eruca a 80 mph ad 160 mph. Sed hesterno die fuit — nunc etiam ventorum convalescit.",2025-12-18 14:59:04+00:00
03390ca804259c4383da3dea3599959c,2023-09-08T15:02:46Z,'hurricane',www.forbes.com,en,0.9,Hurricane Lee Now Category 5 After Rapidly Intensifying Over 24 Hours,"Hurricane Lee strengthened to a Category 5 hurricane late Thursday, the National Hurricane Center said, after rapidly intensifying over the previous 24 hours as it continued to move over the warm waters of the Atlantic ocean.",https://www.forbes.com/video/6336819066112/hurricane-lee-now-category-5-after-rapidly-intensifying-over-24-hours/,https://imageio.forbes.com/i-forbesimg/media/video/2023/09/08/6336819066112_still.jpg?format=jpg&height=460&width=800&fit=bounds,http://web.archive.org/web/20230914124250/https://www.forbes.com/video/6336819066112/hurricane-lee-now-category-5-after-rapidly-intensifying-over-24-hours/,"Hurricane Lee strengthened to a Category 5 hurricane late Thursday, the National Hurricane Center said, after rapidly intensifying over the previous 24 hours as it continued to move over the warm wat… [+25 chars]",,"Hurrikan Lee ist jetzt Kategorie 5, nachdem er sich über 24 Stunden hinweg rasch intensiviert hat. Hurrikan Lee verstärkte sich am späten Donnerstag zu einem Hurrikan der Kategorie 5, teilte das National Hurricane Center mit, nachdem er sich in den letzten 24 Stunden rasch verstärkt hatte, während er sich weiter über das warme Wasser des Atlantischen Ozeans bewegte.","Hurricane Lee Now Category 5 After Rapidly Intensifying Over 24 Hours. Hurricane Lee strengthened to a Category 5 hurricane late Thursday, the National Hurricane Center said, after rapidly intensifying over the previous 24 hours as it continued to move over the warm waters of the Atlantic ocean.","Procellae Lee Nunc Categoria 5 Post Rapidly augendi Plus 24 Horae. Procellae Lee ad Categoriam 5 Procellae nuper Iovis, Centrum Nationalis Hurricane dixit, postquam celeriter auget per 24 horas priorem, cum per aquas calidas Oceani Atlantici movere perseveravit.",2025-12-18 14:59:04+00:00
7d1f4cf203c20a54c55c5fb8cf02ae5f,2023-09-08T15:10:00Z,'typhoon',jalopnik.com,en,0.9,Watch A Typhoon Push A Car Backwards As It Drives Into The Wind,"Southern China has been battered by Typhoon Haikui. High winds and the heaviest rains in recorded history have flooded cities like Hong Kong and Shenzhen, injuring multiple people and compounding damage already created by last week’s super typhoon Saola. Even…",https://jalopnik.com/typhoon-haikui-push-car-backwards-as-it-drives-wind-1850817477,"https://i.kinja-img.com/gawker-media/image/upload/c_fill,f_auto,fl_progressive,g_center,h_675,pg_1,q_80,w_1200/af8f6d84a0ca7a1546038e2d781213ea.gif",http://web.archive.org/web/20230908223357/https://jalopnik.com/typhoon-haikui-push-car-backwards-as-it-drives-wind-1850817477,"Southern China has been battered by Typhoon Haikui. High winds and the heaviest rains in recorded history have flooded cities like Hong Kong and Shenzhen, injuring multiple people and compounding dam… [+1148 chars]",,"Beobachten Sie, wie ein Taifun ein Auto rückwärts schiebt, während es in den Wind fährt. Südchina wurde vom Taifun Haikui heimgesucht. Starke Winde und die heftigsten Regenfälle in der Geschichte haben Städte wie Hongkong und Shenzhen überschwemmt, mehrere Menschen verletzt und die bereits durch den Supertaifun Saola letzte Woche verursachten Schäden noch verschlimmert. Sogar…","Watch A Typhoon Push A Car Backwards As It Drives Into The Wind. Southern China has been battered by Typhoon Haikui. High winds and the heaviest rains in recorded history have flooded cities like Hong Kong and Shenzhen, injuring multiple people and compounding damage already created by last week’s super typhoon Saola. Even…","Vigilate Typhonis ventilabis A car retro, sicut inpulerit in ventum. Sina australis a Typhoon Haikui pulsata est. Altissimi venti et pluviae gravissimae in historia memoriae inundaverunt urbes sicut Hong Kong et Shenzhen, multiplicis homines laedunt et damnum componunt iam ultima septimana super typhon Saola creatum est. Etiam…",2025-12-18 14:59:04+00:00
aa7178a5964ae2ba2203866eac900eb0,2023-09-08T16:35:57Z,'hurricane',www.breitbart.com,en,0.9,Hurricane Lee Strengthens Rapidly in Atlantic; Path Remains Uncertain,"Hurricane Lee has rapidly intensified to a major hurricane in the Atlantic Ocean, according to the National Hurricane Center.",https://www.breitbart.com/politics/2023/09/08/hurricane-lee-strengthens-rapidly-atlantic-path-remains-uncertain/,https://media.breitbart.com/media/2023/09/Hurricane-Lee-640x335.jpg,http://web.archive.org/web/20230908215803/https://www.breitbart.com/politics/2023/09/08/hurricane-lee-strengthens-rapidly-atlantic-path-remains-uncertain/,"Hurricane Lee has rapidly intensified to a major hurricane in the Atlantic Ocean, and all eyes look to its track as those on the East Coast hope for a dramatic pull north.
An 11:00 a.m. advisory fro… [+3147 chars]",,Hurrikan Lee verstärkt sich im Atlantik rasch; Der Weg bleibt ungewiss. Nach Angaben des National Hurricane Center hat sich Hurrikan Lee im Atlantik rasch zu einem großen Hurrikan entwickelt.,"Hurricane Lee Strengthens Rapidly in Atlantic; Path Remains Uncertain. Hurricane Lee has rapidly intensified to a major hurricane in the Atlantic Ocean, according to the National Hurricane Center.","Procellae Lee Confirmat Celeriter in Atlantico; Iter incertus. Procellae Lee ad maiorem procellam in Oceano Atlantico celeriter intenditur, secundum Centrum Nationale Hurricane.",2025-12-18 14:59:04+00:00
f6f46af2f03acfb8f98c9755aaee80f3,2023-09-08T17:14:43Z,'hurricane',abcnews.go.com,en,0.9,Hurricane Lee becomes rare storm to intensify from Cat 1 to Cat 5 in 24 hours,Hurricane Lee is only one of a handful of hurricanes in the Atlantic basin during the satellite era to intensify by 85 mph or more within a 24-hour period.,https://abcnews.go.com/US/hurricane-lee-rare-storm-rapidly-intensify-cat-1/story?id=103025650,https://i.abcnewsfe.com/a/2deae9b5-fc47-42a3-a48a-a3dafa10a8fa/hurricane-lee-2-ht-gmh-230908_1694178867217_hpMain_16x9t.jpg?w=992,http://web.archive.org/web/20230908174619/https://abcnews.go.com/US/hurricane-lee-rare-storm-rapidly-intensify-cat-1/story?id=103025650,"Hurricane Lee, now a powerful Category 4 hurricane, is one of only a handful of hurricanes in the Atlantic basin during the satellite era to intensify by 85 mph or more within a 24-hour period.
The … [+1841 chars]",,"Hurrikan Lee ist ein seltener Sturm, der sich innerhalb von 24 Stunden von Kategorie 1 auf Kategorie 5 steigert. Hurrikan Lee ist nur einer von wenigen Hurrikanen im Atlantikbecken während des Satellitenzeitalters, die sich innerhalb von 24 Stunden um 85 Meilen pro Stunde oder mehr verstärkten.",Hurricane Lee becomes rare storm to intensify from Cat 1 to Cat 5 in 24 hours. Hurricane Lee is only one of a handful of hurricanes in the Atlantic basin during the satellite era to intensify by 85 mph or more within a 24-hour period.,Procellae Lee tempestas rara fit ut augeatur ab Cat 1 ad Cat 5 in 24 horas. Procella Lee una tantum ex paucis turbinum in pelvi Atlantico est durante era satellite ad 85 mph vel plus intra tempus 24 horarum augendum.,2025-12-18 14:59:04+00:00
5c481051a8c49532e4045b5b1f8cf2ac,2023-09-08T18:05:34Z,veryUnusualAndNeverUsedKeyword,www.usatoday.com,en,0.9,Hurricane Lee tracker live: Follow the storm's path as it heads toward the Bahamas,"Hurricane Lee intensified into a Category 5 hurricane Thursday, according to the National Hurricane Center. Follow the storm with this live tracker.",https://www.usatoday.com/story/news/weather/2023/09/08/hurricane-lee-path-tracker/70795737007/,https://s.yimg.com/ny/api/res/1.2/ivFyC_lNzB66TPaRC5Iy7Q--/YXBwaWQ9aGlnaGxhbmRlcjt3PTEyMDA7aD0xMjAw/https://media.zenfs.com/en/usa_today_news_641/aa3df2a9294fea56da8047fea5998a4d,http://web.archive.org/web/20230909135559/https://www.usatoday.com/story/news/weather/2023/09/08/hurricane-lee-path-tracker/70795737007/,"Hurricane Lee intensified into a Category 5 hurricane Thursday in the Atlantic Ocean before dropping back down to a Category 4 hurricane, the National Hurricane Center said Friday morning.
Lee doubl… [+1267 chars]",,Hurrikan-Lee-Tracker live: Verfolgen Sie den Weg des Sturms auf seinem Weg in Richtung Bahamas. Nach Angaben des National Hurricane Center hat sich Hurrikan Lee am Donnerstag zu einem Hurrikan der Kategorie 5 verstärkt. Verfolgen Sie den Sturm mit diesem Live-Tracker.,"Hurricane Lee tracker live: Follow the storm's path as it heads toward the Bahamas. Hurricane Lee intensified into a Category 5 hurricane Thursday, according to the National Hurricane Center. Follow the storm with this live tracker.","Procellae Lee venato vive: Iter procellae sequere dum versus Bahamas ducit. Procellae Lee in Categoriam 5 Procellae quintae intenditur, secundum Centrum Nationalis Procellae. Sequere tempestatem cum hac venato vivo.",2025-12-18 14:59:04+00:00
6906450ded8b839edaaf17391b6a3f0a,2023-09-08T18:38:53Z,'hurricane',www.cnn.com,en,0.9,Lee adds to a growing trend of intense hurricanes powered by warmer oceans,"Hurricane Lee rapidly intensified at a historic pace into a Category 5 storm Thursday night, adding to a spate of extremely intense hurricanes this year and in recent decades which experts say is a symptom of the climate crisis.",https://www.cnn.com/2023/09/08/weather/category-5-hurricane-frequency-climate/index.html,"https://media.cnn.com/api/v1/images/stellar/prod/230908104321-weather-hurricane-lee-satellite-image-090823.jpg?c=16x9&q=w_800,c_fill",http://web.archive.org/web/20230909032619/https://www.cnn.com/2023/09/08/weather/category-5-hurricane-frequency-climate/index.html,"Hurricane Lee rapidly intensified at a historic pace into a Category 5 storm Thursday night, adding to a spate of extremely intense hurricanes this year and in recent decades which experts say is a s… [+3441 chars]",,"Lee trägt zu einem wachsenden Trend intensiver Hurrikane bei, die von wärmeren Ozeanen angetrieben werden. Hurrikan Lee verstärkte sich am Donnerstagabend in historischem Tempo schnell zu einem Sturm der Kategorie 5 und fügte damit eine Flut extrem heftiger Hurrikane in diesem Jahr und in den letzten Jahrzehnten hinzu, die laut Experten ein Symptom der Klimakrise sind.","Lee adds to a growing trend of intense hurricanes powered by warmer oceans. Hurricane Lee rapidly intensified at a historic pace into a Category 5 storm Thursday night, adding to a spate of extremely intense hurricanes this year and in recent decades which experts say is a symptom of the climate crisis.","Lee addit incrementum vehementium turbinum oceanorum calidioribus. Procellae Lee celeriter aucta gressu historico in Categoriam 5 tempestatis Iovis noctis, addito spatio vehementissimorum turbinum hoc anno et proximis decenniis quos periti dicunt esse discrimen discrimen climatis.",2025-12-18 14:59:04+00:00
a9507de7389f7e72b0b27fdb92e7c805,2023-09-08T19:07:54Z,'hurricane',www.sfgate.com,en,0.9,What to know about how Hurricane Jova will impact California,A hurricane off the Coast of Baja California is not on the same track as Hurricane Hilary.,https://www.sfgate.com/bayarea/article/know-hurricane-jova-impact-california-18354965.php,https://s.hdnux.com/photos/01/34/27/67/24215026/5/rawImage.jpg,http://web.archive.org/web/20230909031832/https://www.sfgate.com/bayarea/article/know-hurricane-jova-impact-california-18354965.php,"Approximate path of Hurricane Jova for the next five days as of Sept. 8, 2023.
NOAA
A hurricane off the coast of Baja California is not on the same track as Hurricane Hilary. Hurricane Jova will ne… [+3652 chars]",,Was Sie über die Auswirkungen von Hurrikan Jova auf Kalifornien wissen sollten. Ein Hurrikan vor der Küste von Baja California ist nicht auf dem gleichen Weg wie Hurrikan Hilary.,What to know about how Hurricane Jova will impact California. A hurricane off the Coast of Baja California is not on the same track as Hurricane Hilary.,Quid scire quomodo Procellae Jova Californiae incursum erit. Procellae oram Baja Californiae non in eodem vestigio ac Procellae Hilarii non est.,2025-12-18 14:59:04+00:00
21f63772ba1fe158789226564def49d1,2023-09-08T19:18:49Z,'hurricane',www.forbes.com,en,0.9,Here’s What Hurricane ‘Rapid Intensification’—Like With Lee And Idalia—Means,Rapid intensification happens when the speed of a tropical cyclone’s winds grow by at least 30 knots within a 24-hour time frame.,https://www.forbes.com/sites/ariannajohnson/2023/09/08/heres-what-hurricane-rapid-intensification-like-with-lee-and-idalia-means/,"https://imageio.forbes.com/specials-images/imageserve/64ef9224ce97e3ad8a1e8140/0x0.jpg?format=jpg&crop=2500,1405,x0,y29,safe&width=1200",http://web.archive.org/web/20230909032147/https://www.forbes.com/sites/ariannajohnson/2023/09/08/heres-what-hurricane-rapid-intensification-like-with-lee-and-idalia-means/,"Rapid intensification has caused several hurricanes to become more destructive and deadly as experts warn the results of climate change are worsening its effects.
This satellite image, provided by t… [+5488 chars]",,"Hier ist, was Hurrikan „Rasche Intensivierung“ – wie bei Lee und Idalia – bedeutet. Eine schnelle Intensivierung liegt vor, wenn die Windgeschwindigkeit eines tropischen Wirbelsturms innerhalb von 24 Stunden um mindestens 30 Knoten zunimmt.",Here’s What Hurricane ‘Rapid Intensification’—Like With Lee And Idalia—Means. Rapid intensification happens when the speed of a tropical cyclone’s winds grow by at least 30 knots within a 24-hour time frame.,"Hic quid Procellae 'Rapid Intensio'—Like With Lee And Idalia-Means. Celeritas intensio fit, cum celeritas ventorum cyclonis tropicae augetur saltem 30 nodis intra tempus 24 horarum.",2025-12-18 14:59:04+00:00
