index,published,keyword,domain,language,valid,title,description,url,image,archive,content,quote,de,en,la,added
906d96b9bb102ccafea5e9a29286ecb1,2025-08-20T03:32:35Z,veryUnusualAndNeverUsedKeyword,slashdot.org,en,0.8,"N.C., Virginia under Hurricane Erin storm alerts, some East Coast beaches shut - Axios","N.C., Virginia under Hurricane Erin storm alerts, some East Coast beaches shutAxios Hurricane Erin’s impacts to spread up East Coast as tropical storm alerts expand in North Carolina, VirginiaFOX Weather Heavy rain Wednesday could cause flooding in Tri-State …",https://slashdot.org/firehose.pl?op=view&amp;id=178775046,,http://web.archive.org/web/20160119174443/http://slashdot.org/firehose.pl?op=view,"If what they've been doing hasn't solved the problem, tell them to
do something else.
-- Gerald Weinberg, ""The Secrets of Consulting""",,"N.C., Virginia unter Sturmwarnungen für Hurrikan Erin, einige Strände an der Ostküste geschlossen – Axios. N.C., Virginia, unter Hurrikan-Erin-Sturmwarnungen, einige Strände an der Ostküste geschlossenAxios Die Auswirkungen von Hurrikan Erin breiten sich auf die Ostküste aus, während die Tropensturmwarnungen in North Carolina, Virginia, zunehmenFOX-Wetter Starker Regen am Mittwoch könnte zu Überschwemmungen in Tri-State führen …","N.C., Virginia under Hurricane Erin storm alerts, some East Coast beaches shut - Axios. N.C., Virginia under Hurricane Erin storm alerts, some East Coast beaches shutAxios Hurricane Erin’s impacts to spread up East Coast as tropical storm alerts expand in North Carolina, VirginiaFOX Weather Heavy rain Wednesday could cause flooding in Tri-State …","N.C., Virginia sub Procellae Erin erecta tempestate, quaedam Litora Orientalis includunt - Axios. N.C., Virginia sub Procellae Erin in summis tempestatibus quaedam litora Coast East Axios impulsus Hurricane Erin in Orientem Coast expandere ut procella tropica erecta expandunt in Carolina Septentrionali, VirginiaFOX Tempestas Gravis pluviae Mercurii inundationem in Tri-State … facere potuit.",2025-12-17 12:46:33+00:00
67c0fb3c9a557b578267904947017aa9,2025-08-01T09:50:26Z,'hurricane',abcnews.go.com,en,0.9,Tropical Storm Gil expected to become a hurricane in the eastern Pacific but won't threaten land,Forecasters say Tropical Storm Gil is expected to become a hurricane in the eastern Pacific Ocean on Friday,https://abcnews.go.com/International/wireStory/tropical-storm-gil-expected-become-hurricane-eastern-pacific-124270158,https://i.abcnewsfe.com/a/8ae1c56a-a18b-4644-8cb9-daaabf228eb9/wirestory_24202ec6dbf9ff6df915ce1badb5f83f_16x9.jpg?w=1600,http://web.archive.org/web/20250801115158/https://abcnews.go.com/International/wireStory/tropical-storm-gil-expected-become-hurricane-eastern-pacific-124270158,"MEXICO CITY -- Tropical Storm Gil was expected to become a hurricane in the eastern Pacific Ocean on Friday but wasn't expected to threaten land, forecasters said.
The Miami-based U.S. National Hurr… [+816 chars]",,"Der Tropensturm Gil dürfte sich im Ostpazifik zu einem Hurrikan entwickeln, wird aber das Land nicht gefährden. Meteorologen gehen davon aus, dass sich der Tropensturm Gil am Freitag im Ostpazifik zu einem Hurrikan entwickeln wird",Tropical Storm Gil expected to become a hurricane in the eastern Pacific but won't threaten land. Forecasters say Tropical Storm Gil is expected to become a hurricane in the eastern Pacific Ocean on Friday,Tropical Storm Gil expectatur turbinem in Pacifico Orientali fieri sed terram non imminere. Weatherers dicunt Tropical Gil expectatur fieri procellae in Oceano Orientali die Veneris,2025-12-17 12:46:33+00:00
4465b62c3a17a6c86143dd5bd00765b0,2025-08-01T11:42:46Z,'hurricane',consent.yahoo.com,en,0.9,Tropical Storm Gil expected to become a hurricane Friday: See tracker,,https://consent.yahoo.com/v2/collectConsent?sessionId=1_cc-session_a792a0e3-c0bd-414a-ab31-b904f3d993af,,,"If you click 'Accept all', we and our partners, including 236 who are part of the IAB Transparency &amp; Consent Framework, will also store and/or access information on a device (in other words, use … [+714 chars]",,Tropensturm Gil dürfte sich am Freitag zu einem Hurrikan entwickeln: Siehe Tracker. Nan,Tropical Storm Gil expected to become a hurricane Friday: See tracker. nan,Tropical Storm Gil expectatur procellae Veneris fias: Vide venato. nan,2025-12-17 12:46:33+00:00
7e73fc594da37b7ea838a8ae837fc438,2025-08-02T02:14:52Z,'hurricane',economictimes.indiatimes.com,en,0.9,Tropical Storm Gil is expected to become a hurricane in the eastern Pacific but won't threaten land,"Tropical Storm Gil is anticipated to strengthen into a hurricane in the eastern Pacific, posing no immediate threat to land. Located 995 miles west-southwest of Baja California, it has winds of 70 mph and moves west-northwest at 17 mph. Meanwhile, Tropical St…",https://economictimes.indiatimes.com/news/international/global-trends/tropical-storm-gil-is-expected-to-become-a-hurricane-in-the-eastern-pacific-but-wont-threaten-land/articleshow/123054704.cms,"https://img.etimg.com/thumb/msid-123054710,width-1200,height-630,imgsize-122218,overlay-economictimes/articleshow.jpg",http://web.archive.org/web/20250802061333/https://economictimes.indiatimes.com/news/international/global-trends/tropical-storm-gil-is-expected-to-become-a-hurricane-in-the-eastern-pacific-but-wont-threaten-land/articleshow/123054704.cms,"Tropical Storm Gil is anticipated to strengthen into a hurricane in the eastern Pacific, posing no immediate threat to land. Located 995 miles west-southwest of Baja California, it has winds of 70 mp… [+190 chars]",,"Es wird erwartet, dass sich der Tropensturm Gil im Ostpazifik zu einem Hurrikan entwickelt, das Land jedoch nicht bedroht. Es wird erwartet, dass sich der Tropensturm Gil im Ostpazifik zu einem Hurrikan entwickelt, der keine unmittelbare Bedrohung für das Land darstellt. Er liegt 995 Meilen westsüdwestlich von Baja California, hat Windgeschwindigkeiten von 70 Meilen pro Stunde und bewegt sich mit 27 Meilen pro Stunde westnordwestlich. In der Zwischenzeit hat Tropical St…","Tropical Storm Gil is expected to become a hurricane in the eastern Pacific but won't threaten land. Tropical Storm Gil is anticipated to strengthen into a hurricane in the eastern Pacific, posing no immediate threat to land. Located 995 miles west-southwest of Baja California, it has winds of 70 mph and moves west-northwest at 17 mph. Meanwhile, Tropical St…","Tropical Storm Gil expectatur turbinem in Pacifico Orientali fieri sed terram non imminere. Tropical Storm Gil praecipitur ad confirmandum procellae in Pacifico Orientali, nullam statim comminationem ad terram ponens. Sita 995 milia passuum occidentem-meridiem Baja Californiae, habet ventos 70 mph et occidentem septentrionem versus 17 mph movet. Interea Tropical St…",2025-12-17 12:46:33+00:00
a02005cf6c4d2707118c8bf9df92c6d6,2025-08-02T15:16:27Z,'hurricane',consent.yahoo.com,en,0.9,Tropical Storm Gil briefly becomes hurricane: See tracker,,https://consent.yahoo.com/v2/collectConsent?sessionId=1_cc-session_15aae58c-1311-436d-9d07-21a8919e63cf,,,"If you click 'Accept all', we and our partners, including 236 who are part of the IAB Transparency &amp; Consent Framework, will also store and/or access information on a device (in other words, use … [+714 chars]",,Tropensturm Gil wird kurzzeitig zum Hurrikan: Siehe Tracker. Nan,Tropical Storm Gil briefly becomes hurricane: See tracker. nan,Tropical Storm Gil breviter fit turbo: Vide venato. nan,2025-12-17 12:46:33+00:00
46f1739b63cadbacc85280d98686a4ab,2025-08-02T16:26:56Z,'hurricane alert',economictimes.indiatimes.com,en,0.9,"Tropical Storm Gil strengthens to become hurricane, urgent alert issued for Hawaii, California travellers","Tropical storm Gil transformed into a hurricane in the Pacific Ocean, later weakening back to a tropical storm. The National Hurricane Center issued a warning for Hawaii travelers. The storm is expected to weaken further and become post-tropical soon. Authori…",https://economictimes.indiatimes.com/news/international/global-trends/us-news-tropical-storm-gil-strengthens-to-become-hurricane-urgent-alert-issued-for-hawaii-california-travellers/articleshow/123064771.cms,"https://img.etimg.com/thumb/msid-123064779,width-1200,height-630,imgsize-122218,overlay-economictimes/articleshow.jpg",http://web.archive.org/web/20250802191831/https://economictimes.indiatimes.com/news/international/global-trends/us-news-tropical-storm-gil-strengthens-to-become-hurricane-urgent-alert-issued-for-hawaii-california-travellers/articleshow/123064771.cms,"Tropical storm Gil strengthened to become a hurricane in the Pacific Ocean before weakening again into a tropical storm, the National Hurricane Center said Saturday, August 2. A warning has been issu… [+3787 chars]",,"Der Tropensturm Gil verstärkt sich und entwickelt sich zu einem Hurrikan, eine dringende Warnung für Reisende aus Hawaii, Kalifornien. Der Tropensturm Gil verwandelte sich im Pazifischen Ozean in einen Hurrikan, der sich später wieder zu einem Tropensturm abschwächte. Das National Hurricane Center gab eine Warnung für Hawaii-Reisende heraus. Es wird erwartet, dass sich der Sturm weiter abschwächt und bald posttropisch wird. Autor…","Tropical Storm Gil strengthens to become hurricane, urgent alert issued for Hawaii, California travellers. Tropical storm Gil transformed into a hurricane in the Pacific Ocean, later weakening back to a tropical storm. The National Hurricane Center issued a warning for Hawaii travelers. The storm is expected to weaken further and become post-tropical soon. Authori…","Tropical Storm Gil confirmat ut procellae fiant, urgentes intentae Hawaii, Californiae viatores sunt editae. Tropical tempestas Gil in procellam in Oceanum Pacificum vertit, postea ad tropicam tempestatem debilitavit. National Hurricane Centrum denuntiavit de viatoribus Hawaii. Tempestas expectatur ulterius debilitare et mox post-tropica fiet. Authori…",2025-12-17 12:46:33+00:00
755b794d71fa6c69d0522f30b1f71fe4,2025-08-03T13:00:54Z,'hurricane season',www.news-journalonline.com,en,0.9,Hurricane Center tracking Invest 95L off North Carolina coast and a large tropical wave,"Will it rain today? Atlantic hurricane season is June 1 to Nov. 30, 2025, with most tropical storm activity between August and October in Florida.",https://www.news-journalonline.com/story/news/2025/08/03/hurricane-season-track-path-dexter-florida/85494791007/,https://media.zenfs.com/en/daytona-beach-news-journal/a5a938856b9770ccfe5d49dedce506b3,http://web.archive.org/web/20250804020046/https://www.news-journalonline.com/story/news/2025/08/03/hurricane-season-track-path-dexter-florida/85494791007/,"Two months after the start of hurricane season, something big may be brewing in the tropics.
In the 8 a.m. Sunday, Aug. 3, 2025, tropics advisory from the National Hurricane Center in Miami, Florida… [+5366 chars]",,"Hurricane Center verfolgt Invest 95L vor der Küste von North Carolina und eine große tropische Welle. Wird es heute regnen? Die Hurrikansaison im Atlantik dauert vom 1. Juni bis 30. November 2025, wobei die meisten Tropenstürme in Florida zwischen August und Oktober stattfinden.","Hurricane Center tracking Invest 95L off North Carolina coast and a large tropical wave. Will it rain today? Atlantic hurricane season is June 1 to Nov. 30, 2025, with most tropical storm activity between August and October in Florida.","Procellae Centrum sequi Invest 95L off Carolinae Septentrionalis oram et magnam tropicam undam. Pluetne hodie? Tempus Atlanticum typhonicum est die 1 mensis Iunii ad diem 30 novembris 2025, cum maxima tropica actione inter Augustum et Octobrem in Florida.",2025-12-17 12:46:33+00:00
f55ebe7e0253bc3a6bb4c39471fcc8d3,2025-08-04T14:53:29Z,veryUnusualAndNeverUsedKeyword,www.cnn.com,en,0.9,Hurricane season 2025: We’re entering primetime for the Atlantic season. Here’s what’s going on,"Atlantic hurricane season is about to hit its stride. August through mid-September is historically the most active stretch of the season, and while there have been a handful of short-lived named storms, the Atlantic has yet to spawn a hurricane in 2025.",https://www.cnn.com/2025/08/04/weather/atlantic-hurricane-season-storm-dexter-climate,"https://media.cnn.com/api/v1/images/stellar/prod/cnnd-al-tropical-outlook-080425-8a.png?c=16x9&q=w_800,c_fill",,"Atlantic hurricane season is about to hit its stride. August through mid-September is historically the most active stretch of the season, and while there have been a handful of short-lived named stor… [+4862 chars]",,"Hurrikansaison 2025: Wir beginnen die Hauptsendezeit der Atlantiksaison. Hier ist, was los ist. Die Hurrikansaison im Atlantik steht vor der Tür. August bis Mitte September ist historisch gesehen die aktivste Zeitspanne der Saison, und obwohl es eine Handvoll kurzlebiger benannter Stürme gab, hat der Atlantik im Jahr 2025 noch keinen Hurrikan hervorgebracht.","Hurricane season 2025: We’re entering primetime for the Atlantic season. Here’s what’s going on. Atlantic hurricane season is about to hit its stride. August through mid-September is historically the most active stretch of the season, and while there have been a handful of short-lived named storms, the Atlantic has yet to spawn a hurricane in 2025.","Procellae temporum 2025: Primum tempus inimus pro Atlantico. Hic est quid agitur. Atlanticus tempestatis tempus est passu suo feriendi. Augustus per medium Septembrem historice temporis tractum acerrimum est, et cum multae tempestates breves appellatae sunt, Atlanticus adhuc tempestatem 2025 pariebat.",2025-12-17 12:46:33+00:00
c84b66476b9ca35e04752fa93a120f12,2025-08-04T16:27:34Z,'hurricane season',www.usatoday.com,en,0.9,"Tropical trouble: After Dexter, could 'Erin' and 'Fernand' be next?","""We are now moving into a more active period (of the) Atlantic hurricane season,"" said Weather Trader meteorologist Ryan Maue to USA TODAY.",https://www.usatoday.com/story/news/weather/2025/08/04/tropical-storms-erin-fernand-follow-dexter-hurricane/85508304007/,https://media.zenfs.com/en/usa_today_news_641/0e47e2302218b0034a8cb0dded121e3b,http://web.archive.org/web/20250804172324/https://www.usatoday.com/story/news/weather/2025/08/04/tropical-storms-erin-fernand-follow-dexter-hurricane/85508304007/,"As Tropical Storm Dexter races out to sea away from the United States, hurricane forecasters Aug. 4 were watching two other areas of potential concern in the Atlantic, which if they form, could be na… [+3472 chars]",,"Tropisches Problem: Könnten nach Dexter „Erin“ und „Fernand“ die nächsten sein? „Wir bewegen uns jetzt in eine aktivere Phase der atlantischen Hurrikansaison“, sagte Weather Trader-Meteorologe Ryan Maue gegenüber USA TODAY.","Tropical trouble: After Dexter, could 'Erin' and 'Fernand' be next?. ""We are now moving into a more active period (of the) Atlantic hurricane season,"" said Weather Trader meteorologist Ryan Maue to USA TODAY.","Tropical trouble: Post Dexter, potuit esse proximus Erin et Fernand. ""Iam movemur in tempus magis activum tempestatis Atlantici"" dixit Tempestas Mercator astrologus Ryan Maue ad USA TODAY.",2025-12-17 12:46:33+00:00
982cb43ac7c8c6f34f3e4c60304c34d3,2025-08-05T06:12:42Z,'hurricane',timesofindia.indiatimes.com,en,0.9,Tropical Storm Dexter explained: 4 things students should know about this Atlantic weather threat,"Tropical Storm Dexter, the fourth named storm of the 2025 Atlantic hurricane season, is not expected to make landfall but is already impacting US coastal conditions. This student-focused guide explains how Dexter formed, why it matters, and what it reveals ab…",https://timesofindia.indiatimes.com/education/learning-with-toi/tropical-storm-dexter-explained-4-things-students-should-know-about-this-atlantic-weather-threat/articleshow/123111626.cms,"https://static.toiimg.com/thumb/msid-123111615,width-1070,height-580,imgsize-49596,resizemode-75,overlay-toi_sw,pt-32,y_pad-40/photo.jpg",http://web.archive.org/web/20250806010947/https://timesofindia.indiatimes.com/education/learning-with-toi/tropical-storm-dexter-explained-4-things-students-should-know-about-this-atlantic-weather-threat/articleshow/123111626.cms,Rupali Gangulys top 10 gorgeous festive looks,,"Tropensturm Dexter erklärte: 4 Dinge, die Schüler über diese atlantische Wetterbedrohung wissen sollten. Tropensturm Dexter, der vierte benannte Sturm der atlantischen Hurrikansaison 2025, wird voraussichtlich nicht auf Land treffen, hat aber bereits Auswirkungen auf die Küstenbedingungen in den USA. Dieser schülerorientierte Leitfaden erklärt, wie Dexter entstanden ist, warum es wichtig ist und was es über … verrät.","Tropical Storm Dexter explained: 4 things students should know about this Atlantic weather threat. Tropical Storm Dexter, the fourth named storm of the 2025 Atlantic hurricane season, is not expected to make landfall but is already impacting US coastal conditions. This student-focused guide explains how Dexter formed, why it matters, and what it reveals ab…","Tropical Storm Dexter explicavit: 4 res studentes scire debent de comminatione huius tempestatis Atlantici. Tropical Storm Dexter, quarta tempestate nominatus 2025 tempestatis Atlantici, non expectatur ut landum iacturam faciat, sed condiciones maritimas iam incidat. Hoc ductor discipulo-focused quomodo Dexter formatus sit, quid refert, quidque ab eo detexerit…",2025-12-17 12:46:33+00:00
f48e422a6a8e66893b6f170443820dc9,2025-08-05T07:14:15Z,'hurricane season',economictimes.indiatimes.com,en,0.9,Tropical Storms Dexter and Henriette active in Atlantic and Pacific as hurricane season intensifies,"Tropical Storm Dexter is tracking away from the US East Coast while producing high surf and rip currents. Meanwhile, Tropical Storm Henriette has formed in the eastern Pacific. The National Hurricane Center is monitoring two additional systems in the Atlantic…",https://economictimes.indiatimes.com/news/international/us/tropical-storms-dexter-and-henriette-active-in-atlantic-and-pacific-as-hurricane-season-intensifies/articleshow/123112886.cms,"https://img.etimg.com/thumb/msid-123112987,width-1200,height-630,imgsize-546654,overlay-economictimes/articleshow.jpg",http://web.archive.org/web/20250806075555/https://economictimes.indiatimes.com/news/international/us/tropical-storms-dexter-and-henriette-active-in-atlantic-and-pacific-as-hurricane-season-intensifies/articleshow/123112886.cms,"Tropical Storm Dexter moves away from East CoastTropical Storm Dexter formed late Sunday night, August 3, from an area of low pressure along a stalled frontal boundary between North Carolinas Outer B… [+3514 chars]",,"Die tropischen Stürme Dexter und Henriette sind im Atlantik und im Pazifik aktiv, während sich die Hurrikansaison intensiviert. Der Tropensturm Dexter entfernt sich von der US-Ostküste und erzeugt dabei starke Brandungs- und Brandungsströmungen. Unterdessen hat sich im Ostpazifik der Tropensturm Henriette gebildet. Das National Hurricane Center überwacht zwei weitere Systeme im Atlantik…","Tropical Storms Dexter and Henriette active in Atlantic and Pacific as hurricane season intensifies. Tropical Storm Dexter is tracking away from the US East Coast while producing high surf and rip currents. Meanwhile, Tropical Storm Henriette has formed in the eastern Pacific. The National Hurricane Center is monitoring two additional systems in the Atlantic…",Tempestates tropicae Dexter et Henriette activae in Atlantico et Pacifico sicut tempus tempestatum exasperantur. Tropical Tempestas Dexter ab US Orientalis Coast insequitur dum altum salo producit et flumina rip facit. Interim Henriette Tempestas tropica in Pacifico Orientali formavit. Procellae Nationalis Centrum magna est duo systemata additamenta in Atlantico…,2025-12-17 12:46:33+00:00
318ff73d4ccae4555d87c195833429ba,2025-08-06T20:43:36Z,'hurricane',www.accuweather.com,en,0.9,"Atlantic to teem with tropical activity, concerns arise for Caribbean, USA...","Budding activity over the vast Atlantic hurricane basin has AccuWeather meteorologists closely watching multiple areas of interest, and some of those may pose a threat to the United States in the coming days. There will be some tropical concerns near the U.S.…",https://www.accuweather.com/en/hurricane/atlantic-to-teem-with-tropical-activity-concerns-to-arise-for-caribbean-us/1802841,https://cms.accuweather.com/wp-content/uploads/2025/08/AtlanticWindRain6Aug.jpeg?w=768,http://web.archive.org/web/20250806164722/https://www.accuweather.com/en/hurricane/atlantic-to-teem-with-tropical-activity-concerns-to-arise-for-caribbean-us/1802841,"Budding tropical activity across the Atlantic has AccuWeather meteorologists tracking several systems, some of which could threaten the U.S. in the days ahead.
Heading into the second week of August… [+4059 chars]",,"Im Atlantik wimmelt es von tropischer Aktivität, die Karibik und die USA bereiten sich Sorgen. Aufgrund der aufkeimenden Aktivität über dem riesigen atlantischen Hurrikanbecken beobachten AccuWeather-Meteorologen mehrere Gebiete von Interesse genau, und einige davon könnten in den kommenden Tagen eine Bedrohung für die Vereinigten Staaten darstellen. In der Nähe der USA wird es einige tropische Probleme geben …","Atlantic to teem with tropical activity, concerns arise for Caribbean, USA.... Budding activity over the vast Atlantic hurricane basin has AccuWeather meteorologists closely watching multiple areas of interest, and some of those may pose a threat to the United States in the coming days. There will be some tropical concerns near the U.S.…","Atlantic ut cum tropica actione gignere, curas pro Caribbean, USA oriuntur.... Budding activitatem in pelvem Atlantici vastam habet AccuWeather astrologi astrologi arcte spectantes multiplices usurarum areas, et nonnullae ex iis minas in Civitatibus Foederatis in diebus proximis ponere possunt. Erit aliqua tropica cura circa US ...",2025-12-17 12:46:33+00:00
31aaf0d758c3b114d274957ba3cf488d,2025-08-08T19:07:57Z,'hurricane',www.yahoo.com,en,0.9,"Atlantic tropical storm and hurricane potential, US risk to increase around mid-August",AccuWeather hurricane experts are predicting three to five named storms will form across the Atlantic basin throughout August as conditions become prime for ...,https://www.yahoo.com/news/articles/atlantic-tropical-storm-hurricane-potential-190757124.html,https://media.zenfs.com/en/accuweather_articles_339/97f83a5797b124bf8c4eb8422d7b9c28,http://web.archive.org/web/20250808204825/https://www.yahoo.com/news/articles/atlantic-tropical-storm-hurricane-potential-190757124.html,"Atlantic tropical storm and hurricane potential, US risk to increase around mid-August
AccuWeather hurricane experts are predicting three to five named storms will form across the Atlantic basin dur… [+4142 chars]",,"Potenzial für tropische Stürme und Hurrikane im Atlantik, das Risiko in den USA wird etwa Mitte August zunehmen. Die Hurrikanexperten von AccuWeather gehen davon aus, dass sich im Laufe des Augusts drei bis fünf benannte Stürme über dem Atlantikbecken bilden werden, wenn die Bedingungen ideal für ... sind.","Atlantic tropical storm and hurricane potential, US risk to increase around mid-August. AccuWeather hurricane experts are predicting three to five named storms will form across the Atlantic basin throughout August as conditions become prime for ...","Tempestas tropica Atlantica et potentiale typhonica, US periculum auget circa medium Augusti. Periti tempestatis accuWeather praedicunt tres ad quinque tempestates nominatas trans pelvim Atlanticum per Augustum formabunt sicut condiciones primae pro ...",2025-12-17 12:46:33+00:00
b6a15ba32e46c3807b8fdb9d3e88c739,2025-08-10T16:32:00Z,'tropical depression',www.orlandosentinel.com,en,0.9,Hurricane center gives high chance 1 of 2 tracked Atlantic systems will develop,The National Hurricane Center on Sunday has given an Atlantic tropical wave a high chance of becoming the season’s next tropical depression or storm while...,https://www.orlandosentinel.com/2025/08/10/hurricane-center-tracks-2-atlantic-systems-that-could-develop/,https://s.yimg.com/ny/api/res/1.2/SpZ4H55HKbZmxsdMPllJyg--/YXBwaWQ9aGlnaGxhbmRlcjt3PTEyMDA7aD03NDY7Y2Y9d2VicA--/https://media.zenfs.com/en/orlando_sentinel_national_858/a105d3e90db12fc967f630772d2e60e4,http://web.archive.org/web/20250810132204/https://www.orlandosentinel.com/2025/08/10/hurricane-center-tracks-2-atlantic-systems-that-could-develop/,"The National Hurricane Center on Sunday has given an Atlantic tropical wave a high chance of becoming the seasons next tropical depression or storm while also keeping track of a second system.
As of… [+1877 chars]",,"Das Hurrikanzentrum bietet eine hohe Wahrscheinlichkeit, dass sich eines von zwei verfolgten Atlantiksystemen entwickelt. Das National Hurricane Center hat am Sonntag einer atlantischen tropischen Welle eine hohe Chance eingeräumt, zum nächsten tropischen Tiefdruckgebiet oder Sturm der Saison zu werden, während ...",Hurricane center gives high chance 1 of 2 tracked Atlantic systems will develop. The National Hurricane Center on Sunday has given an Atlantic tropical wave a high chance of becoming the season’s next tropical depression or storm while...,"Procellae centrum dat fortuitum 1 ex 2 systematibus Atlanticis pervestigatis evolvendis. The National Hurricane Center on Sunday, tropical undam Atlanticam dedit altam occasionem descensionis tropicae vel tempestatis dum... fieri in tempore proximo.",2025-12-17 12:46:33+00:00
